Newspaper,Heading,Date,Time,URL,Cluster,cluster_similarity_value
India Today, BRO Recruitment 2019: Apply for 778 Electrician and other vacancies @bro.gov.in,2019-05-31,13:41,https://timesofindia.indiatimes.com/education-today/government-jobs/story/bro-recruitment-2019-electrician-bro-gov-in-divd-1538362-2019-05-30,0,0.58
Time of India,UPSEE 2019 result to be declared on June 3 @upsee.nic.in; check details here,2019-05-31, 11:27:00,https://timesofindia.indiatimes.com/home/education/news/upsee-2019-result-to-be-declared-on-june-3-upsee-nic-in-check-details-here/articleshow/69592722.cms,1,0.63
Indian Express,RBSE Rajasthan Board 10th result 2019: Date and time updates,2019-05-31,10:19:35 am,https://indianexpress.com/article/education/rbse-rajasthan-board-10th-result-2019-date-and-time-rajeduboard-rajasthan-gov-in-5757644/,2,0.31
Indian Express,"Dungar College Rajasthan declares PTET results 2019 at ptet2019.net, ptet2019.org",2019-05-31,10:13:35 am,https://indianexpress.com/article/education/rajasthan-ptet-result-2019-date-and-time-ptet2019-net-ptet2019-org-5755887/,2,0.28
Indian Express,Rajasthan RSOS class 12 results: How to check via websites,2019-05-31,12:34:50 pm,https://indianexpress.com/article/education/rajasthan-rsos-class-12-result-declared-how-to-check-via-websites-rsosapp-rajasthan-gov-in-5756742/,2,0.2
India Today, New York teacher casts black kids as slaves in mock auction,2019-05-31,13:41,https://timesofindia.indiatimes.com/education-today/news/story/new-york-teacher-casts-black-kids-as-slaves-in-mock-auction-1539208-2019-05-31,3,1.0
India Today, BSEB Bihar Board 10th Compartment result 2019 today: List of websites to check Bihar board Matric Result ,2019-05-31,13:41,https://timesofindia.indiatimes.com/education-today/notification/story/bseb-bihar-board-10th-compartment-result-2019-bihar-board-matric-result-divd-1539168-2019-05-31,4,0.62
India Today, Bihar Board 10th Compartmental Result 2019 date and time confirmed: Check Bihar Board matric result @ biharboardonline.bihar.gov.in,2019-05-31,13:41,https://timesofindia.indiatimes.com/education-today/notification/story/bihar-board-10th-compartmental-result-2019-date-and-time-confirmed-check-bihar-board-matric-result-biharboardonline-bihar-gov-in-1539140-2019-05-31,4,0.47
Hindiustan Times,Bihar board 10th compartment result date and time: BSEB matric compartment result today at 3pm,2019-05-31,13:34:00,https://www.hindustantimes.com/education/bihar-board-10th-compartment-result-date-and-time-bseb-class-10-compartment-result-today-at-3pm/story-j9zCl1eMnGttpXmjpqbT5N.html,4,0.49
Indian Express,Bihar Board BSEB 10th Compartmental Result 2019 today: When and where to check,2019-05-31,9:35:52 am,https://indianexpress.com/article/education/bihar-board-bseb-10th-compartmental-result-2019-when-and-where-to-check-bsebssresult-com-biharboard-ac-in-5757280/,4,0.48
Hindiustan Times,BSEB Bihar board 10th compartment result 2019 live updates,2019-05-31,13:37:00,https://www.hindustantimes.com/education/bihar-board-10th-compartment-result-date-and-time-bseb-matric-compartment-result-today-at-3pm/story-7rwCU4FGBIqiLe429sgwKI.html,4,0.45
Hindiustan Times,DU admissions 2019: Sports and ECA seats up for grabs ,2019-05-31,11:37:00,https://www.hindustantimes.com/education/du-admissions-2019-sports-and-eca-seats-up-for-grabs/story-VouNAiZJRmkEhbT52F1g0M.html,5,0.21
Hindiustan Times,"DU online admission process begins, first cutoff list likely on June 20",2019-05-31,11:26:00,https://www.hindustantimes.com/education/du-online-admission-process-begins-first-cutoff-list-likely-on-june-20/story-VQYSlqQSxKzkKuAJawCAsJ.html,5,0.17
India Today, Delhi University online admissions begin: All you need to know about the application process,2019-05-31,13:41,https://timesofindia.indiatimes.com/education-today/news/story/delhi-university-online-admissions-begin-all-you-need-to-know-1538470-2019-05-31,5,0.2
Time of India,BJMC Admissions 2019: Become new age media professional with the Times School of Media,2019-05-31, 11:27:00,https://timesofindia.indiatimes.com/home/education/news/bajmc-admissions-2019-become-new-age-media-professional-with-the-times-school-of-media/articleshow/69592697.cms,5,0.18
India Today," Earn upto Rs 2, 08,700 for 439 vacancies in Banaras Hindu University (BHU), apply online @bhu.ac.in",2019-05-31,13:41,https://timesofindia.indiatimes.com/education-today/government-jobs/story/earn-upto-rs-2-08-700-banaras-hindu-university-bhu-bhu-ac-in-divd-1535637-2019-05-27,5,0.2
India Today, DU Admissions 2019: 14 new changes in Delhi University admissions,2019-05-31,13:41,https://timesofindia.indiatimes.com/education-today/news/story/du-admissions-2019-14-new-changes-in-delhi-university-admissions-1539149-2019-05-31,5,0.29
India Today, CBSE Board Exam 2019: Find Class 10 Maths sample paper with answers here,2019-05-31,13:41,https://timesofindia.indiatimes.com/education-today/sample-papers/story/cbse-board-exam-2019-find-class-10-maths-sample-paper-with-answers-here-1417498-2018-12-26,6,0.47
India Today, CBSE Class 12 Biology sample paper 2019 with solutions: Check now,2019-05-31,13:41,https://timesofindia.indiatimes.com/education-today/sample-papers/story/cbse-class-12-biology-sample-paper-2019-divd-1454151-2019-02-12,6,0.63
Indian Express,"DU admissions 2019: NTA to conduct entrance exams, check details here",2019-05-31,11:44:48 am,https://indianexpress.com/article/education/delhi-university-du-admissions-2019-nta-to-conduct-entrance-exams-for-all-ug-pg-courses-5756782/,7,0.73
India Today, 10 ways to politely say 'NO',2019-05-31,13:41,https://timesofindia.indiatimes.com/education-today/grammar-vocabulary/story/10-ways-to-politely-say-no-1505465-2019-04-19,8,0.13
India Today, Areas with productive climate tend to have more languages: Study,2019-05-31,13:41,https://timesofindia.indiatimes.com/education-today/gk-current-affairs/story/productive-climate-language-diversity-study-1529426-2019-05-20,8,0.14
India Today," [WATCH] Nipah virus can be transmitted through contaminated water and fruits, warns govt advisory",2019-05-31,13:41,https://timesofindia.indiatimes.com/education-today/video/-watch-nipah-virus-can-be-transmitted-through-contaminated-water-and-fruits-warns-govt-advisory-1238575-2018-05-22,8,0.13
India Today, How IIT Bombay's healthcare innovation centre BETiC is solving India's doctor shortage with innovative and low-cost medical devices,2019-05-31,13:41,https://timesofindia.indiatimes.com/education-today/how-i-made-it/story/how-iit-bombay-healthcare-innovation-centre-betic-is-solving-india-doctor-shortage-1488389-2019-03-28,8,0.14
India Today," On Menstrual Hygiene Day, here's how workplaces need to deal with periods ",2019-05-31,13:41,https://timesofindia.indiatimes.com/education-today/featurephilia/story/menstruation-how-workplaces-need-to-deal-with-periods-1536483-2019-05-28,8,0.14
Indian Express,"In a first, Punjab govt organises social studies melas in schools",2019-05-31,11:27:02 am,https://indianexpress.com/article/education/students-feel-that-sst-melas-fairs-makes-a-boring-subject-a-joyful-one-students-5756425/,8,0.13
India Today, 20 words to use instead of 'sad',2019-05-31,13:41,https://timesofindia.indiatimes.com/education-today/grammar-vocabulary/story/20-words-to-use-instead-of-sad-1503076-2019-04-16,8,0.16
India Today, Ex-IAS officer and former Chief Secretary of J&K C Phunsog to become first VC of Ladakh University,2019-05-31,13:41,https://timesofindia.indiatimes.com/education-today/news/story/ex-ias-officer-former-chief-secretary-of-j-k-c-phunsog-to-become-first-vc-of-ladakh-university-1539257-2019-05-31,8,0.26
India Today, Why your mental health is an important factor in your government exam preparation,2019-05-31,13:41,https://timesofindia.indiatimes.com/education-today/featurephilia/story/why-your-mental-health-is-an-important-factor-in-your-govt-exam-preparation-1536297-2019-05-28,9,0.27
India Today, UPSC Civil Services 2019 prelims: Dos and don'ts for UPSC IAS exam,2019-05-31,13:41,https://timesofindia.indiatimes.com/education-today/tips-and-tricks/story/upsc-civil-services-2019-prelims-dos-and-don-ts-for-upsc-ias-exam-1535626-2019-05-27,9,0.3
Time of India,Jipmer MBBS entrance exam to be held on June 2,2019-05-31, 13:12:00,https://timesofindia.indiatimes.com/home/education/news/jipmer-mbbs-entrance-exam-to-be-held-on-june-2/articleshow/69594282.cms,9,0.32
India Today, This small-town school in Bengal teaches students with apps and storybooks ,2019-05-31,13:41,https://timesofindia.indiatimes.com/education-today/video/levelfield-school-teaches-students-with-apps-and-storybooks-html-1393974-2018-11-22,10,0.24
India Today, DRDO is hiring! Apply for 351 technician vacancies till this date,2019-05-31,13:41,https://timesofindia.indiatimes.com/education-today/government-jobs/story/drdo-recruitment-2019-sarkari-naukri-govt-job-divd-1536482-2019-05-28,10,0.25
India Today," CLAT 2019 answer key released, check now at clatconsortiumofnlu.ac.in",2019-05-31,13:41,https://timesofindia.indiatimes.com/education-today/notification/story/clat-2019-answer-key-released-check-now-at-clatconsortiumofnlu-ac-in-1538538-2019-05-30,10,0.27
India Today, Earn upto 2 lakh per month by applying for UPSC CDS 2 2019 recruitment: Check important dates and vacancy details here,2019-05-31,13:41,https://timesofindia.indiatimes.com/education-today/government-jobs/story/2-lakh-per-month-upsc-cds-2-2019-recruitment-darkari-naukri-sarkari-result-divd-1539215-2019-05-31,11,0.76
India Today," LIC ADO Recruitment 2019: Official notice released, check important dates for recruitment",2019-05-31,13:41,https://timesofindia.indiatimes.com/education-today/jobs-and-careers/story/lic-ado-recruitment-2019-official-notice-released-check-important-dates-for-recruitment-1529509-2019-05-20,11,0.52
India Today, This 24-year-old college graduate is making pencils with newspaper waste,2019-05-31,13:41,https://timesofindia.indiatimes.com/education-today/how-i-made-it/story/college-graduate-making-pencils-with-waste-newspapers-1529467-2019-05-20,12,0.14
India Today, Gender parity on rise: 11 countries with the strongest gender-balanced cabinets,2019-05-31,13:41,https://timesofindia.indiatimes.com/education-today/gk-current-affairs/story/south-africa-women-cabinet-ministers-gender-balanced-cabinets-in-world-list-1539219-2019-05-31,12,0.15
India Today, NTA NEET UG Result 2019 expected to be declared on this date: Check NTA NEET scores @ ntaneet.nic.in,2019-05-31,13:41,https://timesofindia.indiatimes.com/education-today/notification/story/nta-neet-ug-result-2019-expected-to-be-declared-on-this-date-check-nta-neet-scores-ntaneet-nic-in-1539177-2019-05-31,12,0.3
India Today, KCET 2019 document verification to begin from this date: Check list of documents required and general instructions here,2019-05-31,13:41,https://timesofindia.indiatimes.com/education-today/notification/story/kcet-2019-document-verification-divd-1539118-2019-05-31,12,0.19
India Today, World No Tobacco Day: 34.6 per cent adults in India are smokers,2019-05-31,13:41,https://timesofindia.indiatimes.com/education-today/general-knowledge/story/world-no-tobacco-day-34-6-per-cent-adults-in-india-are-smokers-1539130-2019-05-31,12,0.14
India Today, List of 6 manned moon missions: These people set foot on lunar surface after Neil Armstrong,2019-05-31,13:41,https://timesofindia.indiatimes.com/education-today/gk-current-affairs/story/manned-moon-mission-lunar-surface-moon-landing-nasa-1408563-2018-12-13,12,0.15
India Today, 5 off-beat career options to break the monotony of 9 to 5 jobs,2019-05-31,13:41,https://timesofindia.indiatimes.com/education-today/jobs-and-careers/story/5-off-beat-career-options-to-break-the-monotony-of-9-to-5-jobs-1527398-2019-05-17,12,0.17
India Today, 15 tips for a high score in JEE Advanced 2019,2019-05-31,13:41,https://timesofindia.indiatimes.com/education-today/tips-and-tricks/story/15-tips-for-a-high-score-in-jee-advanced-2019-1534393-2019-05-25,13,0.51
Indian Express,"JEE Advanced 2019: Result on June 14, experts believe cut-off to go down",2019-05-31,9:39:21 am,https://indianexpress.com/article/education/jee-advanced-2019-result-on-june-14-cut-off-to-lower-jeeadv-ac-in-5752615/,13,0.42
India Today, 6 Indian-origin kids in historic 8-way tie in National Spelling Bee for first time in 92 years,2019-05-31,13:41,https://timesofindia.indiatimes.com/education-today/news/story/national-spelling-bee-ends-in-historic-8-way-tie-for-first-time-in-92-years-1539196-2019-05-31,14,1.0
India Today, CHSE Odisha Plus 2 Result 2019 expected to release today at orissaresults.nic.in: Date and time,2019-05-31,13:41,https://timesofindia.indiatimes.com/education-today/notification/story/chse-odisha-plus-2-result-2019-expected-to-release-today-at-orissaresults-nic-in-date-and-time-1539110-2019-05-31,15,0.5
Indian Express,Maharashtra HSC results: Thousands seek re-evaluation; online procedure does not click with many,2019-05-31,9:19:30 am,https://indianexpress.com/article/education/maharashtra-hsc-examination-results-re-evaluation-online-procedure-5757479/,15,0.26
