Heading,Date,Time,URL,Content
US immigration law tweak could be ‘disastrous’ for some Indians,2019-05-18, 07:57,https://www.hindustantimes.com/india-news/us-immigration-law-tweak-could-be-disastrous-for-some-indians/story-eOUkqtocP0C8GPJIIU9yTI.html,"['US President Donald Trump’s new immigration plan, which has been called “dead-on-arrival” by Democrats, could be “disastrous” for those already in queue for a Green Card, including hundreds of thousands of Indians, as it intends to replace the existing system in favour of one that prioritises merit over family. The new system will also make it impossible to sponsor some categories of relatives.', 'There are 261,765 Indians waiting for family-sponsored Green cards and 306,601 (these are principal applicants; the number is more than half a million counting dependents) in the employment based queue, according to the US state department and the US citizenship and immigration services data. ', 'In all, there are 3.6 million and 395,025 in the two categories respectively.', '“We will replace the existing Green Card categories with a new visa, the Build America visa -- which is what we all want to hear,” the president said announcing his new “merit-based, high-security plan” Thursday. It seeks to overhaul legal immigration and bolster border security, including a wall.', 'The plan envisages a points-based immigration system that scores merit, age, professional skills, education and proficiency in English language over family ties.', '', 'Of the 1.1 million Green Cards issued every year, 66% go to relatives and 21% to asylum seekers and those picked in a visa lottery. Only 12% go to those seeking permanent residency through employment. President Trump intends to reverse that and take that 12% number to 57%, even higher.', 'If enacted into law, young, qualified, professional, English-speaking Indian applicants will stand a better chance of qualifying for Green Card, going forward, than those banking on familial ties to relatives such as children, spouses, siblings, parents, even grandparents.', 'But for those already in queue, experts said, it would be disastrous. Doug Rand, a former Obama White House official who worked on immigration and is co-founder of an immigration services company Boundless, said, “Although superficially beneficial for immigrants with more education and skills, this proposal could be disastrous for H-1B workers, most of whom are from India.”', 'First, he added, it would “pull the rug out from under the half-million or so skilled workers and their families” who are waiting for their Green Cards, because “they apparently they would all have to start over and reapply for the new ‘Build America visas’.” And, second, even if they managed, they will not be able to sponsor parents, adult children and siblings under the family-based category.', 'Stuart Andersen, an immigration expert who runs a non-partisan think-tank National Foundation for American Policy, said, “Indians with pending family-based Green Card applications would see those applications eliminated. Some Indians waiting for employment-based Green Cards might find a quicker path but since all employment-based Green Card applications would be eliminated anyone who doesn’t gain enough points under the system would eventually have to leave the United States.” And those who are American citizens will not be able to sponsor some relatives.', 'But the plan appears to have no future, not at least in its current avatar. Democrats, who control the House of Representatives that will have to pass the plan, have already come out against it. “This dead-on-arrival plan is not a remotely serious proposal,” said House Speaker Nancy Pelosi in a statement, and added, “To say that this plan’s application criteria are ‘merit-based’ is the height of condescension.” And, a big problem for them: the plan does not address the issue of “Dreamers”, undocumented immigrants brought to the country as children, several thousand of them are from India. ', 'President Trump acknowledged the plan’s uncertain future in his announcement remarks from the White House. “If for some reason -- possibly political -- we can’t get the Democrats to approve this merit-based, high-security plan, then we will get it approved immediately after the (2020) election, when we take back the House, keep the Senate, and, of course, hold the presidency,” he said. ', '\nFirst Published:\r\n\t\t\t\t\t\t\t\t\tMay 17, 2019 23:37 IST\n']"
Maharashtra cabinet gives nod to issue ordinance to amend SEBC Act,2019-05-17, 23:20,https://www.hindustantimes.com/mumbai-news/maharashtra-cabinet-gives-nod-to-issue-ordinance-to-amend-sebc-act/story-0xTIeQJIWD0QHSd3WsSynM.html,"['', 'The Maharashtra cabinet on Friday gave its nod to promulgate an ordinance to amend the Socially and Educationally Backward Classes (SEBC) Act to uphold admissions of 253 post graduate medical and dental course aspirants in the Maratha quota. The state will also provide scholarship to students from the open category, if the admission process is disturbed owing to the implementation of the Maratha quota.', 'The decisions come after the Supreme Court (SC) struck down reservations in the SEBC quota for PG medical and dental courses this year. State revenue minister Chandrakant Patil said the ordinance shows the “intent” of the government to provide reservation. “The ordinance explains what we had said earlier [in the Act]. There’s nothing new. The cabinet, after getting due clearance from the Election Commission, decided to bring in an ordinance to protect the admission of these students,” Patil said.', 'A senior state government official said although the draft has been sent, the ordinance may not be promulgated immediately. “The governor is busy. Moreover, he will have to consult his legal team before giving a go-ahead. It will take a couple of days at least,” the official said.', 'The SC petitioner had contended that a section in the SEBC Act states the provision of the Act will not apply to the admission processes that have already been initiated. “Entrance exams don’t have reservations. We had declared that we will implement the SEBC quota in our 50% share. The process began on February 22, when we declared our prospectus. The ordinance is needed to specify this,” Patil said.', 'Meanwhile, protesting students said their stir will continue. “The government has released a press note on the ordinance and not the ordinance. Our protest will continue till it is finalised,” said Shivaji Bhonsale, a PG student, who is protesting at Azad Maidan in Mumbai. Patil, however, said, “Protesters need to understand how the government works. The cabinet, which is the highest body in the state, has taken a decision. Now the process will start.”', 'Anticipating petitions against the decision, the state will file a caveat in the Bombay high court and the Aurangabad and Nagpur benches as well as the Supreme Court, Patil said. The state has also sought to extend the deadline to complete the admission process till May 31, from the earlier May 25.', 'The cabinet decided to seek additional 213 seats in medical courses, and took an in-principle decision to provide scholarship to students of open category seeking admission in private colleges. “We have sent a proposal to the Centre seeking more seats. We have sought 195 PG medical and 32 PG dental seats in Maharashtra. Our proposal will be discussed in a meeting on May 21. If we get these additional seats, we will be able to give admissions to more students. After the Maratha reservation came into force, many students got admissions in deemed colleges through the management quota. For such cases, the state will provide scholarship and aid them in fees,” the minister said.', '\nFirst Published:\r\n\t\t\t\t\t\t\t\t\tMay 17, 2019 23:19 IST\n']"
"After dissent over clean chits, Ashok Lavasa skips poll body meetings ",2019-05-18, 12:16 IST,https://www.hindustantimes.com/lok-sabha-elections/ashok-lavasa-opts-out-of-meetings-on-ec-code-till-dissent-is-recorded/story-W2iKVSRGP39bmHUhEZLiGI.html,"['Ashok Lavasa, the election commissioner who disagreed with the poll panel’s decisions to clear Prime Minister Narendra Modi and Bharatiya Janata Party president Amit Shah of charges of violating the so-called Model Code of Conduct (MCC) — which regulates candidate, party and government behaviour during the elections — has, since May 4 recused himself from all meetings to discuss MCC issues. ', 'He has insisted that he will do so only after dissent notes and minority decisions are included in the orders of the commission.', 'Also Read |\u2009Rs 3000 crore haul by Election Commission, highest in Lok Sabha polls', 'According to a person familiar with the development, the commission has not held any meetings to discuss MCC violations since May 4 because of this. The poll panel’s decision to clear Modi and Shah in all cases of MCC violations, made in a May 3 meeting came in for significant criticism.', 'This was followed by news reports that Lavasa had disagreed with the decisions, although this dissent wasn’t registered in the orders that were passed.', 'The orders themselves came ahead of a scheduled Supreme Court hearing in a case on the EC dragging its feet over complaints regarding violations of the code of conduct by Shah and Modi filed by Congress leader Sushmita Dev.', 'The specific complaints discussed at the EC meeting regarding Modi and Shah included the PM’s speech in Nanded in Maharashtra on April 6 where he referred to the majority being a minority in Wayanad (Congress President Rahul Gandhi’s second constituency); and for his speech in Varanasi where he said 42 terrorists were killed to avenge the death of 40 troopers in Pulwama. Shah was let off for his remarks in an election rally in Kerala where he purportedly said that it was difficult to make out if Wayanad is in India or Pakistan.', 'Opinion | Election Commission should appear to be ‘fair’', 'The person familiar with the matter said that Lavasa has sent several reminders to the Chief Election Commissioner since May 4, to include minority decisions or dissent notes in the final orders. The Election Commission has not passed any orders on violations of the model code since, although it has asked those behind alleged violations for explanations, the official added. ', '“The commissioner had earlier sought to know why his dissenting note was not made part of the final orders issued by the commission,” said this person.', 'Chief Election Commissioner Sunil Arora did not respond to text messages seeking comment.', 'A former finance secretary, Lavasa differed with the decision of the two other members of the poll body, Arora and election commissioner Sushil Chandra, while deciding on the cases of model code of conduct violations against Prime Minister Modi and BJP President Shah. He suggested sending a notice to Modi, which wasn’t accepted. There were at least six complaints in which the PM was given a clean chit, while Congress president Rahul Gandhi was let off in one case.', 'A bunch of complaints pertaining to the violations of the model code of conduct, including one against Prime Minister Modi, for addressing former PM Rajiv Gandhi as “Bhrashtachari No 1” is now pending with the commission.', 'On whether the commission can go ahead with the meetings in his absence, the person cited above said the rules allow for a majority decision and therefore, a decision can be taken in his absence.', 'As per the Election Commission (Conditions of Service of Election Commissioners and Transaction of Business) Act, 1991, if the chief election commissioner and other election commissioners differ in opinion on any matter, such matters are decided according to the opinion of the majority. The commission transacts its business by holding regular meetings and also by circulation of papers. All election commissioners have equal say in the decision making of the commission. ', 'HT reported on May 6 that the EC had justified not including the dissenting opinion on the grounds that since the decision on the violations was not a quasi-judicial decision, the dissent was not recorded. However, a former CEC said on condition of anonymity that such dissenting opinions have to be included in the final order even in cases of MCC violations.', 'In 2017, the then EC OP Rawat recused himself from cases related to the Aam Aadmi Party after party leader Arvind Kejriwal questioned his independence.', '\nFirst Published:\r\n\t\t\t\t\t\t\t\t\tMay 18, 2019 07:20 IST\n']"
"PM Modi offers prayers at Kedarnath shrine, Badrinath next stop",2019-05-18, 11:32 IST,https://www.hindustantimes.com/india-news/pm-modi-in-uttarakhand-to-offer-prayers-at-kedarnath-shrine/story-M52WZnEawYecbsLpRD4ZZO.html,"['Prime Minister Narendra Modi offered prayers at the Kedarnath shrine in Uttarakhand, on Saturday, days before the counting for the Lok Sabha elections on May 23.', 'The Prime Minister who landed around 9.30 am will also review the Kedarpuri reconstruction project. This is his fourth visit to Kedarnath since assuming charge as the prime minister following the BJP’s massive win in the 2014 Lok Sabha elections.', 'He will also go to the Badrinath shrine on Sunday during his two-day visit of the state. In Badrinath, he is scheduled to review a beautification project for the shrine area.', 'Watch | PM Modi offers prayers at Kedarnath, to visit Badrinath next', '“However, it will be his first visit to Badrinath since he became the prime minister five years ago”, said Badrinath Kedarnath Temple Committee (BKTC) chairman Mohan Prasad Thapaliyal. ', '“A fund of Rs 75 crore has been released for the beautification project, for which the work began only recently”, Thapaliyal said adding during his visit, he would also share with officials his vision for the beautification project.', 'During his visit stay at Kedarnath Modi would also meet with officials to review Kedarpuri reconstruction project, the foundation stone of which he laid two years ago.', '“Since then Modiji has been personally monitoring the Kedarpuri reconstruction project”, Thapaliyal said adding during his current visit he will review all the five projects. ', '“About 75% of the Kedarpuri reconstruction project is complete and the remaining works will be completed within the next six months”, Thapaliyal said. The Astha Path (approach road) to the Kedarnath temple, the reconstruction of the shrine area and flood protection works along the Mandakini works have been completed, he said. According to Thapaliyal, flood protection works are currently being undertaken along the river Saraswati.', '“Since then two meditation caves have also come up some one-and-a-half km from the Kedarnath shrine”, Thapaliyal said. According to officials, Modi during his stay at Kedarnath may meditate in one of the caves where he used to meditate when he was an ordinary Rashtriya Swayamsewak Sangh (RSS) pracharak.', '\nFirst Published:\r\n\t\t\t\t\t\t\t\t\tMay 18, 2019 10:08 IST\n']"
‘PM Modi should clearly state what he thinks about Godse’: Priyanka Gandhi,2019-05-18, 11:22 IST,https://www.hindustantimes.com/lok-sabha-elections/pm-modi-should-clearly-state-what-he-thinks-about-godse-priyanka-gandhi/story-gLMh29ISHp42xQJi9CFt1L.html,"['On the last day of the 2019 election campaign, Congress general secretary Priyanka Gandhi Vadra spoke to Sunetra Choudhury about the big controversies of the day, her political debut, and the possibility of seeking election to the Lok Sabha. Edited excerpts: ', 'What is your reaction to the Prime Minister’s remark today that he can’t forgive the remark by Pragya Thakur that Mahatma Gandhi’s assassin Nathuram Godse was a patriot?', 'It’s a cop-out. You are the Prime Minister of the country, there is a question of somebody stating that the person who killed the founder of this country and created its democratic foundation, is a patriot. It’s not enough to say that in your heart, you will not forgive them. You are a political leader, you have to state your political position. What is your position on the killer of Mahatma Gandhi? ', 'Also Read |\u2009Priyanka Gandhi game for Amethi bypoll fight?', 'What should he have done? ', 'He should have taken action. He should have stated very clearly what he felt about Nathuram Godse. I don’t know what the Prime Minister thinks about Nathuram Godse.', 'Your brother Rahul Gandhi said that he has always been pushing you, but you didn’t enter politics because your children were young. What did they say when you decided?', 'I believed very firmly that my children should have as normal and simple a childhood as possible. Bringing up children in Delhi, as it is, is full of challenges. ', 'Rahul and I grew up under the shadow of violence and loss. I did not want my children to have to face that. Often, the burden of a political career is carried by the family, especially the children. I felt I needed to protect my children from this. As it happens, recently they became keen that I should enter politics and they were quite happy that I did.', 'Did they say, ‘Mom you should fight’?', 'Yes, my son would tease me by saying, you are wasting your political skills trying to solve problems between the cook and the electrician, put them to better use! In the last couple of years, both of them were encouraging me to enter politics. ', 'Also Read |\u2009PM\u2009Modi, Rahul Gandhi make final pitch for Lok Sabha polls', 'In your first speech at the Congress Working Committee, you spoke about the current political scenario. Would it be accurate to say that this was a major motivator for your entry?', 'Actually, I think there were two different aspects to my deciding to be in politics. The first was that my view of myself, my life and its relationship to politics changed drastically. The second aspect was that I found myself watching silently as the BJP [Bharatiya Janata Party] was systematically destroying democratic institutions, enforcing a hate-filled political narrative and creating divisions among people for its own political advancement. I began to feel that remaining silent was cowardly. I didn’t know how to accept that cowardice. ', 'When Rahul Gandhi became vice-president of the party he gave the ‘power is poison’ speech; what words of advice did he or your mother give you when you entered politics? ', 'My brother’s advice was very clear. He told me that my job as a politician was to go to all those who are suffering, to find them, stand side-by-side with them, fight for them, and ensure that they had political representation in the system. My mother’s advice was that I talk too much and I should be more prudent about what I say.', 'Do you think that you “talked too much’’ at any point in this campaign? ', 'No, I don’t think so.', 'Do you think the Duryodhan comment against Prime Minister Narendra Modi was too much?', 'Absolutely not. I said very clearly that India has a history of not forgiving arrogance that dates back to the Mahabharat and in that context I quoted a famous poem about Duryodhan. What’s wrong with that? ', 'Did it make you angry when Mr Modi attacked your father? ', 'Not at all, I actually find the Prime Minister funny when he attacks my father because it shows that he is weak and has run out of substantial political arguments. ', 'If we talk about your current assignment in UP, you speak about the booth-level strengthening of the party. Is it feasible so soon? Is Priyanka Gandhi planning for 2019 or 2022? ', 'Clearly in three months, booth-level strengthening and rebuilding an entire political organisation in a state as complex as UP is not feasible. The aim in this election is to defeat the BJP. Where our organisation is weaker, we have ensured that our candidate does not damage the alliance [Samajwadi Party and Bahujan Samaj Party]. However by 2022, it is completely feasible to build booth-level organisations though that is not the main focus of my assignment. My aim is to build representation in the party and to see to it that social groups, women and young people are adequately represented in our party. I think that is actually the deeper aspect of the task ahead of me. The booth level building of an organisation is only going to be a reflection of how well we manage to bring new life, new people and genuine ground level social, cultural and political leaders into our party. ', 'Did you reach out to Mayawati or Akhilesh Yadav to try to salvage an alliance?', 'My mother spoke to Mayawati ji, my brother reached out to both of them, and Mr Scindia [Jyotiraditya Scindia, also a general secretary of the Congress] reached out to Mr Akhilesh Yadav Ji a number of times. We were open to discussing an alliance right from the beginning, simply because we wanted to defeat the BJP in UP. However, for their own political reasons and in their own wisdom, both of them were unresponsive. They probably felt that it was not a feasible proposition for them, and therefore we are fighting alone. I think we have made as good a fight of it as we could have.', 'Many refer to you as Indira 2, referring to your grandmother Indira Gandhi. You invoke her too,why? What is the one similarity you have with her and something that differentiates you?', 'I don’t think it’s fair to say that I invoke her. I speak about her when I feel it’s relevant to speak about her. Just because she is my grandmother, I cannot pretend that she does not exist. She was a prime minister of India and she did a lot of phenomenal work for the country, and as a Congresswoman it is but obvious that I should speak about her. ', 'I think comparisons between her and me are facile. She was a fearless leader of great stature whose political journey began with the fight for India’s independence and ended with her martyrdom. How can anyone compare me with her? I just entered politics three months ago! ', 'Similarity and difference…?', 'My grandmother was a revolutionary and a fighter, I am just a fighter. Maybe the similarity is that once we make up our minds to fight for something we believe in, we will fight to the end. ', 'Now that the campaign is over, Rahul Gandhi will have to give up one of the two seats he contested,should he win both. You have gone to Wayanad and said my brother won’t let you down. So will you rise to the challenge in Amethi?', 'It’s not a challenge. The biggest challenge is for me to build the party for 2022 in Uttar Pradesh.', 'Will you fight in Amethi?', 'It will be decided when my brother decides to leave one of the seats; that discussion will happen then. \u2003', '\nFirst Published:\r\n\t\t\t\t\t\t\t\t\tMay 18, 2019 05:58 IST\n']"
Priyanka Gandhi hints she is game for Amethi bypoll fight,2019-05-18, 07:55 IST,https://www.hindustantimes.com/lok-sabha-elections/priyanka-gandhi-game-for-amethi-bypoll-fight/story-Mfv3I5JX8hXGATvFq7W2FN.html,"['Congress general secretary Priyanka Gandhi Vadra hinted on Friday that she might contest from Amethi in case party president and her brother Rahul Gandhi wins both the seats he is contesting in the Lok Sabha elections, one of which is the family’s traditional stronghold.', '“It’s not a challenge,” Priyanka Gandhi said in an interview to HT on Friday, when asked if she was ready to take on the task of contesting for the Amethi seat in case the Congress president gives it up – a scenario that is possible if he wins Amethi as well as Wayanad in Kerala.', 'Also Read:\u2009‘PM Modi should clearly state what he thinks about Godse’: Priyanka Gandhi', '“It will be decided when my brother decides to leave one of the seats, that discussion will happen then,” she added.', '\nFirst Published:\r\n\t\t\t\t\t\t\t\t\tMay 18, 2019 07:42 IST\n']"
