Heading,Date,Time,URL,Content
"HBSE 10th Result 2019: Daughters of labourer, carpenter and driver among toppers ",2019-05-18, 08:26,https://www.hindustantimes.com/education/hbse-10th-result-2019-daughters-of-labourer-carpenter-and-driver-among-toppers/story-LS76lt58JtyFMPCd6XY3lK.html,"[' Daughters of a labourer, a driver and a carpenter have secured top positions in Class 10 exam of Board of School Education Haryana. ', 'Kaithal labourer’s daughter Isha Devi with 497 marks out of 500 sharesthe first position with three others. ', 'Isha is a student of Shiv Shiksha Niketan Sr Secondary School at Sanghan in Kaithal district. She belongs to Barta village of the district. ', 'Talking to HT, Isha’s mother Raj Rani said, “Isha is very good at studies and we were expecting that she would top the exam.” ', 'She said Isha’s achievement has come as a hope for the family as her father Dharmendra is a daily-wager and does not earn enough to provide quality education and facilities to his children. “We could not send her for private tuition and she got the first position by self study.”', 'Isha’s teacher Shiela said that she is a disciplined girl and always focused on study. “She comes from a very humble background, but now she has become a source of inspiration for other students,” she added.', 'Sanju Rani of the Ashadeep High School of Karhans in Panipat district is also among the toppers with 497 marks.', 'Sanju belongs to a very poor family of Karhans village. Sanju’s father Rampal, who is carpenter, said he is very happy over the achievement of his daughter. ', 'Her mother Anju, who is a housewife, says, “It is a big day of my life as my daughter, a girl from an ordinary family of a small village, has topped the exam.”', '“In 2017, my son had topped Class 10 exam at the block level, but my daughter has proved that girls can even do better than boys,” she added.', 'Sanju gave credit for her success to her family, especially her father, as she said that he always fulfilled her expectations.”I also owe it to my teachers and other family members as they extended all support to me.” ', 'She added that she did not go for tuition and dedicated eight hours daily to self study”. ', 'Sanju’s classmate Tannu is among four students, who shared the second position. ', 'Tannu, a student of Ashadeep High School of Karhans in Panipat, has got 496 marks. Tannu belongs to Pasina Kalan village and her father Ramesh Chander is a driver. Tannu says that she studied 6-7 hours daily and was expecting to be among the toppers.', 'Meanwhile, Hisar’s Nidhi also bagged 496 marks and shsred the second position. Daughter of a property dealer, Nidhi says she wants to become an IAS officer. “I will study hard to achieve my target. I have already started studying for my higher education and I will take best coaching to become an IAS officer.” ', '\nFirst Published:\r\n\t\t\t\t\t\t\t\t\tMay 18, 2019 08:26 IST\n']"
"GBSHSE Goa Board 10th SSC Result 2019 to be declared on May 21, check details here ",2019-05-18, 07:48,https://www.hindustantimes.com/education/gbshse-goa-board-10th-ssc-result-2019-to-be-declared-on-may-21-check-details-here/story-yY0AsxhS2pWXEPxKQLLNGO.html,"['Goa Board of Secondary and Higher Secondary Education (GBSHSE) has confirmed the date of declaring class 10th exam result. GBSHSE\u2009will declare the results of class 10th board exam on May 21 at 11:30 AM. ', 'Candidates can check the results at ghshse.gov.in.  If you are unable to see the results online, you can send a text message in the following format -RESULT<space>GOA10<space>ROLLNO - to 56263 to get your result on your phone.', 'According to reports, over 18,000 students had appeared for the \u2009GBSHSE\u2009class 10th exam that was conducted between April 2 and 23, 2019. ', 'According to the official press note, distribution of grades/ marks of SSC\u2009exam will be on May 23 from 9:30 am to 1:30 pm as per the schedule. ', 'How to check Goa Board SSC\u2009Result 2019', 'Visit the official website of Goa Board at gbshse.org', 'On the homepage, click on the link that reads GHBSHE\u2009SSC\u2009Result 2019', 'Key in your roll number and other login credential and submit', 'Your result will be displayed on the screen', 'Download and take its print out. ', '\nFirst Published:\r\n\t\t\t\t\t\t\t\t\tMay 18, 2019 07:48 IST\n']"
Pass percentage up six points in state board Class 10 results,2019-05-18, 04:29,https://www.hindustantimes.com/gurgaon/pass-percentage-up-six-points-in-state-board-class-10-results/story-uscFEhY0HfrwuZATZhqffN.html,"['Four students jointly topped the Haryana board Class 10 examination, the results of which were declared by the Board of School Education Haryana (BSEH) on Friday.', 'Himanshu of Newton High School, Jhajjar; Sanju of Ashadeep Adarsh School, Panipat; Isha Devi of Shiv Shiksha Niketan, Kaithal and Shalini of Maharshi Dayanand School, Jind, were declared the joint toppers as they all secured 497 marks out of 500 (99.4%).', 'The overall pass percentage this year is 57.39%, up by six points as compared to last year’s, when 51.15% students had made the cut. ', 'Nonetheless, the poor show in Class 10 continued as 1.4 lakh students failed the exams while another 18,000 got compartments. A total of 3.64 lakh candidates had appeared in the exams.', 'Experts have been blaming the poor results of Class 10 every year on the government’s no-detention policy that bars schools from failing any student till Class 8. Uneven distribution of teachers is another factor leading to dismal results in government schools, which have been outperformed by private schools this year by a margin of 10 percentage points. ', 'Girl students outperformed boys by nine percentage points. Compared to 62.17% girls, only 53.43% boys cleared the examination. With 496 marks out of 500, the second position was also shared by four students — Nidhi of Hisar, Ritika of Fatehabad, Tannu of Panipat and Divya of Sirsa. ', 'As many as eight students — Ekta, Chhaya and Anshu of Jind, Muskan of Sirsa, Sahil of Panipat, Pooja of Hisar, Shubhanshu of Sonepat and Nidhi of Fatehabad — were placed at third spot as they secured 495 marks each.', 'The pass percentage of Class 10 had hit a low of 49% in 2016 when the state board had scrapped its moderation policy.  After 2016, the results have improved marginally. ', 'Board chairman Jagbir Singh said the board had distributed past three years’ question papers to schools this year. “The schools were encouraged to hold three mock exams, which seems to have helped,” he said. ', '\nFirst Published:\r\n\t\t\t\t\t\t\t\t\tMay 18, 2019 04:29 IST\n']"
Curfew continues in violence-hit Jammu town for second day,2019-05-18, 01:46,https://www.hindustantimes.com/india-news/curfew-continues-in-violence-hit-jammu-town-for-second-day/story-m0CnhvcxENwN7MsZR9YhGL.html,"['The situation in Jammu and Kashmir continued to be tense on Friday as curfew in the violence-hit Bhaderwah town  in\u2009Doda districtremained in force for the second consecutive day and a shutdown was observed in the Valley.', 'The curfew was imposed in Bhaderwah town after a man was shot by some unidentified gunmen on Thursday morning.', 'Doda district SSP, Shabir Malik said, “Situation is under control but the curfew is still on in Bhaderwah town. There was no law and order problem today”.', 'The police rounded up eight suspects Thursday and they are being questioned, said Malik adding no arrests have been made yet. Mobile internet services also remained suspended in the communally sensitive town to check rumour-mongers.“Police have recovered a licensed gun but it was not clear whether it was used in committing the crime or not. It remains a matter of investigation,” he said.', 'Police said, around 2 am on Thursday, information was received that one Nayeem Ahmed Shah, a resident of Qilla Mohalla, was shot by unidentified persons near Nalti Bridge in Bhaderwah.', 'Meanwhile, police issued a statement rejecting the angle of cow vigilantism in the murder.', '“...no such information has been confirmed. Neither the accused has been identified nor is the motto of killing known,” said a police spokesman.', 'Condemning the incident, governor Satya Pal Malik urged the people not to take law in their own hands and co-operate with the law enforcing agencies. Malik also directed the police and civil administration to spare no efforts in bringing the culprits to justice. ', 'In Kashmir, separatists had called for a shutdown in protest against the “gruesome killings of innocent civilians Arshad Ahmad Dar (Pattan), Raies Ahmad Dar (Pulwama) and Nayeem Ahmad Shah (Baderwah)” during anti-terror operations. ', 'Shops, businesses and educational institutions were closed while public transport was mostly off the roads.  The separatists had also called for protest marches after Friday prayers across the state. Authorities had imposed restrictions in parts of old city to prevent the protests. There was heavy deployment of police and Central Reserve Police Forcein sensitive areas.', 'The Kashmir Valley has been put on a three-day alert after intelligence agencies warned of a possible terror attack on defence installations in the area to coincide with the 17th day of Ramzan on May 21.', 'In the past, militants have chosen the 17th day of Ramzan, the day of the battle of Badr or Jang e Badr to attack security installations in the Valley.', 'A senior official said though there is no specific input that any particular security installation could be targeted but a general alert is sounded. ', '\nFirst Published:\r\n\t\t\t\t\t\t\t\t\tMay 18, 2019 01:46 IST\n']"
20 of 35 new junior colleges in MMR to open in Thane,2019-05-18, 00:40,https://www.hindustantimes.com/mumbai-news/20-of-35-new-junior-colleges-in-mmr-to-open-in-thane/story-eulZX201HJFxzmLqJBH7sJ.html,"['', 'Of the 35 new junior colleges that will open in the Mumbai Metropolitan Region (MMR) this academic year, 20 are in Thane, seven in Mumbai West, five in Mumbai North, two in south Mumbai and one in Panvel, according to the education department.', 'Around 5,200 seats will be up for grabs in these new colleges. The 35 colleges have most divisions in the science stream (27), followed by commerce (25) and arts (13).', 'Principals said the approval for new seats in unaided colleges is worrying. ', '“With most science aspirants wanting to join a college which allows them to take coaching for competitive exams, unaided colleges are interested in getting science divisions. This is defeating the purpose of junior colleges, as many existing colleges are struggling to retain students,” said Satram Verhani, vice-principal, CHM College, Ulhasnagar.', 'The admission portal for FYJC will be open for students from May 25, after which they can fill out part 1 of their admission forms, which includes their personal details. This year, 849 colleges in MMR will be open for admissions. ', '“Information booklets for the admission process will reach guidance centres and schools by May 25, after which the portal will be opened,” said Bhaskarrao Babar, assistant director of education, Mumbai region.', '“Students will get detailed information on how to apply through the booklet and from their respective schools and guidance centres,” said Babar.', '\nFirst Published:\r\n\t\t\t\t\t\t\t\t\tMay 18, 2019 00:37 IST\n']"
The truth about eggs...,2019-05-18, 00:13,https://www.hindustantimes.com/health/the-truth-about-eggs/story-UBbUqSFHcqSvznWugnLS8O.html,"['Why is Taron Egerton’s character in the 2014 release Kingsman (also starring Colin Firth) nicknamed Eggsy? Sadly, the film doesn’t ever explain. But wouldn’t it be the perfect nickname for many around us, simply because of their love for eggs?', 'Take Delhi resident Prithvi, for example. Last month the 38-year-old returned to the treadmill after a gap of 10 years. What prompted him was not his weight – which was touching 100 kg – or any real concern over the fact that he was beginning to pant every time he negotiated the flight of stairs to his second-floor apartment in south Delhi. Nor was it with any idea to lose the growing paunch that his wife had been cribbing about for years. “I had a routine medical check-up and my blood cholesterol level was high. Considering my weight issues, the doctor put all kinds of dietary restrictions on me, including cutting down my meat and eggs intake,” says Prithvi. “I don’t eat meat daily. But not having eggs was like a punishment. So I thought maybe if I lost some weight and became healthier, I could continue to have eggs,” he adds with a laugh.', 'Medical journals define cholesterol as a waxy substance in the blood, needed to build cells, among other things. It is of two kinds – high-density lipid (HDL) and low-density lipid (LDL). The problem arises when there is too much cholesterol in the blood (especially of the sticky LDL kind called bad cholesterol), which can then accumulate on the artery walls, choking them and increasing risks of heart attacks and other cardiac problems.', 'In his 1906 novel Love Among The Chickens, PG Wodehouse asks, “Have you ever seen a man, woman, or child who wasn’t eating an egg or just going to eat an egg or just coming away from eating an egg? I tell you, the good old egg is the foundation of daily life.” For years, however, this ‘nature’s multivitamin’ as it is often referred to, for its rich store of nutrients, has been maligned because of its association with that dirty, scary ‘C’ word – cholesterol. A big egg (weighing about 50 gm) has about 184 mg of cholesterol, which is concentrated in the yolk. ', '“The simplistic reasoning was that cholesterol is not good for health, it gets deposited in the arteries, egg yolk contains a high level of cholesterol, so avoid eggs,” explains Dr Vikram Jaggi, director, Asthma, Chest & Allergy Centre, Delhi.', 'Scientists in America began researching the links between lifestyle, diet and cardiovascular diseases in humans from the late 1940s. In 1968, the American Heart Association (AHA) announced a dietary recommendation that all individuals should consume less than 300 mg of dietary cholesterol per day and not more than three whole eggs in a week. This American apprehension then spread to the rest of the world, depriving many an egg-lover of their favoured source of nourishment.  ', 'In a 2015 article, The 50 Year Rehabilitation of the Egg, available on the National Center for Biotechnology Information website, Donald J McNamara (former director of the Egg Nutrition Center) recalls the effect the  AHA guideline had on consumption. “The egg industry was faced with a difficult situation... fight back and be accused of putting profits ahead of public health or simply give in to the dietary cholesterol phobia...” he writes. The decline in egg consumption finally “prompted the egg industry to establish the Egg Nutrition Center to promote research and initiate health education ...”.', 'According to a 2017 article on the National Public Radio website, Walter Willett of the Harvard TH Chan School of Public Health was one of the first physicians to realise that while cholesterol is associated with higher risks of heart disease, there was no proof that cholesterol consumption increased its levels in the blood. “Willett and his colleagues have since studied thousands of patients for years and have found no evidence that moderate dietary cholesterol or egg consumption increases the risk for heart disease and stroke, except in people with a strong genetic risk for high cholesterol and possibly people with diabetes.” Other researchers have also over the years have also failed to find a link between dietary cholesterol and its level in the blood and given a clean chit to eggs.', 'A 2017 article in Harvard Health  Publishing pointed out that only about 20 per cent of the cholesterol in our blood comes from the food we eat. Agrees nutritionist and author, Kavita Devgan, “A large percentage of the cholesterol in our body is manufactured in the body. It has little relation to what we eat.”', '', 'To Eat Or Not To Eat', 'But the confusion – and contradictory opinion – about eggs persists. In the past one year two studies came up with very different findings. In March this year, various publications reported the findings of a study published in the The Journal of the American Medical Association, which found “that for each additional 300 milligrams a day of cholesterol in the diet, there was a 17 per cent increased risk of cardiovascular disease and an 18 per cent increased risk of premature death from any cause.” The study had been conducted among almost 30,000 participants, over a period of 17 years. Eggs – because of their rich cholesterol content – “had the same more-is-worse effect”, wrote the New York Times (NYT) while reporting on the study. Norrina B Allen, lead author of the study and associate professor of epidemiology at Northwestern University, however, was quoted by the NYT as saying, “eggs have some advantages – amino acids and minerals... You do want to reduce the number of eggs, especially egg yolks, as part of a healthy diet. But we don’t want people to walk away thinking they shouldn’t eat any eggs.” Earlier, in May last year, CNN had reported on research by Canqing Yu, associate professor in the Peking University School of Public Health in Beijing and his colleagues, which found that “daily egg-eaters had an 18 per cent lower risk of dying from cardiovascular disease”. ', 'Meanwhile, Jaggi’s patients continue to ask him about whether they should have eggs and how many is too many. ', 'In the US, The Dietary Guidelines  2015-2020, removed the earlier limit on dietary cholesterol, but cautioned that “individuals should eat as little dietary cholesterol as possible” because “foods that are higher in dietary cholesterol... are also higher in saturated fats.” This means eggs should be safe because they contain little saturated fat. The British Heart Foundation has also removed their earlier restrictions, which recommended people with high cholesterol levels to not consume more than three-four eggs a week. “One reason for this [confusion] is that we doctors are taught more about diseases and medicines than about good health and diets,” says Jaggi. “As a result, we do not have good scientific knowledge of what kind of food is good and what isn’t. Much of what we know about diets are hypothesis.” ', 'The National Egg Coordination Committee (NECC) India, launched the campaign ‘Sunday ho ya Monday, roz khao ande’ in the 1980s. The campaign became an instant hit and enjoys recall even today. “That campaign was launched in response to prevalent religious beliefs which made people avoid eggs – as part of non-vegetarian – food on certain days of the week,” recalls national vice-chairman, NECC, Sandeep Mehta. But that does not mean that poultry farmers weren’t affected by the medical flip-flop over eggs. “About 20 years back the cholesterol worry was making many give up eggs. Our business had been seriously affected. We had even visited doctors to try and understand the concern and see if anything could be done to address it,” recalls Mehta.', 'Today most doctors in India are of the opinion that it’s all right to eat eggs – at least in moderation. “Healthy adults, till the age of 40, may have one to two eggs a day. Those with a more active lifestyle – sportsmen for example – may even three-four eggs a day. After 40, as activity levels go down, one egg a day is good,” says Ritika Samaddar, chief clinical nutritionist at Max, Delhi. And by egg, she means a whole egg – not just the white. “Egg whites only are the biggest myth. It is true that most of the calories, as well as all the cholesterol, in an egg is in the yolk. But it is also rich in nutrients such as protein and vitamins. I always advise a whole egg for all my patients,” she says. Samaddar believes even vegetarians will benefit from eggs, even if they don’t eat meat. “Being an animal protein, it has 100 per cent absorption. Vegetable protein has fibres and other nutrient inhibitors present making it unavailable for absorption,” she says. ', '', 'Those with a high cholesterol issue or with a history of heart ailments or diabetes, may also have eggs – but should probably restrict it two about two-three a week, says cardiologist Praveen Chandra, who practices at the Medanta hospital. “Dietary cholesterol raises the total serum cholesterol in the body, but is a less important contributor to coronary heart diseases than saturated fat. Eggs are a chief source of dietary cholesterol, but the association between regular egg consumption and risk of coronary heart disease and stroke are uncertain,” says cardiologist KK Aggarwal, president, Heart Care Foundation of India. “In patients with high cholesterol, it is more important to restrict trans fat and bad saturated fats.” So avoid making an omelette in hydrogenated oil, he cautions.', 'Check your breakfast platter for the real culprits – refined carbohydrates like sugar, maida, rice etc. As Anthony Komaroff (MD) writes in an article in the Harvard Health Publishing, “It matters greatly what you eat with your eggs. The saturated fat in butter, cheese, bacon, sausage, muffins, or scones, for example, raises your blood cholesterol much more than the cholesterol in your egg. And the highly refined “bad carbs” in white toast, pastries, home fries, and hash browns may also increase your risk of heart disease, stroke, and other cardiovascular diseases.” A balanced diet is important, insists Aggarwal. “And finally, what can be eaten and what can’t can vary on a case to case basis. There can’t be generalisations,” he says. ', 'So here’s hope yet, for Prithvi. He may indulge in his egg a day, if he can curb his love for sweets and stop himself from sneaking to the kitchen for a few after-dinner deserts in the middle of the night. And has his morning egg with a bowl of sprouts or just a single slice of bread (preferably multigrain, unbuttered and not topped with sugar). ', '\nFirst Published:\r\n\t\t\t\t\t\t\t\t\tMay 18, 2019 00:13 IST\n']"
