Source,Heading,Category,Date,Time,URL,Cluster,cluster_similarity_value
The Hindu, All that ’ s bready and meaty at Tres in Delhi,food,2019-06-12,14:22:00,https://www.thehindu.com/life-and-style/food/review-of-tres-a-restaurant-delhi/article27852336.ece,0,0.57
The Hindu, Mango or jackfruit Pick one,food,2019-06-08,11:40:00,https://www.thehindu.com/life-and-style/food/when-faced-with-a-choice-would-you-choose-mango-or-jackfruit/article27556192.ece,1,0.24
The Hindu, Know the heritage varieties of rice,food,2019-06-14,17:56:00,https://www.thehindu.com/life-and-style/food/kullakar-kaatuyanam-poongkar-karunkuruvai-thavala-kannan-matta-reversing-diabetes-in-21-days-charulatha-newar-heirloom-rice/article27907083.ece,1,0.26
Savvy, Protein Punch Dr Siddhant Bhargava on the renewed push for protein in men and women,food,2019-01-22,15:02,http://www.savvy.co.in/article/cookbook/protein-punch-dr-siddhant-bhargava-on-the-renewed-push-for-protein-in-men-and-women/12372,1,0.22
The Hindu, How to make authentic avakaya the Telugu mango pickle,food,2019-06-13,09:20:00,https://www.thehindu.com/life-and-style/food/how-to-make-authentic-avakaya-the-hyderbadi-mango-pickle/article27883211.ece,1,0.26
The Hindu, The man reviving endangered mango varieties,food,2019-06-13,16:47:00,https://www.thehindu.com/life-and-style/food/the-man-reviving-endangered-mango-varieties/article27899033.ece,1,0.3
The Hindu, How to cook breakfast in under 15 minutes,food,2019-06-17,16:40:00,https://www.thehindu.com/life-and-style/food/how-to-cook-breakfast-in-under-15-minutes/article27996703.ece,2,0.53
The Hindu, Nigella Lawson on how cooking is a sign of independence,food,2019-06-08,14:35:00,https://www.thehindu.com/life-and-style/food/nigella-lawson-on-how-cooking-and-keeping-oneself-alive-is-a-sign-of-independence/article27661122.ece,3,0.87
The Hindu, Need your food to be styled for the perfect picture meet food stylist Aarthy Rao,food,2019-06-08,18:13:00,https://www.thehindu.com/life-and-style/food-stylist-aarthy-rao-on-her-work/article27655613.ece,4,0.41
The Hindu, Toscano in Chennai fine Italian cuisine with picture perfect food,food,2019-06-14,18:07:00,https://www.thehindu.com/life-and-style/food/toscano-in-chennai-fine-italian-cuisine-with-picture-perfect-food/article27934096.ece,4,0.46
The Hindu, How cheap is a three course meal in Chennai,food,2019-06-13,16:54:00,https://www.thehindu.com/life-and-style/food/cheap-budget-meal-in-chennai-mannady/article27762311.ece,4,0.38
The Hindu, After a decade black tiger shrimps stage a comeback in Kerala,food,2019-06-17,16:49:00,https://www.thehindu.com/sci-tech/energy-and-environment/after-a-decade-black-tiger-shrimps-stage-a-comeback-in-kerala/article27997485.ece,5,1.0
Savvy, Quick Bite Amit Bajaj treats you to finger licking party food,food,2019-01-21,15:02,http://www.savvy.co.in/article/cookbook/quick-bite-amit-bajaj-treats-you-to-finger-licking-party-food/12371,6,0.32
Savvy, Lite Bite,food,2018-12-16,15:02,http://www.savvy.co.in/article/cookbook/lite-bite/12346,6,0.29
Savvy, Heavenly Bites Treat your loved ones to a delightful spread,food,2019-06-10,15:02,http://www.savvy.co.in/article/cookbook/heavenly-bites-treat-your-loved-ones-to-a-delightful-spread/12432,6,0.27
Savvy, Drunken Stupor Nutritionist Karishma Chawla shows you how to deal with a hangover after a hard night of partying,food,2019-06-12,15:02,http://www.savvy.co.in/article/cookbook/drunken-stupor-nutritionist-karishma-chawla-shows-you-how-to-deal-with-a-hangover-after-a-hard-night/12433,6,0.28
The Hindu, Straight from the Malabar Coast,food,2019-06-14,21:42:00,https://www.thehindu.com/life-and-style/food/straight-from-the-malabar-coast/article27942808.ece,7,0.65
The Hindu, On Michelin starred budget trail in Singapore,food,2019-06-05,15:09:00,https://www.thehindu.com/life-and-style/travel/on-michelin-starred-budget-trail-in-singapore/article27503382.ece,8,1.0
Savvy, Refreshing,food,2019-06-08,15:02,http://www.savvy.co.in/article/cookbook/refreshing/12431,9,0.25
The Hindu, The grand unravelling of a murder mystery across a magnificent dining table,food,2019-06-15,17:47:00,https://www.thehindu.com/life-and-style/food/the-grand-unravelling-of-a-murder-mystery-across-a-magnificent-dining-table/article27950165.ece,9,0.31
The Hindu, Of sauces spices and strognoff in Kochi,food,2019-06-15,11:53:00,https://www.thehindu.com/life-and-style/food/burgers-stroganoff-and-safe-food-in-kochi/article27948207.ece,9,0.27
Savvy, Traditional Twist,food,2019-01-04,15:02,http://www.savvy.co.in/article/cookbook/traditional-twist/12364,10,0.5
The Hindu, Remembering Jiggs Kalra,food,2019-06-06,16:02:00,https://www.thehindu.com/life-and-style/food/remembering-jiggs-kalra/article27554814.ece,11,1.0
The Hindu, The Food Bar Coimbatore offers tasty fare in generous portions,food,2019-06-14,17:56:00,https://www.thehindu.com/life-and-style/food/the-food-bar-coimbatore-offers-tasty-fare-in-generous-portions/article27899061.ece,12,0.28
The Hindu, When murder and food come together in a book,food,2019-06-08,16:39:00,https://www.thehindu.com/life-and-style/food/death-by-sandwich/article27615226.ece,12,0.28
The Hindu, ‘ Oh Baby ’ Samantha goes food hopping,food,2019-06-15,17:21:00,https://www.thehindu.com/life-and-style/food/oh-baby-samantha-akkineni-akkineni-nageshwar-rao-fooddrifter-ashis-nayak-neidhi-kumaar/article27950021.ece,12,0.3
Savvy, Hearty Healthy,food,2019-04-25,15:02,http://www.savvy.co.in/article/cookbook/hearty-healthy/12413,13,1.0
The Hindu, After Id celebrations,food,2019-06-08,11:46:00,https://www.thehindu.com/life-and-style/food/rahul-verma-post-eid-food/article27695276.ece,14,1.0
The Hindu, Tasting China chef Quing Chang style,food,2019-06-14,21:45:00,https://www.thehindu.com/life-and-style/food/tasting-china-chef-quing-chang-style/article27942837.ece,15,1.0
Savvy, Christmas Spirit,food,2019-02-15,15:02,http://www.savvy.co.in/article/cookbook/christmas-spirit/12397,16,1.0
The Hindu, Fruits around a stick,food,2019-06-12,15:44:00,https://www.thehindu.com/news/cities/Coimbatore/tarun-anand-has-launched-sticksy-a-new-brand-of-ice-lollies-in-coimbatore/article27861339.ece,17,1.0
The Hindu, What ’ s in a bread The story of the Indian bread basket,food,2019-06-06,18:49:00,https://www.thehindu.com/life-and-style/food/whats-in-a-bread/article27564796.ece,18,0.55
