Source,Heading,Category,Date,Time,URL
Indian Express,2005 Ayodhya terror attack case: Verdict likely on June 18,lucknow news,2019-06-12,04:31:35:00,https://indianexpress.com/article/cities/lucknow/2005-ayodhya-terror-attack-case-verdict-likely-on-june-18-5776162/
Indian Express,"Uttar Pradesh: Minor raped, hunt on for two suspects",lucknow news,2019-06-12,04:24:01:00,https://indianexpress.com/article/cities/lucknow/uttar-pradesh-minor-raped-hunt-on-for-two-suspects-meerut-5776157/
Indian Express,"Uttar Pradesh to allow microbreweries, hike old-age pension to Rs 500",lucknow news,2019-06-12,04:17:25:00,https://indianexpress.com/article/cities/lucknow/uttar-pradesh-cabinet-meeting-microbreweries-old-age-pension-yogi-adityanath-5776150/
Indian Express,Two transgender groups clash in Meerut,lucknow news,2019-06-11,04:24:43:00,https://indianexpress.com/article/cities/lucknow/two-transgender-groups-clash-in-meerut-5774343/
Indian Express,Uttar Pradesh: Priyanka Gandhi and Scindia to hold post-poll review meeting this week,lucknow news,2019-06-11,04:09:13:00,https://indianexpress.com/article/cities/lucknow/uttar-pradesh-priyanka-gandhi-scindia-to-hold-post-poll-review-meeting-5774336/
Indian Express,Yogi Adityanath visits Mulayam after SP leader returns from hospital,lucknow news,2019-06-11,04:02:41:00,https://indianexpress.com/article/cities/lucknow/yogi-adityanath-visits-mulayam-after-sp-leader-returns-from-hospital-5774328/
Indian Express,"Yogi Adityanath calls emergency meeting; police handling rape cases with sensitivity, says DGP",lucknow news,2019-06-11,03:56:58:00,https://indianexpress.com/article/cities/lucknow/yogi-adityanath-uttar-pradesh-dgp-police-handling-rape-cases-with-sensitivity-5774319/
Indian Express,"In UP’s Kushinagar, 13-year-old girl sexually assaulted by six men: Cops",lucknow news,2019-06-10,05:00:59:00,https://indianexpress.com/article/cities/lucknow/in-ups-kushinagar-13-year-old-girl-sexually-assaulted-by-six-men-cops-5772532/
Indian Express,UP: CISF team takes stock of security arrangements at Gorakhnath temple,lucknow news,2019-06-08,04:55:10:00,https://indianexpress.com/article/cities/lucknow/up-cisf-team-takes-stock-of-security-arrangements-at-gorakhnath-temple-5770429/
Indian Express,"UP Police: Man found killed, three arrested",lucknow news,2019-06-08,04:51:04:00,https://indianexpress.com/article/cities/lucknow/up-police-man-found-killed-three-arrested-5770427/
Indian Express,Jaipur: Fire breaks out in SMS Hospital,jaipur news,2019-05-10,15:12:23:00,https://indianexpress.com/article/cities/jaipur/fire-breaks-out-in-sms-hospital-5721107/
Indian Express,Foreigner held with satellite phone at Jaipur airport,jaipur news,2019-04-22,13:25:55:00,https://indianexpress.com/article/cities/jaipur/foreigner-held-with-satellite-phone-at-jaipur-airport-5688157/
Indian Express,Rajasthan Congress MLA booked for rape,jaipur news,2019-04-21,06:33:59:00,https://indianexpress.com/article/cities/jaipur/rajasthan-congress-mla-booked-for-rape-5686357/
Indian Express,Rajasthan: 44 Pakistani migrants granted Indian citizenship,jaipur news,2019-03-07,15:49:37:00,https://indianexpress.com/article/cities/jaipur/rajasthan-pakistani-migrants-granted-indian-citizenship-5615744/
Indian Express,Convict from Pakistan killed in Jaipur Central Jail brawl,jaipur news,2019-02-21,07:17:43:00,https://indianexpress.com/article/cities/jaipur/convict-from-pakistan-killed-in-jaipur-central-jail-brawl-5593719/
Indian Express,Pakistan national killed in Jaipur jail following brawl with inmates,jaipur news,2019-02-21,02:05:09:00,https://indianexpress.com/article/cities/jaipur/pakistan-national-killed-in-jaipur-jail-5592998/
Indian Express,"Jaipur councillors allege 500 cow deaths at Hingonia centre, seek action",jaipur news,2019-02-16,07:39:41:00,https://indianexpress.com/article/cities/jaipur/jaipur-councillors-allege-500-cow-deaths-at-hingonia-centre-seek-action-5586692/
Indian Express,Farm loan waiver certificates from Feb 7,jaipur news,2019-02-04,02:11:23:00,https://indianexpress.com/article/cities/jaipur/farm-loan-waiver-certificates-from-feb-7-5567397/
Indian Express,"Rajasthan High Court asks Robert Vadra, his mother to appear before ED on February 12",jaipur news,2019-01-21,21:47:32:00,https://indianexpress.com/article/cities/jaipur/rajasthan-high-court-robert-vadra-ed-money-laundering-5549070/
Indian Express,Former Union minister CP Joshi elected Speaker of Rajasthan Assembly,jaipur news,2019-01-16,16:42:53:00,https://indianexpress.com/article/cities/jaipur/congress-cp-joshi-speaker-of-rajasthan-assembly-5541482/
Indian Express,Senior Congress leader CP Joshi to be Rajasthan Assembly speaker,jaipur news,2019-01-14,18:04:32:00,https://indianexpress.com/article/cities/jaipur/cp-joshi-rajasthan-assembly-speaker-5538151/
Indian Express,"Rajasthan HC stays allotment of 10k petrol pumps; issues notices to centre, state govt, oil companies",jaipur news,2019-01-12,19:36:21:00,https://indianexpress.com/article/cities/jaipur/rajasthan-hc-stays-allotment-of-10k-petrol-pumps-issues-notices-to-centre-state-govt-oil-companies-5535640/
Indian Express,Chennai News June 14 Highlights : Tamil Nadu writers win Sahitya Academi awards; Logs in airport entrance catch fire,chennai news,2019-06-14,17:52:54:00,https://indianexpress.com/article/cities/chennai/chennai-news-live-updates-tamil-nadu-news-today-chennai-news-today-chennai-weather-traffic-live-updates-live-5779897/
Indian Express,Chennai News June 13 Highlights: AIADMK appoints spokepersons for media interactions; Swami Sankardas Ani meets Captain Vijaykanth,chennai news,2019-06-14,13:31:06:00,https://indianexpress.com/article/cities/chennai/chennai-live-news-updates-on-traffic-weather-rains-corporation-movies-politics-and-local-issues-live-5778011/
Indian Express,Chennai News June 12 Highlights: NIA concludes raids at Coimbatore; stoplines on Kamarajar Salai get LED lights,chennai news,2019-06-13,20:50:36:00,https://indianexpress.com/article/cities/chennai/chennai-live-news-updates-on-traffic-weather-rains-corporation-movies-politics-and-local-issues-live-5776206/
Indian Express,Chennai: Homosexual arrested for chopping off genitals of two men,chennai news,2019-06-13,12:05:20:00,https://indianexpress.com/article/cities/chennai/chennai-homosexual-arrested-for-chopping-off-genitals-of-two-men-5778396/
Indian Express,"Chennai June 11 Highlights: Cyclone Vayu to skip Chennai; Justice Sivagnanam, Bhavani Supparayan to hear Vedanta plea",chennai news,2019-06-11,17:42:49:00,https://indianexpress.com/article/cities/chennai/chennai-live-news-updates-on-traffic-weather-rains-corporation-movies-politics-and-local-issues-live-5774395/
Indian Express,"Tamil Nadu allows shops to remain open 24×7, gets a mixed response",chennai news,2019-06-11,17:15:24:00,https://indianexpress.com/article/cities/chennai/tamil-nadu-allows-shops-to-open-24x7-gets-a-mixed-response-5771071/
Indian Express,Chennai News June 8 Highlights: DMK Student wing to stage protests; City Traffic Police initiate crackdown on traffic violators,chennai news,2019-06-08,17:16:14:00,https://indianexpress.com/article/cities/chennai/chennai-live-news-updates-on-traffic-weather-rains-corporation-movies-politics-and-local-issues-live-5770669/
Indian Express,"Chennai’s beaches now wear cleaner look, courtesy these machines",chennai news,2019-06-08,07:24:08:00,https://indianexpress.com/article/cities/chennai/chennai-beaches-become-cleaner-with-beach-cleaning-machines-5769676/
Indian Express,Chennai News June 7 Highlights: Thermal convection likely to trigger rain in the State; K Bhagyaraj to contest against Vishal,chennai news,2019-06-07,18:23:41:00,https://indianexpress.com/article/cities/chennai/chennai-live-news-updates-on-traffic-weather-rains-corporation-movies-politics-and-local-issues-live-5769396/
Indian Express,Gandhiana at Chennai International Airport makes heads turn,chennai news,2019-06-04,12:25:15:00,https://indianexpress.com/article/cities/chennai/gandhiana-at-chennai-international-airport-makes-heads-turn/
Indian Express,Chennai’s Chitlapakkam lake revival model holds key to fight water crisis,chennai news,2019-05-31,13:10:44:00,https://indianexpress.com/article/cities/chennai/chennais-chitlapakkam-lake-revival-model-holds-key-to-fight-water-crisis-5758223/
Indian Express,Zero Waste Chennai: Planning for a garbage-free city,chennai news,2019-05-29,18:48:02:00,https://indianexpress.com/article/cities/chennai/zero-waste-chennai-planning-for-a-garbage-free-city-5754862/
