Source,Heading,Category,Date,Time,URL
Business Today,Privatise mining firms to cut import bill by $400 billion: Anil Agarwal to PM Modi,corporate,2019-06-24,16:38,https://www.businesstoday.in/current/corporate/privatise-mining-firms-to-cut-import-bill-by-400-billion-anil-agarwal-to-pm-modi/story/358442.html
Business Today,Government recognises ONGC as promoter of HPCL,corporate,2019-06-24,16:38,https://www.businesstoday.in/current/corporate/government-recognises-ongc-as-promoter-of-hpcl/story/358371.html
Business Today,"Six of top-10 firms lose Rs 53,459 crore in m-cap; RIL takes steepest hit",corporate,2019-06-24,16:38,https://www.businesstoday.in/current/corporate/six-of-top-10-firms-lose-rs-53459-crore-in-m-cap-ril-takes-steepest-hit/story/358332.html
Business Today,Usha International toying with franchisee model to expand footprint in tier II and III cities,corporate,2019-06-24,16:38,https://www.businesstoday.in/current/corporate/usha-international-toying-with-franchisee-model-to-expand-footprint-in-tier-ii-and-iii-cities/story/358312.html
Business Today,"TCS to open centre in Patna, says Ravi Shankar Prasad",corporate,2019-06-24,16:38,https://www.businesstoday.in/current/corporate/tcs-to-open-centre-in-patna-says-ravi-shankar-prasad/story/358288.html
Business Today,NCLT directs Bandhan Bank to seek shareholders nod for merger with Gruh Finance,corporate,2019-06-24,16:38,https://www.businesstoday.in/current/corporate/nclt-directs-bandhan-bank-to-seek-shareholders-nod-for-merger-with-gruh-finance/story/358266.html
Business Today,"Interest level of strategic investors in Zee higher than before, say insiders",corporate,2019-06-24,16:38,https://www.businesstoday.in/current/corporate/interest-level-of-strategic-investors-in-zee-higher-than-before-say-insiders/story/358109.html
Business Today,IndiGo flight from Delhi faces nose wheel malfunction on landing in Mumbai,corporate,2019-06-24,16:38,https://www.businesstoday.in/current/corporate/indigo-flight-from-delhi-faces-nose-wheel-malfunction-on-landing-in-mumbai/story/358413.html
Business Today,BHEL wins Rs 840 crore order for emission control equipment,corporate,2019-06-24,16:38,https://www.businesstoday.in/current/corporate/bhel-wins-rs-840-crore-order-for-emission-control-equipment/story/358350.html
Business Today,"Companies using GST softwares will increase, says Logo Infosoft CEO",corporate,2019-06-24,16:38,https://www.businesstoday.in/current/corporate/companies-using-gst-softwares-will-increase-says-logo-infosoft-ceo/story/358313.html
Business Today,Radiant Life Care completes acquisition of 49.7% stake in Max Healthcare,corporate,2019-06-24,16:38,https://www.businesstoday.in/current/corporate/radiant-life-care-completes-acquisition-of-497pc-stake-in-max-healthcare/story/358289.html
Business Today,Fitch affirms Tata Steels BB rating with stable outlook,corporate,2019-06-24,16:38,https://www.businesstoday.in/current/corporate/fitch-affirms-tata-steel-bb-rating-with-stable-outlook/story/358278.html
Business Today,"PNB fraud: ED rejects Choksis request to question him in Antigua, says it can provide air ambulance",corporate,2019-06-24,16:38,https://www.businesstoday.in/current/corporate/pnb-fraud-ed-says-no-to-question-mehul-choksi-in-antigua-says-it-can-provide-air-ambulance-to-bring-him-back/story/358207.html
Business Today,Indiabulls Housing Finance and Lakshmi Vilas Bank merger gets CCI nod,corporate,2019-06-24,16:38,https://www.businesstoday.in/current/corporate/indiabulls-housing-finance-and-lakshmi-vilas-bank-merger-gets-cci-nod/story/358061.html
Business Today,Ratan Tatas top aide R Venkataramanan joins Mukesh Ambanis Reliance Industries,corporate,2019-06-24,16:38,https://www.businesstoday.in/current/corporate/ratan-tata-r-venkataramanan-joins-mukesh-ambani-reliance-industries/story/357928.html
Business Today,Moodys downgrades Tata Motors credit rating on JLR worries,corporate,2019-06-24,16:38,https://www.businesstoday.in/current/corporate/moodys-downgrades-tata-motors-credit-rating-on-jlr-worries/story/357858.html
Business Today,"IL&FS Fraud Case: Six Probe agencies train guns on auditors Deloitte, BSR",corporate,2019-06-24,16:38,https://www.businesstoday.in/current/corporate/ilfs-fraud-case-six-probe-agencies-investigate-auditors-deloitte-bsr/story/357627.html
Business Today,Indian smartphone users consume maximum data in the world at 9.8 GB per month: Ericsson,corporate,2019-06-24,16:38,https://www.businesstoday.in/current/corporate/smartphones-indian-users-data-consumption-ericsson-mobilephones-5g/story/357579.html
Business Today,"Apollo group exits insurance business to focus on hospitals growth, reduce debt",corporate,2019-06-24,16:38,https://www.businesstoday.in/current/corporate/apollo-group-exits-insurance-business-to-focus-on-hospitals-growth-reduce-debt/story/357458.html
Business Today,"Paytm Money eyes $1.2 billion funding, to be 3rd unicorn from Paytm family",corporate,2019-06-24,16:38,https://www.businesstoday.in/current/corporate/paytm-money-eyes-investment-worth-12-billion-to-be-3rd-unicorn-from-paytm-family/story/357314.html
Business Today,"Blackstone buys office space in Mumbais BKC building that houses Facebook, Amazon for Rs 2,500 crore",corporate,2019-06-24,16:38,https://www.businesstoday.in/current/corporate/blackstone-one-bkc-building-mumbai-bandra-kurla-complex-radius-developers-office-space-largest-commercial-real-estate-deal/story/357256.html
Business Today,"Ritesh Agarwals American Dream to get $300 million thrust! Oyo to launch in New York, Los Angeles, San Fransisco",corporate,2019-06-24,16:38,https://www.businesstoday.in/current/corporate/oyo-hospitality-ritesh-agarwal-american-dream-us-market-investment-new-york-los-angeles-san-fransisco/story/357882.html
Business Today,"Jet Airways crisis: NCLT admits SBIs insolvency plea, orders resolution in three months",corporate,2019-06-24,16:38,https://www.businesstoday.in/current/corporate/jet-airways-crisis-nclt-admits-sbi-insolvency-plea-orders-resolution-in-three-months/story/357778.html
Business Today,"Paytm says no to cashbacks on P2P transactions, gives incentives to offline merchants",corporate,2019-06-24,16:38,https://www.businesstoday.in/current/corporate/paytm-says-no-to-cashbacks-on-p2p-transactions-gives-incentives-to-offline-merchants/story/357605.html
Business Today,CCI to Android phone makers: Explain agreements with Google,corporate,2019-06-24,16:38,https://www.businesstoday.in/technology/news/cci-competition-commission-of-india-google-phone-handset-makers-android-operating-system-os-anti-trust-regulator/story/357529.html
Business Today,"HDFC to acquire majority stake in Apollo Munich Health Insurance for Rs 1,347 crore",corporate,2019-06-24,16:38,https://www.businesstoday.in/current/corporate/hdfc-to-acquire-majority-stake-in-apollo-munich-health-insurance-rs-1347-cr/story/357427.html
Business Today,Cricket Australia selects HCL Technologies as digital technology partner,corporate,2019-06-24,16:38,https://www.businesstoday.in/current/corporate/cricket-australia-selects-hcl-technologies-digital-technology-partner/story/357295.html
Business Today,"ED attaches 6,000 vehicles worth Rs 1,610 crore of Surat-based logistics firm for bank fraud, money laundering",corporate,2019-06-24,16:38,https://www.businesstoday.in/current/corporate/ed-attaches-6000-vehicles-worth-rs-1610-crore-surat-based-logistics-firm-bank-fraud-money-laundering/story/357255.html
Business Today,"Chinese banks seek Rs 14,775 crore from Anil Ambanis RCom",corporate,2019-06-24,16:38,https://www.businesstoday.in/current/corporate/chinese-banks-seek-rs-14775-crore-from-anil-ambani-bankrupt-firm-rcom/story/357202.html
Business Today,"Razorpay gets $75 million from Sequoia India, Ribbit Capital in Series-C funding",corporate,2019-06-24,16:38,https://www.businesstoday.in/current/corporate/razorpay-usd-75-million-sequoia-india-ribbit-capital-series-c-funding/story/357088.html
Business Today,IndiGo places $20 bn order for jet engines with CFM,corporate,2019-06-24,16:38,https://www.businesstoday.in/current/corporate/indigo-cfm-leap1-a-engine-deal-280-jets-20-billion-aviation-airbus-a320-neo-a321neo-aircraft/story/356982.html
Business Today,Jet Airways to go into bankruptcy as lenders fail to agree to revive,corporate,2019-06-24,16:38,https://www.businesstoday.in/current/corporate/jet-airways-crisis-banks-sbi-nclt-insolvency-and-bankruptcy-code-resolution/story/356808.html
Business Today,"BSNL launches Rs 168 recharge plan; offers international roaming activation, validity extension",corporate,2019-06-24,16:38,https://www.businesstoday.in/sectors/telecom/bsnl-launches-rs-168-recharge-plan-offers-international-roaming-activation-validity-extension/story/356768.html
Business Today,Govt may move NCLT to freeze IL&FS former directors assets: Report,corporate,2019-06-24,16:38,https://www.businesstoday.in/current/corporate/govt-may-move-nclt-to-freeze-assets-of-ilfs-former-directors/story/356706.html
Business Today,BHEL wins 200 MW solar energy orders worth Rs 800 crore,corporate,2019-06-24,16:38,https://www.businesstoday.in/current/corporate/bhel-wons-200-mw-solar-energy-orders-worth-rs-800-crore/story/356612.html
Business Today,RBI slaps Rs 1 crore fine on HDFC Bank for non-compliance of KYC norms,corporate,2019-06-24,16:38,https://www.businesstoday.in/current/corporate/rbi-slaps-fine-of-rs-1-crore-on-hdfc-bank-for-non-compliance-of-kyc-norms/story/357170.html
Business Today,HDFC Mutual Fund to buy Rs 500-crore non-convertible debentures of Essel Group,corporate,2019-06-24,16:38,https://www.businesstoday.in/current/corporate/hdfc-mutual-fund-to-buy-rs-500-crore-ncds-of-essel-group-to-reassure-fmp-investors/story/357039.html
Business Today,Bandhan Bank lowers interest rate on micro loans by 70 bps to 17.95%,corporate,2019-06-24,16:38,https://www.businesstoday.in/current/corporate/bandhan-bank-lowers-interest-rate-on-micro-loans-by-70-bps-to-1795pc/story/356930.html
Business Today,"London IPO: Airtel Africa sets price range at 80-100 pence per share, aims to raise Rs $750 million",corporate,2019-06-24,16:38,https://www.businesstoday.in/current/corporate/london-ipo-airtel-africa-sets-price-range-at-80-100-pence-per-share-aims-raise-rs-750-million/story/356782.html
Business Today,Anil Ambani falls off billionaire club; equity wealth crashes from $42 billion to $0.5 billion,corporate,2019-06-24,16:38,https://www.businesstoday.in/current/corporate/anil-ambani-falls-off-billionaire-club-equity-wealth-crashes-from-usd-42-billion-to-usd-523-million/story/356735.html
Business Today,Paytms gaming platform Gamepind rebranded as FirstGames,corporate,2019-06-24,16:38,https://www.businesstoday.in/technology/news/paytm-gaming-platform-gamepind-rebranded-as-firstgames/story/356690.html
Business Today,"PNB to auction NPAs worth over Rs 1,000 crore on June 27",corporate,2019-06-24,16:38,https://www.businesstoday.in/current/corporate/punjab-national-bank-to-auction-rs-1000-crore-of-npas-on-june-27/story/356609.html
Business Today,Lakshmi Mittals South African subsidiary ArcelorMittal faces environmental contravention charges,corporate,2019-06-24,16:38,https://www.businesstoday.in/current/corporate/lakshmi-mittal-south-african-subsidiary-arcelormittal-faces-environmental-contravention-charges/story/356597.html
Business Today,"Six of top-10 firms add Rs 34,250 crore in m-cap; TCS top gainer",corporate,2019-06-24,16:38,https://www.businesstoday.in/current/corporate/six-of-top-10-firms-add-rs-34250-crore-in-m-cap-tcs-top-gainer/story/356517.html
Business Today,Novartis India appoints Sanjay Murdeshwar as managing director and vice chairman,corporate,2019-06-24,16:38,https://www.businesstoday.in/current/corporate/novartis-india-appoints-sanjay-murdeshwar-as-managing-director-and-vice-chairman/story/356421.html
Business Today,"Tata Motors Finance plans to raise Rs 1,000 crore via debt instrument",corporate,2019-06-24,16:38,https://www.businesstoday.in/current/corporate/tata-motors-finance-plans-to-raise-rs-1000-crore-via-debt-instrument/story/356371.html
Business Today,Karnataka cabinet refers decision on JSW land sale to sub-committee for reconsideration,corporate,2019-06-24,16:38,https://www.businesstoday.in/current/corporate/karnataka-cabinet-refers-decision-on-jsw-land-sale-to-sub-committee-for-reconsideration/story/356338.html
Business Today,"Walmarts Flipkart, Indian startup GOQii settle dispute over sharp discounting",corporate,2019-06-24,16:38,https://www.businesstoday.in/current/corporate/walmart-flipkart-indian-startup-goqii-settle-dispute-discounting/story/356201.html
Business Today,Walmart may pump $1.2 billion into Flipkarts operations,corporate,2019-06-24,16:38,https://www.businesstoday.in/current/corporate/walmart-flipkart-operations-investment-12-billion-us-united-states-india-ecommerce/story/356049.html
Business Today,Vedanta lost $200 million in profits in one year of Tuticorin plant shutdown: Anil Agarwal,corporate,2019-06-24,16:38,https://www.businesstoday.in/current/corporate/vedanta-lost-200-million-in-profits-in-one-year-of-tuticorin-plant-shutdown-anil-agarwal/story/356595.html
Business Today,"Fortis Healthcare scraps plan to sell stake in RHT Health Trust, RHTTM",corporate,2019-06-24,16:38,https://www.businesstoday.in/current/corporate/fortis-healthcare-scraps-plan-to-sell-stake-in-rht-health-trust-rhttm/story/356450.html
Business Today,I-T Dept summons Jet Airways founder Naresh Goyal in tax evasion case: Report,corporate,2019-06-24,16:38,https://www.businesstoday.in/current/corporate/i-t-dept-summons-jet-airways-founder-naresh-goyal-in-tax-evasion-case-report/story/356400.html
Business Today,M&M buys 11.25% stake in Swiss agri-tech firm Gamaya for Rs 30 crore,corporate,2019-06-24,16:38,https://www.businesstoday.in/current/corporate/mm-buys-1125-stake-in-swiss-agri-tech-firm-gamaya-for-rs-30-crore/story/356362.html
Business Today,Corporate profit-to-GDP metric recovers from a decades low in FY19,corporate,2019-06-24,16:38,https://www.businesstoday.in/current/corporate/corporate-profit-to-gdp-metric-recovers-from-a-decade-low-in-fy19/story/356295.html
Business Today,"Tech Mahindra appoints former Axis Bank CEO Shikha Sharma, Haigreve Khaitan as independent directors",corporate,2019-06-24,16:38,https://www.businesstoday.in/current/corporate/tech-mahindra-appoints-ex-axis-bank-ceo-shikha-sharma-haigreve-khaitan-as-independent-directors/story/356116.html
Business Today,"Amazon India set to offer students, retired individuals, homemakers part-time delivery jobs",corporate,2019-06-24,16:38,https://www.businesstoday.in/current/corporate/amazon-india-set-to-offer-students-retired-individuals-homemakers-part-time-delivery-jobs/story/356042.html
Business Today,"Auto stocks fall post NITI Aayogs directive on EVs; TVS motors, Motherson down 3%",markets,2019-06-24,16:38,https://www.businesstoday.in/markets/company-stock/auto-industry-shares-fall-on-niti-aayogs-push-for-electric-vehicles/story/358537.html
Business Today,Jet Airways shares surge 10% as insolvency proceedings begin,markets,2019-06-24,16:38,https://www.businesstoday.in/markets/company-stock/jet-airways-shares-surge-10pc-as-insolvency-proceedings-begin/story/358526.html
Business Today,"5 key factors that will influence Sensex, Nifty this week",markets,2019-06-24,16:38,https://www.businesstoday.in/markets/stocks/5-key-factors-that-will-influence-sensex-nifty-this-week/story/358380.html
Business Today,"Six of top-10 firms lose Rs 53,459 crore in m-cap; RIL takes steepest hit",markets,2019-06-24,16:38,https://www.businesstoday.in/current/corporate/six-of-top-10-firms-lose-rs-53459-crore-in-m-cap-ril-takes-steepest-hit/story/358332.html
Business Today,Maruti stock falls almost 4% after UBS downgrades to sell,markets,2019-06-24,16:38,https://www.businesstoday.in/markets/company-stock/maruti-stock-falls-almost-4-after-ubs-downgrades-to-sell/story/357969.html
Business Today,Aurobindo Pharma stock falls over 7% on USFDA warning for Andhra Pradesh plant,markets,2019-06-24,16:38,https://www.businesstoday.in/markets/company-stock/aurobindo-pharma-stock-usfda-warning-andhra-pradesh-plant/story/357922.html
Business Today,Why Tata Motors share price fell nearly 3% in early trade,markets,2019-06-24,16:38,https://www.businesstoday.in/markets/company-stock/tata-motors-share-price-fell-nearly-3-in-early-trade/story/357852.html
Business Today,Why Jet Airways share price rose 150% in trade today,markets,2019-06-24,16:38,https://www.businesstoday.in/markets/company-stock/jet-airways-share-price-rises-nclt-order-sbi-insolvency-plea/story/357626.html
Business Today,Ashok Leyland share price falls on temporary closure of Pantnagar plant,markets,2019-06-24,16:38,https://www.businesstoday.in/markets/company-stock/ashok-leyland-share-price-falls-pantnagar-plant/story/357533.html
Business Today,Suzlon Energy rises over 12% amid reports of majority stake sale to Brookfield,markets,2019-06-24,16:38,https://www.businesstoday.in/markets/company-stock/suzlon-energy-rises-over-12-on-reports-to-sell-majority-stake-to-brookfield/story/358536.html
Business Today,IndiaMart IPO opens today: Should you subscribe to the issue?,markets,2019-06-24,16:38,https://www.businesstoday.in/markets/ipo-corner/indiamart-ipo-opens-today-should-you-subscribe-to-the-issue/story/358467.html
Business Today,"Foreign investors infuse Rs 10,312 crore in June so far",markets,2019-06-24,16:38,https://www.businesstoday.in/current/economy-politics/foreign-investors-infuses-rs-10312-crore-in-june-so-far/story/358344.html
Business Today,"Bitcoin breaches $10,000 for the first time in 15 months; heres why",markets,2019-06-24,16:38,https://www.businesstoday.in/markets/commodities/bitcoin-breaches-10000-for-the-first-time-in-15-months-heres-why/story/358234.html
Business Today,"SpiceJet, InterGlobe Aviation stocks fall with spike in oil prices",markets,2019-06-24,16:38,https://www.businesstoday.in/markets/company-stock/spicejet-interglobe-aviation-stocks-fall-with-spike-in-oil-prices/story/357923.html
Business Today,Sobha share price falls 11% post block deal,markets,2019-06-24,16:38,https://www.businesstoday.in/markets/company-stock/sobha-share-price-falls-post-block-deal/story/357898.html
Business Today,Want to buy Reliance Jio stock? Your wait may soon be over,markets,2019-06-24,16:38,https://www.businesstoday.in/markets/ipo-corner/reliance-jio-ipo-reliance-jio-share-enters-stock-market/story/357835.html
Business Today,"IndiaMart to launch IPO on June 24, price band set at Rs 970 to Rs 973 per share",markets,2019-06-24,16:38,https://www.businesstoday.in/markets/ipo-corner/indiamart-ipo-launch-modi-govt-tenure-indiamart-intermesh/story/357589.html
Business Today,"Jain Irrigation Systems share price extends losses on debt downgrade, hits fresh 52-week low",markets,2019-06-24,16:38,https://www.businesstoday.in/markets/company-stock/jain-irrigation-systems-share-price-debt-downgrade/story/357526.html
Business Today,Jain Irrigation Systems share price falls over 28% on debt rating downgrade,markets,2019-06-24,16:38,https://www.businesstoday.in/markets/company-stock/jain-irrigation-systems-share-price-falls-on-debt-rating-downgrade/story/357318.html
Business Today,Why Reliance Infrastructure shares nosedived 57% in last three weeks,markets,2019-06-24,16:38,https://www.businesstoday.in/markets/company-stock/why-reliance-infrastructure-shares-nosedived-57pc-in-last-three-weeks/story/357049.html
Business Today,Jet Airways share price hits fresh all-time low of 32.25 after revival hopes for airline crash,markets,2019-06-24,16:38,https://www.businesstoday.in/markets/company-stock/jet-airways-share-price-crash-all-time-low-naresh-goyal-sbi-nclt/story/356968.html
Business Today,"Bharti Airtel, Vodafone Idea shares fall after DCC backs penalty on telcos",markets,2019-06-24,16:38,https://www.businesstoday.in/markets/company-stock/bharti-airtel-vodafone-idea-shares-fall-after-dcc-backs-penalty-on-telcos/story/356749.html
Business Today,Shriram Transport shares fall over 6% after Piramal Enterprises sells entire stake,markets,2019-06-24,16:38,https://www.businesstoday.in/markets/company-stock/shriram-transport-shares-fall-6-pc-after-piramal-enterprises-sells-entire-stake/story/356732.html
Business Today,Jet Airways share price slides to all-time low of Rs 69.75 ahead of lenders meeting on revival,markets,2019-06-24,16:38,https://www.businesstoday.in/markets/company-stock/jet-airways-share-price-all-time-low-naresh-goyal-etihad-airways/story/356680.html
Business Today,HDFC sells another 4.22% stake in Gruh Finance for Rs 899 crore,markets,2019-06-24,16:38,https://www.businesstoday.in/markets/hdfc-sells-another-stake-in-gruh-finance-for-rs-899-crore/story/356370.html
Business Today,"Hexaware Technologies acquires US firm Mobiquity, share price rises after three days",markets,2019-06-24,16:38,https://www.businesstoday.in/markets/company-stock/hexaware-technologies-buys-us-firm-mobiquity-share-rises-amazon-bse/story/356018.html
Business Today,Reliance Capital share price trading lower for second session after PwC resigns as auditor,markets,2019-06-24,16:38,https://www.businesstoday.in/markets/company-stock/reliance-capital-share-price-falls-pwc-resigns-as-auditor/story/355689.html
Business Today,Yes Bank shares hit 52-week low after brokerage firm UBS cuts target price; falls 20% in five days,markets,2019-06-24,16:38,https://www.businesstoday.in/markets/company-stock/yes-bank-shares-hit-52-week-low-after-ubs-cuts-target-price-falls-20pc-five-days/story/357094.html
Business Today,"HDFC AMC loses Rs 2,500 crore in market cap on liquidity infusion to debt schemes with exposure to Essel Group",markets,2019-06-24,16:38,https://www.businesstoday.in/markets/company-stock/hdfc-asset-management-company-share-price-falls-essel-group-fmp-schemes/story/356993.html
Business Today,5 reasons why Sensex fell nearly 500 points today,markets,2019-06-24,16:38,https://www.businesstoday.in/markets/stock-picks/5-reasons-why-sensex-fell-nearly-500-points-today/story/356819.html
Business Today,"NDTV shares fall 7.7% after Sebi bars promoters Prannoy, Radhika Roy from securities market",markets,2019-06-24,16:38,https://www.businesstoday.in/markets/company-stock/ndtv-shares-fall-77-after-sebi-bars-promoters-prannoy-radhika-roy-from-securities-market/story/356736.html
Business Today,"Reliance Infra share falls over 7% on biggest ever quarterly loss of Rs 3,301 crore",markets,2019-06-24,16:38,https://www.businesstoday.in/markets/company-stock/reliance-infra-share-falls-over-7-on-biggest-ever-quarterly-loss-of-rs-3301-crore/story/356709.html
Business Today,"FPIs remain net buyers in June, pour in Rs 11,132 crore",markets,2019-06-24,16:38,https://www.businesstoday.in/current/economy-politics/fpis-remain-net-buyers-in-june-pour-in-rs-11132-crore/story/356520.html
Business Today,"Adani Gas share price rises nearly 7% amid report French firm Total close to acquire 30% stake for over Rs 5,500 crore",markets,2019-06-24,16:38,https://www.businesstoday.in/markets/company-stock/adani-gas-share-price-rises-french-firm-total-bse/story/356093.html
Business Today,Jet Airways share price slumps over 23% on report NSE to remove stock from F&O trading from June 28,markets,2019-06-24,16:38,https://www.businesstoday.in/markets/company-stock/jet-airways-share-price-nse-to-remove-stock-from-daily-trading/story/355704.html
Business Today,Reliance Capital share price falls nearly 7% after statutory auditor PwC resigns,markets,2019-06-24,16:38,https://www.businesstoday.in/markets/company-stock/reliance-capital-share-price-falls-statutory-auditor-pwc-resigns/story/355418.html
Business Today,"IndiaBulls Housing Finance share price falls amid allegations of misappropriating Rs 98,000 cr of public money",markets,2019-06-24,16:38,https://www.businesstoday.in/markets/company-stock/indiabulls-housing-finance-share-price-falls-bse/story/355157.html
Business Today,Sterlite Technologies share price rises over 11% after promoter removes pledge on firms share,markets,2019-06-24,16:38,https://www.businesstoday.in/markets/company-stock/sterlite-technologies-share-price-rises-twin-star-overseas-removes-pledge/story/355118.html
Business Today,"Share Market Update: Sensex closes 165 points higher, Nifty at 11,965; Zee Entertainment, ONGC, YES Bank top performers",markets,2019-06-24,16:38,https://www.businesstoday.in/markets/company-stock/share-market-live-sensex-up-88-points-nifty-above-11900-ongc-indusind-bank-vedanat-top-performers/story/355086.html
Business Today,Anil Ambanis Reliance Power shares hit 52-week low after suffering massive loss in Q4,markets,2019-06-24,16:38,https://www.businesstoday.in/markets/company-stock/anil-ambani-reliance-power-shares-hit-52-week-low-after-suffering-massive-loss-in-q4/story/354936.html
Business Today,"DHFL share price recovers after three days, rises up to 10%",markets,2019-06-24,16:38,https://www.businesstoday.in/markets/company-stock/dhfl-share-price-recovers-icra-crisil-debt-rating-downgrade/story/354791.html
Business Today,This stock from ace investor Rakesh Jhunjhunwalas portfolio continues to scale new highs,markets,2019-06-24,16:38,https://www.businesstoday.in/markets/company-stock/titan-company-share-price-rakesh-jhunjhunwala-portfolio-hits-all-time-high/story/354770.html
Business Today,"Six of top-10 firms lose Rs 34,590 crore in m-cap; HDFC, HUL shine",markets,2019-06-24,16:38,https://www.businesstoday.in/current/economy-politics/six-of-top-10-firms-lose-rs-34590-crore-in-m-cap-hdfc-hul-shine/story/354593.html
Business Today,Forex reserves swell by $1.8 billion to $421.8 billion,markets,2019-06-24,16:38,https://www.businesstoday.in/top-story/forex-reserves-swell-by-18-billion-to-4218-billion/story/354301.html
