Source,Heading,Category,Date,Time,URL
Business Today,Can Indian pharma weather the twin-storm in US of price-fixing and quality?,opinion,2019-06-24,16:38,https://www.businesstoday.in/opinion/perspective/can-indian-pharma-weather-the-twin-storm-in-us-of-price-fixing-and-quality/story/347082.html
Business Today,Is factor investing a smart way of investing in stocks?,opinion,2019-06-24,16:38,https://www.businesstoday.in/opinion/columns/is-factor-investing-a-smart-way-of-investing-in-stocks/story/345587.html
Business Today,Reliances acquisition of Hamleys takes the retail war to global shores,opinion,2019-06-24,16:38,https://www.businesstoday.in/opinion/perspective/reliance-hamleys-acquisition-takes-retail-war-global-shores/story/345353.html
Business Today,Waste controlling in India- Is it really happening?,opinion,2019-06-24,16:38,https://www.businesstoday.in/opinion/columns/waste-controlling-india-waste-management-plastic-recycling/story/344945.html
Business Today,"Why you shouldnt have fill it, shut it, forget it approach to life insurance",opinion,2019-06-24,16:38,https://www.businesstoday.in/opinion/columns/why-you-shouldnt-have-fill-it-shut-it-forget-it-approach-to-life-insurance/story/344476.html
Business Today,"Election Result 2019: No matter who wins, its time middle class gets these tax reliefs",opinion,2019-06-24,16:38,https://www.businesstoday.in/opinion/columns/election-result-2019-no-matter-who-wins-it-is-time-middle-class-gets-these-tax-reliefs/story/349195.html
Business Today,5 points to consider before selecting travel credit cards,opinion,2019-06-24,16:38,https://www.businesstoday.in/opinion/columns/5-points-to-consider-before-selecting-travel-credit-cards/story/348338.html
Business Today,"Sorry Maam, thats not for you; Default gender bias in this men-run-the-show world",opinion,2019-06-24,16:38,https://www.businesstoday.in/opinion/columns/gender-bias-men-women-society/story/347923.html
Business Today,How a Sukhoi-BrahMos strike will make Pakistani airspace look like Swiss cheese,opinion,2019-06-24,16:38,https://www.businesstoday.in/opinion/columns/how-a-sukhoi-brahmos-strike-will-make-pakistani-airspace-look-like-swiss-cheese/story/347321.html
Business Today,The digital enterprise - Thinking Indian industry further,opinion,2019-06-24,16:38,https://www.businesstoday.in/opinion/columns/digital-enterprise-indian-industry-digitalisation/story/345714.html
Business Today,Digital Twins: Driving unprecedented efficiencies in Industry 4.0,opinion,2019-06-24,16:38,https://www.businesstoday.in/opinion/columns/digital-twins-industry-40-driving-efficiencies/story/345582.html
Business Today,The story of two cities and two cyclones,opinion,2019-06-24,16:38,https://www.businesstoday.in/opinion/columns/the-story-of-two-cities-and-two-cyclones/story/345276.html
Business Today,Moving target - Migration and maternal health,opinion,2019-06-24,16:38,https://www.businesstoday.in/opinion/columns/migration-and-maternal-health-newborn-care-in-india/story/344859.html
Business Today,"No ifs and buts, NDA is returning to power: Piyush Goyal",opinion,2019-06-24,16:38,https://www.businesstoday.in/opinion/interviews/no-ifs-and-buts-nda-is-returning-to-power-piyush-goyal/story/344339.html
Business Today,How to ward off hostile takeovers,opinion,2019-06-24,16:38,https://www.businesstoday.in/opinion/columns/how-to-ward-off-hostile-takeovers/story/343872.html
Business Today,"EXCLUSIVE: Well fire up the economy with NYAY, create jobs, says Rahul Gandhi",opinion,2019-06-24,16:38,https://www.businesstoday.in/current/economy-politics/exclusive-we-will-fire-up-the-economy-with-nyay-create-jobs-says-rahul-gandhi/story/342923.html
Business Today,"Move on, Masood: Why China threw its favourite terrorist under the bus",opinion,2019-06-24,16:38,https://www.businesstoday.in/opinion/columns/masood-azhar-why-china-threw-favourite-terrorist-under-bus/story/342658.html
Business Today,Lockheeds F-16 hard sell: Pros and cons of buying the American fighter,opinion,2019-06-24,16:38,https://www.businesstoday.in/opinion/columns/lockheed-f-16-hard-sell-pros-and-cons-buying-american-fighter/story/341243.html
Business Today,Tik Toks porn problem: Why the social media app is more susceptible,opinion,2019-06-24,16:38,https://www.businesstoday.in/opinion/perspective/tik-tok-porn-problem-why-the-social-media-app-is-more-susceptible/story/340499.html
Business Today,Government achieving disinvestment target doesnt mean that there are takers for PSU equities,opinion,2019-06-24,16:38,https://www.businesstoday.in/opinion/perspective/government-achieving-disinvestment-target-doesnt-mean-that-there-are-takers-for-psu-equities/story/339765.html
Business Today,Why Jet Airways stock is still relatively resilient,opinion,2019-06-24,16:38,https://www.businesstoday.in/opinion/perspective/why-jet-airways-stock-is-still-relatively-resilient/story/338706.html
Business Today,Reliance Industries faces debt surge as need for capital grows,opinion,2019-06-24,16:38,https://www.businesstoday.in/opinion/perspective/reliance-industries-debt-surge-capital-need-grows/story/338673.html
Business Today,Will Jet Airways ever fly again?,opinion,2019-06-24,16:38,https://www.businesstoday.in/opinion/perspective/will-jet-airways-ever-fly-again/story/338490.html
Business Today,AI can lead to greater impact on sustainability than ever before: Microsofts Lucas Joppa,opinion,2019-06-24,16:38,https://www.businesstoday.in/opinion/interviews/ai-can-lead-to-greater-impact-on-sustainability-than-ever-before-microsoft-lucas-joppa/story/342962.html
Business Today,ITR Decoded: All about new ITR Forms,opinion,2019-06-24,16:38,https://www.businesstoday.in/opinion/columns/itr-decoded-all-about-new-itr-forms/story/342673.html
Business Today,Slowdown grips Indian economy; how do we emerge unscathed?,opinion,2019-06-24,16:38,https://www.businesstoday.in/opinion/business-wise/slowdown-grips-indian-economy-how-do-we-emerge-unscathed/story/341714.html
Business Today,Why auditors fail to detect frauds,opinion,2019-06-24,16:38,https://www.businesstoday.in/opinion/perspective/why-auditors-fail-to-detect-frauds/story/340883.html
Business Today,Commercial real estate investments: Which option is right for you?,opinion,2019-06-24,16:38,https://www.businesstoday.in/opinion/columns/commercial-real-estate-investments-best-option-right-riet/story/340365.html
Business Today,"Sri Lankas Faustian bargain with Pakistan: Exit LTTE, enter ISI",opinion,2019-06-24,16:38,https://www.businesstoday.in/opinion/columns/sri-lanka-faustian-bargain-with-pakistan-exit-ltte-enter-isi/story/339389.html
Business Today,Here is how the new owner should fix Jet Airways,opinion,2019-06-24,16:38,https://www.businesstoday.in/opinion/perspective/here-is-how-the-new-owner-should-fix-jet-airways/story/338694.html
Business Today,Defaulting promoters may challenge proceedings under banned Feb 12 Circular,opinion,2019-06-24,16:38,https://www.businesstoday.in/opinion/interviews/defaulting-promoters-may-challenge-proceedings-under-banned-feb-12-circular/story/338525.html
Business Today,No alternative to a tough policy towards Pakistan: Ashley J. Tellis,opinion,2019-06-24,16:38,https://www.businesstoday.in/opinion/interviews/middle-east-is-among-the-major-successes-of-modi-foreign-policy-ashley-j-tellis/story/338488.html
