Source,Heading,Category,Date,Time,URL
Business Today,"Dewan Housing share price extends losses on downgrade by ICRA, Crisil; hits fresh 52-week low",markets,2019-06-24,16:38,https://www.businesstoday.in/markets/company-stock/dewan-housing-share-price-downgrade-icra-crisil-fresh-52-week-low/story/354277.html
Business Today,"After Reliance Industries, TCS beats this global technology giant in market capitalisation race",markets,2019-06-24,16:38,https://www.businesstoday.in/markets/company-stock/tcs-beat-reliance-industries-ibm-in-market-capitalisation-race/story/355106.html
Business Today,"Jet Airways share closes 10.58% lower amid report Hinduja, Etihad unwilling to support ailing airline",markets,2019-06-24,16:38,https://www.businesstoday.in/markets/company-stock/jet-airways-share-price-falls-hinduja-etihad--airways-ailing-airline/story/355087.html
Business Today,TCS overtakes RIL to become most valued firm by market-cap,markets,2019-06-24,16:38,https://www.businesstoday.in/markets/stocks/tcs-overtakes-ril-to-become-most-valued-firm-by-market-cap/story/355034.html
Business Today,"Rakesh Jhunjhunwala, wife Rekha have earned Rs 915 crore with Titan Company stock since March this year",markets,2019-06-24,16:38,https://www.businesstoday.in/markets/company-stock/rakesh-jhunjhunwala-wife-rekha-jhunjhunwala-titan-share-profit/story/354864.html
Business Today,J&K Bank shares plunge up to 20% after govt starts probe against former bank chairman,markets,2019-06-24,16:38,https://www.businesstoday.in/markets/company-stock/jk-bank-shares-plunge-bank-chairman-parvez-ahmad/story/354783.html
Business Today,"Share Market LIVE: Sensex closes 168 points up, Nifty at 11,922; Britannia, Bharti Infratel, Tech Mahindra top performers",markets,2019-06-24,16:38,https://www.businesstoday.in/markets/stocks/share-market-live-sensex-rises-260-points-nifty-above-11940-britannia-tata-steel-tech-mahindra-top-performers/story/354760.html
Business Today,"FPIs pour in Rs 7,095 crore in first week of June",markets,2019-06-24,16:38,https://www.businesstoday.in/current/economy-politics/fpis-pour-in-rs-7095-crore-in-first-week-of-june/story/354590.html
Business Today,What makes debt market more dangerous in India than in the US,markets,2019-06-24,16:38,https://www.businesstoday.in/opinion/prosaic-view/what-makes-indian-debt-market-more-dangerous-than-in-the-us/story/354281.html
Business Today,"Eros International share price extends losses post downgrade by CARE Ratings, hits fresh all-time low",markets,2019-06-24,16:38,https://www.businesstoday.in/markets/company-stock/eros-international-share-price-extends-losses-care-ratings-downgrade/story/354253.html
Business Today,"Share Market Update: Sensex ends 86 points up, Nifty at 11,870; Bharti Infratel, Vedanta, BPCL top performers",markets,2019-06-24,16:38,https://www.businesstoday.in/markets/stocks/share-market-live-sensex-nifty-trading-may-7-2019-indusind-maruti/story/354248.html
Business Today,RBI monetary policy: Why Sensex lost 450 points despite 25 bps repo rate cut,markets,2019-06-24,16:38,https://www.businesstoday.in/markets/stocks/rbi-monetary-policy-sensex-nifty-rbi-cuts-repo-rate/story/354204.html
Business Today,GAIL share price falls 10% on CLSA downgrade,markets,2019-06-24,16:38,https://www.businesstoday.in/markets/stocks/gail-share-price-falls-pngrb-clsa-downgrade/story/354144.html
Business Today,Why Dewan Housing Finance share price fell up to 15% in early trade today,markets,2019-06-24,16:38,https://www.businesstoday.in/markets/company-stock/dewan-housing-finance-share-price-falls-icra-crisil/story/354114.html
Business Today,GE Power India share price rises over 5% on Rs 738-crore order win,markets,2019-06-24,16:38,https://www.businesstoday.in/markets/company-stock/ge-power-india-share-price-rises-rs-738-crore-order-win/story/353661.html
Business Today,"Share Market Update: Sensex closes 184 points lower ahead of RBI monetary policy, Nifty holds 12,000 level",markets,2019-06-24,16:38,https://www.businesstoday.in/markets/stocks/share-market-live-sensex-nifty-open-june-4-2019-rupee-it-stocks/story/353590.html
Business Today,"Sensex closes above 40k for first time, Nifty hits record high: Five factors that propelled the rally",markets,2019-06-24,16:38,https://www.businesstoday.in/markets/stocks/sensex-closes-above-40000-for-first-time-nifty-record-high/story/353402.html
Business Today,Hero MotoCorp share price rises nearly 6% on strong May sales,markets,2019-06-24,16:38,https://www.businesstoday.in/markets/company-stock/hero-motocorp-share-price-rises-on-strong-may-sales/story/353307.html
Business Today,Bajaj Auto share price trading higher on 3% rise in May sales,markets,2019-06-24,16:38,https://www.businesstoday.in/markets/company-stock/bajaj-auto-share-price-rises-may-sales-rise/story/353227.html
Business Today,Sensex tanks 554 points as RBI rate cut fails to address NBFC concerns,markets,2019-06-24,16:38,https://www.businesstoday.in/markets/stocks/sensex-tanks-554-points-as-rbi-rate-cut-fails-to-address-nbfc-concerns/story/354229.html
Business Today,Eros International share price hits all-time low on downgrade by CARE Ratings,markets,2019-06-24,16:38,https://www.businesstoday.in/markets/company-stock/eros-international-share-price-tanks-care-ratings-downgrade/story/354178.html
Business Today,RBI monetary policy: What Dalal Street expects from the central bank today,markets,2019-06-24,16:38,https://www.businesstoday.in/markets/stocks/rbi-monetary-policy-dalal-street-expectations-shaktikanta-das/story/354120.html
Business Today,"Share Market Update: Sensex logs biggest one day fall this year, tanks 554 points; Nifty ends 177 points lower",markets,2019-06-24,16:38,https://www.businesstoday.in/markets/stocks/share-market-live-sensex-nifty-open-higher-rbi-monetary-policy-indian-oil-dr-reddys-asian-paints/story/354107.html
Business Today,This stock from ace investor Rakesh Jhunjhunwalas portfolio hits all-time high in early trade,markets,2019-06-24,16:38,https://www.businesstoday.in/markets/company-stock/titan-company-share-price-rises-rakesh-jhunjhunwala-portfolio/story/353607.html
Business Today,"Investor wealth rises by Rs 1.76 lakh cr as Sensex, Nifty hit record highs",markets,2019-06-24,16:38,https://www.businesstoday.in/markets/stocks/investor-wealth-rises-sensex-nifty-hit-record-highs/story/353419.html
Business Today,"This stock was valued just Rs 4 in 2009, now its worth over Rs 650!",markets,2019-06-24,16:38,https://www.businesstoday.in/markets/company-stock/safari-industries-share-price-rise-sensex-vip-industries/story/353275.html
Business Today,"Share Market Update: Sensex closes above 40,000 for first time, Nifty too ends at record closing high",markets,2019-06-24,16:38,https://www.businesstoday.in/markets/company-stock/share-market-live-sensex-nifty-trading-june-3-2019-hero-motocorp-asian-paints-airtel/story/353220.html
Business Today,"Benchmark indices Sensex, Nifty climb as slower growth raises rate cut hopes",markets,2019-06-24,16:38,https://www.businesstoday.in/markets/company-stock/benchmark-indices-sensex-nifty-climb-as-slower-growth-raises-rate-cut-hopes/story/353256.html
Business Today,Only 33% women take independent investment decisions as compared to 64% men,money,2019-06-24,16:38,https://www.businesstoday.in/current/economy-politics/only-33-percent-women-take-independent-investment-decisions-as-compared-to-64-percent-men/story/352360.html
Business Today,Senior citizens with taxable income up to Rs 5 lakh can seek TDS exemption on bank interest,money,2019-06-24,16:38,https://www.businesstoday.in/current/senior-citizens-taxable-income-5-lakhtds-exemption-bank-interest/story/349440.html
Business Today,"Why you shouldnt have fill it, shut it, forget it approach to life insurance",money,2019-06-24,16:38,https://www.businesstoday.in/opinion/columns/why-you-shouldnt-have-fill-it-shut-it-forget-it-approach-to-life-insurance/story/344476.html
Business Today,FMP Crisis: What should investors do?,money,2019-06-24,16:38,https://www.businesstoday.in/current/economy-politics/fmp-crisis-what-should-investors-do/story/336813.html
Business Today,Why you should plan your investments and taxes in April and not March,money,2019-06-24,16:38,https://www.businesstoday.in/current/economy-politics/why-you-should-plan-your-investments-and-taxes-in-april-and-not-march/story/334126.html
Business Today,"EPF or NPS, which one is a better retirement saving option for you",money,2019-06-24,16:38,https://www.businesstoday.in/money/epf-or-nps-which-one-is-a-better-retirement-saving-option-for-you/story/325137.html
Business Today,Are discount broking firms a threat to traditional brokerages?,money,2019-06-24,16:38,https://www.businesstoday.in/money/are-discount-broking-firms-a-threat-to-traditional-brokerages/story/323293.html
Business Today,Rupee falls 14 paise against US dollar in early trade,money,2019-06-24,16:38,https://www.businesstoday.in/money/news/rupee-falls-14-paise-against-us-dollar-in-early-trade/story/318641.html
Business Today,What are the best investment options for working women in their 30s?,money,2019-06-24,16:38,https://www.businesstoday.in/top-story/what-are-the-best-investment-options-for-working-women-in-their-30s/story/318517.html
Business Today,"Mutual Fund industry wants new govt to act on consumption, investment",money,2019-06-24,16:38,https://www.businesstoday.in/money/mutual-fund/mutual-fund-industry-wants-new-govt-to-act-on-consumption-investment/story/349637.html
Business Today,Here are 5 ways to gift your mom financial security this Mothers Day,money,2019-06-24,16:38,https://www.businesstoday.in/top-story/mothers-day-gift-mom-financial-security/story/345327.html
Business Today,Akshaya Tritiya 2019: Should you invest in gold or real estate?,money,2019-06-24,16:38,https://www.businesstoday.in/top-story/akshaya-tritiya-invest-gold-or-real-estate/story/343979.html
Business Today,PPF account: How to make the most of this tax-free investment option,money,2019-06-24,16:38,https://www.businesstoday.in/current/economy-politics/ppf-account-how-to-make-the-most-of-this-tax-free-investment-option/story/336610.html
Business Today,LICs new Navjeevan plan: All you need to know,money,2019-06-24,16:38,https://www.businesstoday.in/top-story/lic-navjeevan-plan-all-you-need-to-know/story/330789.html
Business Today,Pre-tax Season: Is Your Employee Tax Reimbursement Process Slowing You Down?,money,2019-06-24,16:38,https://www.businesstoday.in/money/tax/pre-tax-season-is-your-employee-tax-reimbursement-process-slowing-you-down/story/323619.html
Business Today,5 loans for Indias millennials,money,2019-06-24,16:38,https://www.businesstoday.in/money/5-loans-for-indias-millennials/story/320895.html
Business Today,5 reasons why provident fund is so important to the salaried class!,money,2019-06-24,16:38,https://www.businesstoday.in/top-story/5-reasons-why-provident-fund-is-so-important-to-the-salaried-class/story/318554.html
Business Today,How To Choose A Mutual Fund In India - Where To Invest Money?,money,2019-06-24,16:38,https://www.businesstoday.in/top-story/how-to-choose-a-mutual-fund-where-to-invest-money/story/318506.html
Business Today,Keep It Simple - Dont Overcomplicate Your Investments,money,2019-06-24,16:38,https://www.businesstoday.in/money/keep-it-simple-dont-overcomplicate-your-investments/story/312380.html
Business Today,7 mistakes to avoid while investing in mutual funds,money,2019-06-24,16:38,https://www.businesstoday.in/top-story/7-mistakes-to-avoid-while-investing-in-mutual-funds/story/302418.html
Business Today,"Which mutual funds are the top performers in last 1, 3 and 5 years?",money,2019-06-24,16:38,https://www.businesstoday.in/top-story/which-mutual-funds-are-the-top-performers-in-last-1-3-and-5-years/story/298425.html
Business Today,Even Debit Card gives you airport lounge access. Heres how,money,2019-06-24,16:38,https://www.businesstoday.in/top-story/now-you-can-swipe-your-debit-card-for-free-lounge-access-at-airports/story/297114.html
Business Today,How to transfer mutual fund holdings when an investor dies?,money,2019-06-24,16:38,https://www.businesstoday.in/top-story/how-to-transfer-mutual-fund-holdings-when-an-investor-dies/story/295776.html
Business Today,How to transfer your provident fund balance from your previous office,money,2019-06-24,16:38,https://www.businesstoday.in/top-story/how-to-transfer-your-provident-fund-balance-from-your-previous-office/story/295037.html
Business Today,DSP launches Healthcare Fund. Should you invest?,money,2019-06-24,16:38,https://www.businesstoday.in/top-story/dsp-launches-healthcare-fund.-should-you-invest/story/292690.html
Business Today,Why you should not buy physical gold this Dhanteras,money,2019-06-24,16:38,https://www.businesstoday.in/top-story/why-you-should-not-buy-physical-gold-this-dhanteras/story/288437.html
Business Today,Money-wise tips for Entrepreneurs,money,2019-06-24,16:38,https://www.businesstoday.in/top-story/money-wise-tips-for-entrepreneurs/story/285502.html
Business Today,Mutual funds vs Fixed Deposits: How FD investors had the last laugh in 2018,money,2019-06-24,16:38,https://www.businesstoday.in/top-story/how-gold-fixed-deposit-investors-had-the-last-laugh-in-2018/story/304634.html
Business Today,"Do you know PF can be withdrawn for buying a house, marriage, other expenses",money,2019-06-24,16:38,https://www.businesstoday.in/top-story/do-you-know-pf-can-be-withdrawn-for-buying-a-house-marriage-other-expenses/story/298449.html
Business Today,ICICI Bank launches Robo Advisory App for Mutual Fund Investment,money,2019-06-24,16:38,https://www.businesstoday.in/top-story/icici-bank-launches-robo-advisory-app-for-mutual-fund-investment/story/298007.html
Business Today,Direct mutual fund vs regular mutual fund: How can you switch between the two?,money,2019-06-24,16:38,https://www.businesstoday.in/top-story/direct-mutual-fund-vs-regular-mutual-fund-how-can-you-switch-between-the-two/story/296893.html
Business Today,"Want to check, withdraw or transfer your provident fund balance? Heres what you need to do",money,2019-06-24,16:38,https://www.businesstoday.in/top-story/want-to-check-withdraw-or-transfer-your-provident-fund-balance-heres-what-you-need-to-do/story/295346.html
Business Today,"Now, you can make your LIC premium payment on Paytm app",money,2019-06-24,16:38,https://www.businesstoday.in/technology/internet/now-you-can-make-your-lic-premium-payment-on-paytm-app/story/293425.html
Business Today,Heres what mutual fund investors should know about Riskometer,money,2019-06-24,16:38,https://www.businesstoday.in/top-story/heres-what-mutual-fund-investors-should-know-about-riskometer/story/290102.html
Business Today,This is how you can make market crash work for you,money,2019-06-24,16:38,https://www.businesstoday.in/money/investment/this-is-how-you-can-make-stock-market-crash-work-for-you/story/286220.html
Business Today,Mahindra Mutual Funds fresh NFO kicks off on Friday; should you invest?,money,2019-06-24,16:38,https://www.businesstoday.in/money/mutual-fund/mahindra-mutual-fund-fresh-nfo-kicks-off-on-friday/story/285410.html
Business Today,Investing online? Heres what you need to know,money,2019-06-24,16:38,https://www.businesstoday.in/top-story/investing-online-heres-what-you-need-to-know/story/282840.html
Business Today,Be future ready! 9 tips thatll come handy if you fear losing your job,money,2019-06-24,16:38,https://www.businesstoday.in/top-story/be-future-ready-9-tips-thatll-come-handy-if-you-fear-losing-your-job/story/282343.html
Business Today,Looking to park money for short term? Consider this instrument for 9.1% return,money,2019-06-24,16:38,https://www.businesstoday.in/money/investment/short-term-investment-ncd-non-convertible-debentures/story/282217.html
Business Today,How many credit cards should you have?,money,2019-06-24,16:38,https://www.businesstoday.in/buzztop/buzztop-personal-finance/how-many-credit-cards-should-you-have/story/281730.html
Business Today,Growth option vs dividend plan in mutual funds: Which one should you opt for?,money,2019-06-24,16:38,https://www.businesstoday.in/money/mutual-fund/growth-option-dividend-option-in-mutual-funds/story/281296.html
Business Today,Want to choose a financial advisor? Follow these four steps,money,2019-06-24,16:38,https://www.businesstoday.in/money/investment/picking-financial-advisor-financial-planning-wealth-management/story/280645.html
Business Today,Five tips to follow before you buy term insurance,money,2019-06-24,16:38,https://www.businesstoday.in/money/insurance/term-insurance-purchase-tips-cash-flow-life-insurance/story/279413.html
Business Today,Five credit card charges you should know about,money,2019-06-24,16:38,https://www.businesstoday.in/money/banking/credit-card-charges-you-should-know-about/story/276938.html
Business Today,What happens when your PPF account matures,money,2019-06-24,16:38,https://www.businesstoday.in/money/investment/ppf-account-maturity-section-80c-home-loans-debt-portfolio/story/275571.html
Business Today,Investing in mutual funds may soon get cheaper by 25%,money,2019-06-24,16:38,https://www.businesstoday.in/money/mutual-fund/mutual-funds-investment-cheaper-total-expense-ratio/story/282512.html
Business Today,10 financial tips for working women in their 30s,money,2019-06-24,16:38,https://www.businesstoday.in/top-story/10-financial-tips-for-working-women-in-their-30s/story/282293.html
Business Today,Shopaholic? Here are 7 financial tips for people who splurge,money,2019-06-24,16:38,https://www.businesstoday.in/top-story/credit-card-rich-billing-cycle-interest-saving-sip-epf-ppf-retire-term-insurance-insurance-debt-personal-loan-assets-liabilities/story/281768.html
Business Today,How expensive is it to plan your retirement in 40s instead of 30s?,money,2019-06-24,16:38,https://www.businesstoday.in/top-story/retirement-retirement-planning-savings-inflation-sip-lifestyle-good-habits-expenditure-building-wealth-financial-goals/story/281719.html
Business Today,Should you buy gold or invest in mutual funds?,money,2019-06-24,16:38,https://www.businesstoday.in/top-story/should-you-buy-gold-or-invest-in-mutual-funds/story/281217.html
Business Today,10 reasons to reject your life insurance claim,money,2019-06-24,16:38,https://www.businesstoday.in/latest/9-situations-when-your-life-insurance-claim-may-get-rejected/story/280188.html
Business Today,Five steps to follow before you take a loan,money,2019-06-24,16:38,https://www.businesstoday.in/money/banking/home-loan-car-loan-medical-bills-housing-loans/story/277022.html
Business Today,10 financial planning values you should teach your children,money,2019-06-24,16:38,https://www.businesstoday.in/money/investment/financial-planning-values-children-mothers-day-personal-finance/story/276702.html
Business Today,Four factors to consider before stopping an SIP and exiting a mutual fund,money,2019-06-24,16:38,https://www.businesstoday.in/money/mutual-fund/sip-mutual-fund-sip-tenure-mutual-fund-investments/story/275113.html
Business Today,Step-by-step guide on how to link Aadhaar with insurance policies,money,2019-06-24,16:38,https://www.businesstoday.in/money/insurance/link-aadhaar-with-insurance-policies-aadhaar-deadline-extended/story/266034.html
Business Today,Here is how and why you should link your mutual fund and Aadhaar,money,2019-06-24,16:38,https://www.businesstoday.in/money/mutual-fund/here-is-how-and-why-you-should-link-your-mutual-fund-and-aadhaar/story/265870.html
Business Today,What happens if you dont link your Aadhaar with LIC by December 31?,money,2019-06-24,16:38,https://www.businesstoday.in/money/aadhaar-lic-linking-insurance-policy-by-dec-31-pan/story/265123.html
Business Today,What happens if you dont link your Aadhaar and insurance policy by Dec 31?,money,2019-06-24,16:38,https://www.businesstoday.in/money/insurance/insurance-aadhaar-deadline-aadhaar-linkage-irda-kyc-bank-accounts-pan-rbi/story/264084.html
Business Today,How mutual funds benefited from demonetisation,money,2019-06-24,16:38,https://www.businesstoday.in/money/mutual-fund/equity-mutual-funds-demonetisation--banking-cash-fixed-deposits-remonetisation/story/263521.html
Business Today,Demonetisation anniversary: I-T department ready to issue notices for huge deposits,money,2019-06-24,16:38,https://www.businesstoday.in/money/centre-ready-to-issue-notices-for-huge-deposits/story/263464.html
Business Today,How mutual fund classification will impact your portfolio,money,2019-06-24,16:38,https://www.businesstoday.in/money/mutual-fund/mutual-fund-classification-impact-portfolio-equity-fund-hybrid-fund-balanced-fund/story/262510.html
Business Today,Should you invest in General Insurance Corporation IPO?,money,2019-06-24,16:38,https://www.businesstoday.in/money/investment/gic-re-ipo-general-insurance-corporation-reinsurance/story/261823.html
Business Today,Now your PF will automatically transfer as you change jobs. Know what you need to do,money,2019-06-24,16:38,https://www.businesstoday.in/money/investment/now-your-pf-will-automatically-transfer-as-you-change-jobs-know-what-you-need-to-do/story/261022.html
Business Today,"After slowdown, will real estate be back on track in 2018?",money,2019-06-24,16:38,https://www.businesstoday.in/money/real-estate/real-estate-sector-be-back-on-track-in-2018-housing/story/266416.html
Business Today,How to keep your Bitcoin safe?,money,2019-06-24,16:38,https://www.businesstoday.in/money/tax/bitcoin-security-cryptocurrency-digital-money-rbi-bitxoxo-wallets/story/265791.html
Business Today,"How Paytm Payment Bank, Airtel Payment Bank are different from normal banks",money,2019-06-24,16:38,https://www.businesstoday.in/money/banking/how-paytm-payment-bank-airtel-payment-bank-are-different-from-normal-banks/story/265031.html
Business Today,"Checking PF Balance, raising claim, applying for PAN and other things you can do using UMANG app",money,2019-06-24,16:38,https://www.businesstoday.in/money/news/check-pf-balance-raise-claim-apply-for-pan-umang-app/story/264013.html
Business Today,Demonetisation keeps digital payments up; cashless transactions grow 13.5% in September,money,2019-06-24,16:38,https://www.businesstoday.in/money/banking/demonetisation-digital-payments-cashless-transactions-ewallets-credit-card-debit-card-paytm/story/263466.html
Business Today,Are Bitcoin gains taxable?,money,2019-06-24,16:38,https://www.businesstoday.in/money/tax/bitcoin-gains-tax-cryptocurrency-income-from-other-sources-capital-gains-short-term-gains-income-tax-returns/story/263434.html
Business Today,How to ensure a smooth settlement of life insurance claims,money,2019-06-24,16:38,https://www.businesstoday.in/money/insurance/life-insurance--settlement-claim/story/262499.html
Business Today,Your bank may charge you for closing a bank account. Know why,money,2019-06-24,16:38,https://www.businesstoday.in/money/banking/your-bank-may-charge-you-for-closing-a-bank-account-know-why/story/261304.html
Business Today,Here are 5 small investments you can make for your house help,money,2019-06-24,16:38,https://www.businesstoday.in/money/little-things-you-can-do-to-secure-the-future-of-your-house-help/story/259944.html
Business Today,"BSNL begs again, says no funds to pay June salary to 1.76 lakh employees",industry,2019-06-24,16:38,https://www.businesstoday.in/sectors/jobs/bsnl-no-funds-june-salaries-to-pay-employees-bharat-sanchar-nigam-limited-modi-government/story/358576.html
Business Today,Why did RBI Deputy Governor Viral Acharya resign abruptly?,industry,2019-06-24,16:38,https://www.businesstoday.in/sectors/banks/why-did-rbi-deputy-governor-viral-acharya-abruptly-resign/story/358548.html
Business Today,Govt policies like T20 match: RBI Deputy Governor Viral Acharyas speech that got him into trouble,industry,2019-06-24,16:38,https://www.businesstoday.in/sectors/banks/viral-acharya-resigns-rbi-deputy-governor-speech-2017/story/358525.html
Business Today,"Good news, cricket fans! BSNL Superstar 300 plan offers free Hotstar Premium subscription",industry,2019-06-24,16:38,https://www.businesstoday.in/sectors/telecom/world-cup-2019-cricket-fans-bsnl-new-superstar-300-plan-offers-free-hotstar-premium-subscription/story/358513.html
Business Today,"Infosys created 9,100 jobs in US since April 2017",industry,2019-06-24,16:38,https://www.businesstoday.in/sectors/jobs/infosys-hired-9100-employees-in-us-since-april-2017/story/358395.html
Business Today,AAI starts year-long study to improve future slot allotment at six major airports,industry,2019-06-24,16:38,https://www.businesstoday.in/sectors/aviation/aai-starts-year-long-study-to-improve-future-slot-allotment-at-six-major-airports/story/358359.html
Business Today,"Niti Aayog asks scooter, bike makers to draw up plan for EVs",industry,2019-06-24,16:38,https://www.businesstoday.in/sectors/auto/niti-aayog-asks-scooter-bike-makers-to-draw-up-plan-for-evs/story/358256.html
Business Today,"Indian airlines to avoid Iranian airspace, will re-route flights: aviation regulator DGCA",industry,2019-06-24,16:38,https://www.businesstoday.in/sectors/aviation/indian-airlines-to-avoid-iranian-airspace-will-re-route-flights-aviation-regulator-dgca/story/358235.html
Business Today,Dharmendra Pradhan raises concerns over rising oil prices with Saudi Arabia,industry,2019-06-24,16:38,https://www.businesstoday.in/top-story/dharmendra-pradhan-raises-concerns-over-rising-oil-prices-with-saudi-arabia/story/358124.html
Business Today,"Union Budget: CII, FICCI suggest ideas to handle jobs crisis",industry,2019-06-24,16:38,https://www.businesstoday.in/union-budget-2019/news/union-budget-cii-ficci-suggest-ideas-to-handle-jobs-crisis/story/358569.html
Business Today,"Auto stocks fall post NITI Aayogs directive on EVs; TVS motors, Motherson down 3%",industry,2019-06-24,16:38,https://www.businesstoday.in/markets/company-stock/auto-industry-shares-fall-on-niti-aayogs-push-for-electric-vehicles/story/358537.html
