Newspaper,Heading,Category,Date,Time,URL
India Today," Siddhant Chaturvedi reveals he auditioned for the lead role in AladdinSiddhant Chaturvedi revealed that before bagging a role as MC Sher in Gully
Boy, he auditioned for two Disney films-Aladdin and Million Dollar Arm.",hollywood,2019-06-11,00:56:00,https://www.indiatoday.in/movies/hollywood/story/siddhant-chaturvedi-reveals-he-auditioned-for-the-lead-role-in-aladdin-1545395-2019-06-10
India Today," Avengers Endgame star Chris Pratt ties the knot with Arnold Schwarzenegger's daughter KatherineChris Pratt married fiancee Katherine Schwarzenegger in a private ceremony in
Montecito, California.",hollywood,2019-06-11,00:56:00,https://www.indiatoday.in/movies/hollywood/story/avengers-endgame-star-chris-pratt-ties-the-knot-with-arnold-schwarzenegger-s-daughter-katherine-1545427-2019-06-09
India Today," Brad Pitt and Jennifer Aniston's former house is on sale for Rs 343 croreBrad Pitt and Jennifer Aniston's former house is on sale. The ex-couple had
bought it back in 2001 for Rs 93 crore.",hollywood,2019-06-11,00:56:00,https://www.indiatoday.in/movies/hollywood/story/brad-pitt-and-jennifer-aniston-s-former-house-is-on-sale-for-rs-343-crore-1544359-2019-06-07
India Today," Avengers Endgame stars share videos from funeral sequence, reveal they were told it was a wedding Mark Ruffalo shared a series of BTS photos from Avengers Endgame, on his
social media accounts, revealing that they hadn't known about Iron Man's
funeral.",hollywood,2019-06-11,00:56:00,https://www.indiatoday.in/movies/hollywood/story/avengers-endgame-stars-share-videos-from-funeral-sequence-reveal-they-were-told-it-was-a-wedding-1544300-2019-06-07
India Today," Bradley Cooper and Irina Shayk split after being together for 4 yearsBradley Cooper and Irina Shayk have broken up after four years of
relationship. The stars have a two-year-old daughter Lea De Seine.",hollywood,2019-06-11,00:56:00,https://www.indiatoday.in/movies/hollywood/story/bradley-cooper-and-irina-shayk-split-after-being-together-for-4-years-1544242-2019-06-07
India Today," Dark Phoenix box office collection day 1: Sophie Turner film braves Bharat wave Dark Phoenix, starring Sophie Turner, James McAvoy and Michael Fassbender did
well on its opening day and managed to brave the Bharat wave.",hollywood,2019-06-11,00:56:00,https://www.indiatoday.in/movies/hollywood/story/dark-phoenix-box-office-collection-day-1-sophie-turner-film-braves-bharat-wave-1544229-2019-06-07
India Today," Avengers star Chris Evans blasts men for planning Straight Pride Parade, calls them homophobicChris Evans penned an angry post about the absurdity of Straight Pride Parade
in Boston.",hollywood,2019-06-11,00:56:00,https://www.indiatoday.in/movies/hollywood/story/avengers-endgame-star-chris-evans-blasts-people-for-planning-straight-pride-parade-calls-them-homophobic-1543991-2019-06-06
India Today," Hugh Jackman reveals he was almost fired as Wolverine from first X-Men film: I was angryHugh Jackman revealed that he was almost fired from the X-Men franchise as
the makers did not think that he was able to play the role well.",hollywood,2019-06-11,00:56:00,https://www.indiatoday.in/movies/hollywood/story/hugh-jackman-reveals-he-was-almost-fired-as-wolverine-from-first-x-men-film-i-was-angry-1543940-2019-06-06
India Today," Bradley Cooper and Irina Shayk's relationship in trouble. Is Lady Gaga the reason?Star couple Bradley Cooper and Irina Shayk's relationship is on the rocks and
there is much speculation that Lady Gaga is the reason behind this.",hollywood,2019-06-11,00:56:00,https://www.indiatoday.in/movies/hollywood/story/bradley-cooper-and-irina-shayk-s-relationship-in-trouble-is-lady-gaga-the-reason-1543757-2019-06-06
India Today," Jennifer Aniston: I am not ashamed of posing nude at 50. Nobody should beRecently, Jennifer Aniston opened up about posing topless for a magazine
photoshoot. the actress said that she was not ashamed of it and that nobody
should feel so, either.",hollywood,2019-06-11,00:56:00,https://www.indiatoday.in/movies/hollywood/story/jennifer-aniston-i-am-not-ashamed-of-posing-nude-at-50-nobody-should-be-1543656-2019-06-06
India Today," Jaaved Jaaferi son Meezaan dating Navya Naveli Nanda? This is what the actor saysMeezaan Jaferi, who is gearing up for the release of his Bollywood debut
Malaal, reacted to the link-up rumours with Navya Naveli Nanda.",celebs-gossips,2019-06-11,00:56:00,https://www.indiatoday.in/movies/gossip/story/jaaved-jaaferi-son-meezaan-dating-navya-naveli-nanda-actor-has-this-to-say-1545794-2019-06-10
India Today," Imran Khan was asked if he is getting divorced from Avantika Malik. This is what happened nextWhen Imran Khan was asked about the trouble in his marriage with Avantika
Malik, he dodged the question.",celebs-gossips,2019-06-11,00:56:00,https://www.indiatoday.in/movies/gossip/story/imran-khan-was-asked-if-he-is-getting-divorced-from-avantika-malik-this-is-what-happened-next-1544726-2019-06-08
India Today,"  Sara Ali Khan cannot stop smiling on phone call. Fans think she is speaking to Kartik AaryanSara Ali Khan was spotted talking and laughing on the phone. Fans assumed
that she was talking to Kartik Aaryan.",celebs-gossips,2019-06-11,00:56:00,https://www.indiatoday.in/movies/gossip/story/-sara-ali-khan-cannot-stop-smiling-on-phone-call-fans-think-she-is-speaking-to-kartik-aaryan-1544383-2019-06-07
India Today," Shraddha Kapoor takes off to Turkey with rumoured boyfriend Rohan Shrestha. See picsShraddha Kapoor is currently in Antalya for a shoot, and her rumoured
boyfriend Rohan Shrestha is also with her.",celebs-gossips,2019-06-11,00:56:00,https://www.indiatoday.in/movies/gossip/story/shraddha-kapoor-takes-off-to-turkey-with-rumoured-boyfriend-rohan-shrestha-see-pics-1543756-2019-06-06
India Today," Ananya Panday on Kartik Aaryan and Sara Ali Khan: There is no love triangleAnanya Panday also said that she has ""amazing chemistry"" with Kartik Aaryan.",celebs-gossips,2019-06-11,00:56:00,https://www.indiatoday.in/movies/gossip/story/ananya-panday-on-kartik-aaryan-and-sara-ali-khan-there-is-no-love-triangle-1542998-2019-06-05
India Today," Ananya Panday reacts to link-up rumours with Kartik Aaryan: I am happyBuzz is that Kartik Aaryan and Ananya Panday are the newest couple in B-Town.
The Student Of The Year 2 actress opened up about the link-up rumours doing
the rounds.",celebs-gossips,2019-06-11,00:56:00,https://www.indiatoday.in/movies/gossip/story/ananya-panday-reacts-to-link-up-rumours-with-kartik-aaryan-i-am-happy-1541215-2019-06-03
India Today," Salman Khan takes a dig at Katrina Kaif on their break-up: Inhone mujhe chhod diyaSalman Khan playfully pulled Katrina Kaif's leg on Kapil Sharma's show, on
which he claimed that she left him.",celebs-gossips,2019-06-11,00:56:00,https://www.indiatoday.in/movies/gossip/story/salman-khan-takes-a-dig-at-katrina-kaif-on-their-break-up-inhone-mujhe-chhod-diya-1539220-2019-05-31
India Today," Katrina Kaif thinks Varun Dhawan would make for a bad chat show host. Here's whyOn Neha Dhupia's chat show, Katrina Kaif said that Varun Dhawan would make a
really bad chat show host.",celebs-gossips,2019-06-11,00:56:00,https://www.indiatoday.in/movies/gossip/story/katrina-kaif-thinks-varun-dhawan-would-make-for-a-bad-chat-show-host-here-s-why-1538137-2019-05-30
India Today,"  Is Sonal Chauhan dating cricketer KL Rahul? Not at all, says the actressJannat actress Sonal Chauhan has rubbished link-up rumours with cricketer KL
Rahul. The actress said that there is no truth to these rumours.",celebs-gossips,2019-06-11,00:56:00,https://www.indiatoday.in/movies/gossip/story/-is-sonal-chauhan-dating-cricketer-kl-rahul-not-at-all-says-the-actress-1537418-2019-05-29
India Today," Kartik Aaryan reveals what he hates the most about Ananya PandayKartik Aaryan, who has been linked to Ananya Panday, revealed on a chat show
what he does not like about her at all.",celebs-gossips,2019-06-11,00:56:00,https://www.indiatoday.in/movies/gossip/story/kartik-aaryan-reveals-what-he-hates-the-most-about-ananya-panday-1537348-2019-05-29
India Today," Disha Patani on Tiger Shroff: I want us to be more than just great friendsDisha Patani for the first time opened up on her equation with Tiger Shroff.
The actress revealed that she wants to be more than just great friends with
Tiger.",celebs-gossips,2019-06-11,00:56:00,https://www.indiatoday.in/movies/gossip/story/disha-patani-on-tiger-shroff-i-want-us-to-be-more-than-just-great-friends-1536330-2019-05-28
India Today," Salman Khan on Priyanka Chopra quitting Bharat: The embarrassing thing happened, she chose to get marriedSalman Khan called Priyanka Chopra's last-minute exit from Bharat
""embarrassing"" during a recent media interaction.",celebs-gossips,2019-06-11,00:56:00,https://www.indiatoday.in/movies/gossip/story/salman-khan-on-priyanka-chopra-quitting-bharat-the-embarrassing-thing-happened-she-chose-to-get-married-1535801-2019-05-27
India Today," Suhana Khan takes the dance floor by storm. See video A video of Shah Rukh Khan's daughter Suhana Khan partying with friends has
gone viral on social media.",celebs-gossips,2019-06-11,00:56:00,https://www.indiatoday.in/movies/star-kids/story/suhana-khan-takes-the-dance-floor-by-storm-see-video-1545919-2019-06-10
India Today," Watch: Sushmita Sen shares adorable video of daughter Alisah dancing to Akshay Kumar song with bestieSushmita Sen shared a super-cute video of her daughter Alisah dancing to the
song Ve Maahi with her best friend Alexa.",celebs-gossips,2019-06-11,00:56:00,https://www.indiatoday.in/movies/star-kids/story/watch-sushmita-sen-shares-adorable-video-of-daughter-alisah-dancing-to-akshay-kumar-song-with-bestie-1545263-2019-06-09
India Today," Ayushmann Khurrana says son Virajveer doesn't get his films: He likes Varun Dhawan and Tiger ShroffAyushmann Khurrana, who is gearing up for the release of his upcoming film
Article 15, said that his son Virajveer will be proud of his films in future.",celebs-gossips,2019-06-11,00:56:00,https://www.indiatoday.in/movies/star-kids/story/ayushmann-khurrana-says-son-virajveer-doesn-t-get-his-films-he-likes-varun-dhawan-and-tiger-shroff-1544273-2019-06-07
India Today," Suhana Khan is all set to become an actor. See videoIn a behind-the-scene video from her short film, Suhana Khan proves that she
is ready to enter Bollywood.",celebs-gossips,2019-06-11,00:56:00,https://www.indiatoday.in/movies/star-kids/story/suhana-khan-is-all-set-to-become-an-actor-see-video-1544036-2019-06-06
India Today," Shah Rukh Khan said I was so good in SOTY 2: Ananya Panday Ananya Panday opened up about Shah Rukh Khan's reaction to her performance in
Student Of The Year 2.",celebs-gossips,2019-06-11,00:56:00,https://www.indiatoday.in/movies/star-kids/story/shah-rukh-khan-said-i-was-so-good-in-soty-2-ananya-panday-1542990-2019-06-05
India Today," See: Mira Rajput shares awww-dorable photos of Misha and Zain bondingMira Rajput took to her Instagram account to share super-cute pictures of her
children, Misha and Zain.",celebs-gossips,2019-06-11,00:56:00,https://www.indiatoday.in/movies/star-kids/story/see-mira-rajput-shares-awww-dorable-photos-of-misha-and-zain-bonding-1542952-2019-06-05
India Today," Suhana Khan looks drop-dead gorgeous in new selfie. See picA jaw-droppingly gorgeous picture of Suhana Khan is doing the rounds on
social media.",celebs-gossips,2019-06-11,00:56:00,https://www.indiatoday.in/movies/star-kids/story/suhana-khan-looks-drop-dead-gorgeous-in-new-selfie-see-pic-1542922-2019-06-05
India Today," Kunal Kemmu on daughter Inaaya: I am learning how to be a parentKunal Kemmu and Soha Ali Khan welcomed their daughter Inaaya in September
2017.",celebs-gossips,2019-06-11,00:56:00,https://www.indiatoday.in/movies/star-kids/story/kunal-kemmu-on-daughter-inaaya-i-am-learning-how-to-be-a-parent-1542407-2019-06-04
India Today," Shah Rukh Khan shares adorable photos of Aryan, Suhana and AbRam: Sugar, spice and everything niceShah Rukh Khan took to Twitter to share pictures of his children Aryan,
Suhana and AbRam from the six-year-old's birthday bash recently.",celebs-gossips,2019-06-11,00:56:00,https://www.indiatoday.in/movies/star-kids/story/shah-rukh-khan-shares-adorable-photos-of-aryan-suhana-and-abram-sugar-spice-and-everything-nice-1542109-2019-06-04
India Today," Aamir Khan's daughter Ira flaunts belly button piercing and first tattoo. See picsIra Khan recently got her first tattoo and she flaunted it in an Instagram
post.",celebs-gossips,2019-06-11,00:56:00,https://www.indiatoday.in/movies/star-kids/story/aamir-khan-s-daughter-ira-flaunts-belly-button-piercing-and-first-tattoo-see-pics-1541444-2019-06-03
India Today," Ananya Panday reveals she and Suhana Khan shot for a scene in My Name Is KhanAnanya Panday revealed that she and Suhana Khan were thrilled to be a part of
a scene from My Name Is Khan. However, the scene did not make it to the final
cut.",celebs-gossips,2019-06-11,00:56:00,https://www.indiatoday.in/movies/star-kids/story/ananya-panday-reveals-she-and-suhana-khan-shot-for-a-scene-in-my-name-is-khan-1541292-2019-06-03
India Today," Suhana Khan is resplendent in traditional attire at family wedding in KolkataSuhana Khan's latest pictures with a friend from a family wedding in Kolkata
have gone viral on social media.",celebs-gossips,2019-06-11,00:56:00,https://www.indiatoday.in/movies/star-kids/story/suhana-khan-is-resplendent-in-traditional-attire-at-family-wedding-in-kolkata-1539121-2019-05-31
India Today, A fun day out with Banoo Main Teri Dulhann's Ritu Vasisht,television,2019-06-11,00:56,https://www.indiatoday.in/television/video/a-fun-day-out-with-banoo-main-teri-dulhann-s-ritu-vasisht-1546066-2019-06-10
India Today, Siddharth Shukla to Devoleena Bhattacharjee: Are these celebs participating in Bigg Boss 13?,television,2019-06-11,00:56,https://www.indiatoday.in/television/photo/siddharth-shukla-to-devoleena-bhattacharjee-are-these-celebs-participating-in-bigg-boss-13-1546064-2019-06-10
India Today, Yeh Rishta Kya Kehlata Hai: Naira saves her son from kidnapping attempt,television,2019-06-11,00:56,https://www.indiatoday.in/television/video/yeh-rishta-kya-kehlata-hai-naira-saves-her-son-from-kidnapping-attempt-1546053-2019-06-10
India Today, Did you know Karan Singh Grover played a rapist in original Kasautii Zindagii Kay?,television,2019-06-11,00:56,https://www.indiatoday.in/television/soaps/story/did-you-know-karan-singh-grover-played-a-rapist-in-original-kasautii-zindagii-kay-1546022-2019-06-10
India Today, Sanjay Suri to play Karisma Kapoor's on-screen husband in Mentalhood,television,2019-06-11,00:56,https://www.indiatoday.in/television/web-series/story/sanjay-suri-to-play-karisma-kapoor-s-on-screen-husband-in-mentalhood-1545971-2019-06-10
India Today," Adaa Khan and Arhaan Behll's Sitaara to go off air, actors say goodbye to fans",television,2019-06-11,00:56,https://www.indiatoday.in/television/video/adaa-khan-and-arhaan-behll-s-sitaara-to-go-off-air-actors-say-goodbye-to-fans-1545937-2019-06-10
India Today, Yeh Rishta Kya Kehlata Hai: Kartik saves Vedika from goons,television,2019-06-11,00:56,https://www.indiatoday.in/television/video/yeh-rishta-kya-kehlata-hai-kartik-saves-vedika-from-goons-1545936-2019-06-10
India Today," TV newsmakers: Charu Asopa and Rajeev Sen get married secretly, Manish Naggdev says Srishty Rode used him for professional gains",television,2019-06-11,00:56,https://www.indiatoday.in/television/top-stories/story/tv-newsmakers-charu-asopa-and-rajeev-sen-get-married-secretly-manish-naggdev-says-srishty-rode-used-him-for-professional-gains-1545866-2019-06-10
India Today," Bigg Boss 13 or Nach Baliye 9? Salman Khan announces comeback on TV, shares glimpse from sets",television,2019-06-11,00:56,https://www.indiatoday.in/television/reality-tv/story/bigg-boss-13-or-nach-baliye-9-salman-khan-announces-comeback-on-tv-shares-glimpse-from-sets-1545875-2019-06-10
India Today, Kasautii Zindagii Kay spoiler: Here's why Mr Bajaj will force Prerna to marry him,television,2019-06-11,00:56,https://www.indiatoday.in/television/soaps/story/kasautii-zindagii-kay-spoiler-here-s-why-mr-bajaj-will-force-prerna-to-marry-him-1545851-2019-06-10
India Today," The Kapil Sharma Show completes 50 episodes, team members celebrate its massive success",television,2019-06-11,00:56,https://www.indiatoday.in/television/reality-tv/story/the-kapil-sharma-show-completes-50-episodes-team-members-celebrate-its-massive-success-1545826-2019-06-10
India Today, Maaya actress Shama Sikander is too hot to handle in latest pics,television,2019-06-11,00:56,https://www.indiatoday.in/television/photo/maaya-actress-shama-sikander-is-too-hot-to-handle-in-latest-pics-1545816-2019-06-10
India Today, Dipika Kakar spends priceless moments with hubby Shoaib Ibrahim on show's sets,television,2019-06-11,00:56,https://www.indiatoday.in/television/photo/dipika-kakar-spends-priceless-moments-with-hubby-shoaib-ibrahim-on-show-s-sets-1545800-2019-06-10
India Today, Is Hina Khan Ekta Kapoor's next Naagin? Here's what she has to say,television,2019-06-11,00:56,https://www.indiatoday.in/television/soaps/story/is-hina-khan-ekta-kapoor-s-next-naagin-here-s-what-she-has-to-say-1545789-2019-06-10
India Today, New mommy Chhavi Mittal's advice on post-pregnancy weight loss is worth a read,television,2019-06-11,00:56,https://www.indiatoday.in/television/celebrity/story/new-mommy-chhavi-mittal-s-advice-on-post-pregnancy-weight-loss-is-worth-a-read-1545775-2019-06-10
India Today, Sa Re Ga Ma Pa Li'l Champs 2019: 14-year-old Sugandha Date wins the show,television,2019-06-11,00:56,https://www.indiatoday.in/television/reality-tv/story/sa-re-ga-ma-pa-li-l-champs-2019-14-year-old-sugandha-date-wins-the-show-1545438-2019-06-09
India Today, Watch: Inside video from Ekta Kapoor's star-studded birthday bash,television,2019-06-11,00:56,https://www.indiatoday.in/television/video/watch-inside-video-from-ekta-kapoor-s-star-studded-birthday-bash-1545456-2019-06-09
India Today," Sanjay Suri to play Karisma Kapoor's on-screen husband in MentalhoodActor Sanjay Suri will play actress Karisma Kapoors character Meira Sharmas
husband in Mentalhood, a web series on the crazy ride of motherhood.",web-series,2019-06-11,00:56:00,https://www.indiatoday.in/television/web-series/story/sanjay-suri-to-play-karisma-kapoor-s-on-screen-husband-in-mentalhood-1545971-2019-06-10
India Today," Leila's Huma Qureshi, Deepa Mehta on making art in troubled times and learning from pastIn viewing the power of art, acknowledging the troubled times and pinning
hope, that art--and only that--can make the world a better place, actor Huma
Qureshi and filmmaker Deepa Mehta are on the same page.",web-series,2019-06-11,00:56:00,https://www.indiatoday.in/television/web-series/story/leila-s-huma-qureshi-deepa-mehta-on-making-art-in-troubled-times-and-learning-from-past-1545326-2019-06-09
India Today," It's a wrap for Abhishek Bachchan, Amit Sadh starrer Breathe 2Amit Sadh posted an emotional note after wrapping up Breathe 2.",web-series,2019-06-11,00:56:00,https://www.indiatoday.in/television/web-series/story/it-s-a-wrap-for-abhishek-bachchan-amit-sadh-starrer-breathe-2-1544440-2019-06-07
India Today," The Test Case to Haq Se: 5 best web series of Ekta Kapoor on her birthday From Nimrat Kaur-starrer The Test Case Rajkummar Rao's Bose Dead/Alive, Ekta
Kapoor has made some impressive web shows for Alt Balaji.",web-series,2019-06-11,00:56:00,https://www.indiatoday.in/television/web-series/story/the-test-case-to-haq-se-5-best-web-series-of-ekta-kapoor-on-her-birthday-1544333-2019-06-07
India Today," Lucifer renewed for the final season: I'll see you in hell, says Tom EllisNetflix has renewed Lucifer for fifth and final series. Tom Ellis shared his
excitement on social media.",web-series,2019-06-11,00:56:00,https://www.indiatoday.in/television/web-series/story/lucifer-renewed-for-the-final-season-i-ll-see-you-in-hell-says-tom-ellis-1544326-2019-06-07
India Today," Sakshi Tanwar to play a scientist in Ekta Kapoor's M.O.M. - Mission Over MarsALTBalaji's M.O.M. - Mission Over Mars stars Sakshi Tanwar, Mona Singh, Nidhi
Singh and Palomi Ghosh. The series is based on Mangalyaan Mars Orbiter
Mission.",web-series,2019-06-11,00:56:00,https://www.indiatoday.in/television/web-series/story/sakshi-tanwar-to-play-a-scientist-in-ekta-kapoor-s-m-o-m-mission-over-mars-1544218-2019-06-07
India Today," Karisma Kapoor wraps up shooting for her digital debut MentalhoodActress Karisma Kapoor is all set to make her digital debut with ALTBalaji's
Mentalhood.",web-series,2019-06-11,00:56:00,https://www.indiatoday.in/television/web-series/story/karisma-kapoor-wraps-up-shooting-for-her-digital-debut-mentalhood-1543125-2019-06-05
India Today," Ashton Kutcher starrer The Ranch to end in 2020 Netflix sitcom The Ranch will end with Season 4, Ashton Kutcher confirmed the
news on Twitter.",web-series,2019-06-11,00:56:00,https://www.indiatoday.in/television/web-series/story/ashton-kutcher-starrer-the-ranch-to-end-in-2020-1543110-2019-06-05
India Today," After taking a dig at Narendra Modi, Hasan Minhaj analyses result of Lok Sabha Election 2019The latest episode of Hasan Minhaj's examines how BJP managed to pull off
such a massive win in Lok Sabha Election 2019.",web-series,2019-06-11,00:56:00,https://www.indiatoday.in/television/web-series/story/after-taking-a-dig-at-narendra-modi-hasan-minhaj-analyses-result-of-lok-sabha-election-2019-1542568-2019-06-04
India Today," When a badly injured Ronit Roy continued to shoot for HostagesRonit Roy injured himself during a fight sequence in Hotstar Special Hostages
and got 17 stitches. But that didn't stop him from continuing to shoot.",web-series,2019-06-11,00:56:00,https://www.indiatoday.in/television/web-series/story/when-a-badly-injured-ronit-roy-continued-to-shoot-for-hostages-1542457-2019-06-04
India Today," Hostages review: Ronit Roy, Tisca Chopra's brilliant acting marred by tangled plotHostages review: Ronit Roy, Tisca Chopra starrer is intriguing in parts but
fails to hold the interest of its viewers.",web-series,2019-06-11,00:56:00,https://www.indiatoday.in/television/web-series/story/hostages-review-ronit-roy-tisca-chopra-s-brilliant-acting-marred-by-tangled-plot-1542291-2019-06-04
India Today," Amazon Prime announces second season of Four More Shots Please!Amazon Prime's Four More Shots Please! stars Sayani Gupta, Kirti Kulhari,
Maanvi Gagroo and Bani J in the lead. The first season premiered in January
2019.",web-series,2019-06-11,00:56:00,https://www.indiatoday.in/television/web-series/story/amazon-prime-announces-second-season-of-four-more-shots-please-1541276-2019-06-03
Time of India,Social media users troll Disha Patani for her dinner outing with Aditya Thackeray,bollywood,2019-06-11, 00:52:00,https://timesofindia.indiatimes.com/entertainment/hindi/bollywood/news/social-media-users-troll-disha-patani-for-her-dinner-outing-with-aditya-thackeray/articleshow/69732004.cms
Time of India,Amitabh Bachchan’s Twitter account hacked!,bollywood,2019-06-11, 00:12:00,https://timesofindia.indiatimes.com/entertainment/hindi/bollywood/news/amitabh-bachchans-twitter-account-hacked/articleshow/69731625.cms
Time of India,Taapsee Pannu shares a picture with her 'prosthetics artist' who made her hand look bruised,bollywood,2019-06-10, 23:11:00,https://timesofindia.indiatimes.com/entertainment/hindi/bollywood/news/taapsee-pannu-shares-a-picture-with-her-prosthetics-artist-who-made-her-hand-look-bruised/articleshow/69731008.cms
Time of India,"Kriti Sanon, Arjun Rampal and other Bollywood celebs react to the first Mumbai rains",bollywood,2019-06-10, 22:46:00,https://timesofindia.indiatimes.com/entertainment/hindi/bollywood/news/kriti-sanon-arjun-rampal-and-other-bollywood-celebs-react-to-the-first-monsoon-in-the-city/articleshow/69730481.cms
Time of India,Anand Ahuja's picture with Sonam Kapoor is all about love!,bollywood,2019-06-10, 22:12:00,https://timesofindia.indiatimes.comhttps://timesofindia.indiatimes.com/entertainment/hindi/bollywood/photo-features/sonam-kapoor-anand-ahujas-love-story/anand-ahujas-picture-with-sonam-kapoor-is-all-about-love/photostory/69730204.cms
Time of India,"EXCLUSIVE! VT station will not be recreated in London for ‘Coolie No. 1’, clarifies Varun Dhawan",bollywood,2019-06-10, 21:45:00,https://timesofindia.indiatimes.com/entertainment/hindi/bollywood/news/exclusive-vt-station-will-not-be-recreated-in-london-for-coolie-no-1-clarifies-varun-dhawan/articleshow/69729818.cms
Time of India,"Rishi Kapoor, Neetu Kapoor and Navya Nanda in one frame; have a look!",bollywood,2019-06-10, 20:33:00,https://timesofindia.indiatimes.com/entertainment/hindi/bollywood/news/rishi-kapoor-neetu-kapoor-and-navya-nanda-in-one-frame-have-a-look/articleshow/69728900.cms
Time of India,Kiara Advani looks absolutely delightful in This outfit for 'Kabir Singh' promotions,bollywood,2019-06-10, 20:33:00,https://timesofindia.indiatimes.com/entertainment/hindi/bollywood/news/kiara-advani-looks-absolutely-delightful-in-this-outfit-for-kabir-singh-promotions/articleshow/69728873.cms
Time of India,Mini Mathur hits back at troll: I won't use botox,bollywood,2019-06-10, 20:23:00,https://timesofindia.indiatimes.com/entertainment/hindi/bollywood/news/mini-mathur-hits-back-at-troll-i-wont-use-botox/articleshow/69728478.cms
Time of India,Deepika Padukone inspires brides to recreate her gorgeous wedding looks!,bollywood,2019-06-10, 19:52:00,https://timesofindia.indiatimes.com/entertainment/hindi/bollywood/news/deepika-padukone-inspires-brides-to-recreate-her-gorgeous-wedding-looks/articleshow/69728334.cms
