Newspaper,Heading,Category,Date,Time,URL
Hindiustan Times,"Sonali Bendre shares her experience from aqua therapy session, says ‘this isn’t as easy as it looks’. Watch video",bollywood,2019-06-10,21:42:00,https://www.hindustantimes.com/bollywood/sonali-bendre-shares-her-experience-from-aqua-therapy-session-says-this-isn-t-as-easy-as-it-looks-watch-video/story-tzOuYNVSKi3XNJK8T47eJJ.html
Hindiustan Times,"Varun Dhawan, Anushka Sharma, Abhishek Bachchan hail Yuvraj Singh post his retirement",bollywood,2019-06-10,21:38:00,https://www.hindustantimes.com/bollywood/varun-dhawan-anushka-sharma-abhishek-bachchan-hail-yuvraj-singh-post-his-retirement/story-lbCTpUdKsdQbcDGB5kQlhJ.html
Hindiustan Times,"Disha Patani dines with Aditya Thackeray, Malaika Arora and Janhvi Kapoor hit the gym. See pics",bollywood,2019-06-10,20:30:00,https://www.hindustantimes.com/bollywood/disha-patani-dines-with-aditya-thackeray-malaika-arora-and-janhvi-kapoor-hit-the-gym-see-pics/story-XqPOYXTcbouzwytb5re1aI.html
Hindiustan Times,When Shah Rukh Khan’s daughter Suhana Khan danced at a party like no one’s watching. Watch,bollywood,2019-06-10,18:28:00,https://www.hindustantimes.com/bollywood/when-shah-rukh-khan-s-daughter-suhana-khan-danced-at-a-party-like-no-one-s-watching-watch/story-QNuESL34GERjYTUFUxtS5J.html
Hindiustan Times,Meezaan on link-up rumours with Amitabh Bachchan’s granddaughter Navya Naveli: ‘She’s a really good friend’,bollywood,2019-06-10,18:15:00,https://www.hindustantimes.com/bollywood/meezaan-on-link-up-rumours-with-amitabh-bachchan-s-granddaughter-navya-naveli-she-s-a-really-good-friend/story-o5wBQ70Ix4G4skDwfp7bqK.html
Hindiustan Times,Hazel Keech’s appreciation post for husband Yuvraj Singh gets a compliment from his ex-girlfriend Kim Sharma,bollywood,2019-06-10,18:32:00,https://www.hindustantimes.com/bollywood/hazel-keech-s-appreciation-post-for-husband-yuvraj-singh-gets-a-compliment-from-his-ex-girlfriend-kim-sharma/story-k1zzCWR7dnpzhxFAHTbIHO.html
Hindiustan Times,"Hrithik Roshan’s sister Sunaina refutes rumours of ‘being critical, in hospital’, says she is partying with friends",bollywood,2019-06-10,17:21:00,https://www.hindustantimes.com/bollywood/hrithik-roshan-s-sister-sunaina-refutes-rumours-of-being-critical-in-hospital-says-she-is-partying-with-friends/story-ye6yI0QRluWUgS33xcD0BM.html
Hindiustan Times,"Nick Jonas reveals his two favourite Bollywood songs, only one features Priyanka Chopra",bollywood,2019-06-10,16:07:00,https://www.hindustantimes.com/bollywood/nick-jonas-reveals-his-two-favourite-bollywood-songs-only-one-features-priyanka-chopra/story-BOwh3yfg6sdgFJlDWgPilJ.html
Hindiustan Times,Saif Ali Khan on spending time with family: ‘I feel bad when I come home after work and find Taimur sleeping’ ,bollywood,2019-06-10,14:57:00,https://www.hindustantimes.com/bollywood/saif-ali-khan-on-spending-time-with-family-i-feel-bad-when-i-come-home-after-work-and-find-taimur-sleeping/story-GOhW3ZZ9hs2cGCGb0k3uSN.html
Hindiustan Times,"Sameera Reddy shares pregnancy shoot, slams trolls ‘who feel uncomfortable with me enjoying my pregnant belly’",bollywood,2019-06-10,15:28:00,https://www.hindustantimes.com/bollywood/sameera-reddy-shares-pregnancy-shoot-slams-trolls-who-feel-uncomfortable-with-me-enjoying-my-pregnant-belly/story-q89TEsiUzxDrRGQa3HVp2K.html
Hindiustan Times,"Anushka Sharma cheers for Virat Kohli’s kind gesture for Steve Smith during World Cup match, says he’s ‘so easy to love’",bollywood,2019-06-10,14:22:00,https://www.hindustantimes.com/bollywood/anushka-sharma-cheers-for-virat-kohli-s-kind-gesture-for-steve-smith-during-world-cup-match-says-he-s-so-easy-to-love/story-4x6qAfeKl5BLUUJ1PZ5lkK.html
Hindiustan Times,"RIP Girish Karnad: The man who brought art, literature to the man on the street",bollywood,2019-06-10,13:36:00,https://www.hindustantimes.com/bollywood/rip-girish-karnad-the-man-who-bought-art-literature-to-the-man-on-the-street/story-le5yPHxMj8A7azS5vVn0QP.html
Hindiustan Times,Deepika Padukone on playing Ranveer Singh’s onscreen wife in 83: ‘This isn’t coming from a personal equation’,bollywood,2019-06-10,12:50:00,https://www.hindustantimes.com/bollywood/deepika-padukone-on-playing-ranveer-singh-s-onscreen-wife-in-83-this-isn-t-coming-from-a-personal-equation/story-kfgfINpqVipL5uOtS5zpPM.html
Hindiustan Times,"Bhoot: Karan Johar, Vicky Kaushal announce new horror franchise with scary poster. See here",bollywood,2019-06-10,12:07:00,https://www.hindustantimes.com/bollywood/bhoot-karan-johar-vicky-kaushal-announce-new-horror-franchise-with-scary-poster-see-here/story-1Gh8eBcAX51xZdHCepG4bN.html
Hindiustan Times,"Siddhant Chaturvedi says he auditioned for Aladdin, Million Dollar Arm. Here’s why he didn’t land the roles",bollywood,2019-06-10,11:12:00,https://www.hindustantimes.com/bollywood/siddhant-chaturvedi-says-he-auditioned-for-aladdin-million-dollar-arm-here-s-why-he-didn-t-land-the-roles/story-4LlVqdEtBPLoFS8dlQKNNJ.html
Hindiustan Times,"Chris Pratt shares first pic with wife Katherine Schwarzenegger, Priyanka Chopra wishes the couple",hollywood,2019-06-10,13:44:00,https://www.hindustantimes.com/hollywood/chris-pratt-shares-first-pic-with-wife-katherine-schwarzenegger-priyanka-chopra-wishes-the-couple/story-IzTS9fZQ2FdPSSzddvV6FP.html
Hindiustan Times,"George Clooney on friendship with Meghan Markle, Prince Harry: ‘We live not too far from one another and we have dinners’",hollywood,2019-06-09,14:26:00,https://www.hindustantimes.com/hollywood/george-clooney-on-friendship-with-meghan-markle-prince-harry-we-live-not-too-far-from-one-another-and-we-have-dinners/story-JYeRpZGo6KfAgHxnwC7i6K.html
Hindiustan Times,"Chris Pratt and Katherine Schwarzenegger marry in an intimate ceremony, see pics",hollywood,2019-06-09,11:26:00,https://www.hindustantimes.com/hollywood/chris-pratt-and-katherine-schwarzenegger-marry-in-an-intimate-ceremony-see-pics/story-7jOY72XLE1E09KozY1wBIN.html
Hindiustan Times,I Am Mother movie review: Has Netflix found the new Christopher Nolan? Hilary Swank thinks so,hollywood,2019-06-10,16:55:00,https://www.hindustantimes.com/hollywood/i-am-mother-movie-review-has-netflix-found-the-new-christopher-nolan-hilary-swank-thinks-so/story-jX2su2n885F2n8ng2yoC9M.html
Hindiustan Times,X Men Dark Phoenix to register loss of Rs 695 crore. Here’s what went wrong,hollywood,2019-06-10,16:32:00,https://www.hindustantimes.com/hollywood/x-men-dark-phoenix-to-register-loss-of-rs-695-crore-here-s-what-went-wrong/story-14KaHogLoRtSOqMBCJruvI.html
Hindiustan Times,"Chris Pratt shares first pic with wife Katherine Schwarzenegger, Priyanka Chopra wishes the couple",hollywood,2019-06-10,13:44:00,https://www.hindustantimes.com/hollywood/chris-pratt-shares-first-pic-with-wife-katherine-schwarzenegger-priyanka-chopra-wishes-the-couple/story-IzTS9fZQ2FdPSSzddvV6FP.html
Hindiustan Times,"George Clooney on friendship with Meghan Markle, Prince Harry: ‘We live not too far from one another and we have dinners’",hollywood,2019-06-09,14:26:00,https://www.hindustantimes.com/hollywood/george-clooney-on-friendship-with-meghan-markle-prince-harry-we-live-not-too-far-from-one-another-and-we-have-dinners/story-JYeRpZGo6KfAgHxnwC7i6K.html
Hindiustan Times,"Chris Pratt and Katherine Schwarzenegger marry in an intimate ceremony, see pics",hollywood,2019-06-09,11:26:00,https://www.hindustantimes.com/hollywood/chris-pratt-and-katherine-schwarzenegger-marry-in-an-intimate-ceremony-see-pics/story-7jOY72XLE1E09KozY1wBIN.html
Hindiustan Times,"John Cena joins Fast & Furious 9 cast, calls it ‘an incredible honour’",hollywood,2019-06-08,19:56:00,https://www.hindustantimes.com/hollywood/john-cena-joins-fast-furious-9-cast-calls-it-an-incredible-honour/story-DJKw4bLQMaqtPBR8tBllHP.html
Hindiustan Times,Set phasers to stun: Your warp-speed guide to the Star Trek universe,hollywood,2019-06-08,16:54:00,https://www.hindustantimes.com/art-and-culture/set-phasers-to-stun-your-warp-speed-guide-to-the-star-trek-universe/story-DKJf8VHnS4LPftHdHpdKKM.html
Hindiustan Times,Dhanush says The Extraordinary Journey of a Fakir has dealt with immigration ‘in a very positive way’,hollywood,2019-06-08,16:36:00,https://www.hindustantimes.com/hollywood/dhanush-says-the-extraordinary-journey-of-a-fakir-has-dealt-with-immigration-in-a-very-positive-way/story-fZ3ktC9WsOBwqE5QG6mFiP.html
Hindiustan Times,"#Film: The zombies are rising, which means the world is in crisis again",hollywood,2019-06-08,16:06:00,https://www.hindustantimes.com/hollywood/film-the-zombies-are-rising-which-means-the-world-is-in-crisis-again/story-XzBwmCXamC3LDcyoXmEJZO.html
Hindiustan Times,"Dark Phoenix done, a definitive ranking of the X-Men series, before it joins the MCU",hollywood,2019-06-08,15:56:00,https://www.hindustantimes.com/hollywood/dark-phoenix-done-a-definitive-ranking-of-the-x-men-series-before-it-joins-the-mcu/story-x4TolUpvZs5PxUrKCGqsiK.html
Hindiustan Times,"Avengers Endgame: Chris Evans, Chris Hemsworth, Mark Ruffalo, Tom Holland share top secret videos of funeral scene. Watch here",hollywood,2019-06-07,21:35:00,https://www.hindustantimes.com/hollywood/avengers-endgame-chris-evans-chris-hemsworth-mark-ruffalo-tom-holland-share-top-secret-videos-of-funeral-scene-watch-here/story-NSi7cZWTHJW9WgrRKhafDN.html
Hindiustan Times,"Bradley Cooper, Irina Shayk separate after four years, will share custody of 2-year-old daughter: Report",hollywood,2019-06-07,10:55:00,https://www.hindustantimes.com/hollywood/bradley-cooper-irina-shayk-separate-after-four-years-will-share-custody-of-2-year-old-daughter-report/story-JaZ0GAvNoa5mqeTOA4FfVL.html
Hindiustan Times,Marvel producer already has two possible post Avengers Endgame team-ups in mind,hollywood,2019-06-06,17:31:00,https://www.hindustantimes.com/hollywood/marvel-producer-already-has-two-possible-post-avengers-endgame-team-ups-in-mind/story-LV7iamm87T9Y8uSm3f7OUJ.html
Hindiustan Times,"Rocketman got A certificate from CBFC with no cuts, here are the three changes that were made",hollywood,2019-06-06,16:19:00,https://www.hindustantimes.com/bollywood/rocketman-got-a-certificate-from-cbfc-with-no-cuts-here-are-the-three-changes-that-were-made/story-BmVQZZH7PApEC9Ex3lm74I.html
Hindiustan Times,"No Joker, Wonder Woman at Comic Con, but Warner Bros will debut It Chapter 2 footage",hollywood,2019-06-06,15:45:00,https://www.hindustantimes.com/hollywood/no-joker-wonder-woman-at-comic-con-but-warner-bros-will-debut-it-chapter-2-footage/story-LDkPq3R3pT1DD87DxeYiEM.html
Hindiustan Times,When Hugh Jackman was almost fired as Wolverine from the first X-Men movie,hollywood,2019-06-06,14:53:00,https://www.hindustantimes.com/hollywood/when-hugh-jackman-was-almost-fired-as-wolverine-from-the-first-x-men-movie/story-Z4XZSsEfzaZrEX4qj9DpyI.html
Hindiustan Times,"Harvey Weinstein ‘was incredibly sexually flirtatious’ and ‘crossed all lines’, says Madonna",hollywood,2019-06-06,13:36:00,https://www.hindustantimes.com/hollywood/harvey-weinstein-was-incredibly-sexually-flirtatious-and-crossed-all-lines-says-madonna/story-DvaQrH71ii63gAjkItISFK.html
Hindiustan Times,Jennifer Lawrence on her Dark Phoenix death scene: ‘I cried watching Sophie Turner’ ,hollywood,2019-06-06,13:24:00,https://www.hindustantimes.com/hollywood/jennifer-lawrence-on-her-dark-phoenix-death-scene-i-cried-watching-sophie-turner/story-x7aPBmHNXC9yS1vB5qEPAK.html
Hindiustan Times,"Bradley Cooper, Irina Shayk considering split?: ‘It has nothing to do with Lady Gaga’",hollywood,2019-06-06,13:13:00,https://www.hindustantimes.com/hollywood/bradley-cooper-irina-shayk-considering-split-it-has-nothing-to-do-with-lady-gaga/story-xEThRFMp6It8cYORiBNxTJ.html
Hindiustan Times,"Woody Allen stages MeToo comeback, new film scheduled to begin filming in Spain",hollywood,2019-06-06,11:53:00,https://www.hindustantimes.com/hollywood/woody-allen-stages-metoo-comeback-new-film-scheduled-to-begin-filming-in-spain/story-VS57yOC4YmZYFlzenjQIJL.html
Hindiustan Times,"Wonder Woman 1984 poster out, Gal Gadot gleams in a new golden suit. See pic",hollywood,2019-06-06,10:01:00,https://www.hindustantimes.com/hollywood/wonder-woman-1984-poster-out-gal-gadot-gleams-in-a-new-golden-suit-see-pic/story-FJsLhj3WT2V7uydYryxlRO.html
Hindiustan Times,X-Men Dark Phoenix review: Sophie Turner  stars in a lousy conclusion to Marvel’s X-Men saga; sloppy seconds to Avengers Endgame,hollywood,2019-06-06,17:25:00,https://www.hindustantimes.com/hollywood/x-men-dark-phoenix-movie-review-the-worst-film-in-the-x-men-saga-sloppy-seconds-to-avengers-endgame/story-PfemEZVFXGJXj7TVkTUsCJ.html
Hindiustan Times,"Avengers Endgame vs Avatar: Barring miracle, Marvel film will not beat James Cameron’s epic as number one film of all time",hollywood,2019-06-05,17:51:00,https://www.hindustantimes.com/hollywood/avengers-endgame-vs-avatar-barring-miracle-marvel-film-will-not-beat-james-cameron-s-epic-as-number-one-film-of-all-time/story-tMTL3a0NgxWfNK75HjHJ5K.html
Hindiustan Times,Ad Astra trailer: Brad Pitt goes interstellar in Christopher Nolan-esque thriller. Watch here,hollywood,2019-06-05,17:34:00,https://www.hindustantimes.com/hollywood/ad-astra-trailer-brad-pitt-goes-interstellar-in-christopher-nolan-esque-thriller-watch-here/story-tiQ6YtehCsAoWvFruAc1VK.html
Hindiustan Times,"New James Bond film’s set rocked by an explosion, one crew member injured",hollywood,2019-06-05,10:09:00,https://www.hindustantimes.com/hollywood/new-james-bond-film-rocked-by-an-explosion-one-crew-member-injured/story-ZfMmMR7Qv7OFMUIiX43eqK.html
Hindiustan Times,"Kevin Spacey appears in court, lawyer says ‘he is suffering every day that this goes on’",hollywood,2019-06-04,15:44:00,https://www.hindustantimes.com/hollywood/kevin-spacey-appears-in-court-lawyer-says-he-is-suffering-every-day-that-this-goes-on/story-XQzN4LOaQLUdYtErZpMpVP.html
Hindiustan Times,The Extraordinary Journey Of The Fakir trailer: Dhanush embarks on a crazy journey to Paris via a twisted route,hollywood,2019-06-04,17:35:00,https://www.hindustantimes.com/entertainment/the-extraordinary-journey-of-the-fakir-trailer-dhanush-embarks-on-a-crazy-journey-to-paris-via-a-twisted-route/story-nDSeC5oPs5DTrHh2dKSRVJ.html
Hindiustan Times,"Miley Cyrus groped by fan, reached out to husband Liam Hemsworth for help",hollywood,2019-06-04,12:00:00,https://www.hindustantimes.com/hollywood/miley-cyrus-groped-by-fan-reached-out-to-husband-liam-hemsworth-for-help/story-hCQQKrzCUZ94WHolGkavfI.html
Hindiustan Times,Keanu Reeves in talks to make Marvel debut with Angelina Jolie starrer The Eternals,hollywood,2019-06-03,21:26:00,https://www.hindustantimes.com/hollywood/keanu-reeves-in-talks-to-make-marvel-debut-with-angelina-jolie-starrer-the-eternals/story-JZvz4CcTD8tFHNMUd1ZeAP.html
Hindiustan Times,"Marvel leak teases post Avengers Endgame lineup: Young Avengers, New Avengers and Dark Avengers in pipeline",hollywood,2019-06-04,17:45:00,https://www.hindustantimes.com/hollywood/marvel-leak-teases-post-avengers-endgame-lineup-young-avengers-new-avengers-and-dark-avengers-in-pipeline/story-tMDFgABpZQ8uBowDHj9rZP.html
Hindiustan Times,"Ford v Ferrari trailer: Matt Damon, Christian Bale bring one of the greatest racing rivalries to life",hollywood,2019-06-03,10:50:00,https://www.hindustantimes.com/hollywood/ford-v-ferrari-trailer-matt-damon-christian-bale-bring-one-of-the-greatest-racing-rivalries-to-life/story-PVt0CPRIOrYcZnJYaysLOK.html
Hindiustan Times,"Will Smith shares his Genie beauty secrets from Aladdin, says ‘I don’t want Kylie Jenner stealing my stuff’",hollywood,2019-06-02,18:46:00,https://www.hindustantimes.com/hollywood/will-smith-shares-his-genie-beauty-secrets-from-aladdin-says-i-don-t-want-kylie-jenner-stealing-my-stuff/story-Tlt9kAjMkUuBCDi4UPE3nI.html
Hindiustan Times,Newsmaker: Quentin Tarantino and his ninth symphony,hollywood,2019-06-02,09:53:00,https://www.hindustantimes.com/hollywood/newsmaker-quentin-tarantino-and-his-ninth-symphony/story-bDWjGrUHErhigbOnsYWJyN.html
Hindiustan Times,"Rocketman movie review: Taron Egerton soars in the sky, explodes in all the brilliant colours of Elton John",hollywood,2019-05-31,17:22:00,https://www.hindustantimes.com/hollywood/rocketman-movie-review-taron-egerton-soars-in-the-sky-explodes-in-all-the-brilliant-colours-of-elton-john/story-9aDsIfyLDTgQ1GiBpon1FL.html
Hindiustan Times,Always Be My Maybe movie review: Netflix’s latest rom-com is the perfect antidote to Crazy Rich Asians ,hollywood,2019-05-31,09:10:00,https://www.hindustantimes.com/hollywood/always-be-my-maybe-movie-review-netflix-s-latest-rom-com-is-the-perfect-antidote-to-crazy-rich-asians/story-ODOASegoWdl4bpYw515VhP.html
Hindiustan Times,"Godzilla King of the Monsters movie review: Sound and fury, signifying nothing",hollywood,2019-05-31,08:14:00,https://www.hindustantimes.com/hollywood/godzilla-king-of-the-monsters-movie-review-sound-and-fury-signifying-nothing/story-m1lsDMiOHriweRavvkaSNJ.html
Hindiustan Times,"Ashton Kutcher recounts learning of female friend’s murder, says ‘I was freaking out, my fingerprints were on the door’",hollywood,2019-05-30,16:17:00,https://www.hindustantimes.com/hollywood/ashton-kutcher-recounts-learning-of-female-friend-s-murder-says-i-was-freaking-out-my-fingerprints-were-on-the-door/story-j3Y6FqA55KYnV3AtbpMiqO.html
Hindiustan Times,"Christopher Nolan to shoot Tenet in Mumbai this September, features Robert Pattinson, Dimple Kapadia ",hollywood,2019-05-30,12:58:00,https://www.hindustantimes.com/hollywood/christopher-nolan-to-shoot-tenet-in-mumbai-this-september-features-robert-pattinson-dimple-kapadia/story-q7tPhv89tEkROcTfwaugvK.html
Hindiustan Times,Avengers Endgame vs Avatar box office: Marvel epic needs just $102 million to beat James Cameron film,hollywood,2019-05-29,22:52:00,https://www.hindustantimes.com/hollywood/avengers-endgame-vs-avatar-box-office-marvel-needs-just-102-million-to-beat-james-cameron-film/story-USSJDWK2AxR1e3Ep6O1MGI.html
Hindiustan Times,The Perfection movie review: A deranged and disturbing new thriller for you to discover on Netflix,hollywood,2019-05-29,15:36:00,https://www.hindustantimes.com/hollywood/the-perfection-movie-review-a-deranged-and-disturbing-new-thriller-for-you-to-discover-on-netflix/story-uZfdXN7EOgE5e2gL23yQtM.html
Hindiustan Times,"Huma Qureshi joins Zack Snyder’s Netflix zombie film, also starring Dave Bautista",hollywood,2019-05-29,14:17:00,https://www.hindustantimes.com/hollywood/huma-qureshi-joins-zack-snyder-s-netflix-zombie-film-also-starring-dave-bautista/story-IQqIdcjMrjZLhELhIvHjFI.html
Hindiustan Times,"Siddhant Chaturvedi clicks selfie with Chris Hemsworth, says dubbing for him in MIB International was overwhelming",hollywood,2019-05-28,14:14:00,https://www.hindustantimes.com/hollywood/siddhant-chaturvedi-clicks-selfie-with-chris-hemsworth-says-dubbing-for-him-in-mib-international-was-overwhelming/story-N8A67J73xudpmZie5GL7GK.html
Hindiustan Times,Can’t expect an accurate representation of Indians from non-Indian writers in Hollywood: Divyansh Sharma,hollywood,2019-05-27,11:33:00,https://www.hindustantimes.com/hollywood/can-t-expect-an-accurate-representation-of-indians-from-non-indian-writers-in-hollywood-divyansh-sharma/story-oJ6AJn40rbLuV4ryUGqUwK.html
Hindiustan Times,"South Korean film Parasite beats Brad Pitt, Leonardo DiCaprio’s Once Upon A Time In Hollywood to win Palme d’Or at Cannes ",hollywood,2019-05-26,09:10:00,https://www.hindustantimes.com/hollywood/south-korean-film-parasite-beats-brad-pitt-leonardo-dicaprio-s-once-upon-a-time-in-hollywood-to-win-palme-d-or-at-cannes/story-ZbtRTsRCYwDOKE0juELuWM.html
Hindiustan Times,"After fan backlash, Sonic the Hedgehog’s release gets postponed by 3 months to redesign main character",hollywood,2019-05-25,12:35:00,https://www.hindustantimes.com/hollywood/after-fan-backlash-sonic-the-hedgehog-s-release-gets-postponed-by-3-months-to-redesign-main-character/story-h16YyOlkOdUZBkhoUwaX4M.html
Hindiustan Times,"JJ Abrams on the ‘spiritual, cosmic’ decision to bring back Carrie Fisher in Star Wars The Rise of Skywalker",hollywood,2019-05-24,20:08:00,https://www.hindustantimes.com/hollywood/jj-abrams-on-the-spiritual-cosmic-decision-to-bring-back-carrie-fisher-in-star-wars-the-rise-of-skywalker/story-qoBEZXUxsNqeHFniH1ZKBI.html
Hindiustan Times,Game of Thrones writer reveals the one character who wasn’t supposed to die,hollywood,2019-05-24,17:03:00,https://www.hindustantimes.com/hollywood/emilia-clarke-turned-down-fifty-shades-of-grey-because-she-didn-t-want-to-be-pigeonholed-as-someone-who-gets-naked/story-GcWtz8kxHgB7ex8dClACWN.html
Hindiustan Times,"Lisa Ray recalls auditioning for Quantum of Solace with Daniel Craig, says Gal Gadot was also in contention",hollywood,2019-05-24,15:46:00,https://www.hindustantimes.com/hollywood/lisa-ray-recalls-auditioning-for-quantum-of-solace-with-daniel-craig-says-gal-gadot-was-also-in-contention/story-yK8uDBHcsfkIlHBd58chbJ.html
Hindiustan Times,Aladdin movie review: Will Smith makes the magic happen in Guy Ritchie’s Disney film,hollywood,2019-05-24,19:20:00,https://www.hindustantimes.com/hollywood/aladdin-movie-review-will-smith-delivers-star-performance-in-guy-ritchie-s-gully-boy/story-qauMsXTPe7Ol2eyUaBZkYK.html
Hindiustan Times,"Terminator: Dark Fate trailer marks the return of Arnold Schwarzenegger, Linda Hamilton as Sarah Connor",hollywood,2019-05-24,10:39:00,https://www.hindustantimes.com/hollywood/terminator-dark-fate-trailer-marks-the-return-of-arnold-schwarzenegger-linda-hamilton-as-sarah-connor/story-2wnHW0nODkDRSgElIZq6KL.html
Hindiustan Times,"Bharat movie review: Salman Khan, Katrina Kaif deliver an emotional Eid entertainer",movie-review,2019-06-05,21:39:00,https://www.hindustantimes.com/bollywood/bharat-movie-review-salman-khan-katrina-kaif-deliver-an-eid-entertainer/story-hKdFAnPahxlATb31WvineL.html
Hindiustan Times,"Rocketman movie review: Taron Egerton soars in the sky, explodes in all the brilliant colours of Elton John",movie-review,2019-05-31,17:22:00,https://www.hindustantimes.com/hollywood/rocketman-movie-review-taron-egerton-soars-in-the-sky-explodes-in-all-the-brilliant-colours-of-elton-john/story-9aDsIfyLDTgQ1GiBpon1FL.html
Hindiustan Times,Devi 2 movie review: This Prabhudeva starrer is a lousy sequel with no redeeming moments,movie-review,2019-05-31,17:05:00,https://www.hindustantimes.com/regional-movies/devi-2-movie-review-this-prabhudeva-tamannaah-bhatia-movie-is-a-lousy-sequel-with-no-redeeming-moments/story-Z8560BKbUIYU9Yljgcdo4J.html
Hindiustan Times,I Am Mother movie review: Has Netflix found the new Christopher Nolan? Hilary Swank thinks so,movie-review,2019-06-10,16:55:00,https://www.hindustantimes.com/hollywood/i-am-mother-movie-review-has-netflix-found-the-new-christopher-nolan-hilary-swank-thinks-so/story-jX2su2n885F2n8ng2yoC9M.html
Hindiustan Times,X-Men Dark Phoenix review: Sophie Turner  stars in a lousy conclusion to Marvel’s X-Men saga; sloppy seconds to Avengers Endgame,movie-review,2019-06-06,17:25:00,https://www.hindustantimes.com/hollywood/x-men-dark-phoenix-movie-review-the-worst-film-in-the-x-men-saga-sloppy-seconds-to-avengers-endgame/story-PfemEZVFXGJXj7TVkTUsCJ.html
Hindiustan Times,"Bharat movie review: Salman Khan, Katrina Kaif deliver an emotional Eid entertainer",movie-review,2019-06-05,21:39:00,https://www.hindustantimes.com/bollywood/bharat-movie-review-salman-khan-katrina-kaif-deliver-an-eid-entertainer/story-hKdFAnPahxlATb31WvineL.html
Hindiustan Times,"X-Men: Dark Phoenix is mindless mutant mayhem, says Rashid Irani",movie-review,2019-06-05,14:10:00,https://www.hindustantimes.com/movie-reviews/x-men-dark-phoenix-is-mindless-mutant-mayhem-says-rashid-irani/story-rVLsbzsSd5kUHtT5GRQx2J.html
Hindiustan Times,"Rocketman is moving, fun, and just so Elton John, says Rashid Irani",movie-review,2019-05-31,17:54:00,https://www.hindustantimes.com/movie-reviews/rocketman-is-moving-fun-and-just-so-elton-john-says-rashid-irani/story-tMgMWORRtHRu5ns0CSXbZK.html
Hindiustan Times,Devi 2 movie review: This Prabhudeva starrer is a lousy sequel with no redeeming moments,movie-review,2019-05-31,17:05:00,https://www.hindustantimes.com/regional-movies/devi-2-movie-review-this-prabhudeva-tamannaah-bhatia-movie-is-a-lousy-sequel-with-no-redeeming-moments/story-Z8560BKbUIYU9Yljgcdo4J.html
Hindiustan Times,NGK movie review: This Suriya starrer is an uneven political thriller,movie-review,2019-05-31,11:56:00,https://www.hindustantimes.com/regional-movies/ngk-movie-review-this-suriya-starrer-is-an-uneven-political-thriller/story-hCmuL3925eyRRHAWb2HkJK.html
Hindiustan Times,Always Be My Maybe movie review: Netflix’s latest rom-com is the perfect antidote to Crazy Rich Asians ,movie-review,2019-05-31,09:10:00,https://www.hindustantimes.com/hollywood/always-be-my-maybe-movie-review-netflix-s-latest-rom-com-is-the-perfect-antidote-to-crazy-rich-asians/story-ODOASegoWdl4bpYw515VhP.html
Hindiustan Times,"Chopsticks movie review: Netflix’s new Abhay Deol, Mithila Palkar film would be better suited for Hotstar",movie-review,2019-05-31,08:10:00,https://www.hindustantimes.com/bollywood/chopsticks-movie-review-netflix-s-new-abhay-deol-mithila-palkar-film-would-be-better-suited-for-hotstar/story-wYuNvlNX5rEBMh13FBBY0I.html
Hindiustan Times,"Godzilla King of the Monsters movie review: Sound and fury, signifying nothing",movie-review,2019-05-31,08:14:00,https://www.hindustantimes.com/hollywood/godzilla-king-of-the-monsters-movie-review-sound-and-fury-signifying-nothing/story-m1lsDMiOHriweRavvkaSNJ.html
Hindiustan Times,"Godzilla: King of the Monsters is a colossal failure, says Rashid Irani",movie-review,2019-05-30,19:52:00,https://www.hindustantimes.com/movie-reviews/godzilla-king-of-the-monsters-is-a-colossal-failure-says-rashid-irani/story-arpbhCHtPrrDF1Trkw5OtL.html
