Source,Heading,Category,Date,Time,URL
Business Today,Are discount broking firms a threat to traditional brokerages?,money,2019-06-20,23:15,https://www.businesstoday.in/money/are-discount-broking-firms-a-threat-to-traditional-brokerages/story/323293.html
Business Today,Rupee falls 14 paise against US dollar in early trade,money,2019-06-20,23:15,https://www.businesstoday.in/money/news/rupee-falls-14-paise-against-us-dollar-in-early-trade/story/318641.html
Business Today,What are the best investment options for working women in their 30s?,money,2019-06-20,23:15,https://www.businesstoday.in/top-story/what-are-the-best-investment-options-for-working-women-in-their-30s/story/318517.html
Business Today,"Mutual Fund industry wants new govt to act on consumption, investment",money,2019-06-20,23:15,https://www.businesstoday.in/money/mutual-fund/mutual-fund-industry-wants-new-govt-to-act-on-consumption-investment/story/349637.html
Business Today,Here are 5 ways to gift your mom financial security this Mothers Day,money,2019-06-20,23:15,https://www.businesstoday.in/top-story/mothers-day-gift-mom-financial-security/story/345327.html
Business Today,Akshaya Tritiya 2019: Should you invest in gold or real estate?,money,2019-06-20,23:15,https://www.businesstoday.in/top-story/akshaya-tritiya-invest-gold-or-real-estate/story/343979.html
Business Today,PPF account: How to make the most of this tax-free investment option,money,2019-06-20,23:15,https://www.businesstoday.in/current/economy-politics/ppf-account-how-to-make-the-most-of-this-tax-free-investment-option/story/336610.html
Business Today,LICs new Navjeevan plan: All you need to know,money,2019-06-20,23:15,https://www.businesstoday.in/top-story/lic-navjeevan-plan-all-you-need-to-know/story/330789.html
Business Today,Pre-tax Season: Is Your Employee Tax Reimbursement Process Slowing You Down?,money,2019-06-20,23:15,https://www.businesstoday.in/money/tax/pre-tax-season-is-your-employee-tax-reimbursement-process-slowing-you-down/story/323619.html
Business Today,5 loans for Indias millennials,money,2019-06-20,23:15,https://www.businesstoday.in/money/5-loans-for-indias-millennials/story/320895.html
Business Today,5 reasons why provident fund is so important to the salaried class!,money,2019-06-20,23:15,https://www.businesstoday.in/top-story/5-reasons-why-provident-fund-is-so-important-to-the-salaried-class/story/318554.html
Business Today,How To Choose A Mutual Fund In India - Where To Invest Money?,money,2019-06-20,23:15,https://www.businesstoday.in/top-story/how-to-choose-a-mutual-fund-where-to-invest-money/story/318506.html
Business Today,Keep It Simple - Dont Overcomplicate Your Investments,money,2019-06-20,23:15,https://www.businesstoday.in/money/keep-it-simple-dont-overcomplicate-your-investments/story/312380.html
Business Today,7 mistakes to avoid while investing in mutual funds,money,2019-06-20,23:15,https://www.businesstoday.in/top-story/7-mistakes-to-avoid-while-investing-in-mutual-funds/story/302418.html
Business Today,"Which mutual funds are the top performers in last 1, 3 and 5 years?",money,2019-06-20,23:15,https://www.businesstoday.in/top-story/which-mutual-funds-are-the-top-performers-in-last-1-3-and-5-years/story/298425.html
Business Today,Even Debit Card gives you airport lounge access. Heres how,money,2019-06-20,23:15,https://www.businesstoday.in/top-story/now-you-can-swipe-your-debit-card-for-free-lounge-access-at-airports/story/297114.html
Business Today,How to transfer mutual fund holdings when an investor dies?,money,2019-06-20,23:15,https://www.businesstoday.in/top-story/how-to-transfer-mutual-fund-holdings-when-an-investor-dies/story/295776.html
Business Today,How to transfer your provident fund balance from your previous office,money,2019-06-20,23:15,https://www.businesstoday.in/top-story/how-to-transfer-your-provident-fund-balance-from-your-previous-office/story/295037.html
Business Today,DSP launches Healthcare Fund. Should you invest?,money,2019-06-20,23:15,https://www.businesstoday.in/top-story/dsp-launches-healthcare-fund.-should-you-invest/story/292690.html
Business Today,Why you should not buy physical gold this Dhanteras,money,2019-06-20,23:15,https://www.businesstoday.in/top-story/why-you-should-not-buy-physical-gold-this-dhanteras/story/288437.html
Business Today,Money-wise tips for Entrepreneurs,money,2019-06-20,23:15,https://www.businesstoday.in/top-story/money-wise-tips-for-entrepreneurs/story/285502.html
Business Today,Mutual funds vs Fixed Deposits: How FD investors had the last laugh in 2018,money,2019-06-20,23:15,https://www.businesstoday.in/top-story/how-gold-fixed-deposit-investors-had-the-last-laugh-in-2018/story/304634.html
Business Today,"Do you know PF can be withdrawn for buying a house, marriage, other expenses",money,2019-06-20,23:15,https://www.businesstoday.in/top-story/do-you-know-pf-can-be-withdrawn-for-buying-a-house-marriage-other-expenses/story/298449.html
Business Today,ICICI Bank launches Robo Advisory App for Mutual Fund Investment,money,2019-06-20,23:15,https://www.businesstoday.in/top-story/icici-bank-launches-robo-advisory-app-for-mutual-fund-investment/story/298007.html
Business Today,Direct mutual fund vs regular mutual fund: How can you switch between the two?,money,2019-06-20,23:15,https://www.businesstoday.in/top-story/direct-mutual-fund-vs-regular-mutual-fund-how-can-you-switch-between-the-two/story/296893.html
Business Today,"Want to check, withdraw or transfer your provident fund balance? Heres what you need to do",money,2019-06-20,23:15,https://www.businesstoday.in/top-story/want-to-check-withdraw-or-transfer-your-provident-fund-balance-heres-what-you-need-to-do/story/295346.html
Business Today,"Now, you can make your LIC premium payment on Paytm app",money,2019-06-20,23:15,https://www.businesstoday.in/technology/internet/now-you-can-make-your-lic-premium-payment-on-paytm-app/story/293425.html
Business Today,Heres what mutual fund investors should know about Riskometer,money,2019-06-20,23:15,https://www.businesstoday.in/top-story/heres-what-mutual-fund-investors-should-know-about-riskometer/story/290102.html
Business Today,This is how you can make market crash work for you,money,2019-06-20,23:15,https://www.businesstoday.in/money/investment/this-is-how-you-can-make-stock-market-crash-work-for-you/story/286220.html
Business Today,Mahindra Mutual Funds fresh NFO kicks off on Friday; should you invest?,money,2019-06-20,23:15,https://www.businesstoday.in/money/mutual-fund/mahindra-mutual-fund-fresh-nfo-kicks-off-on-friday/story/285410.html
Business Today,Bihar encephalitis deaths linked to litchis: Muzaffarpurs public health centres rated 0 out of 5,industry,2019-06-20,23:15,https://www.businesstoday.in/sectors/pharma/acute-encephalitis-syndrome-muzaffarpur-bihar-health-centre/story/357686.html
Business Today,Govt to prepare fresh proposal for Air India sale,industry,2019-06-20,23:15,https://www.businesstoday.in/sectors/aviation/govt-to-prepare-fresh-proposal-for-air-india-sale/story/357591.html
Business Today,"Kia Seltos 2019 unveiled in India; check out price, engine, features",industry,2019-06-20,23:15,https://www.businesstoday.in/sectors/auto/2019-kia-seltos-unveiled-india-check-out-price-engine-features/story/357573.html
Business Today,RBI slaps Rs 10 lakh fine on South Indian Bank for violating norms,industry,2019-06-20,23:15,https://www.businesstoday.in/sectors/banks/rbi-slaps-rs-10-lakh-fine-on-south-indian-bank-for-violating-norms/story/357542.html
Business Today,"Kia Seltos teaser before June 20 global debut reveals more design, feature details",industry,2019-06-20,23:15,https://www.businesstoday.in/sectors/auto/kia-seltos-teaser-before-june-20-global-debut-reveals-more-design-feature-details/story/357426.html
Business Today,"Renault Triber seven-seater MPV unveiled in India; check out price, engine, features",industry,2019-06-20,23:15,https://www.businesstoday.in/sectors/auto/renault-triber-mpv-global-debut-india-price-engine-features/story/357354.html
Business Today,"ICICI Bank, Axis Bank, Kotak Mahindra Bank tweak FD rates after RBI repo rate cut; check out latest rates here",industry,2019-06-20,23:15,https://www.businesstoday.in/sectors/banks/icici-bank-axis-bank-kotak-mahindra-bank-tweak-fd-rates/story/357303.html
Business Today,RBI panel on MSMEs recommends doubling collateral-free loans limit to Rs 20 lakh,industry,2019-06-20,23:15,https://www.businesstoday.in/sectors/banks/rbi-panel-recommends-doubling-msme-collateral-free-loans-ceiling/story/357273.html
Business Today,"After deadly crashes, Boeing revives, signs first deal for 737 Max jet",industry,2019-06-20,23:15,https://www.businesstoday.in/sectors/aviation/after-deadly-crashes-boeing-revives-signs-first-deal-for-737-max-jet/story/357236.html
Business Today,GoAir to offer domestic air tickets for as low as Rs 899 in limited-period sale,industry,2019-06-20,23:15,https://www.businesstoday.in/sectors/aviation/goair-to-offer-domestic-air-tickets-for-as-low-as-rs-899-in-limited-period-sale/story/357684.html
Business Today,Compliance skills in demand as data becomes the new oil,industry,2019-06-20,23:15,https://www.businesstoday.in/sectors/jobs/compliance-skills-in-demand-as-data-becomes-the-new-oil/story/357588.html
Business Today,Former Royal Enfield chief Rudratej Singh to now lead BMW India,industry,2019-06-20,23:15,https://www.businesstoday.in/sectors/auto/former-royal-enfield-chief-rudratej-singh-to-now-lead-bmw-india/story/357547.html
Business Today,"Maharashtra govt identifies new site for Saudi Aramco, ADNOCs refinery",industry,2019-06-20,23:15,https://www.businesstoday.in/sectors/energy/maharashtra-govt-identifies-new-site-for-saudi-aramco-adnoc-refinery/story/357443.html
Business Today,Air India likely to ban pilots from carrying lunch in flights,industry,2019-06-20,23:15,https://www.businesstoday.in/sectors/aviation/air-india-likely-to-ban-pilots-from-carrying-lunch-in-flights/story/357356.html
Business Today,"Air India, IndiGo, Vistara announce new routes, offer heavy discounts",industry,2019-06-20,23:15,https://www.businesstoday.in/sectors/aviation/air-india-indigo-vistara-announce-new-routes-offer-heavy-discounts/story/357342.html
Business Today,"Now pay up to Rs 36,000 more for Mahindra Scorpio, Bolero, Marazzo; find out why",industry,2019-06-20,23:15,https://www.businesstoday.in/sectors/auto/now-pay-up-to-rs-36000-more-for-mahindra-scorpio-bolero-marazzo-find-out-why/story/357277.html
Business Today,"Day after lenders move NCLT, tribunal to hear Jet Airways case today",industry,2019-06-20,23:15,https://www.businesstoday.in/sectors/aviation/day-after-lenders-move-nclt-tribunal-to-hear-jet-airways-case-today/story/357240.html
Business Today,"Jet Airways eroded investor wealth worth Rs 9,430 crore in 18 months",industry,2019-06-20,23:15,https://www.businesstoday.in/sectors/aviation/jet-airways-eroded-investor-wealth-worth-rs-9430-crore-in-18-months/story/357151.html
Business Today,"Razorpay gets $75 million from Sequoia India, Ribbit Capital in Series-C funding",industry,2019-06-20,23:15,https://www.businesstoday.in/current/corporate/razorpay-usd-75-million-sequoia-india-ribbit-capital-series-c-funding/story/357088.html
Business Today,What next for Jet Airways employees as the curtain comes down?,industry,2019-06-20,23:15,https://www.businesstoday.in/sectors/aviation/jet-airways-employees-what-next-curtains-come-down/story/357050.html
Business Today,HDFC Mutual Fund to buy Rs 500-crore non-convertible debentures of Essel Group,industry,2019-06-20,23:15,https://www.businesstoday.in/current/corporate/hdfc-mutual-fund-to-buy-rs-500-crore-ncds-of-essel-group-to-reassure-fmp-investors/story/357039.html
Business Today,"Good news for job seekers! Manufacturing, infrastructure sector to create 58,200 jobs in H1 FY20",industry,2019-06-20,23:15,https://www.businesstoday.in/sectors/jobs/good-news-for-job-seekers-manufacturing-infra-sector-to-create-58200-jobs-h1-fy20/story/356929.html
Business Today,"Hiring activity increases 11% in May; IT, BPO, education take the lead: report",industry,2019-06-20,23:15,https://www.businesstoday.in/sectors/jobs/hiring-activity-increases-11-may-it-bpo-education-lead-report/story/356791.html
Business Today,"BSNL launches Rs 168 recharge plan; offers international roaming activation, validity extension",industry,2019-06-20,23:15,https://www.businesstoday.in/sectors/telecom/bsnl-launches-rs-168-recharge-plan-offers-international-roaming-activation-validity-extension/story/356768.html
Business Today,"DoT set to back TRAIs Rs 3,050 crore penalty on Airtel, Vodafone Idea over Reliance Jios complaint",industry,2019-06-20,23:15,https://www.businesstoday.in/sectors/telecom/dot-rs-3050-crore-penalty-on-airtel-vodafone-idea-on-jio-complaint/story/356708.html
Business Today,Boeing to cut down on costly physical tests for new aircrafts in favour of computer models,industry,2019-06-20,23:15,https://www.businesstoday.in/sectors/aviation/boeing-to-cut-down-on-costly-physical-tests-in-favour-of-computer-models/story/356695.html
Business Today,Boeing CEO accepts mistake with planes in 2 fatal crashes,industry,2019-06-20,23:15,https://www.businesstoday.in/sectors/aviation/boeing-ceo-accepts-mistake-with-planes-in-2-fatal-crashes/story/356684.html
Business Today,"GST, DeMo, maternity benefits helped formalise 7 million jobs between 2015-18, study shows",industry,2019-06-20,23:15,https://www.businesstoday.in/sectors/jobs/gst-demonetisation-maternity-benefits-efp-esic-skill-india-formalise-7-million-jobs/story/357079.html
Business Today,RBI to review data storage rules for payment firms: government,industry,2019-06-20,23:15,https://www.businesstoday.in/sectors/banks/rbi-to-review-data-storage-rules-for-payment-firms-government/story/357043.html
Business Today,Circular economy could create 1.4 crore jobs in next 5-7 years: Niti Aayog CEO Amitabh Kant,industry,2019-06-20,23:15,https://www.businesstoday.in/sectors/jobs/circular-economy-could-create-14-crore-jobs-in-next-5-7-years-niti-aayog-ceo-amitabh-kant/story/356995.html
Business Today,"BT Insight: Interest rate, credit and concentration risks in debt funds that you must know about",industry,2019-06-20,23:15,https://www.businesstoday.in/sectors/banks/bt-insight-interest-rate-credit-and-concentration-risks-in-debt-funds-that-you-must-know-about/story/356809.html
Business Today,Renault Triber teased ahead of global launch on June 19,industry,2019-06-20,23:15,https://www.businesstoday.in/sectors/auto/renault-triber-teased-ahead-of-global-launch-on-june-19/story/356773.html
Business Today,Global PE firms seek details from Yes Bank before committing to $500-750 million investment,industry,2019-06-20,23:15,https://www.businesstoday.in/sectors/banks/global-pe-firms-seek-yes-bank-details-before-investing/story/356754.html
Business Today,Govt may move NCLT to freeze IL&FS former directors assets: Report,industry,2019-06-20,23:15,https://www.businesstoday.in/current/corporate/govt-may-move-nclt-to-freeze-assets-of-ilfs-former-directors/story/356706.html
Business Today,UCO Bank declares Yashovardhan Birla wilful defaulter for failing to repay Rs 67.65 crore,industry,2019-06-20,23:15,https://www.businesstoday.in/sectors/banks/uco-bank-declares-yashovardhan-birla-wilful-defaulter-failing-repay-rs-67-65-crore/story/356687.html
Business Today,Uber piloting 24x7 on-trip security helpline in India,industry,2019-06-20,23:15,https://www.businesstoday.in/sectors/auto/uber-piloting-24x7-on-trip-security-helpline-in-india/story/356676.html
Business Today,Caution! IT Dept is keeping an eye on your social media posts,opinion,2019-06-20,23:15,https://www.businesstoday.in/union-budget-2019/columns/income-tax-department-it-social-media-facebook-instagram-tax-evaders-big-data-technology-it-act/story/357282.html
Business Today,Are weak public sector banks discouraging term deposits?,opinion,2019-06-20,23:15,https://www.businesstoday.in/opinion/perspective/are-weak-public-sector-banks-discouraging-term-deposits/story/357205.html
Business Today,Fathers Day: 3 important tips to make your children financially independent,opinion,2019-06-20,23:15,https://www.businesstoday.in/union-budget-2019/columns/father-day-3-important-rules-to-make-your-children-financially-independent/story/356549.html
Business Today,The scope of alternative investment in India as more Indians turn risk-seekers,opinion,2019-06-20,23:15,https://www.businesstoday.in/opinion/columns/the-scope-of-alternative-investment-in-india-as-more-indians-turn-risk-seekers/story/356054.html
Business Today,Why this Kolaveri over arrest of tax evaders by GST commissioner?,opinion,2019-06-20,23:15,https://www.businesstoday.in/opinion/columns/goods-and-services-tax-gst-commissioner-arrest-supreme-court-indirect-tax-law-india-economic-offences/story/355840.html
Business Today,"The jet that costs a bomb, why F-35 cant be Indias dogfight duke",opinion,2019-06-20,23:15,https://www.businesstoday.in/opinion/columns/f-35-fighter-jet-stealth-aircraft-us-india-dogfight-indian-air-force-iaf-modi-govt-donald-trump/story/355414.html
Business Today,Budget 2019: Key tax issues Modi 2.0 must address,opinion,2019-06-20,23:15,https://www.businesstoday.in/union-budget-2019/columns/budget-2019-tax-issues-modi-20-government-finance-minister-nirmala-sitharaman/story/354297.html
Business Today,What makes debt market more dangerous in India than in the US,opinion,2019-06-20,23:15,https://www.businesstoday.in/opinion/prosaic-view/what-makes-indian-debt-market-more-dangerous-than-in-the-us/story/354281.html
Business Today,Equity assets give better returns than other asset classes in the long term: Swati Kulkarni of UTI AMC,opinion,2019-06-20,23:15,https://www.businesstoday.in/opinion/interviews/equity-assets-give-better-returns-than-other-asset-classes-in-the-long-term-swati-kulkarni-of-uti-amc/story/354223.html
Business Today,Buying your first term plan? Keep these steps in mind,opinion,2019-06-20,23:15,https://www.businesstoday.in/opinion/columns/term-plan-insurance-premium-calculations-insurers-in-india/story/357267.html
Business Today,Corporate literacy test: A board exam of a different kind,opinion,2019-06-20,23:15,https://www.businesstoday.in/opinion/columns/corporate-literacy-test-independent-directors-modi-government-20-company-boards/story/356733.html
Business Today,"Extinction Rebellion- Its not climate change, its climate emergency",opinion,2019-06-20,23:15,https://www.businesstoday.in/opinion/columns/climate-change-extinction-rebellion-environment-emergency-advocacy-group-global-warming/story/356171.html
Business Today,Consumers movie habits havent changed at all: PVR Chairman Ajay Bijli,opinion,2019-06-20,23:15,https://www.businesstoday.in/opinion/interviews/movie-consumption-habits-of-consumers-have-not-changed-at-all-ajay-bijli-chairman-pvr/story/355909.html
Business Today,How APIs are transforming businesses in India to get future smart,opinion,2019-06-20,23:15,https://www.businesstoday.in/opinion/columns/api-application-programming-interfaces-indian-businesses-get-future-smart-software-technology-cloud/story/355787.html
Business Today,5G mobile services expected to create over $27 billion business opportunity for India by 2026: Nitin Bansal of Ericsson India,opinion,2019-06-20,23:15,https://www.businesstoday.in/opinion/interviews/5g-mobile-services-expected-to-create-over-27-billion-business-opportunity-for-india-by-2026-nitin-bansal-of-ericsson-india/story/355155.html
Business Today,Time for Modi 2.0 to realise grand healthcare dream sold in 2018,opinion,2019-06-20,23:15,https://www.businesstoday.in/opinion/columns/healthcare-india-modi-government-20-to-realise-dream-sold-in-2018-ayushman-bharat/story/354291.html
Business Today,Turning portfolio diversification theory upside down,opinion,2019-06-20,23:15,https://www.businesstoday.in/opinion/prosaic-view/turning-portfolio-diversification-theory-upside-down/story/354235.html
Business Today,Bilderberg Conference 2019: What happens in the secretive meet of the worlds most powerful people?,opinion,2019-06-20,23:15,https://www.businesstoday.in/opinion/columns/bilderberg-conference-2019-secretive-meeting-of-worlds-most-powerful-people-western-elite-us-mike-pompeo-satya-nadella-microsoft-donald-trump/story/354219.html
Business Today,Economic growth by itself not enough; need to focus on jobs too: CEA Subramanian,opinion,2019-06-20,23:15,https://www.businesstoday.in/opinion/interviews/economic-growth-by-itself-not-enough-need-to-focus-on-jobs-too/story/354206.html
Business Today,"Our core is to offer premium services for free, says Investing.com CEO Shlomi Biger",opinion,2019-06-20,23:15,https://www.businesstoday.in/opinion/interviews/our-core-offer-premium-services-free-investingcom-ceo-shlomi-biger/story/353790.html
Business Today,Merger of half-a-dozen banks in offing? Here are challenges that may come up,opinion,2019-06-20,23:15,https://www.businesstoday.in/opinion/perspective/public-sector-banks-merger-challenges-bank-of-baroda-dena-bank-vijaya-bank/story/352520.html
Business Today,Old ideas must die: A formula for opposition to defeat Modi in 2024,opinion,2019-06-20,23:15,https://www.businesstoday.in/opinion/columns/pm-modi-indian-opposition-2024-old-ideas-must-die-lok-sabha-elections-2019-nda-upa-congress-bjp/story/351828.html
Business Today,"India a core market for us among 172 countries, says Gary Knell, National Geographic Partners",opinion,2019-06-20,23:15,https://www.businesstoday.in/opinion/interviews/india-a-core-market-for-us-among-172-countries-says-gary-knell-national-geographic-partners/story/351222.html
Business Today,"Restaurant industry suffers due to policy changes, no input tax credit: First Fiddle CEO",opinion,2019-06-20,23:15,https://www.businesstoday.in/opinion/interviews/looking-to-get-into-more-serious-dining-brands-says-priyank-sukhija-of-first-fiddle/story/350931.html
Business Today,Modern monetary theory- a resurrection of a failed idea,opinion,2019-06-20,23:15,https://www.businesstoday.in/opinion/columns/modern-monetary-theory-mmt-currency-cash-government-economy-bankruptcy-default-money-fiscal-deficit/story/350551.html
Business Today,"Sensex hovering around 40,000 mark is danger zone for investors",opinion,2019-06-20,23:15,https://www.businesstoday.in/opinion/perspective/sensex-hovering-around-40000-mark-is-danger-zone-for-investors/story/349596.html
Business Today,"Lok Sabha election result: Now that they have got the votes, they should give these tax benefits!",opinion,2019-06-20,23:15,https://www.businesstoday.in/opinion/columns/income-tax-individual-taxpayers-modi-government-union-budget/story/349264.html
Business Today,"Dont cheer for rate cuts! Banks have only transmitted 0.6 per cent of 2.25 per cent repo cut by RBI, choking up the economy",opinion,2019-06-20,23:15,https://www.businesstoday.in/opinion/business-wise/banks-repo-rate-cut-reserve-bank-of-india-economy-shaktikanta-das/story/354172.html
Business Today,PNB reports huge losses in Q4FY19; challenges only to compound,opinion,2019-06-20,23:15,https://www.businesstoday.in/opinion/perspective/pnb-reports-huge-losses-in-q4fy19-challenges-only-to-compound/story/353428.html
Business Today,Consolidation brewing in Indias co-working market,opinion,2019-06-20,23:15,https://www.businesstoday.in/opinion/perspective/consolidation-brewing-in-india-co-working-market/story/351831.html
Business Today,From Warren Buffetts signature wit to Charlie Mungers blunt self- Insights from the 2019 Berkshire Hathaway AGM,opinion,2019-06-20,23:15,https://www.businesstoday.in/opinion/columns/warren-buffett-berkshire-hathaway-2019-annual-meeting-charlie-munger-investments-shares/story/351602.html
Business Today,"Naresh Goyal deplaning: From Nirav to Mallya, why Indian businessmen flee to London",opinion,2019-06-20,23:15,https://www.businesstoday.in/opinion/columns/naresh-goyal-nirav-modi-vijay-mallya-london-britain-indian-fugitive/story/351019.html
Business Today,Disability is a strength for any organisation: Jenny Lay-Flurrie of Microsoft,opinion,2019-06-20,23:15,https://www.businesstoday.in/opinion/interviews/manage-accessibility-as-a-business--jenny-lay-flurrie-of-microsoft/story/350930.html
Business Today,Election results 2019: Modi 2.0 faces the tough task of fixing the economy,opinion,2019-06-20,23:15,https://www.businesstoday.in/opinion/prosaic-view/challenges-aplenty-for-modi-20/story/349632.html
Business Today,Election Result 2019: Why Modi 2.0 will make India a stronger military power,opinion,2019-06-20,23:15,https://www.businesstoday.in/opinion/columns/pm-modi-re-election-india-military-power-russia-china-pakistan-lok-sabha-election-2019/story/349442.html
Business Today,"Election Result 2019: No matter who wins, its time middle class gets these tax reliefs",opinion,2019-06-20,23:15,https://www.businesstoday.in/opinion/columns/election-result-2019-no-matter-who-wins-it-is-time-middle-class-gets-these-tax-reliefs/story/349195.html
