Source,Heading,Category,Date,Time,URL
cnbc,"Tech upgrade to help Arvind Fashions gain better customer-choice insights
Arvind Fashions, the branded retail arm of textile giant Arvind, is working on a large scale technology upgrade across its stores.  The tech revamp could help Arvind Fashions improve margins by 200 to 300 basis points over the next two years, sources told CNBC-TV18.",retail ,2019-06-20,23:16,https://www.cnbctv18.com/retail/tech-upgrade-to-help-arvind-fashions-gain-better-customer-choice-insights-3651061.htm
cnbc,"Amazon most trusted among Internet brands in India
E-commerce major Amazon is the most trusted among the Internet brands in India, followed by Google and Facebook, according to a recent report by TRA Research.",retail ,2019-06-20,23:16,https://www.cnbctv18.com/retail/amazon-most-trusted-among-internet-brands-in-india-3641471.htm
cnbc,"Dell leads chart: Here are the top 10 most trusted brands in India
Dell has emerged as the most trusted brand in India in 2019, according to a report released by brand analytics firm TRA Research. Also, e-commerce major Amazon is the most trusted among the Internet brands in India, followed by Google and Facebook, according to a recent report by TRA Research. Here is the list of top 10 most trusted brands in India.",retail ,2019-06-20,23:16,https://www.cnbctv18.com/retail/dell-leads-chart-here-are-the-top-10-most-trusted-brands-in-india-3640471.htm
cnbc,Harman International expects 50-60% growth in consumer electronics space this year,retail ,2019-06-20,23:16,https://www.cnbctv18.com/retail/harman-international-expects-50-60-growth-in-consumer-electronics-space-this-year-3603311.htm
cnbc,"Rural distress takes heavy toll on FMCG sales: How it all stacks up
Volume and sales growth numbers of almost all of India’s consumer goods companies in the fourth-quarter have reflected a slowdown in consumption. ",retail ,2019-06-20,23:16,https://www.cnbctv18.com/retail/rural-distress-takes-heavy-toll-on-fmcg-sales-how-it-all-stacks-up-3561971.htm
cnbc,"Wipro Consumer Care continues to explore organic, inorganic growth strategy
Besides, the company which owns brands such as Santoor and Chandrika, is expanding its footprints in the north and east regions and is also increasing its product portfolio. ",retail ,2019-06-20,23:16,https://www.cnbctv18.com/retail/wipro-consumer-care-continues-to-explore-organic-inorganic-growth-strategy-3629851.htm
cnbc,"Storyboard: Puma India's offbeat campaign for Cricket World Cup 2019
The Cricket World Cup has begun and Puma has created a fun new offbeat campaign which is specially designed to celebrate the cricket fans and their passion for the sport in India.",retail ,2019-06-20,23:16,https://www.cnbctv18.com/storyboard/storyboard-puma-indias-offbeat-campaign-for-cricket-world-cup-2019-3623161.htm
cnbc,"Will introduce a new vehicle every 6 months, says Kia Motors after Seltos SUV launch
CNBC-TV18 spoke with Manohar Bhat, the Kia Motors' vice-president and head of sales and marketing to get the company's business outlook and goods and services tax (GST) expectations.",auto ,2019-06-20,23:16,https://www.cnbctv18.com/auto/will-introduce-a-new-vehicle-every-6-months-says-kia-motors-after-seltos-suv-launch-3753591.htm
cnbc,"Renault will vote to back Nissan's move to give it boardroom seats
French carmaker Renault, which is looking to preserve and strengthen its alliance with Nissan, said it would vote in favour of a move by Nissan to grant Renault's representatives a seat on the committees of the Nissan board.",auto ,2019-06-20,23:16,https://www.cnbctv18.com/auto/renault-will-vote-to-back-nissans-move-to-give-it-boardroom-seats-3755651.htm
cnbc,"Kia Motors unveils new SUV Kia Seltos in India
South Korean motor firm Kia unveiled its compact SUV Kia Seltos worldwide which the company claims is specially designed for Indian roads. The SUV, as per reports, is expected to launch in India soon and will be priced between Rs 11-15 lakh (ex-showroom). The car comes with ample number of features such as a 360-degree camera, wireless charging, in-car WiFi, among others. Take a look: ",auto ,2019-06-20,23:16,https://www.cnbctv18.com/auto/kia-motors-unveils-new-suv-kia-seltos-in-india-3751841.htm
cnbc,"India's Electric Vehicle Push: These are the top auto firms taking the green route
India’s electric vehicle (EV) push has gained a lot of traction in the last few months, with the country's top three-and-four wheeler makers marking their forays in the EV space.",auto ,2019-06-20,23:16,https://www.cnbctv18.com/auto/indias-electric-vehicle-push-these-are-the-top-auto-firms-taking-the-green-route-3737531.htm
cnbc,"Renault to stop selling diesel vehicles in India from next year
The company, which made its global unveil of its compact multi-purpose vehicle Triber in India, is bringing the vehicle only in petrol engine option as part of the strategy even as it prepares to introduce electric vehicles (EV) in the near future. ",auto ,2019-06-20,23:16,https://www.cnbctv18.com/auto/renault-to-stop-selling-diesel-vehicles-in-india-from-next-year-3748541.htm
cnbc,"Harley-Davidson in talks with Hero MotoCorp for a potential alliance, says report
Harley-Davidson Motor is in discussions with India's Hero MotoCorp Ltd to outsource the production of 250-500cc motorcycles that the US-based motorbike maker plans to develop for emerging markets, Mint reported.",auto ,2019-06-20,23:16,https://www.cnbctv18.com/auto/harley-davidson-in-talks-with-hero-motocorp-for-a-potential-alliance-says-report-3747181.htm
cnbc,Here's all you need to know about the 2019 Renault Triber,auto ,2019-06-20,23:16,https://www.cnbctv18.com/auto/heres-all-you-need-to-know-about-the-2019-renault-triber-3743861.htm
cnbc,"Rudratej Singh appointed BMW Group India President and CEO
German auto major BMW Group on Wednesday announced the appointment of ex-Royal Enfield global president Rudratej Singh as President and CEO of its Indian operations.",auto ,2019-06-20,23:16,https://www.cnbctv18.com/auto/rudratej-singh-appointed-bmw-group-india-president-and-ceo-3741951.htm
cnbc,"In clean energy push, government proposes to exempt electric vehicles from registration fees
In another move to boost electric mobility, the Ministry of Road Transport and Highways has issued a draft notification proposing exemption of registration fees for electric vehicles.",auto ,2019-06-20,23:16,https://www.cnbctv18.com/auto/in-clean-energy-push-government-proposes-to-exempt-electric-vehicles-from-registration-fees-3741491.htm
cnbc,"Renault keen on launching EV products in Indian market, says CEO Thierry Bolloré",auto ,2019-06-20,23:16,https://www.cnbctv18.com/auto/renault-keen-on-launching-ev-products-in-indian-market-says-ceo-thierry-bollore-3740581.htm
cnbc,"Citing cost spike due to safety norms, Mahindra says will increase price of its passenger vehicles",auto ,2019-06-20,23:16,https://www.cnbctv18.com/auto/citing-cost-spike-due-to-safety-norms-mahindra-says-will-increase-price-of-its-passenger-vehicles-3737601.htm
cnbc,"Aluminium forging capacity to triple going forward with new plants, says Bharat Forge",auto ,2019-06-20,23:16,https://www.cnbctv18.com/auto/aluminium-forging-capacity-to-triple-going-forward-with-new-plants-says-bharat-forge-3736101.htm
cnbc,"GST on electric vehicles may be cut to 5%, says report
The GST imposed on electric vehicles may be reduced to 5 percent from existing 12 percent to provide stimulus to the sector, reported The Economic Times. ",auto ,2019-06-20,23:16,https://www.cnbctv18.com/auto/gst-on-electric-vehicles-may-be-cut-to-5-says-report-3735171.htm
cnbc,"Revolt launches India’s first all-electric motorcycle RV400; pre-bookings begin on June 25
Revolt founder Rahul Sharma, who had earlier founded mobile phone maker Micromax, launched India’s first artificial intelligence (AI)- enabled electric motorcycle called RV 400 on Tuesday.",auto ,2019-06-20,23:16,https://www.cnbctv18.com/auto/revolt-launches-indias-first-all-electric-motorcycle-rv400-pre-bookings-begin-on-june-25-3734691.htm
cnbc,Experts express concerns over new royalty payment norms,auto ,2019-06-20,23:16,https://www.cnbctv18.com/retail/experts-express-concerns-over-new-royalty-payment-norms-3734381.htm
cnbc,"Revolt RV400: India’s first all-electric motorcycle unveiled
Here is a look at Revolt RV400, India’s first all-electric motorcycle.",auto ,2019-06-20,23:16,https://www.cnbctv18.com/auto/revolt-rv400-indias-first-all-electric-motorcycle-unveiled-3726761.htm
cnbc,"India's top 10 best selling sedans in May 2019
Two cars each from Maruti, Honda and Hyundai feature in the list of the top-selling sedans in India in May, while Ford, Skoda, Toyota and Volkswagen made the top 10 list with one car apiece. Maruti Dzire remains the market leader in the segment with 16,196 units sold last month. The Maruti offering has a substantial lead over its closest competition — Honda Amaze which sold 6,000 units. Here's a list of India's top 10 best selling sedans in May 2019",auto ,2019-06-20,23:16,https://www.cnbctv18.com/auto/indias-top-10-best-selling-sedans-in-may-2019-3727591.htm
cnbc,"Auto companies fear space crunch for BS-VI stock, oil cos to share roll-out plan for better synchronisation
Members of Society of Indian Automobile Manufacturers and Federation of Indian Petroleum Industry will form a joint working group for better coordination in the rollout of Bharat Stage-VI fuel.",auto ,2019-06-20,23:16,https://www.cnbctv18.com/auto/auto-cos-fear-space-crunch-for-bs-vi-stock-oil-cos-to-share-roll-out-plan-for-better-synchronisation-3727721.htm
cnbc,Automobile group SIAM drums up support for alternative fuels,auto ,2019-06-20,23:16,https://www.cnbctv18.com/auto/automobile-group-siam-drums-up-support-for-alternative-fuels-3726521.htm
cnbc,"Truckmaker Volvo to partner with Nvidia to develop AI for driverless vehicles
The agreement between Volvo and Nvidia is a long-term partnership spanning several years, and work will begin immediately with personnel from the two companies being co-located in Gothenburg, Sweden and Santa Clara, California.",auto ,2019-06-20,23:16,https://www.cnbctv18.com/auto/truckmaker-volvo-to-partner-with-nvidia-to-develop-ai-for-driverless-vehicles-3726171.htm
cnbc,"Young Turks: Here's how Ather Energy, Ultraviolette and Tork are promoting electric vehicles
CNBC-TV18’s Young Turks catches up with Ather Energy, Ultraviolette and Tork, and spoke to them about their story.",auto ,2019-06-20,23:16,https://www.cnbctv18.com/young-turks/young-turks-heres-how-ather-energy-ultraviolette-and-tork-are-promoting-electric-vehicles-3701131.htm
cnbc,"Young Turks: Here's a look at an electric bike that can hit a top speed of 100 kmph
In this episode of Young Turks, we find out the story behind Pune-based Tork Motors, which was started by Kapil Shelke in 2008.",auto ,2019-06-20,23:16,https://www.cnbctv18.com/young-turks/young-turks-heres-a-look-at-an-electric-bike-that-can-hit-a-top-speed-of-100-kmph-3701241.htm
cnbc,"Young Turks: Here's a startup that's building a 'Made in India’ EV since 2013
In this episode of Young Turks, we find out the story behind Bengaluru-based Ather Energy, which was started by IIT Madras alumni Tarun Mehta and Swapnil Jain in 2013.",auto ,2019-06-20,23:16,https://www.cnbctv18.com/young-turks/young-turks-heres-a-startup-thats-building-a-made-in-india-ev-since-2013-3701161.htm
cnbc,"Young Turks: Here’s a look at a 250cc electric motorcycle with advanced analytics & intelligent user interface
In this episode of Young Turks, we find out the story behind Bengaluru-based start-up Ultraviolette, which was started by Niraj Rajmohan and Narayan Subramaniam.",auto ,2019-06-20,23:16,https://www.cnbctv18.com/young-turks/young-turks-heres-a-look-at-a-250cc-electric-motorcycle-with-advanced-analytics-intelligent-user-interface-3701321.htm
cnbc,"E-vehicle sector for priority-lending, R&D incentives in Budget
With government committed to bringing the electric vehicle (EV) revolution to India in the next few years, the industry expectations from the Union Budget 2019-20 run high.",auto ,2019-06-20,23:16,https://www.cnbctv18.com/auto/e-vehicle-sector-for-priority-lending-rd-incentives-in-budget-3715371.htm
cnbc,"Ahead of Union Budget, Maruti Suzuki pitches for 18% GST on CNG cars
Maruti Suzuki, India’s largest car maker with a 51 percent market share, is hoping for a reduction in Goods and Services Tax (GST) on CNG cars from 28 to 18 percent.",auto ,2019-06-20,23:16,https://www.cnbctv18.com/auto/ahead-of-union-budget-maruti-suzuki-pitches-for-18-gst-on-cng-cars-3713871.htm
cnbc,"Shriram Transport Finance shares fall 6% after Piramal Enterprises sells entire 10% stake in company
CNBC-TV18 reported that about 10 percent equity worth Rs 2,305 crore exchanged hands on NSE at around Rs 1,000-1,023 per share.",auto ,2019-06-20,23:16,https://www.cnbctv18.com/market/shriram-transport-finance-shares-fall-6-after-piramal-enterprises-sells-entire-10-stake-in-company-3711001.htm
cnbc,"Overdrive: Skoda Karoq first drive review
In this episode of Overdrive, Simran Rastogi test drives Skoda Auto's new SUV Karoq.",auto ,2019-06-20,23:16,https://www.cnbctv18.com/auto/overdrive-skoda-karoq-first-drive-review-3701471.htm
cnbc,"Overdrive: 2019 MG Hector first drive review
In this episode of Overdrive, we test drive India's first internet car, the MG Hector.",auto ,2019-06-20,23:16,https://www.cnbctv18.com/auto/overdrive-2019-mg-hector-first-drive-review-3701431.htm
cnbc,"Piaggio India cautious on electric vehicle spending, says EV infrastructure still not ready
Piaggio Vehicles, the country's second-largest three-wheeler maker, has voiced its concerns over the government's electric vehicle-related policies. ",auto ,2019-06-20,23:16,https://www.cnbctv18.com/auto/piaggio-india-cautious-on-electric-vehicle-spending-says-ev-infrastructure-still-not-ready-3699451.htm
cnbc,"A week in review: Here are the top stories from this week
A look back at some of our biggest and best stories from this week. From Jet Airways revival efforts to the government's potential EV policy to Priyanka Chopra's investment plans, we bring you our top ten stories from this week. Here's a quick recap, in case you missed them.",auto ,2019-06-20,23:16,https://www.cnbctv18.com/economy/a-week-in-review-here-are-the-top-stories-from-this-week-10-3698861.htm
cnbc,"Too early to be excited: Commercial vehicle majors give EV plans a reality check
Top manufacturers such as Tata Motors and Ashok Leyland don’t see financial viability for the electric vehicle user at present.",auto ,2019-06-20,23:16,https://www.cnbctv18.com/auto/too-early-to-be-excited-commercial-vehicle-majors-give-ev-plans-a-reality-check-3691971.htm
cnbc,"Piaggio Vehicles to invest Rs 300 crore in India over the next three years, says Diego Graffi",auto ,2019-06-20,23:16,https://www.cnbctv18.com/auto/piaggio-vehicles-to-invest-rs-300-crore-in-india-over-the-next-three-years-says-diego-graffi-3694131.htm
cnbc,"Maruti Suzuki introduces CNG variant Alto, BS-VI compliant WagonR and Swift ahead of 2020 deadline
The firm introduced CNG variants in its Alto model, a safety compliant Swift and a BS-VI petrol compliant model of the same and a BS-VI compliant WagonR.",auto ,2019-06-20,23:16,https://www.cnbctv18.com/auto/maruti-suzuki-introduces-cng-variant-alto-bs-vi-compliant-wagonr-and-swift-ahead-of-2020-deadline-3691691.htm
cnbc,"China asks India to make an independent judgement on Huawei
China on Thursday urged India to make an ""independent judgement"" about Huawei's operations in the country without being guided by the US ban on the Chinese telecom giant's products and provide an ""unbiased and non-discriminatory"" environment for the Chinese businesses.",telecom ,2019-06-20,23:16,https://www.cnbctv18.com/telecom/china-asks-india-to-make-an-independent-judgement-on-huawei-3753641.htm
cnbc,"OPPO becomes third most trusted smartphone brand in India
According to TRA's Brand Trust Report 2019, OPPO climbed up seven ranks to secure this year's third spot in the top 10 smartphone brands in India. ",telecom ,2019-06-20,23:16,https://www.cnbctv18.com/technology/oppo-becomes-third-most-trusted-smartphone-brand-in-india-3727881.htm
cnbc,"Claims against RCom swell to Rs 57,382 crore; Reliance ADAG firms among claimants",telecom ,2019-06-20,23:16,https://www.cnbctv18.com/telecom/claims-against-rcom-swell-to-rs-57382-crore-reliance-adag-firms-among-claimants-3717671.htm
cnbc,"DCC clears imposing penalty on Airtel, Vodafone Idea; seeks Trai view on fine amount
However, before imposing the penalty, the Commission has decided to seek Trai's views on revising Rs 3,050 crore penalty recommended by the sector regulator amid financial stress in the sector.",telecom ,2019-06-20,23:16,https://www.cnbctv18.com/telecom/dcc-clears-imposing-penalty-on-airtel-vodafone-idea-seeks-trai-view-on-fine-amount-3713661.htm
cnbc,Airtel Africa expects London IPO to be priced between 80-100 pence a share,telecom ,2019-06-20,23:16,https://www.cnbctv18.com/telecom/airtel-africa-expects-london-ipo-to-be-priced-between-80-100-pence-a-share-3712411.htm
cnbc,"DoT supports Trai decision of imposing Rs 3,050 crore fine on Airtel, Vodafone Idea
A senior official told the paper that member, technology, said there was noncompliance of licence provisions and quality of service (QoS) norms and the regulator’s recommendation of imposing a penalty is valid and is likely to be accepted by the DoT.",telecom ,2019-06-20,23:16,https://www.cnbctv18.com/telecom/dot-supports-trai-decision-of-imposing-rs-3050-crore-fine-on-airtel-vodafone-idea-3710001.htm
cnbc,"Telecom panel asks Trai to reconsider recommendations on spectrum auction
The Digital Communications Commission (DCC), which met on Thursday, also approved the terms and conditions for 5G trials in the country, sources said.",telecom ,2019-06-20,23:16,https://www.cnbctv18.com/telecom/telecom-panel-asks-trai-to-reconsider-recommendations-on-spectrum-auction-3680661.htm
cnbc,"Reliance Industries in talks with several investors for tower, fibre InvIT",telecom ,2019-06-20,23:16,https://www.cnbctv18.com/telecom/reliance-industries-in-talks-with-several-investors-for-tower-fibre-invit-3661371.htm
cnbc,"Airtel, Voda Idea may turn fibre JV into infra investment trust, says report
Telecom giants Vodafone Idea and Bharti Airtel are in talks to turn their proposed optic fibre network joint entity into an infrastructure investment trust (InvIT), reported The Economic Times. ",telecom ,2019-06-20,23:16,https://www.cnbctv18.com/telecom/airtel-voda-idea-may-turn-fibre-jv-into-infra-investment-trust-says-report-3659091.htm
cnbc,"China telecom giant Huawei hints US pressure hurting sales
Washington last month put Huawei on a blacklist that effectively bars US firms from selling to the company without government approval. ",telecom ,2019-06-20,23:16,https://www.cnbctv18.com/technology/china-telecom-giant-huawei-hints-us-pressure-hurting-sales-3649111.htm
cnbc,"Bharti Airtel to pay Tanzania $26 million, cancel debt at unit to settle dispute
Bharti Airtel also cancelled $407 million of debt owed to it by Airtel Tanzania as part of the settlement, Kabudi said.",telecom ,2019-06-20,23:16,https://www.cnbctv18.com/telecom/bharti-airtel-to-pay-tanzania-26-million-cancel-debt-at-unit-to-settle-dispute-3645261.htm
cnbc,"India may have 88 million 5G connections by 2025: GSMA
Global telecom industry body GSMA expects India to have 920 million unique mobile subscribers by 2025 which will include 88 million 5G connections.",telecom ,2019-06-20,23:16,https://www.cnbctv18.com/telecom/india-may-have-88-million-5g-connections-by-2025-gsma-3591201.htm
cnbc,"Global smartphone shipments may decline 3.1% in 2019, says research firm
 Market research firm Canalys has said smartphone shipments will reach 135 crore units in 2019.",telecom ,2019-06-20,23:16,https://www.cnbctv18.com/technology/global-smartphone-shipments-may-decline-3-1-in-2019-says-research-firm-3577071.htm
cnbc,"Airtel Africa to file for London IPO
The company said the offer is targeted to raise $750 million and proceeds will be used to reduce debt.",telecom ,2019-06-20,23:16,https://www.cnbctv18.com/market/stocks/airtel-africa-to-file-for-london-ipo-3573181.htm
cnbc,"Telecom minister Ravi Shankar Prasad: 5 lakh WiFi hotspots to be established on a fast-track basis
Newly-appointed Telecom Minister Ravi Shankar Prasad on Monday said that India will hold spectrum auction for 5G and other bands in the current calendar year.",telecom ,2019-06-20,23:16,https://www.cnbctv18.com/telecom/telecom-spectrum-auction-to-be-held-this-year-ravi-shankar-prasad-3564131.htm
cnbc,"DoT to auction 4G, 5G spectrum by October, says report
The auction is expected to be the biggest to have taken place in the country, with 8,293.95 MHz of airwaves going under the hammer at an estimated total base price of Rs 5.77 lakh crore.",telecom ,2019-06-20,23:16,https://www.cnbctv18.com/telecom/dot-to-auction-4g-5g-spectrum-by-october-says-report-3559081.htm
cnbc,"Can India offset Huawei's global losses after US ban?
Sandwiched between the ongoing US-China trade war, Chinese telecom equipment major Huawei is frantically looking to salvage its prestige and fast cover the lost ground.",telecom ,2019-06-20,23:16,https://www.cnbctv18.com/technology/can-india-offset-huaweis-global-losses-after-us-ban-3552901.htm
cnbc,"Doha Bank moves NCLT to seek stay on Reliance Infratel's committee of creditors decision
The counsel for Doha Bank claimed that the creditors' panel has considered the claims of lenders of parent firm Reliance Communications on the basis of corporate guarantee of RITL which would reduce its voting share in the CoC. ",telecom ,2019-06-20,23:16,https://www.cnbctv18.com/telecom/doha-bank-moves-nclt-to-seek-stay-on-reliance-infratels-committee-of-creditors-decision-3531011.htm
cnbc,"Ericsson considering new clauses to avoid RCom like situations
The company sued RCom and its promoter Anil Ambani to recover dues of about Rs 1,500 crore, of which it managed to receive only Rs 550 crore.",telecom ,2019-06-20,23:16,https://www.cnbctv18.com/telecom/ericsson-considering-new-clauses-to-avoid-rcom-like-situations-3518381.htm
cnbc,"Airtel Africa looks at $1 billion London listing
The company is aiming to raise around $1 billion in a June equity offering, a source close to the deal said. Airtel operates in 14 African markets including the Democratic Republic of the Congo, Kenya, Nigeria, Rwanda, Seychelles, Uganda, and Zambia.",telecom ,2019-06-20,23:16,https://www.cnbctv18.com/telecom/airtel-africa-looks-at-1-billion-london-listing-3501651.htm
cnbc,"Bharti Telecom stake in Airtel comes down to 41.24%
Stake of Airtel promoter group firm Bharti Telecom has come down to 41.24 percent following renouncement of 11.34 crore shares by the entity valued at around Rs 3,920 crore and Rs 25,000-crore rights issue, according to the updated shareholding of the company.",telecom ,2019-06-20,23:16,https://www.cnbctv18.com/telecom/bharti-telecom-stake-in-airtel-comes-down-to-41-24-3498061.htm
cnbc,"Airtel submits Rs 644 crore bank guarantee in TDSAT for Tata Tele merger
The TDSAT on May 2 granted a partial stay on a Rs 8,300-crore demand raised by the telecom department from Bharti Airtel for approving its merger with the consumer business of Tata Teleservices Ltd (TTSL). ",telecom ,2019-06-20,23:16,https://www.cnbctv18.com/telecom/airtel-submits-rs-644-crore-bank-guarantee-in-tdsat-for-tata-tele-merger-3488711.htm
cnbc,"Debt-laden RCom reports Q4 net loss at Rs 7,767 crore
The company had reported a net loss of Rs 19,776 crore in the corresponding period of 2017-18.",telecom ,2019-06-20,23:16,https://www.cnbctv18.com/earnings/debt-laden-rcom-reports-q4-net-loss-at-rs-7767-crore-3487211.htm
cnbc,"Reliance Jio added 9.4 million wireless subscribers in March as rivals faltered, Trai data reveals",telecom ,2019-06-20,23:16,https://www.cnbctv18.com/telecom/reliance-jio-added-9-4-million-wireless-subscribers-in-march-as-rivals-faltered-trai-data-reveals-3410061.htm
cnbc,"Bharti, Vodafone propose Bimal Dayal as CEO of Bharti Infratel-Indus venture
Bharti Group and Vodafone Group Plc have proposed that industry veteran Bimal Dayal should head the combined tower venture of Indus Towers Ltd and Bharti Infratel, the companies said in a joint statement on Tuesday.",telecom ,2019-06-20,23:16,https://www.cnbctv18.com/telecom/bharti-vodafone-propose-bimal-dayal-as-ceo-of-bharti-infratel-indus-venture-3411451.htm
cnbc,"Spectrum auction need to be commenced for 5G roll out: Tech  Mahindra
The Department of Telecomm need to commence the auction of 5G spectrum in India as the regulators in some countries have already formulated policies and initiated spectrum auctions for the 5G roll out in their respective nations, a senior official of the IT giant Tech Mahindra has said.",telecom ,2019-06-20,23:16,https://www.cnbctv18.com/telecom/spectrum-auction-need-to-be-commenced-for-5g-roll-out-tech-mahindra-3409601.htm
cnbc,"Trai to focus on limited issue of regulatory imbalance between OTTs and telcos, says RS Sharma
Sharma's views come amid reports that the regulator could come out with a separate consultation paper on video OTTs like Sony Liv, Hotstar, Netflix, Amazon Prime, and Voot among others to regulate them in future. Sharma declined to comment on this.",telecom ,2019-06-20,23:16,https://www.cnbctv18.com/telecom/trai-to-focus-on-limited-issue-of-regulatory-imbalance-between-otts-and-telcos-says-rs-sharma-3402821.htm
cnbc,"Google suspends some business with Huawei after Trump blacklist
Future versions of Huawei smartphones that run on Android will also lose access to popular services including the Google Play Store and Gmail and YouTube apps.",telecom ,2019-06-20,23:16,https://www.cnbctv18.com/technology/google-suspends-some-business-with-huawei-after-trump-blacklist-3391271.htm
