Newspaper,Heading,Category,Date,Time,URL
Hindiustan Times,Champions League: ‘Only the start’ - Klopp predicts more good times ahead for Liverpool,football,2019-06-02,10:27:00,https://www.hindustantimes.com/football/champions-league-only-the-start-klopp-predicts-more-good-times-ahead-for-liverpool/story-jny77PIjt6vMvDfsdopPwO.html
Hindiustan Times,Liverpool beat Tottenham 2-0 to win UEFA Champions League title,football,2019-06-02,07:59:00,https://www.hindustantimes.com/football/liverpool-beat-tottenham-2-0-to-win-uefa-champions-league-title/story-GFvfaIz2X0dJSiusGwXavO.html
Hindiustan Times,Minute’s silence to be held for Reyes before Champions League final,football,2019-06-01,20:15:00,https://www.hindustantimes.com/football/minute-s-silence-to-be-held-for-reyes-before-champions-league-final/story-HDJwZNyqXLQ5AOzSqiPxzK.html
Hindiustan Times,India must work to become a force in Asian football again: Igor Stimac,football,2019-06-01,19:23:00,https://www.hindustantimes.com/football/india-must-work-to-become-a-force-in-asian-football-again-igor-stimac/story-7JP6UopbOMzLH8LfpUa2KL.html
Hindiustan Times,Former Spain and Arsenal striker Jose Antonio Reyes killed in car crash,football,2019-06-01,18:19:00,https://www.hindustantimes.com/football/former-spain-and-arsenal-striker-jose-antonio-reyes-killed-in-car-crash/story-52MHp8Ww8mJfel9svDwuKM.html
Hindiustan Times,Chelsea boss Maurizio Sarri close to Juventus switch,football,2019-06-01,15:39:00,https://www.hindustantimes.com/football/chelsea-boss-maurizio-sarri-close-to-juventus-switch/story-TpJuCibjYG1mJZ5RiNXJDM.html
Hindiustan Times,"Liverpool, Tottenham set for Champions League showdown as Madrid picks up",football,2019-06-01,13:04:00,https://www.hindustantimes.com/football/liverpool-tottenham-set-for-champions-league-showdown-as-madrid-picks-up/story-hsns5cl30risTw9hAWUGeJ.html
Hindiustan Times,In Klopp they believe,football,2019-06-01,10:31:00,https://www.hindustantimes.com/football/in-klopp-they-believe/story-DPax3hbSlEDqFWfFqPaWdN.html
Hindiustan Times,Germany coach Loew taken to hospital after accident,football,2019-05-31,23:52:00,https://www.hindustantimes.com/football/germany-coach-loew-taken-to-hospital-after-accident/story-9iBtUU04Kwh5edCjT3yX8L.html
Hindiustan Times,Inter Milan name Antonio Conte as coach,football,2019-05-31,13:37:00,https://www.hindustantimes.com/football/inter-milan-name-antonio-conte-as-coach/story-JOK6VaC5roQofR4rf5sXiL.html
Hindiustan Times,‘I want to retire at Real Madrid’ - Ramos,football,2019-05-31,09:46:00,https://www.hindustantimes.com/football/i-want-to-retire-at-real-madrid-ramos/story-rZ38Sm9o737PcVGBvPbhaI.html
Hindiustan Times,Spalletti leaves Inter Milan with Conte set to take over,football,2019-05-30,18:39:00,https://www.hindustantimes.com/football/spalletti-leaves-inter-milan-with-conte-set-to-take-over/story-1UWolx1Mgc21XINlo4c8WK.html
Hindiustan Times,Europa League Final: Emery hints at potential departures to continue to rebuild at Arsenal,football,2019-05-30,08:40:00,https://www.hindustantimes.com/football/europa-league-final-emery-hints-at-potential-departures-to-continue-to-rebuild-at-arsenal/story-Db8ZYtKdO92p3EN6RtDj4J.html
Hindiustan Times,Rafael Nadal beats Dominic Thiem to claim record-stretching 12th French Open title,tennis,2019-06-09,22:03:00,https://www.hindustantimes.com/tennis/rafael-nadal-beats-dominic-thiem-to-claim-record-stretching-12th-french-open-title/story-NJG3uQQH8drCYM8R4CZTkL.html
Hindiustan Times,French Open: Mladenovic and Babos claim women’s doubles title in Paris,tennis,2019-06-09,23:30:00,https://www.hindustantimes.com/tennis/french-open-mladenovic-and-babos-claim-women-s-doubles-title-in-paris/story-jlSDtn8VFDKRQ9ff7RnNQK.html
Hindiustan Times,French Open 2019: Ashleigh Barty ends Australia’s 46-year wait for Roland Garros title,tennis,2019-06-08,21:49:00,https://www.hindustantimes.com/tennis/french-open-2019-ashleigh-barty-ends-australia-s-46-year-wait-for-roland-garros-title/story-flc94CEjy7KlneVqdATGFL.html
Hindiustan Times,My son made it special: Novak Djokovic after winning fourth Wimbledon t...,tennis,2018-07-16,12:48:00,https://www.hindustantimes.com/videos/sports/my-son-made-it-special-wimbledon-winner-novak-djokovic/video-frqjhA152GIvULiLcZwBYP.html
Hindiustan Times,"After many, many hours, Kevin Anderson beats John Isner in Wimbledon se...",tennis,2018-07-14,16:23:00,https://www.hindustantimes.com/videos/tennis/after-many-many-hours-kevin-anderson-beats-john-isner-in-wimbledon-semifinal/video-CVPPIEw2gHpZseRKQ1ZJdO.html
Hindiustan Times,"Bjorn Borg, Billie Jean King watch supermon Serena enter Wimbledon final",tennis,2018-07-13,21:05:00,https://www.hindustantimes.com/videos/tennis/bjorn-borg-billie-jean-king-watch-supermon-serena-enter-wimbledon-final/video-WZsfUKo4BWK3fLZARrAb2L.html
Hindiustan Times,Kevin Anderson stuns Federer in Wimbledon quarter-final cliffhanger,tennis,2018-07-12,12:48:00,https://www.hindustantimes.com/videos/tennis/kevin-anderson-stuns-federer-in-wimbledon-quarter-final-cliffhanger/video-WSdpD68LfQXLq5KyQCjGxM.html
Hindiustan Times,Maria Sharapova to return to action in Mallorca Open,tennis,2019-06-10,18:38:00,https://www.hindustantimes.com/tennis/maria-sharapova-to-return-to-action-in-mallorca-open/story-Fqvokb6OO5iDMPtwG81nhJ.html
Hindiustan Times,French Open 2019: Here’s why Rafael Nadal won’t target Roger Federer’s Grand Slam record,tennis,2019-06-10,12:23:00,https://www.hindustantimes.com/tennis/french-open-2019-here-s-why-rafael-nadal-won-t-target-roger-federer-s-grand-slam-record/story-L4nbf9HCjgUaBf4QzuX8fN.html
Hindiustan Times,Rafael Nadal beats Dominic Thiem to claim record-stretching 12th French Open title,tennis,2019-06-09,22:03:00,https://www.hindustantimes.com/tennis/rafael-nadal-beats-dominic-thiem-to-claim-record-stretching-12th-french-open-title/story-NJG3uQQH8drCYM8R4CZTkL.html
Hindiustan Times,"French Open 2019 Final Highlights, Rafael Nadal vs Dominic Thiem: Nadal wins 6-3, 5-7, 6-1, 6-1",tennis,2019-06-09,21:49:00,https://www.hindustantimes.com/tennis/french-open-2019-final-live-updates-rafael-nadal-vs-dominic-thiem/story-TzfKCyblEU6o72sBePZSmL.html
Hindiustan Times,French Open: Mladenovic and Babos claim women’s doubles title in Paris,tennis,2019-06-09,23:30:00,https://www.hindustantimes.com/tennis/french-open-mladenovic-and-babos-claim-women-s-doubles-title-in-paris/story-jlSDtn8VFDKRQ9ff7RnNQK.html
Hindiustan Times,French Open 2019: Ashleigh Barty ends Australia’s 46-year wait for Roland Garros title,tennis,2019-06-08,21:49:00,https://www.hindustantimes.com/tennis/french-open-2019-ashleigh-barty-ends-australia-s-46-year-wait-for-roland-garros-title/story-flc94CEjy7KlneVqdATGFL.html
Hindiustan Times,French Open 2019: Dominic Thiem beats Novak Djokovic to enter final,tennis,2019-06-08,19:50:00,https://www.hindustantimes.com/tennis/french-open-2019-dominic-thiem-beats-novak-djokovic-to-enter-final/story-dq29UyaQ2I9cdPuWJnP8BJ.html
Hindiustan Times,French Open: Rain rescues faltering Novak Djokovic at Roland Garros,tennis,2019-06-08,18:55:00,https://www.hindustantimes.com/tennis/french-open-rain-rescues-faltering-novak-djokovic-at-roland-garros/story-dYmBu4GVRLeMlPlLPmfcoK.html
Hindiustan Times,"French Open 2019: Novak Djokovic, Dominic Thiem blown off course in new Roland Garros schedule setback",tennis,2019-06-07,23:29:00,https://www.hindustantimes.com/tennis/french-open-2019-novak-djokovic-dominic-thiem-blown-off-course-in-new-roland-garros-schedule-setback/story-3mM0oaDOEJ1SIwQlAP4RFP.html
Hindiustan Times,French Open 2019: Roger Federer delights fans with hint of Paris return,tennis,2019-06-07,21:35:00,https://www.hindustantimes.com/tennis/french-open-2019-roger-federer-delights-fans-with-hint-of-paris-return/story-VThxJ24bt3KVaJ7xEPH2pO.html
Hindiustan Times,French Open 2019: Rafael Nadal hands Roger Federer worst Grand Slam loss in 11 years to reach final,tennis,2019-06-07,20:46:00,https://www.hindustantimes.com/tennis/french-open-2019-rafael-nadal-hands-roger-federer-worst-grand-slam-loss-in-11-years-to-reach-final/story-TsQwmhbh9ca2cf7KrF5o2O.html
Hindiustan Times,Teenager Vondrousova beats Konta to reach French Open final,tennis,2019-06-07,17:52:00,https://www.hindustantimes.com/tennis/teenager-vondrousova-beats-konta-to-reach-french-open-final/story-RECFJ2aHl1kYgZGOWr5UyH.html
Hindiustan Times,"French Open 2019 Semi-Final Highlights, Roger Federer vs Rafael Nadal: Nadal beats Federer to reach record 12th final",tennis,2019-06-07,19:14:00,https://www.hindustantimes.com/tennis/roger-federer-vs-rafael-nadal-live-updates-french-open-2019-semi-final-clash-of-the-titans-in-paris/story-3e00XTti59BkQPVDKnQD0O.html
Hindiustan Times,"French Open: Barty, Vondrousova to meet in Roland Garros final",tennis,2019-06-07,16:51:00,https://www.hindustantimes.com/tennis/french-open-barty-vondrousova-to-meet-in-roland-garros-final/story-rvDaP4gMwKC9DiOBIbSywO.html
Hindiustan Times,Rafael Nadal expects Roger Federer onslaught in French Open semi-final,tennis,2019-06-07,14:00:00,https://www.hindustantimes.com/tennis/rafael-nadal-expects-roger-federer-onslaught-in-french-open-semi-final/story-FovZHr4mUjoLpgjlyjezSJ.html
Hindiustan Times,French Open 2019: Novak Djokovic to face Dominic Thiem for a spot in final,tennis,2019-06-06,21:04:00,https://www.hindustantimes.com/tennis/french-open-2019-novak-djokovic-to-face-dominic-thiem-for-a-spot-in-final/story-5CQRbIxYDddYo6wJaVfH3K.html
Hindiustan Times,French Open 2019: Ashleigh Barty outplays Madison Keys to reach semis,tennis,2019-06-06,21:43:00,https://www.hindustantimes.com/tennis/french-open-2019-ashleigh-barty-outplays-madison-keys-to-reach-semis/story-jL2HrWSBne8vWEIre7CUeN.html
Hindiustan Times,French Open 2019: 17-year-old Amanda Anisimova stuns defending champion Simona Halep to enter semis,tennis,2019-06-06,17:17:00,https://www.hindustantimes.com/tennis/french-open-2019-17-year-old-amanda-anisimova-stuns-defending-champion-simona-halep-to-enter-semis/story-X10K11PXnXOCb5NLJRwZuK.html
Hindiustan Times,French Open 2019: Rafael Nadal braced for ‘trouble’ in Roger Federer showdown,tennis,2019-06-06,16:54:00,https://www.hindustantimes.com/tennis/french-open-2019-rafael-nadal-braced-for-trouble-in-roger-federer-showdown/story-5AVspVXLplW5BCBtaydYaP.html
Hindiustan Times,Roland Garros washout keeps Novak Djokovic and Simona Halep waiting,tennis,2019-06-05,21:23:00,https://www.hindustantimes.com/tennis/roland-garros-washout-keeps-novak-djokovic-and-simona-halep-waiting/story-L8AxdniBG2T2zqweGdTSsL.html
Hindiustan Times,French Open: Mission impossible? How Federer can beat Nadal at Roland Garros,tennis,2019-06-05,17:56:00,https://www.hindustantimes.com/tennis/french-open-mission-impossible-how-federer-can-beat-nadal-at-roland-garros/story-B2ZmTkJhYDYxJwLsBDOL7M.html
Hindiustan Times,French Open: ‘There’s always a chance’: Federer dreaming of toppling Nadal,tennis,2019-06-05,01:21:00,https://www.hindustantimes.com/tennis/french-open-there-s-always-a-chance-federer-dreaming-of-toppling-nadal/story-bvJdck51k84UmTFpeVdIEI.html
Hindiustan Times,"French Open: ‘I’m ready for special moment’ of facing Federer, says Nadal",tennis,2019-06-05,01:22:00,https://www.hindustantimes.com/tennis/french-open-i-m-ready-for-special-moment-of-facing-federer-says-nadal/story-BCToJZ7EfiKz192xppxiuL.html
Hindiustan Times,Rafael Nadal demolishes Kei Nishikori to set up French Open semi-final showdown,tennis,2019-06-04,23:11:00,https://www.hindustantimes.com/tennis/rafael-nadal-demolishes-kei-nishikori-to-set-up-french-open-semi-final-showdown/story-5hxgcMzAHofjbYsmN92t6L.html
Hindiustan Times,French Open: Roger Federer subdues Stan Wawrinka in Swiss classic,tennis,2019-06-04,23:00:00,https://www.hindustantimes.com/tennis/french-open-roger-federer-subdues-stan-wawrinka-in-swiss-classic/story-JRZAV3AoL7jf5l9VV0Pf1O.html
Hindiustan Times,Johanna Konta first British woman in 36 years to reach Roland Garros semis,tennis,2019-06-04,20:05:00,https://www.hindustantimes.com/tennis/johanna-konta-first-british-woman-in-36-years-to-reach-roland-garros-semis/story-5kXUj0y145k8PFoBlp1j3L.html
Hindiustan Times,Simona Halep reaches French Open quarters with 45-minute thrashing,tennis,2019-06-03,22:40:00,https://www.hindustantimes.com/tennis/simona-halep-reaches-french-open-quarters-with-45-minute-thrashing/story-Lvc423L2tP9GMVVnM8KOnM.html
Hindiustan Times,Zverev to face Djokovic for Roland Garros semi-final spot,tennis,2019-06-03,23:54:00,https://www.hindustantimes.com/tennis/zverev-to-face-djokovic-for-roland-garros-semi-final-spot/story-bjAV9dPvOIDok9sliXY5gJ.html
Hindiustan Times,Dominic Thiem tames Gael Monfils to advance into last eight in French Open,tennis,2019-06-03,23:54:00,https://www.hindustantimes.com/tennis/dominic-thiem-tames-gael-monfils-to-advance-into-last-eight-in-french-open/story-DjCZyoUfZKeds9vPiwMjLK.html
Hindiustan Times,"Record-setting Novak Djokovic into French Open last-eight, Kei Nishikori to face Rafael Nadal",tennis,2019-06-03,18:51:00,https://www.hindustantimes.com/tennis/record-setting-novak-djokovic-into-french-open-last-eight-kei-nishikori-to-face-rafael-nadal/story-R1rTgWVHFzBXdzSlkZLuRI.html
Hindiustan Times,"French Open: Ashleigh Barty, Madison Keys reach quarter-finals",tennis,2019-06-03,18:58:00,https://www.hindustantimes.com/tennis/french-open-ashleigh-barty-madison-keys-reach-quarter-finals/story-HyArZB1XgO0eI12pv79ZuO.html
Hindiustan Times,Thiem blasts Serena ‘bad personality’ in Roland Garros press conference row,tennis,2019-06-03,15:06:00,https://www.hindustantimes.com/tennis/thiem-blasts-serena-bad-personality-in-roland-garros-press-conference-row/story-lkuZtCUmZ73oeM1HeyVhvJ.html
Hindiustan Times,‘Cactus’ Djokovic eyes 13th Roland Garros quarter-final,tennis,2019-06-03,12:25:00,https://www.hindustantimes.com/tennis/cactus-djokovic-eyes-13th-roland-garros-quarter-final/story-PrvTcIgY82g7YOeddnwm8H.html
Hindiustan Times,"Wawrinka beats Tsitsipas in French Open epic, faces Federer in last eight",tennis,2019-06-02,23:29:00,https://www.hindustantimes.com/tennis/wawrinka-beats-tsitsipas-in-french-open-epic-faces-federer-in-last-eight/story-yPHeKiI6zby1VoTah34lSL.html
Hindiustan Times,Rafael Nadal racks up 90th Roland Garros win to reach quarter-finals,tennis,2019-06-02,21:51:00,https://www.hindustantimes.com/tennis/rafael-nadal-racks-up-90th-roland-garros-win-to-reach-quarter-finals/story-EmyMOVcHb4oUsqFV9v9M5L.html
Hindiustan Times,Roger Federer eases into 12th French Open quarter-final,tennis,2019-06-02,23:54:00,https://www.hindustantimes.com/tennis/roger-federer-eases-into-12th-french-open-quarter-final/story-CDzt8AOOKvDUVjMl0iaCNK.html
Hindiustan Times,Britain’s Johanna Konta powers into French Open last eight,tennis,2019-06-02,23:57:00,https://www.hindustantimes.com/tennis/britain-s-johanna-konta-powers-into-french-open-last-eight/story-aHX3bWcuLkxteoyxwfm1EK.html
Hindiustan Times,Czech teenager Marketa Vondrousova into French Open quarters,tennis,2019-06-02,16:29:00,https://www.hindustantimes.com/tennis/czech-teenager-marketa-vondrousova-into-french-open-quarters/story-2rmBjapc9qS1q0iY1nnR6O.html
Hindiustan Times,Serena Williams may seek grasscourt wildcard ahead of Wimbledon,tennis,2019-06-02,13:20:00,https://www.hindustantimes.com/tennis/serena-williams-may-seek-grasscourt-wildcard-ahead-of-wimbledon/story-zR9cvul6Q7x8aE5YtrdRtJ.html
Hindiustan Times,"French Open: Federer, Nadal eye quarter-finals",tennis,2019-06-02,10:18:00,https://www.hindustantimes.com/tennis/french-open-federer-nadal-eye-quarter-finals/story-7plv5EKwK1tBWZelTfnvlJ.html
Hindiustan Times,"French Open: Djokovic beats qualifier, ready for ‘real deal’ in Paris",tennis,2019-06-02,13:20:00,https://www.hindustantimes.com/tennis/french-open-djokovic-beats-qualifier-ready-for-real-deal-in-paris/story-X92SJ9pFpTrh9DqvLXjmiO.html
Hindiustan Times,Serena Williams’ Slam history bid halted in Roland Garros shock,tennis,2019-06-02,00:07:00,https://www.hindustantimes.com/tennis/serena-williams-slam-history-bid-halted-in-roland-garros-shock/story-oOZYNBmEMX0vSps2Adrs8J.html
Hindiustan Times,Sluggish Dominic Thiem into French Open fourth round,tennis,2019-06-02,02:15:00,https://www.hindustantimes.com/tennis/sluggish-dominic-thiem-into-french-open-fourth-round/story-aDvuW9E9z5k8df6z1wzPPK.html
Hindiustan Times,"French Open 2019: Osaka crashes out of Roland Garros, ending bid for third successive Slam",tennis,2019-06-01,19:51:00,https://www.hindustantimes.com/tennis/french-open-2019-osaka-crashes-out-of-roland-garros-ending-bid-for-third-successive-slam/story-fNezFfXbxsL7Uz0BSjoGWP.html
Hindiustan Times,Alexander Zverev through to French Open fourth round after another five-setter,tennis,2019-06-01,19:10:00,https://www.hindustantimes.com/tennis/alexander-zverev-through-to-french-open-fourth-round-after-another-five-setter/story-5a46uZSQHgWboBwEmAlpUN.html
Hindiustan Times,French Open 2019: Tsitsipas first Greek in 83 years to reach Roland Garros last 16,tennis,2019-06-01,18:15:00,https://www.hindustantimes.com/tennis/french-open-2019-tsitsipas-first-greek-in-83-years-to-reach-roland-garros-last-16/story-XdwDdC0N8NAHcBNfK23XAO.html
Hindiustan Times,French Open 2019: Simona Halep races past Lesia Tsurenko to move into fourth round,tennis,2019-06-01,17:06:00,https://www.hindustantimes.com/tennis/french-open-2019-simona-halep-races-past-lesia-tsurenko-to-move-into-fourth-round/story-9McaJEw8OJr4NVtvh7h10J.html
Hindiustan Times,"‘Blessed’ Leander Paes closing in on fourth decade as pro and 1,000 racquets",tennis,2019-06-01,10:30:00,https://www.hindustantimes.com/tennis/blessed-leander-paes-closing-in-on-fourth-decade-as-pro-and-1-000-racquets/story-DxbPMSbLUyaC1E1MEmBVnL.html
Hindiustan Times,Nadal shakes off Goffin comeback to reach French Open fourth round,tennis,2019-05-31,23:28:00,https://www.hindustantimes.com/tennis/nadal-shakes-off-goffin-comeback-to-reach-french-open-fourth-round/story-ZId7JDCPFKOnFLzMyfRk1I.html
Hindiustan Times,"Bopanna-Copil win, Sharan-Demoliner exit from French Open",tennis,2019-05-31,22:04:00,https://www.hindustantimes.com/tennis/bopanna-copil-win-sharan-demoliner-exit-from-french-open/story-t8YYaFSgD6zW95BgoOAzfI.html
Hindiustan Times,Sebastian Vettel puts Ferrari on pole at Canadian Grand Prix,other,2019-06-09,23:28:00,https://www.hindustantimes.com/other-sports/sebastian-vettel-puts-ferrari-on-pole-at-canadian-grand-prix/story-R6dfyUuK5AsrQCQTdCQ39K.html
Hindiustan Times,Canadian GP: Sebastian Vettel  takes pole ahead of Lewis Hamilton,other,2019-06-09,01:22:00,https://www.hindustantimes.com/other-sports/canadian-gp-sebastian-vettel-takes-pole-ahead-of-lewis-hamilton/story-Bu07kiz54ohIXyCXQmIIUL.html
Hindiustan Times,Brittle Indian hockey team seeks mental toughness ,other,2019-06-09,18:14:00,https://www.hindustantimes.com/other-sports/brittle-indian-hockey-team-seeks-mental-toughness/story-V6ZbRtR8srwCfyjoeS21SJ.html
Hindiustan Times,Akashdeep Singh slams hat-trick as India rout Uzbekistan 10-0 in FIH Series Finals,other,2019-06-10,21:42:00,https://www.hindustantimes.com/other-sports/akashdeep-singh-slams-hat-trick-as-india-rout-uzbekistan-10-0-in-fih-series-finals/story-GqNfkTQ8eKvPKu5xr6DJzK.html
Hindiustan Times,‘This is the wrong world’: Sebastian Vettel fumes at costly penalty,other,2019-06-10,09:29:00,https://www.hindustantimes.com/other-sports/this-is-the-wrong-world-sebastian-vettel-fumes-at-costly-penalty/story-RrLfoqumy161I6kU5wDZKM.html
Hindiustan Times,Sebastian Vettel puts Ferrari on pole at Canadian Grand Prix,other,2019-06-09,23:28:00,https://www.hindustantimes.com/other-sports/sebastian-vettel-puts-ferrari-on-pole-at-canadian-grand-prix/story-R6dfyUuK5AsrQCQTdCQ39K.html
Hindiustan Times,Canadian GP: Sebastian Vettel  takes pole ahead of Lewis Hamilton,other,2019-06-09,01:22:00,https://www.hindustantimes.com/other-sports/canadian-gp-sebastian-vettel-takes-pole-ahead-of-lewis-hamilton/story-Bu07kiz54ohIXyCXQmIIUL.html
Hindiustan Times,Brittle Indian hockey team seeks mental toughness ,other,2019-06-09,18:14:00,https://www.hindustantimes.com/other-sports/brittle-indian-hockey-team-seeks-mental-toughness/story-V6ZbRtR8srwCfyjoeS21SJ.html
Hindiustan Times,"Despite setbacks, Japan’s hockey team aims high",other,2019-06-08,12:23:00,https://www.hindustantimes.com/other-sports/despite-setbacks-japan-s-hockey-team-aims-high/story-Nq21ZqAoDksSSWS8lVUWnO.html
Hindiustan Times,FIH Series Finals: Captain Manpreet Singh’s brace hands India 3-1 win over Poland,other,2019-06-07,21:46:00,https://www.hindustantimes.com/other-sports/fih-series-finals-captain-manpreet-singh-s-brace-hands-india-3-1-win-over-poland/story-rSr9VTpP4hjtdlQtTlcqgM.html
Hindiustan Times,"Viswanathan Anand loses to Shakhriyar Mamedyarov, falls to last spot in Norway Chess",other,2019-06-07,14:23:00,https://www.hindustantimes.com/other-sports/viswanathan-anand-loses-to-shakhriyar-mamedyarov-falls-to-last-spot-in-norway-chess/story-xu9muuk1Q9VFSBZTDjxh6L.html
Hindiustan Times,FIH Series Finals: India thrash hapless Russia 10-0,other,2019-06-06,21:41:00,https://www.hindustantimes.com/other-sports/fih-series-finals-india-thrash-hapless-russia-10-0/story-rhhQFrJ2giGXNJVTytIfVP.html
Hindiustan Times,"Sindhu, Sameer lose in dismal day for India at Australian Open",other,2019-06-06,14:27:00,https://www.hindustantimes.com/other-sports/sindhu-sameer-lose-in-dismal-day-for-india-at-australian-open/story-RsFADPrfqYXQ24dctGZK5I.html
Hindiustan Times,Viswanathan Anand loses to Carlsen in Armageddon,other,2019-06-06,12:24:00,https://www.hindustantimes.com/other-sports/viswanathan-anand-loses-to-carlsen-in-armageddon/story-p0joNMgIBE3LMmPhwWyRrK.html
Hindiustan Times,Hamilton seeks magnificent seven for himself and Mercedes,other,2019-06-06,12:24:00,https://www.hindustantimes.com/other-sports/hamilton-seeks-magnificent-seven-for-himself-and-mercedes/story-TxxnQHZLf98Fy9BrUCloPI.html
Hindiustan Times,Indian hockey team kick off Olympic build-up against Russia,other,2019-06-06,01:35:00,https://www.hindustantimes.com/other-sports/indian-hockey-team-kick-off-olympic-build-up-against-russia/story-LYkEDmTx37sJWS7aAvV8GM.html
Hindiustan Times,"Sindhu, Sameer make impressive starts at Australian Open",other,2019-06-05,17:56:00,https://www.hindustantimes.com/other-sports/sindhu-sameer-make-impressive-starts-at-australian-open/story-bXnKQm8tCXw3V3ucEI6FlJ.html
Hindiustan Times,Stakes high for but India up for FIH series finals,other,2019-06-05,10:37:00,https://www.hindustantimes.com/other-sports/stakes-high-for-but-india-up-for-fih-series-finals/story-lqKaNykH6DVw77yOS36xpI.html
Hindiustan Times,India beat Japan 4-1 in final warmup tie,other,2019-06-05,10:37:00,https://www.hindustantimes.com/other-sports/india-beat-japan-4-1-in-final-warmup-tie/story-PdfrGTGcKBS2oLQlHAAe4J.html
Hindiustan Times,Anirban Lahiri qualifies for his third US Open,other,2019-06-04,12:37:00,https://www.hindustantimes.com/other-sports/anirban-lahiri-qualifies-for-his-third-us-open/story-LS75zM3S1MmDdqtQqry3QL.html
Hindiustan Times,"‘Focus on limiting changes to hockey,’ says FIH’s CEO Thierry Weil",other,2019-06-04,11:37:00,https://www.hindustantimes.com/other-sports/focus-on-limiting-changes-to-hockey-says-fih-s-ceo-thierry-weil/story-ZCeak9mkBRd8s1g3IGSDjM.html
Hindiustan Times,"Sindhu, Prannoy eye good show at Australia Open",other,2019-06-03,18:58:00,https://www.hindustantimes.com/other-sports/sindhu-prannoy-eye-good-show-at-australia-open/story-D5H2INF8QchAHo907MUuTL.html
Hindiustan Times,Aditi makes cut at the US Women’s Open,other,2019-06-01,14:18:00,https://www.hindustantimes.com/other-sports/aditi-makes-cut-at-the-us-women-s-open/story-dWrNuSyKdAzPuvboBVOnFN.html
Hindiustan Times,"Vijender is scared, respect Goyat as he stood up to fight: Boxer Amir Khan ",other,2019-06-01,10:30:00,https://www.hindustantimes.com/other-sports/vijender-is-scared-respect-goyat-as-he-stood-up-to-fight-boxer-amir-khan/story-RmuznktInPfhfynXWnWJNM.html
Hindiustan Times,Sushil Kumar’s World Championship participation in danger after being excluded from national camp,other,2019-05-31,23:58:00,https://www.hindustantimes.com/other-sports/sushil-kumar-s-world-championship-participation-in-danger-after-being-excluded-from-national-camp/story-BS64NY0htNzMHb2mYpXp6J.html
Hindiustan Times,ISSF World Cup: Indian teams win both mixed event gold medals,other,2019-05-31,09:46:00,https://www.hindustantimes.com/other-sports/issf-world-cup-indian-teams-win-both-mixed-event-gold-medals/story-lEa4tQ7TpvpzAnm4jHXq2I.html
Hindiustan Times,"Consistency is key, need to be wary of all opponents",other,2019-05-30,16:25:00,https://www.hindustantimes.com/other-sports/consistency-is-key-need-to-be-wary-of-all-opponents/story-zBBAQr8rHTX2vJmtDoUtbN.html
Hindiustan Times,Indian weightlifters caught for doping violation,other,2019-05-29,20:12:00,https://www.hindustantimes.com/other-sports/indian-weightlifters-caught-for-doping-violation/story-pkdwi5YSccSaS4U9EPA06O.html
Hindiustan Times,Pay Rs 8 lakh penalty or face life ban: WFI to tell Reena after failed dope test,other,2019-05-29,23:50:00,https://www.hindustantimes.com/other-sports/pay-rs-8-lakh-penalty-or-face-life-ban-wfi-to-tell-reena-after-failed-dope-test/story-NmdO3RFul2V1s67CKVqyYI.html
Hindiustan Times,Manu Bhaker secures India’s 7th Olympic quota in shooting,other,2019-05-29,18:37:00,https://www.hindustantimes.com/other-sports/manu-bhaker-secures-india-s-7th-olympic-quota-in-shooting/story-SdUzf34r6qHxNixWr5GzgK.html
Hindiustan Times,Hockey India names 18-member Indian women’s team for the FIH Series Finals,other,2019-05-29,14:27:00,https://www.hindustantimes.com/other-sports/hockey-india-names-18-member-indian-women-s-team-for-the-fih-series-finals/story-fRyspdOrv6nlVmjYyg4tOO.html
