Source,Heading,Category,Date,Time,URL,Cluster,cluster_similarity_value
cnbc, Global recession fears grow as manufacturing shrinks across Asia Some economists predict a world recession and a renewed race to the bottom on interest rates if trade tensions fail to ease at a Group of 20 summits in Osaka Japan at the end of June when presidents Donald Trump and Xi Jinping could meet,infrastructure,2019-06-19,01:04,https://www.cnbctv18.com/economy/global-recession-fears-grow-as-manufacturing-shrinks-across-asia-3560851.htm,0,1.0
cnbc, Indian Railway withdraws proposal for head foot massages on 39 trains Mumbai headquartered Western Railway Saturday said it had withdrawn a proposal to provide foot and head massages to passengers on board 39 trains originating from Indore in Madhya Pradesh,infrastructure,2019-06-19,01:04,https://www.cnbctv18.com/infrastructure/indian-railway-withdraws-proposal-for-head-foot-massages-on-39-trains-3702891.htm,1,0.43
cnbc, Soon passengers can get massage service on board running trains For the first time in the history of Indian Railways massage services will be made available for passengers on board running trains,infrastructure,2019-06-19,01:04,https://www.cnbctv18.com/infrastructure/soon-passengers-can-get-massage-service-on-board-running-trains-3623741.htm,1,0.41
cnbc, IRCON prepares to bid for Zoji La tunnel and bullet train project State run construction company IRCON International Ltd is preparing to bid for two major projects this year including high speed rail corridor or bullet train and Zoji La tunnel in an attempt to boost its revenues,infrastructure,2019-06-19,01:04,https://www.cnbctv18.com/infrastructure/ircon-prepares-to-bid-for-zoji-la-tunnel-and-bullet-train-project-3577941.htm,1,0.38
cnbc, Jindal Stainless eyes 25 share in e rickshaw market in 2 years Jindal Stainless Ltd is targeting a 25 percent share of the total electric rickshaws e rickshaws market in India over the next 2 years and is in talks with manufacturers to facilitate their roll out in the country,infrastructure,2019-06-19,01:04,https://www.cnbctv18.com/auto/jindal-stainless-eyes-25-share-in-e-rickshaw-market-in-2-years-3600691.htm,2,0.64
cnbc, Infrastructure Investment Trusts can be a boon for India Here is why InvITs allow individuals and firms to invest a small amount of capital in infrastructure project in return for an income proportionate to their investment,infrastructure,2019-06-19,01:04,https://www.cnbctv18.com/economy/infrastructure-investment-trusts-can-be-a-boon-for-india-here-is-why-3661261.htm,3,0.37
cnbc, Reliance Infrastructure Q4 results today What you should watch out for Reliance Infrastructure is set to report its fourth quarter earnings on Friday and analysts expect the company to report a near 50 percent drop in revenue,infrastructure,2019-06-19,01:04,https://www.cnbctv18.com/infrastructure/reliance-infrastructure-q4-results-today-what-you-should-watch-out-for-3689591.htm,3,0.32
cnbc, Auditors concerns are related to road metro biz Reliance Infra confident of fulfilling debt obligations says CEO Punit Garg Auditors BSR Co LLP and Pathak H D Associates raised questions about Reliance Infras ability to continue as a going concern and have issued a disclaimer of opinion,infrastructure,2019-06-19,01:04,https://www.cnbctv18.com/infrastructure/auditors-concerns-are-related-to-road-metro-biz-reliance-infra-confident-of-fulfilling-debt-obligations-says-ceo-punit-garg-3711061.htm,3,0.34
cnbc, Housing sales up 3 in January March 2019 in 9 major cities Sale of residential apartments during the January March quarter of 2019 rose by 3 percent on a quarter on quarter basis to 33000 units across seven major cities in the country,infrastructure,2019-06-19,01:04,https://www.cnbctv18.com/infrastructure/housing-sales-up-3-in-january-march-2019-in-9-major-cities-3592091.htm,3,0.31
cnbc, Tata Sponge Iron may raise Rs 1800 crore via rights issue says report Tata Steels unit Tata Sponge Iron is looking to raise about Rs 1800 crore via a rights issue to retire existing debt early The Economic Times reported,infrastructure,2019-06-19,01:04,https://www.cnbctv18.com/infrastructure/tata-sponge-iron-may-raise-rs-1800-crore-via-rights-issue-says-report-3673591.htm,4,0.29
cnbc, Cement demand will bounce back in coming quarters says India Cements,infrastructure,2019-06-19,01:04,https://www.cnbctv18.com/infrastructure/cement-demand-will-bounce-back-in-coming-quarters-says-india-cements-3635851.htm,4,0.28
cnbc, Niti Aayog may sell assets of 50 state owned companies says report Niti Aayog is looking to sell assets of more than 50 state owned firms such as NTPC Bharat Earth Movers Cement Corp of India and Steel Authority of India The Economic Times reported,infrastructure,2019-06-19,01:04,https://www.cnbctv18.com/infrastructure/niti-aayog-may-sell-assets-of-50-state-owned-companies-says-report-3608371.htm,4,0.32
cnbc, Sajjan Jindals JSW Steel may bid for British Steel says report JSW Steel Indias second largest private steel producer may bid for British Steel Ltd after the companys liquidation advisor EY reached out to it the Mint reported,infrastructure,2019-06-19,01:04,https://www.cnbctv18.com/infrastructure/sajjan-jindals-jsw-steel-may-bid-for-british-steel-says-report-3608441.htm,4,0.3
cnbc, Urban Reality Mumbai coastal road a boon or bane The ambitious Mumbai coastal road is a proposed 29 2 km freeway that will connect south Mumbai to the western coastal suburbs,infrastructure,2019-06-19,01:04,https://www.cnbctv18.com/infrastructure/urban-reality-mumbai-coastal-road-a-boon-or-bane-3549141.htm,5,0.67
cnbc, Steel ministry seeks commerce ministrys urgent intervention to protect domestic players,infrastructure,2019-06-19,01:04,https://www.cnbctv18.com/infrastructure/steel-ministry-seeks-commerce-ministrys-urgent-intervention-to-protect-domestic-players-3662001.htm,6,0.54
cnbc, SFIO files first chargesheet in IL FS case names 30 individuals including businessman C Sivasankaran The Serious Fraud Investigation Office SFIO on Friday has filed its first chargesheet in the Infrastructure Leasing Financial Services IL FS case,infrastructure,2019-06-19,01:04,https://www.cnbctv18.com/infrastructure/sfio-files-first-chargesheet-in-ilfs-case-names-30-individuals-including-c-sivasankaran-3542051.htm,7,0.28
cnbc, Jaypee Infra insolvency Lenders move NCLAT seeking nod to vote against NBCC bid Lenders of Jaypee Infratech have filed a petition before the NCLAT to allow them to vote against NBCCs bid in an ongoing insolvency process,infrastructure,2019-06-19,01:04,https://www.cnbctv18.com/infrastructure/jaypee-infra-insolvency-lenders-move-nclat-seeking-nod-to-vote-against-nbcc-bid-3545341.htm,7,0.31
cnbc, Vedanta to challenge winding up of Zambian business in court According to a notice filed in court on June 6 Vedanta wants to be represented by lawyers Nchito Nchito and not those appointed by the provisional liquidator,infrastructure,2019-06-19,01:04,https://www.cnbctv18.com/infrastructure/vedanta-to-challenge-winding-up-of-zambian-business-in-court-3648351.htm,7,0.34
cnbc, EUs anti trust authority blocks Thyssenkrupp Tata Steel merger plan The commission the EUs executive arm criticised the merger which would have reduced competition and increased prices for different types of steel a statement said,infrastructure,2019-06-19,01:04,https://www.cnbctv18.com/infrastructure/eus-anti-trust-authority-blocks-thyssenkrupp-tata-steel-merger-plan-3652601.htm,8,0.63
cnbc, Karnataka launches online building plan approval facility Urban Development Minister U T Khader said the initiative of his department will save people from running from pillar to post to get approvals It will also remove middlemen from the system he told reporters here,infrastructure,2019-06-19,01:04,https://www.cnbctv18.com/infrastructure/karnataka-launches-online-building-plan-approval-facility-3686221.htm,9,0.41
cnbc, CCI clears Schneider Electric India MacRitchies buyout of L T arm The Ministry of Corporate Affairs MCA in a statement however noted that the acquisition could lead to lesser competition in the market Therefore the CII has ordered the acquirers to reserve a part of L Ts installed capacity to offer white labelling services to third party competitors,infrastructure,2019-06-19,01:04,https://www.cnbctv18.com/infrastructure/cci-clears-schneider-electric-india-macritchies-buyout-of-lt-arm-3607861.htm,9,0.44
cnbc, L T plans to sell 3 8 of its technology services,infrastructure,2019-06-19,01:04,https://www.cnbctv18.com/infrastructure/lt-plans-to-sell-3-8-of-its-technology-services-3565611.htm,9,0.41
cnbc, Adani expects to ship first coal from Australian mine in two years,infrastructure,2019-06-19,01:04,https://www.cnbctv18.com/infrastructure/adani-expects-to-ship-first-coal-from-australian-mine-in-two-years-3675191.htm,10,0.39
cnbc, Indias undelivered home crisis Can government step in to save homebuyers Experts Discuss The mess in Indias housing sector only seems to be getting deeper Reliable sources from both industry bodies NAREDCO and CREDAI have confirmed to CNBC TV18 that the number of builders arrested in jail and out on bail has crossed 150 across India,infrastructure,2019-06-19,01:04,https://www.cnbctv18.com/infrastructure/indias-undelivered-home-crisis-can-government-step-in-to-save-homebuyers-experts-discuss-3681651.htm,10,0.43
cnbc, Will work with full strength to increase job opportunities in MSMEs says Gadkari This portfolio is associated with the most important issue the countrys growth rate and employment potential And it is the PMs expectation that employment should increase from this sector which is very low now and there should be creation of employment he said,infrastructure,2019-06-19,01:04,https://www.cnbctv18.com/economy/will-work-with-full-strength-to-increase-job-opportunities-in-msmes-says-gadkari-3560691.htm,11,1.0
cnbc, AP govts decision to cancel projects will not affect Dilip Buildcon says Rohan Suryavanshi,infrastructure,2019-06-19,01:04,https://www.cnbctv18.com/infrastructure/dilip-buildcon-does-not-yet-know-extent-of-damages-from-ap-govt-order-3573251.htm,12,1.0
cnbc, SAIL gets positive response from Odisha government on land allocation request says chairman As part of its 50 mtpa expansion plan SAIL is planning to set up a 3 million tonnes per annum mtpa shore based plant at an estimated cost of over Rs 15000 crore in Odisha,infrastructure,2019-06-19,01:04,https://www.cnbctv18.com/infrastructure/sail-gets-positive-response-from-odisha-government-on-land-allocation-request-says-chairman-3630571.htm,13,0.57
