Newspaper,Heading,Date,Time,URL
Hindiustan Times,Sonam Kapoor with husband Anand Ahuja at GQ 100 Best Dressed 2019,2019-06-02,13:55:00,https://www.hindustantimes.com/videos/entertainment/sonam-kapoor-with-husband-anand-ahuja-at-gq-100-best-dressed-2019/video-S7frWI6yR3BOlnAAXr0DUN.html
Hindiustan Times,Saif Ali Khan and Kareena Kapoor leave for London with son Taimur,2019-05-31,13:46:00,https://www.hindustantimes.com/videos/entertainment/saif-ali-khan-and-kareena-kapoor-leave-for-london-with-son-taimur/video-TLEnyHw2B6jNt9IeZphUjO.html
Hindiustan Times,Bollywood stars attend prayer meet of Ajay Devgn’s father,2019-05-31,12:18:00,https://www.hindustantimes.com/videos/entertainment/bollywood-stars-attend-prayer-meet-of-ajay-devgn-s-father/video-9CPAeYIQM8nTsFwyCjBJtL.html
Hindiustan Times,"Kangana, Hema Malini fly to Delhi for PM Modi’s swearing-in ceremony",2019-05-30,17:26:00,https://www.hindustantimes.com/videos/entertainment/kangana-hema-malini-fly-to-delhi-for-pm-modi-s-swearing-in-ceremony/video-zzQPgkFZGSqt0xSmdmZlYO.html
Hindiustan Times,"Actor Dinyar Contractor, known for his roles in films like Baadshah and Khiladi, dies at 79",2019-06-05,12:29:00,https://www.hindustantimes.com/bollywood/actor-dinyar-contractor-known-for-his-roles-in-films-like-baadshah-and-khiladi-dies-at-79/story-JP0MqWmh0l4YlxFRvonuQJ.html
Hindiustan Times,"Mira Rajput’s son Zain pinches sister Misha as she helps him play with a flower, see pics",2019-06-05,11:48:00,https://www.hindustantimes.com/bollywood/mira-rajput-s-son-zain-pinches-sister-misha-as-she-helps-him-play-with-a-flower-see-pics/story-PQ7Myp8POHUjL12kllmP8K.html
Hindiustan Times,Katrina Kaif reveals she had one condition before signing Bharat. Details inside,2019-06-05,11:39:00,https://www.hindustantimes.com/bollywood/katrina-kaif-reveals-she-had-one-condition-before-signing-bharat-details-inside/story-5Bfl55LEqEDtgPmo9PVsyH.html
Hindiustan Times,"Sara Ali Khan twins with mom Amrita in green apron, says ‘Eid Mubarak’. See pic",2019-06-05,10:53:00,https://www.hindustantimes.com/bollywood/sara-ali-khan-twins-with-mom-amrita-in-green-apron-says-eid-mubarak-see-pic/story-VjzuxAOrvEyB902nvTqa8H.html
Hindiustan Times,"Tiger Shroff, Abhishek Bachchan and other Bollywood celebs impressed with Hrithik Roshan’s Super 30 trailer",2019-06-05,10:55:00,https://www.hindustantimes.com/bollywood/tiger-shroff-abhishek-bachchan-and-other-bollywood-celebs-impressed-with-hrithik-roshan-s-super-30-trailer/story-FNccU2TOUeRv4tml7lLGzI.html
Hindiustan Times,"Black Mirror season 5 review: Twisted and terrifying, Netflix’s feel-bad show returns for another round",2019-06-05,10:16:00,https://www.hindustantimes.com/tv/black-mirror-season-5-review-twisted-and-terrifying-netflix-s-feel-bad-show-returns-for-another-round/story-XcFRPdhuiXXi9axFOsWO1L.html
Hindiustan Times,"New James Bond film’s set rocked by an explosion, one crew member injured",2019-06-05,10:09:00,https://www.hindustantimes.com/hollywood/new-james-bond-film-rocked-by-an-explosion-one-crew-member-injured/story-ZfMmMR7Qv7OFMUIiX43eqK.html
Hindiustan Times,"Deepika Padukone wraps up ‘most precious film’ of her career, Chhapaak and Ranveer Singh can’t wait for the magic. See pic",2019-06-05,10:08:00,https://www.hindustantimes.com/bollywood/deepika-padukone-wraps-up-most-precious-film-of-her-career-chhapaak-and-ranveer-singh-can-t-wait-for-the-magic-see-pic/story-f4HUr1tnjJlXkbWYYguKDN.html
Hindiustan Times,"Priyanka Chopra praises Nick Jonas, says it’s ‘incredible how your bond is as a family’ at Chasing Happiness launch, see pics",2019-06-05,09:26:00,https://www.hindustantimes.com/bollywood/priyanka-chopra-praises-nick-jonas-says-it-s-incredible-how-your-bond-is-as-a-family-at-chasing-happiness-launch-see-pics/story-L00ZJ8nFTO5xutrc1qPZBJ.html
Hindiustan Times,"Bharat celeb review: Salman Khan, Katrina Kaif film is labelled ‘paisa Vasool blockbuster’, see pics",2019-06-05,09:37:00,https://www.hindustantimes.com/bollywood/bharat-celeb-review-salman-khan-katrina-kaif-film-is-labelled-paisa-vasool-blockbuster-see-pics/story-tJ8sNOA0YwQPWvVCeAgg1H.html
Hindiustan Times,"Salman Khan, Katrina Kaif’s Bharat premieres ahead of Eid, Tabu, Sonali Kulkarni walk the red carpet. See pics",2019-06-04,21:47:00,https://www.hindustantimes.com/bollywood/salman-khan-katrina-kaif-s-bharat-premieres-ahead-of-eid-tabu-sonali-kulkarni-walk-the-red-carpet-see-pics/story-T3H5QSTBBl1qdgxYq79hVP.html
Hindiustan Times,"Mohanlal’s Lucifer storms into Rs 200 crore club, first for Malayalam cinema",2019-06-04,20:46:00,https://www.hindustantimes.com/regional-movies/mohanlal-s-lucifer-storms-into-rs-200-crore-club-first-for-malayalam-cinema/story-vTm7JXaAdz0FWFTllE4n2I.html
Hindiustan Times,Medically Yourrs review: This engrossing drama treats MBBS jitters with love ,2019-06-05,09:33:00,https://www.hindustantimes.com/tv/medically-yours-review-this-engrossing-drama-treats-mbbs-jitters-with-love/story-hgS4vjz6tz0ul5jU0CPwvM.html
Hindiustan Times,"Kajol posts heartfelt tribute for father-in-law Veeru Devgan, says ‘RIP with love’",2019-06-04,19:42:00,https://www.hindustantimes.com/bollywood/kajol-posts-heartfelt-tribute-for-father-in-law-veeru-devgan-says-rip-with-love/story-Ngf4D2l3t5jTEaQYvEH57J.html
Hindiustan Times,"Neena Gupta celebrates 60th birthday with daughter Masaba, Soni Razdan posts a heartfelt wish for her ‘pyari dost’ ",2019-06-04,19:43:00,https://www.hindustantimes.com/bollywood/neena-gupta-celebrates-60th-birthday-with-daughter-masaba-soni-razdan-posts-a-heartfelt-wish-for-her-pyari-dost/story-rB8M2Z6yZbYqgqbzkEdIxH.html
Hindiustan Times,"Vicky Kaushal, Janhvi Kapoor, Ishaan Khatter attend Russell Peters’ show; Malaika Arora, Mira Rajput hit the gym",2019-06-04,19:16:00,https://www.hindustantimes.com/bollywood/vicky-kaushal-janhvi-kapoor-ishaan-khatter-attend-russell-peters-show-malaika-arora-mira-rajput-hit-the-gym/story-l2kKs8abmymEmUjQFJsYJN.html
Hindiustan Times,"As Hrithik Roshan’s Super 30 trailer gives way to hilarious memes, Twitter plays on Indian elections, nepotism",2019-06-04,18:08:00,https://www.hindustantimes.com/bollywood/as-hrithik-roshan-s-super-30-trailer-gives-way-to-hilarious-memes-twitter-plays-on-indian-elections-nepotism/story-XPOfMe7aLdB3uUaegXb3HO.html
Hindiustan Times,"Jackie Shroff on Salman Khan: ‘I used to carry his photos in my pocket, ask producers to cast him’",2019-06-04,17:35:00,https://www.hindustantimes.com/bollywood/jackie-shroff-on-salman-khan-i-used-to-carry-his-photos-in-my-pocket-ask-producers-to-cast-him/story-zVDEstKoH9Q17On5cqgX3O.html
Hindiustan Times,Shraddha Kapoor shares happy picture with Varun Dhawan from sets of Street Dancer 3D,2019-06-04,16:32:00,https://www.hindustantimes.com/bollywood/shraddha-kapoor-shares-happy-picture-with-varun-dhawan-from-sets-of-street-dancer-3d/story-3JgH78gxyGE9UmItWWfN4M.html
Hindiustan Times,"Kevin Spacey appears in court, lawyer says ‘he is suffering every day that this goes on’",2019-06-04,15:44:00,https://www.hindustantimes.com/hollywood/kevin-spacey-appears-in-court-lawyer-says-he-is-suffering-every-day-that-this-goes-on/story-XQzN4LOaQLUdYtErZpMpVP.html
Hindiustan Times,Taapsee Pannu reacts to Vikas Bahl getting a clean chit: ‘That should not stop other girls from raising their voices’,2019-06-04,15:05:00,https://www.hindustantimes.com/bollywood/taapsee-pannu-reacts-to-vikas-bahl-getting-a-clean-chit-that-should-not-stop-other-girls-from-raising-their-voices/story-po3PkJkgzAsr74Gbtbp0XK.html
Hindiustan Times,"Super 30 trailer: Hrithik Roshan slaps on some tanning lotion, young actors bring in emotion",2019-06-04,16:42:00,https://www.hindustantimes.com/bollywood/super-30-trailer-hrithik-roshan-puts-on-some-tanning-lotion-young-actors-bring-in-emotion/story-brWefeN2xgrVqHD6AD7eJL.html
Hindiustan Times,The Extraordinary Journey Of The Fakir trailer: Dhanush embarks on a crazy journey to Paris via a twisted route,2019-06-04,17:35:00,https://www.hindustantimes.com/entertainment/the-extraordinary-journey-of-the-fakir-trailer-dhanush-embarks-on-a-crazy-journey-to-paris-via-a-twisted-route/story-nDSeC5oPs5DTrHh2dKSRVJ.html
Hindiustan Times,"Salman Khan says Priyanka Chopra quit Bharat to get married knowing it might make him angry, which is a ‘gutsy thing to do’",2019-06-04,16:56:00,https://www.hindustantimes.com/bollywood/salman-khan-says-priyanka-chopra-quit-bharat-to-get-married-knowing-it-might-make-him-angry-which-is-a-gutsy-thing-to-do/story-raNk5PxrWG9uiKyG8ojaAK.html
Hindiustan Times,K-Pop band VAV: Want to work with Aamir Khan ever since we saw 3 Idiots ,2019-06-04,13:22:00,https://www.hindustantimes.com/music/k-pop-band-vav-want-to-work-with-aamir-khan-ever-since-we-saw-3-idiots/story-j4oN1oV34b6HuHMX9cB6RO.html
Hindiustan Times,Akshay Kumar zooms through the streets of Bangkok as he shoots for Rohit Shetty’s Sooryavanshi,2019-06-04,12:46:00,https://www.hindustantimes.com/bollywood/akshay-kumar-zooms-through-the-streets-of-bangkok-as-he-shoots-for-rohit-shetty-s-sooryavanshi/story-la5LELALFwI0J853cmxkjN.html
Hindiustan Times,"Rajinikanth, Akshay Kumar’s 2.0 to release in China on July 12, retitled Robot 2.0: Resurgence ",2019-06-04,12:32:00,https://www.hindustantimes.com/regional-movies/rajinikanth-akshay-kumar-s-2-0-to-release-in-china-on-july-12-retitled-robot-2-0-resurgence/story-rS90yM0XdOyWGSqAo3ikwJ.html
Hindiustan Times,"Miley Cyrus groped by fan, reached out to husband Liam Hemsworth for help",2019-06-04,12:00:00,https://www.hindustantimes.com/hollywood/miley-cyrus-groped-by-fan-reached-out-to-husband-liam-hemsworth-for-help/story-hCQQKrzCUZ94WHolGkavfI.html
Hindiustan Times,"Sushmita Sen lost her passport before Miss Universe, organisers wanted to send Aishwarya Rai instead",2019-06-04,11:28:00,https://www.hindustantimes.com/bollywood/sushmita-sen-lost-her-passport-before-miss-universe-organisers-wanted-to-send-aishwarya-rai-instead/story-1ejlyBsFfyphYHxcq7z8fK.html
Hindiustan Times,Actor Arzoo Govitrikar granted restraining order against husband Siddharth Sabharwal,2019-06-04,11:15:00,https://www.hindustantimes.com/bollywood/actor-arzoo-govitrikar-granted-restraining-order-against-husband-siddharth-sabharwal/story-LeN7HvNZCR6h0ZboRLCM9M.html
Hindiustan Times,Delhi high court dismisses plea to stay release of Bharat: ‘Petition was premature and filed to draw mileage from movie’,2019-06-04,10:22:00,https://www.hindustantimes.com/bollywood/delhi-high-court-dismisses-plea-to-stay-release-of-bharat-petition-was-premature-and-filed-to-draw-mileage-from-movie/story-bL4zNYYPwrMnsm2mKXKqTN.html
Hindiustan Times,"Chernobyl review: An outright masterpiece, HBO delivers the best new show of 2019. 5 stars",2019-06-04,09:51:00,https://www.hindustantimes.com/tv/chernobyl-review-an-outright-masterpiece-hbo-delivers-the-best-new-show-of-2019-5-stars/story-XRf1htFIDND5RQMBioIgeN.html
Hindiustan Times,Ranveer Singh roots for Mumbai dance group on America’s Got Talent: ‘Gully boys dancing like Peshwas’,2019-06-04,09:35:00,https://www.hindustantimes.com/tv/ranveer-singh-roots-for-mumbai-dance-group-on-america-s-got-talent-gully-boys-dancing-like-peshwas/story-hMXZoa8VBbJ9XZL4PkMp2M.html
Hindiustan Times,"Aamir Khan’s daughter Ira Khan debuts first tattoo, look closer to see what it says. See pic",2019-06-04,09:26:00,https://www.hindustantimes.com/bollywood/aamir-khan-s-daughter-ira-khan-debuts-first-tattoo-look-closer-to-see-what-it-says-see-pic/story-7oi9t5t1ZQYuohVujlnrVJ.html
Hindiustan Times,"Priyanka Chopra, Sophie Turner cheer for Nick, Joe Jonas at Jonas Brothers docu Chasing Happiness premiere. See pics",2019-06-04,08:49:00,https://www.hindustantimes.com/tv/priyanka-chopra-sophie-turner-cheer-for-nick-joe-jonas-at-jonas-brothers-docu-chasing-happiness-premiere-see-pics/story-li5xamRvoB08Iibx4qITyJ.html
Hindiustan Times,"Shah Rukh Khan’s kids Aryan, Suhana had a blast at AbRam’s birthday party. See new pics",2019-06-04,08:46:00,https://www.hindustantimes.com/bollywood/shah-rukh-khan-s-kids-aryan-suhana-had-a-blast-at-abram-s-birthday-party-see-new-pics/story-HkDcj5277IzHMfARMymeLI.html
Hindiustan Times,Keanu Reeves in talks to make Marvel debut with Angelina Jolie starrer The Eternals,2019-06-03,21:26:00,https://www.hindustantimes.com/hollywood/keanu-reeves-in-talks-to-make-marvel-debut-with-angelina-jolie-starrer-the-eternals/story-JZvz4CcTD8tFHNMUd1ZeAP.html
Hindiustan Times,"Have you seen these pics of Hrithik Roshan, Janhvi Kapoor, Ajay Devgn with daughter Nysa and son Yug",2019-06-03,21:16:00,https://www.hindustantimes.com/bollywood/have-you-seen-these-pics-of-hrithik-roshan-janhvi-kapoor-ajay-devgn-with-daughter-nysa-and-son-yug/story-Dg6Ck3mt8wX1xb08kaEr2K.html
Hindiustan Times,"Shah Rukh Khan attends hairstylist’s sister’s wedding, leaves the guests thrilled. Watch video ",2019-06-04,08:55:00,https://www.hindustantimes.com/bollywood/shah-rukh-khan-attends-make-up-man-s-wedding-leaves-the-guests-thrilled-watch-video/story-fAJ9GYPJg3pYoBLS1DxEXM.html
Hindiustan Times,The support of the LGBTQIA+ community meant a lot: Priya Bapat,2019-06-03,19:27:00,https://www.hindustantimes.com/regional-movies/the-support-of-the-lgbtqia-community-meant-a-lot-priya-bapat/story-FA8kIqFJ7aXi04i0ghj8KO.html
Hindiustan Times,"Varun Dhawan, Shraddha Kapoor to recreate Guru Randhawa’s Lahore for Street Dancer 3D",2019-06-03,19:14:00,https://www.hindustantimes.com/bollywood/varun-dhawan-shraddha-kapoor-to-recreate-guru-randhawa-s-lahore-for-street-dancer-3d/story-bO7Y54roHygAsoYwAU5TWJ.html
Hindiustan Times,"Priyanka Chopra on political aspirations: ‘I would love to run for prime minister of India, Nick to run for US president’",2019-06-03,18:55:00,https://www.hindustantimes.com/bollywood/priyanka-chopra-on-political-aspirations-i-would-love-to-run-for-prime-minister-of-india-nick-to-run-for-us-president/story-ZBPTsQbxE1jKYJUm3OFTnJ.html
Hindiustan Times,Sushmita Sen reveals how her first interaction with boyfriend Rohman Shawl happened by mistake,2019-06-03,18:32:00,https://www.hindustantimes.com/bollywood/sushmita-sen-reveals-how-her-first-interaction-with-boyfriend-rohman-shawl-happened-by-mistake/story-XaOE8YvMq70yLz5fNDZ1IK.html
Hindiustan Times,Vikas Bahl cleared of #MeToo charges: Here’s what his industry colleagues have to say,2019-06-03,17:27:00,https://www.hindustantimes.com/bollywood/vikas-bahl-cleared-of-metoo-charges-here-s-what-his-industry-colleagues-have-to-say/story-nPRHGdsKDy0AJVQanaA8ZL.html
Hindiustan Times,"Kareena Kapoor shows her quirky side in magazine photo shoot, shares frame with Karan Johar, Diljit Dosanjh. See pics",2019-06-03,17:17:00,https://www.hindustantimes.com/bollywood/kareena-kapoor-shows-her-quirky-side-in-magazine-photo-shoot-shares-frame-with-karan-johar-diljit-dosanjh-see-pics/story-1hi2fiXxnXnD82rM391EhJ.html
Hindiustan Times,Salman Khan congratulates PM Modi and his cabinet,2019-06-03,16:58:00,https://www.hindustantimes.com/bollywood/salman-khan-congratulates-pm-modi-and-his-cabinet/story-BDeDiYd3CFGBvjpXvuqhEP.html
Hindiustan Times,Ali Abbas Zafar reacts to Salman Khan’s comments on Priyanka Chopra: ‘What he’s doing to her happens to me on set everyday’,2019-06-03,17:23:00,https://www.hindustantimes.com/bollywood/ali-abbas-zafar-reacts-to-salman-khan-s-comments-on-priyanka-chopra-what-he-s-doing-to-her-happens-to-me-on-set-everyday/story-P2CYJC7jZLtHHfHqz8sTTL.html
Hindiustan Times,"Ranbir Kapoor, Alia Bhatt’s pics from Brahmastra shoot in Varanasi leak online, see pics",2019-06-03,16:24:00,https://www.hindustantimes.com/bollywood/ranbir-kapoor-alia-bhatt-s-pics-from-brahmastra-shoot-in-varanasi-leak-online-see-pics/story-lThBAkb58TpLDnYGY97t3K.html
Hindiustan Times,"Nawazuddin Siddiqui to star in Netflix’s Serious Men, directed by Sudhir Mishra",2019-06-03,15:51:00,https://www.hindustantimes.com/bollywood/nawazuddin-siddiqui-to-star-in-netflix-s-serious-men-directed-by-sudhir-mishra/story-rX7KkpFo2gKQLX9ux5jZ8I.html
Hindiustan Times,"Priyanka Chopra backs Meghan Markle, calls her victim of racism",2019-06-03,15:31:00,https://www.hindustantimes.com/bollywood/priyanka-chopra-backs-meghan-markle-calls-her-victim-of-racism/story-R9zHle2JAXHbqdt1F80OyK.html
Indian Express,LiveBharat movie review and release LIVE UPDATES,2019-06-05,12:15:25 pm,https://indianexpress.com/article/entertainment/bollywood/bharat-movie-review-and-release-live-updates-5764008/
Indian Express,Actor Dinyar Contractor passes away,2019-06-05,11:54:00 am,https://indianexpress.com/article/entertainment/television/actor-dinyar-contractor-dead-5766024/
Indian Express,"LiveThottappan, Thamasha and Children’s Park movie review and release LIVE  UPDATES",2019-06-05,12:30:15 pm,https://indianexpress.com/article/entertainment/malayalam/thottappan-thamasha-childrens-park-in-cinemas-today-5765432/
Indian Express,First of Many: Rajpal Yadav revisits Shool,2019-06-05,8:02:24 am,https://indianexpress.com/article/entertainment/bollywood/rajpal-yadav-first-of-many-debut-film-shool-5762889/
Indian Express,Hrithik Roshan starrer Super 30’s trailer leaves Anand Kumar’s family in tears,2019-06-05,12:24:28:00,https://indianexpress.com/article/entertainment/bollywood/hrithik-roshan-super-30-trailer-anand-kumar-5766186/
Indian Express,"LiveThottappan, Thamasha and Children’s Park movie review and release LIVE UPDATES: Offer of Thamasha was like winning the lottery for Vinay",2019-06-05,12:00:43:00,https://indianexpress.com/article/entertainment/malayalam/thottappan-thamasha-childrens-park-in-cinemas-today-5765432/
Indian Express,"LiveBharat movie review and release LIVE UPDATES: Salman Khan’s film will be a mammoth hit, says Karan Johar",2019-06-05,12:00:16:00,https://indianexpress.com/article/entertainment/bollywood/bharat-movie-review-and-release-live-updates-5764008/
Indian Express,Actor Dinyar Contractor passes away,2019-06-05,11:54:00:00,https://indianexpress.com/article/entertainment/television/actor-dinyar-contractor-dead-5766024/
Indian Express,Dark Phoenix early reviews: A rushed sendoff,2019-06-05,11:48:29:00,https://indianexpress.com/article/entertainment/hollywood/x-men-dark-phoenix-early-reviews-5766030/
Indian Express,"Explosion on Bond 25 set causes injury, damage to studio",2019-06-05,11:33:30:00,https://indianexpress.com/article/entertainment/hollywood/explosion-on-bond-25-set-causes-injury-damage-to-studio-5765814/
Indian Express,"Shahid Kapoor, Katrina Kaif, Dulquer Salmaan and others wish fans on Eid-ul-Fitr",2019-06-05,10:23:36:00,https://indianexpress.com/article/entertainment/bollywood/katrina-kaif-mohanlal-dulquer-salmaan-actors-wish-on-eid-ul-fitr-5765672/
Indian Express,Chhapaak: Deepika Padukone wraps ‘the most precious film’ of her career,2019-06-05,09:54:20:00,https://indianexpress.com/article/entertainment/bollywood/chhapaak-deepika-padukone-wraps-the-most-precious-film-of-her-career-5765824/
Indian Express,Bharat: Salman Khan’s film to be affected by India vs South Africa World Cup match?,2019-06-05,09:14:38:00,https://indianexpress.com/article/entertainment/bollywood/box-office-collection/world-cup-2019-salman-khan-bharat-to-be-affected-by-india-vs-south-africa-match-5764746/
Indian Express,Ilaiyaraaja’s songs cannot be monetised without his permission: Madras HC,2019-06-05,09:06:26:00,https://indianexpress.com/article/entertainment/tamil/ilaiyaraaja-songs-cannot-be-monetised-without-his-permission-madras-hc-5765729/
Indian Express,First of Many: Rajpal Yadav revisits Shool,2019-06-05,08:02:24:00,https://indianexpress.com/article/entertainment/bollywood/rajpal-yadav-first-of-many-debut-film-shool-5762889/
Indian Express,"Eid-ul-Fitr: Varun Dhawan, Shraddha Kapoor and Mahira Khan wish fans on the auspicious occasion",2019-06-05,07:08:01:00,https://indianexpress.com/article/entertainment/bollywood/varun-dhawan-sophie-choudry-eid-ul-fitr-wishes-5764174/
India Times, Marvel Is Eyeing ‘John Wick’ Star Keanu Reeves For Its Next Film & We’re Already Excited! ,2019-06-05,12:33,https://www.indiatimes.com/entertainment/marvel-is-eyeing-john-wick-star-keanu-reeves-for-its-next-film-we-re-already-excited-368455.html
India Times," Priyanka Chopra Would Love To Be The Prime Minister Of India, Wants Nick To Run For President ",2019-06-05,12:33,https://www.indiatimes.com/entertainment/priyanka-chopra-would-love-to-be-the-prime-minister-of-india-wants-nick-to-run-for-president-368478.html
India Times," In A Heartwarming Gesture, Shah Rukh Khan Attends His Make-Up Man’s Wedding & Fans Are... ",2019-06-05,12:33,https://www.indiatimes.com/entertainment/in-a-heartwarming-gesture-shah-rukh-khan-attends-his-make-up-man-s-wedding-fans-are-gushing-368539.html
India Times, ‘Chernobyl’ Beats ‘GoT’ To Become The Highest-Rated TV Series Ever And We Are Not... ,2019-06-05,12:33,https://www.indiatimes.com/entertainment/celebs/chernobyl-beats-got-to-become-the-highest-rated-tv-series-ever-and-we-are-not-surprised-368563.html
India Times," Anand Kumar Is Teary-Eyed After Watching Hrithik's Trailer Of Super 30, Posts An Emotional Note ",2019-06-05,12:33,https://www.indiatimes.com/entertainment/celebs/anand-kumar-is-teary-eyed-after-watching-hrithik-s-trailer-of-super-30-posts-an-emotional-note-368575.html
India Times, SRK’s Take On Nationalism & Freedom In This 1997 Interview Makes A Lot Of Sense Even Today ,2019-06-05,12:33,https://www.indiatimes.com/entertainment/celebs/srk-s-take-on-nationalism-freedom-in-this-1997-interview-makes-a-lot-of-sense-even-today-368511.html
India Times, Salman Khan Calls Marriage A 'Dying Institution' But He Does Like The Idea Of Companionship ,2019-06-05,12:33,https://www.indiatimes.com/entertainment/celebs/salman-khan-calls-marriage-a-dying-institution-but-he-does-like-the-idea-of-companionship-368538.html
India Times," From A Dance Competition To Endless Fights, Anurag Kashyap & Taapsee Pannu Define The Term... ",2019-06-05,12:33,https://www.indiatimes.com/entertainment/from-a-dance-competition-to-endless-fights-anurag-kashyap-taapsee-pannu-define-the-term-bffs-perfectly-368470.html
India Times, Ekta Kapoor Compares Her Show ‘Naagin’ To ‘Game of Thrones’ And The Internet Is Losing... ,2019-06-05,12:33,https://www.indiatimes.com/entertainment/ekta-kapoor-compares-her-show-naagin-to-game-of-thrones-and-the-internet-is-losing-it-368441.html
India Times," Marvel Fans Just Can’t Get Over Iron Man’s Death, Start A Petition ‘Bring Tony Stark... ",2019-06-05,12:33,https://www.indiatimes.com/entertainment/marvel-fans-just-can-t-get-over-iron-man-s-death-start-a-petition-bring-tony-stark-back-368603.html
India Times," SRK Attends His Make Up Man's Wedding, Miley Cyrus Forcibly Kissed By A Fan & More From Ent. ",2019-06-05,12:33,https://www.indiatimes.com/entertainment/celebs/srk-attends-his-make-up-man-s-wedding-miley-cyrus-forcibly-kissed-by-a-fan-more-from-ent-368585.html
India Times," #MeToo: Kevin Spacey Makes An Appearance In Court, Lawyer Says He's Suffering Everyday! ",2019-06-05,12:33,https://www.indiatimes.com/entertainment/metoo-kevin-spacey-makes-an-appearance-in-court-lawyer-says-he-s-suffering-everyday-368579.html
India Times," Priyanka Chopra Finally Reveals How Nick, Joe & Sophie Turner Felt About The 'Global Scam'... ",2019-06-05,12:33,https://www.indiatimes.com/entertainment/celebs/priyanka-chopra-finally-reveals-how-nick-joe-sophie-turner-felt-about-the-global-scam-story-368570.html
India Times," In A Shocking Incident, Miley Cyrus Groped And Forcibly Kissed By A Fan In Barcelona ",2019-06-05,12:33,https://www.indiatimes.com/entertainment/in-a-shocking-incident-miley-cyrus-groped-and-forcibly-kissed-by-a-fan-in-barcelona-368551.html
India Times," Taapsee Pannu Feels If Perpetrators Aren't Punished, The Spirit Of #MeToo Movement Will Get... ",2019-06-05,12:33,https://www.indiatimes.com/entertainment/celebs/taapsee-pannu-feels-if-perpetrators-aren-t-punished-the-spirit-of-metoo-movement-will-get-shattered-368550.html
India Times," PC Wants To Become Prime Minister, Anurag Has Found A Great Friend In Taapsee & More From Ent ",2019-06-05,12:33,https://www.indiatimes.com/entertainment/pc-wants-to-become-prime-minister-anurag-has-found-a-great-friend-in-taapsee-more-from-ent-368522.html
India Times, Chris Hemsworth Had Fun Getting Cuddles & Belly Rubs From Robert Downey Jr When He Was Fat Thor ,2019-06-05,12:33,https://www.indiatimes.com/entertainment/chris-hemsworth-had-fun-getting-cuddles-belly-rubs-from-robert-downey-jr-when-he-was-fat-thor-368519.html
India Times, Brothers Spend 8 Years To Remake Toy Story 3 With Real Toys & The Outcome Is Simply Awesome ,2019-06-05,12:33,https://www.indiatimes.com/entertainment/brothers-spend-8-years-to-remake-toy-story-3-with-real-toys-the-outcome-is-simply-awesome-368494.html
India Times, Hrithik Roshan Grooves To ‘Ek Pal Ka Jeena’ In China & We Can't Get Enough Of His Cool... ,2019-06-05,12:33,https://www.indiatimes.com/entertainment/hrithik-roshan-grooves-to-ek-pal-ka-jeena-in-china-we-can-t-get-enough-of-his-cool-moves-368485.html
India Times," Keanu Reeves To Be Cast In Marvel Film, Ekta Kapoor Compares Naagin To GoT & More From Ent ",2019-06-05,12:33,https://www.indiatimes.com/entertainment/keanu-reeves-to-be-cast-in-marvel-film-ekta-kapoor-compares-naagin-to-got-more-from-ent-368458.html
India Times, Farhan Akhtar Is Living Every Football Fan’s Dream & We Are Green With Envy! ,2019-06-05,12:33,https://www.indiatimes.com/entertainment/farhan-akhtar-is-living-every-football-fan-s-dream-we-are-green-with-envy-368464.html
India Times, Hawkeye And Ironman's ‘Conversation Of Joy & Love’ Is Making Us Emotional All Over Again! ,2019-06-05,12:33,https://www.indiatimes.com/entertainment/hawkeye-and-ironman-s-conversation-of-joy-love-is-making-us-emotional-all-over-again-368457.html
