Newspaper,Heading,Category,Date,Time,URL
Indian Express,LiveEngland vs Bangladesh live score,nil,2019-06-08,9:29:43 pm,https://indianexpress.com/article/sports/cricket-world-cup/england-vs-bangladesh-live-cricket-score-updates-eng-vs-ban-5770936/
Indian Express,LiveAFG vs NZ: James Neesham puts New Zealand in control,nil,2019-06-08,9:32:30 pm,https://indianexpress.com/article/sports/cricket-world-cup/afghanistan-vs-new-zealand-live-score-updates-5771143/
Indian Express,French Open 2019 Women's Final: Ashleigh Barty vs Marketa Vondrousova,nil,2019-06-08,9:33:52 pm,https://indianexpress.com/article/sports/tennis/french-open-2019-womens-final-ashleigh-barty-vs-marketa-vondrousova-live-score-streaming-updates-5771102/
Indian Express,Watch: Jason Roy's collision with umpire delays century celebrations,nil,2019-06-08,6:58:01 pm,https://indianexpress.com/article/sports/cricket-world-cup/jason-roy-collision-umpire-joel-wilson-england-vs-bangladesh-5771137/
Indian Express,"French Open 2019 Women’s Final: Barty defeats Vondrousova 6-1, 6-3 to win the title",nil,2019-06-08,21:33:52:00,https://indianexpress.com/article/sports/tennis/french-open-2019-womens-final-ashleigh-barty-vs-marketa-vondrousova-live-score-streaming-updates-5771102/
Indian Express,Saudi Arabia rejects women’s match in WWE Super Showdown,nil,2019-06-08,21:33:00:00,https://indianexpress.com/article/sports/wwe-wrestling/saudi-arabia-rejects-alexa-bliss-vs-natalya-in-wwe-super-showdown-reports/
Indian Express,"LiveBangladesh vs England Live Cricket Score Online, ICC World Cup 2019: Shakib nears his 100, Ban four down",nil,2019-06-08,21:27:38:00,https://indianexpress.com/article/sports/cricket-world-cup/england-vs-bangladesh-live-cricket-score-updates-eng-vs-ban-5770936/
Indian Express,FIFA Women’s World Cup: Giulia Gwinn wins it as Germany beat China 1-0 in their opener,nil,2019-06-08,21:26:53:00,https://indianexpress.com/article/sports/football/fifa-womens-world-cup-gwinn-goal-germany-beat-china-5771347/
Indian Express,Watch: Jofra Archer’s thunderbolt clips the bails and flies over the ropes,nil,2019-06-08,21:17:00:00,https://indianexpress.com/article/sports/cricket-world-cup/jofra-archer-hits-stumps-soumya-sarkar-flies-over-boundary/
Indian Express,Steve Smith is world’s best batsman in all three formats: Aaron Finch,nil,2019-06-08,21:14:50:00,https://indianexpress.com/article/sports/cricket-world-cup/steve-smith-world-best-batsman-aaron-finch-5771331/
Indian Express,"LiveAfghanistan vs New Zealand Live Cricket Score Online, World Cup 2019 LIVE Score: AFG vs NZ: James Neesham puts New Zealand in command",nil,2019-06-08,21:09:36:00,https://indianexpress.com/article/sports/cricket-world-cup/afghanistan-vs-new-zealand-live-score-updates-5771143/
Indian Express,You have chosen money over country: Shoaib Akhtar lashes out at AB De Villiers,nil,2019-06-08,21:05:29:00,https://indianexpress.com/article/sports/cricket-world-cup/you-shoaib-akhtar-lashes-out-at-ab-de-villiers-5770331/
Indian Express,French Open 2019: Dominic Thiem beats Novak Djokovic in dramatic semi-final,nil,2019-06-08,20:58:28:00,https://indianexpress.com/article/sports/tennis/french-open-2019-dominic-thiem-defeats-novak-djokovic-5771284/
Indian Express,World Cup 2019: Jason Roy’s stunning 153 takes England to their highest World Cup total,nil,2019-06-08,20:39:00:00,https://indianexpress.com/article/sports/jason-roys-hundred-england-vs-bangladesh-twitter-5771264/
Indian Express,"Arjun Munda, BVP Rao set to be elected presidents in two AAI elections",nil,2019-06-08,20:22:18:00,https://indianexpress.com/article/sports/sport-others/arjun-munda-bvp-rao-set-to-be-elected-presidents-in-two-aai-elections-5771297/
Indian Express,"India vs Australia: How is the weather at Kennington Oval, London",nil,2019-06-08,20:04:13:00,https://indianexpress.com/article/sports/cricket-world-cup/india-vs-australia-how-is-the-weather-at-kennington-oval-london-5771216/
India Today," Don't know what is happening with Dhoni gloves controversy, says Rohit SharmaWorld Cup 2019: India vice captain Rohit Sharma said he is unaware of the
controversy around MS Dhoni's gloves and people would see it on Sunday if the
Indian wicket-keeper wears the same gloves against Australia.",news,2019-06-08,21:37:00,https://www.indiatoday.in/sports/cricket-world-cup-2019/story/icc-cricket-world-cup-2019-ms-dhoni-gloves-controversy-rohit-sharma-australia-game-june-9-1545085-2019-06-08
India Today," England set new ODI record after posting their highest World Cup totalEngland posted 386/6 against Bangladesh in Taunton in their 3rd match of the
World Cup 2019 thus crossing the 300-run mark for a 7th time in succession",news,2019-06-08,21:37:00,https://www.indiatoday.in/sports/cricket-world-cup-2019/story/icc-cricket-world-cup-2019-england-vs-bangladesh-odi-record-300-total-1545084-2019-06-08
India Today," No player will think of what MS Dhoni is sporting on his gloves on Sunday: Harbhajan SinghWorld Cup 2019: Off-spinner Harbhajan Singh said the Indian team will not be
affected by the controversy around MS Dhoni's gloves when they take on
Australia in their next game on Sunday.",news,2019-06-08,21:37:00,https://www.indiatoday.in/sports/cricket-world-cup-2019/story/icc-cricket-world-cup-2019-harbhajan-singh-ms-dhoni-gloves-1545081-2019-06-08
India Today," World Cup 2019: Can’t pick favourites for India-Australia clash, says Sunil GavaskarIndia, who were knocked out of the 2015 World Cup by Australia, take on the
defending champions in one of the most-anticipated World Cup 2019 clashes at
The Oval on Sunday.",news,2019-06-08,21:37:00,https://www.indiatoday.in/sports/cricket-world-cup-2019/story/india-vs-australia-cricket-world-cup-2019-icc-predictions-sunil-gavaskar-harbhajan-singh-exclusives-1545052-2019-06-08
India Today," World Cup 2019: Net bowler hospitalised after getting hit on head by Warner shotAhead of their clash with India, Australia's practice session was halted
after a net bowler of Indian origin was injured off a David Warner shot.",news,2019-06-08,21:37:00,https://www.indiatoday.in/sports/cricket-world-cup-2019/story/icc-cricket-world-cup-2019-australia-practice-seeion-1545021-2019-06-08
India Today," World Cup 2019: Jason Roy hits 9th hundred and knocks down umpire Joel WilsonJason Roy smashed a hundred off 92 balls to lay a solid platform for England
in their third match of the World Cup 2019 against Bangladesh in Cardiff on
Saturday.",news,2019-06-08,21:37:00,https://www.indiatoday.in/sports/cricket-world-cup-2019/story/icc-cricket-world-cup-2019-england-vs-bangladesh-jason-roy-century-1544978-2019-06-08
India Today," World Cup 2019: Virat Kohli's school sending soil to London as blessing As India captain Virat Kohli looks to win his first World Cup as a captain,
his alma mater found a unique way to express their support by sending soil
from the Indian batsman’s school's ground.",news,2019-06-08,21:37:00,https://www.indiatoday.in/sports/cricket-world-cup-2019/story/world-cup-2019-virat-kohli-kapil-dev-m-s-dhoni-vishal-bharti-public-school-1544967-2019-06-08
India Today," Afghanistan vs New Zealand, World Cup 2019 Match 13: Prediction and Probable Playing 11Afghanistan vs New Zealand playing 11: Taunton Cricket Ground will be
returning to international cricket as it hosts its first ODI since 1999 with
Afghanistan taking on New Zealand on June 8. Here's all that you need to know
about the pitch and weather conditions in Taunton and the team news.",news,2019-06-08,21:37:00,https://www.indiatoday.in/sports/cricket-world-cup-2019/story/icc-cricket-world-cup-2019-afghanistan-vs-new-zealand-prediction-probable-xi-1544955-2019-06-08
India Today," Afghanistan vs New Zealand Live Score, World Cup 2019: Neesham's 5 wickets leave AFG reeling",news,2019-06-08,21:37:00,https://www.indiatoday.in/sports/story/afghanistan-vs-new-zealand-live-cricket-score-icc-world-cup-2019-afg-vs-nz-updates-1544941-2019-06-08
India Today," World Cup 2019: Nathan Coulter-Nile not sure of playing against India despite 92 vs WIAfter scoring 92 in just 60 balls which decided Australia's win against West
Indies, all-rounder Nathan Coulter-Nile says that it is good to have
competition among spots. However, he isn't very sure of himself for the
upcoming match between Australia and India.",news,2019-06-08,21:37:00,https://www.indiatoday.in/sports/cricket-world-cup-2019/story/icc-world-cup-2019-nathan-coulter-nile-west-indies-vs-australia-1544852-2019-06-08
India Today," AB de Villiers chose money over country: Shoaib AkhtarIn a YouTube video, Shoaib Akhtar slammed AB de Villiers for ""putting
finances over the country"". Shortly after South Africa's third defeat at the
World Cup, it was revealed that De Villiers had made a last ditch effort to
get into the Proteas squad.",news,2019-06-08,21:37:00,https://www.indiatoday.in/sports/cricket-world-cup-2019/story/shoaib-akhtar-ab-de-villiers-world-cup-2019-1544846-2019-06-08
India Today," ENG vs BAN Live Score, CWC 19: Shakib fifty keeps BAN hopes alive",news,2019-06-08,21:37:00,https://www.indiatoday.in/sports/story/england-vs-bangladesh-live-cricket-score-icc-world-cup-2019-eng-vs-ban-updates-1544847-2019-06-08
India Today," Virat Kohli fined Rs 500 for washing car with drinking waterIndia cricket team Virat Kohli was slapped a fine of Rs 500 by the Municipal
Corporation of Gurugram after his domestic help was seen washing the Indian
batsman's car with drinking water.",cricket,2019-06-08,21:37:00,https://www.indiatoday.in/sports/cricket/story/virat-kohli-india-cricket-team-fined-1544653-2019-06-08
India Today," CoA appoint former CEC N Gopalaswami as BCCI Electoral OfficerOn the advice of the Chief Election Commissioner of India, BCCI's Committee
of Administrators (CoA) has appointed former Chief Election Commissioner N
Gopalaswami as the supervisor for the upcoming Board elections",cricket,2019-06-08,21:37:00,https://www.indiatoday.in/sports/cricket/story/bcci-coa-chief-election-commissioner-n-gopalaswami-electoral-officer-1544563-2019-06-07
India Today," India's home season from September 15 with Freedom Series versus South AfricaThe BCCI today announced the schedule of Team India's home season for 2019-20
which starts with a series against South Africa, culminating with a second
visit by the Proteas in March 2020",cricket,2019-06-08,21:37:00,https://www.indiatoday.in/sports/cricket/story/bcci-announces-team-india-cricket-schedule-2019-2020-1541880-2019-06-03
India Today," Rest of the world: Sunil Gavaskar trolls England over non-English playersSalaam Cricket 2019: Sunil Gavaskar trolled England who have several
non-English players in their team. Eoin Morgan, their captain is an Irish
while their X-factor Jofra Archer is a West Indian.",cricket,2019-06-08,21:37:00,https://www.indiatoday.in/sports/story/salaam-cricket-2019-sunil-gavaskar-england-rest-of-the-world-1541139-2019-06-03
India Today," Still not convinced how England can handle home pressure: Vivian RichardsSalaam Cricket 2019: West Indian legend Viv Richards has thrown his support
behind the Carribean side while stating that he is still not sure whether
favourites England can handle the pressure of playing at home",cricket,2019-06-08,21:37:00,https://www.indiatoday.in/sports/story/salaam-cricket-2019-viv-richards-england-world-cup-home-1541138-2019-06-03
India Today," 1985 India team fitter than Virat Kohli's side: Sunil Gavaskar at Salaam Cricket 2019Sunil Gavaskar said the Indian team which won the World Championship of
Cricket in 1985 was probably the fittest the country has ever seen in one-day
cricket.",cricket,2019-06-08,21:37:00,https://www.indiatoday.in/sports/story/salaam-cricket-2019-sunil-gavaskar-indian-team-1985-world-championship-of-cricket-1541130-2019-06-03
India Today," Best bowling attack will win you the World Cup 2019: Nasser HussainSalaam Cricket 2019: Former cricketers Nasser Hussain and Viv Richards feel
that the white-ball game has come a long way since their own playing days",cricket,2019-06-08,21:37:00,https://www.indiatoday.in/sports/story/salaam-cricket-2019-nasser-hussain-viv-richards-wasim-akram-michael-clarke-1541129-2019-06-03
India Today," Salaam Cricket 2019: When Viv Richards stopped Sachin Tendulkar from retiringSachin Tendulkar revealed he was 90 percent certain of hanging up his boots
after the 2007 World Cup but a 45-minute phone call from his ""batting hero""
changed it all for the Master Blaster.",cricket,2019-06-08,21:37:00,https://www.indiatoday.in/sports/story/sachin-tendulkar-viv-richards-2007-retirement-phone-call-salaam-cricket-conclave-2019-1541094-2019-06-02
India Today," Salaam Cricket 2019: Full guest list, session names and timingSalaam Cricket 2019: Sachin Tendulkar. Wasim Akram. Shane Warne. Viv
Richards. These legends will join several others at Salaam Cricket 2019 on
June 2 in London.",cricket,2019-06-08,21:37:00,https://www.indiatoday.in/sports/story/salaam-cricket-2019-full-guest-list-session-names-and-timing-sachin-wasim-warne-viv-richards-1540254-2019-06-01
India Today," Rohit Sharma and Shikhar Dhawan reveal the funniest sledges by Indian playersIndian openers Rohit Sharma and Shikhar Dhawan, on a recent appearance on a
Youtube talk-show, revealed some of the funniest sledging incidents involving
Indians in recent memory",cricket,2019-06-08,21:37:00,https://www.indiatoday.in/sports/cricket/story/cricket-india-rohit-sharma-shikhar-dhawan-breakfast-with-champions-ajinkya-rahane-dhawal-kulkarni-1540125-2019-06-01
India Today," NZ vs SL Highlights, ICC World Cup 2019: NZ beat SL by 10 wickets",cricket,2019-06-08,21:37:00,https://www.indiatoday.in/sports/story/new-zealand-vs-sri-lanka-live-cricket-score-icc-world-cup-2019-nz-sl-1540115-2019-06-01
India Today," Former first-class players request BCCI to revise their pensionSanjay Jagdale, who has also been a BCCI secretary, has played 53 first-class
games for Madhya Pradesh while Delhi's Ashu Dani has featured in 49 matches",cricket,2019-06-08,21:37:00,https://www.indiatoday.in/sports/cricket/story/bcci-asked-to-raise-pension-for-sanjay-jagdale-ashu-dani-vinay-limba-first-class-cricket-1539422-2019-05-31
India Today," Neymar, sponsors suspend some ad campaigns after rape allegation - statementThe rape allegations surrounding Brazilian star, Neymar has resulted in
speculations that some of his sponsors have agreed to suspend some
advertising campaigns. A brazilian model has accused Neymar of raping and
assaulting her in Paris last month.",football,2019-06-08,21:37:00,https://www.indiatoday.in/sports/football/story/neymar-rape-allegations-sponsors-suspend-nike-mastercard-1544703-2019-06-08
India Today," Eden Hazard signs 5-year contract deal Real Madrid worth 100 million eurosReal Madrid did not reveal the fee but Spanish media reports said it was the
same price Madrid paid for Gareth Bale when he joined from Tottenham Hotspur
in 2013.",football,2019-06-08,21:37:00,https://www.indiatoday.in/sports/football/story/eden-hazard-signs-5-year-contract-deal-real-madrid-worth-100-million-euros-1544705-2019-06-08
India Today," Australian women footballers to get same base pay as menFootball Federation Australia said the country's W-League players will have
their annual minimum remuneration hiked by 33 percent matching men's A-League",football,2019-06-08,21:37:00,https://www.indiatoday.in/sports/football/story/australia-women-football-women-sport-australia-s-w-league-australia-s-a-league-1544341-2019-06-07
India Today," Nike 'very concerned' about rape accusation against NeymarSportswear manufacturing giant, Nike has said it is concerned over
allegations of rape against Neymar and that it will closely monitor the
situation before taking a call. The Paris Saint-Germain superstar has denied
the rape allegation",football,2019-06-08,21:37:00,https://www.indiatoday.in/sports/football/story/neymar-rape-accusation-nike-concerned-sponsorship-1544154-2019-06-07
India Today," Woman reaffirms allegations against Neymar: ‘I was the victim of rape’The woman who had accused Brazilian star footballer Neymar of raping her in
Paris last month, reasserted her claims in a television interview saying she
has been the victim of aggression together with rape.",football,2019-06-08,21:37:00,https://www.indiatoday.in/sports/football/story/brazilian-star-neymar-accused-of-raping-woman-in-paris-1543882-2019-06-06
India Today," Neymar ruled out of Copa America with ankle ligament injuryBrazil football said on Thursday that Neymar suffered the ankle injury during
Brazil's 2-0 friendly win over Qatar and that the star striker won't be able
to recover in time for their Copa America campaign. ",football,2019-06-08,21:37:00,https://www.indiatoday.in/sports/football/story/neymar-ankle-injury-brazil-football-ruled-out-copa-america-2019-1543802-2019-06-06
India Today," Ronaldo hat-trick sends Portugal to Nations League FinalsJuventus star Cristiano Ronaldo scored a hat-trick, including two late goals,
as Portugal beat Switzerland 3-1 in the Nations League semi-final.",football,2019-06-08,21:37:00,https://www.indiatoday.in/sports/football/story/ronaldo-hat-trick-sends-portugal-to-nations-league-finals-1543590-2019-06-06
India Today," Neymar limps off injured in friendly win over QatarNeymar limped off with an ankle injury after 17 minutes into the match but
Brazil managed a 2-0 win over Qatar. The PSG star was carried to the dressing
room with his right ankle wrapped in ice.",football,2019-06-08,21:37:00,https://www.indiatoday.in/sports/football/story/neymar-injured-before-copa-america-1543560-2019-06-06
India Today," King's Cup: India lose 3-1 to Curacao in Igor Stimac's first testSkipper Sunil Chhetri, who overtook Baichung Bhutia to become the most-capped
Indian international, scored in the 31st minute but goals from Luis
Bonevacia, Elson Hooi and Leandro Bacuna meant Curacao progressed to the
final.",football,2019-06-08,21:37:00,https://www.indiatoday.in/sports/football/story/king-s-cup-india-lose-3-1-to-curacao-in-igor-stimac-s-first-test-1543324-2019-06-05
India Today," Gianni Infantino re-elected as FIFA President until 2023On 26 February 2016, Gianni Infantino was elected FIFA President for a period
of three years. Swiss man Infantino holds dual citizenship through his
parents. With his election, he became the first Italian to hold the
Presidency of FIFA.",football,2019-06-08,21:37:00,https://www.indiatoday.in/sports/football/story/gianni-infantino-re-elected-as-fifa-president-until-2023-1543256-2019-06-05
India Today," Rape case against Cristiano Ronaldo droppedRape case filed against footballer Cristiano Ronaldo by Katheryn Mayorga has
been dropped. According to the complaint, Ronaldo invited Mayorga to a party
in his suite and forced himself on her while she begged him to stop.",football,2019-06-08,21:37:00,https://www.indiatoday.in/sports/football/story/cristiano-ronaldo-katheryn-mayorga-rape-case-dropped-reports-1543039-2019-06-05
India Today," Reyes' car was above 220kmph before crash: PoliceFormer Real Madrid and Arsenal football player Jose Antonio Reyes died in a
car crash. The accident took place near his hometown Utrera in Seville on
June 1. His cousin Jonathan Reyes was also killed in the crash.",football,2019-06-08,21:37:00,https://www.indiatoday.in/sports/football/story/real-madrid-atletico-madrid-jose-antonio-reyes-1542925-2019-06-05
India Today," French Open 2019: Dominic Thiem ends Novak Djokovic streak to reach finalFrench Open 2019: In a rain interrupted men's singles semi-final, Dominic
Thiem defeated Novak Djokovic in 5 sets to face Rafael Nadal in the final on
Sunday.",tennis,2019-06-08,21:37:00,https://www.indiatoday.in/sports/tennis/story/french-open-2019-dominic-thiem-beats-novak-djokovic-face-rafael-nadal-final-1545066-2019-06-08
India Today, French Open women's singles final Live: Ashleigh Barty wins maiden Grand Slam singles title,tennis,2019-06-08,21:37:00,https://www.indiatoday.in/sports/story/ashleigh-barty-vs-marketa-vondrousova-french-open-2019-women-s-singles-tennis-live-score-roland-garros-1545000-2019-06-08
India Today," French Open 2019: Djokovic, Thiem resume semifinal, women's final followsNovak Djokovic and Dominic Thiem have split the first two sets, then Thiem
went up by a break in the third, before play was halted Friday due to rain.
They're scheduled to resume in Court Philippe Chatrier on Saturday.",tennis,2019-06-08,21:37:00,https://www.indiatoday.in/sports/tennis/story/french-open-2019-novak-djokovic-dominic-thiem-match-suspended-women-s-final-1544915-2019-06-08
India Today," French Open 2019: Nadal tops Federer in straight sets to reach finalFrench Open 2019: World No. 2 Rafael Nadal defeated Roger Federer in the
semi-finals to continue his bid for a record-extending 12th title.",tennis,2019-06-08,21:37:00,https://www.indiatoday.in/sports/tennis/story/french-open-2019-semi-final-rafael-nadal-beats-roger-federer-reach-final-1544485-2019-06-07
India Today," French Open 2019: Teenager Vondrousova beats Konta to reach finalFrench Open 2019: Marketa Vondrousova of Czech on Friday became the first
teenager to reach a Grand Slam final for 10 years as she beat Johanna Konta
7-5, 7-6(2).",tennis,2019-06-08,21:37:00,https://www.indiatoday.in/sports/tennis/story/french-open-2019-teenager-marketa-vondrousova-beat-johanna-konta-reach-finals-1544467-2019-06-07
India Today," French Open 2019 semi-final Broadcast: Roger Federer vs Rafael Nadal Live StreamingFrench Open 2019, Roger Federer vs Rafael Nadal Live Streaming: Rafel Nadal
is chasing a record-extending 12th Roland Garros title as he meets Roger
Federer in the high-anticipated clash at The Stade Roland Garros in Paris on
Friday.",tennis,2019-06-08,21:37:00,https://www.indiatoday.in/sports/tennis/story/french-open-2019-semifinals-roger-federer-rafael-nadal-when-and-where-live-streaming-1544377-2019-06-07
India Today," French Open 2019: Nadal expects Federer onslaught in semi-finalFor the first time in eight years, Nadal has braced for an all-out assault
from Federer. Of the 38-match rivalry, Federer managed to win the last five
matches, but can never manage more than a set in clay.",tennis,2019-06-08,21:37:00,https://www.indiatoday.in/sports/tennis/story/french-open-2019-rafael-nadal-roger-federer-1544145-2019-06-07
India Today," French Open 2019: Novak Djokovic sets semi-final clash with Dominic Thiem World No. 1 Novak Djokovic defeated Alexander Zverev in straight sets to set
the French Open semi-final clash with Dominic Thiem, who dispatched Russian
Karen Khachanov 6-2, 6-4, 6-2.",tennis,2019-06-08,21:37:00,https://www.indiatoday.in/sports/tennis/story/french-open-2019-novak-djokovic-beat-alexander-zverev-semi-final-dominic-thiem-1544075-2019-06-06
India Today," French Open 2019: Federer excited about Nadal clash, ready to give his best shotFrench Open 2019: Roger Federer came up with a stunning effort against fellow
Swiss Stan Wawrinka in Tuesday's quarter-final, beating him 7-6(4) 4-6 7-6(5)
6-4 to set up a semi-final clash with Rafael Nadal.",tennis,2019-06-08,21:37:00,https://www.indiatoday.in/sports/tennis/story/roger-federer-rafael-nadal-french-open-1542894-2019-06-05
India Today," Andy Murray to play doubles at Queen's ClubAndy Murray said he is excited to return to competitive action for the first
time since his hip surgery. The Brit will play doubles at Queen's Club. ",tennis,2019-06-08,21:37:00,https://www.indiatoday.in/sports/tennis/story/andy-murray-queens-club-tennis-doubles-return-hip-surgery-1542243-2019-06-04
India Today," French Open 2019: Djokovic eases into quarters, Nishikori battles past PaireNovak Djokovic became the first man to reach 10 successive quarter-finals at
Roland Garros while Kei Nishikori registered an error-strewn 6-2 6-7(8) 6-2
6-7(8) 7-5 victory against Benoit Paire.",tennis,2019-06-08,21:37:00,https://www.indiatoday.in/sports/tennis/story/french-open-2019-novak-djokovic-vs-jan-lennard-struff-kei-nishikori-vs-benoit-paire-1541757-2019-06-03
India Today," French Open 2019: Serena Williams showed 'bad personality', says Dominic ThiemWhen Dominic Thiem, who was present at the press conference talking about his
third-round win, was asked to make room for Serena Williams, for which he
accused the former world No. 1 of a bad personality.",tennis,2019-06-08,21:37:00,https://www.indiatoday.in/sports/tennis/story/french-open-2019-dominic-thiem-disappointed-serena-williams-bad-personality-1541428-2019-06-03
India Today," PV Sindhu, Sameer Verma lose in dismal day for India at Australian OpenPV Sindhu's struggles on the tour this season continues as she was knocked
out in the second round of Australian Open 2019 after a straight-game loss to
lower-ranked Nitchaon Jindapol on Thursday.",badminton,2019-06-08,21:37:00,https://www.indiatoday.in/sports/badminton/story/australian-open-pv-sindhu-2nd-round-defeat-sameer-verma-india-badminton-1543884-2019-06-06
India Today," Sindhu, Sameer make impressive starts at Australian OpenP V Sindhu and Sameer Verma progressing to the second round of the Australian
Open World Tour Super 300 tournament. The Indian will meet experienced Thai
Nitchaon Jindapol next.",badminton,2019-06-08,21:37:00,https://www.indiatoday.in/sports/badminton/story/p-v-sindhu-sameer-verma-australian-open-1543149-2019-06-05
India Today," Sudirman Cup: Kento Momota stunned as China cruise to 11th titleWorld No. 1 men's singles shuttler Kento Momota suffered his first defeat in
a team event at the senior level as Shi Yuqi led China to their
record-extending 11th Sudirman Cup title on Sunday.",badminton,2019-06-08,21:37:00,https://www.indiatoday.in/sports/badminton/story/sudirman-cup-2019-china-vs-japan-shi-yuqi-chen-yufei-kento-momota-badminton-report-1535063-2019-05-26
