Newspaper,Heading,Category,Date,Time,URL
Time of India,India seeks permission for Dhoni's dagger insignia gloves; ICC unlikely to play ball,icc wc 2019,2019-06-08,21:36,https://timesofindia.indiatimes.com/sports/cricket/icc-world-cup/teams/india/news/india-seeks-permission-for-dhonis-dagger-insignia-gloves-icc-unlikely-to-play-ball/articleshow/69692938.cms
Time of India,"MS Dhoni glove row: Will go by ICC norms, says Vinod Rai",cricket,2019-06-08,21:36,https://timesofindia.indiatimes.com/sports/cricket/icc-world-cup/we-will-go-by-icc-norms-coa-cheif-vinod-rai-on-ms-dhonis-glove-controversy/articleshow/69702299.cms
Time of India,PM Modi gifts bat to Maldives President Solih,cricket,2019-06-08,21:36,https://timesofindia.indiatimes.com/sports/cricket/news/focus-on-cricket-diplomacy-as-pm-narendra-modi-gifts-bat-to-maldives-president-solih/articleshow/69704237.cms
Time of India,"Warner 'shaken up' by nets mishap, says Finch",cricket,2019-06-08,21:36,https://timesofindia.indiatimes.com/sports/cricket/icc-world-cup/icc-world-cup-2019-warner-shaken-up-by-nets-mishap-says-finch/articleshow/69705598.cms
Time of India,Lloyd tells West Indies to play 'smart' after World Cup frustration,cricket,2019-06-08,21:36,https://timesofindia.indiatimes.com/sports/cricket/icc-world-cup/lloyd-tells-west-indies-to-play-smart-after-world-cup-frustration/articleshow/69706166.cms
Time of India,ICC WC 2019: Team India meets India's High Commissioner to UK in London,cricket,2019-06-08,21:36,https://timesofindia.indiatimes.com/videos/sports/cricket/icc-wc-2019-team-india-meets-indias-high-commissioner-to-uk-in-london/videoshow/69703222.cms
Time of India,"World Cup: We have to play at our best, says Mashrafe Mortaza",cricket,2019-06-08,21:36,https://timesofindia.indiatimes.com/videos/sports/cricket/world-cup-we-have-to-play-at-our-best-says-mashrafe-mortaza/videoshow/69695867.cms
Time of India,ICC refuses to allow Army insignia on Dhoni's gloves,cricket,2019-06-08,21:36,https://timesofindia.indiatimes.com/videos/sports/cricket/icc-refuses-to-allow-army-insignia-on-dhonis-gloves/videoshow/69695819.cms
Time of India,"We don't underestimate Bangladesh, says Eoin Morgan",cricket,2019-06-08,21:36,https://timesofindia.indiatimes.com/videos/sports/cricket/we-dont-underestimate-bangladesh-says-eoin-morgan/videoshow/69695592.cms
Time of India,MCG fined Virat Kohli for washing car with drinking water in Gurugram,cricket,2019-06-08,21:36,https://timesofindia.indiatimes.com/videos/sports/cricket/mcg-fined-virat-kohli-for-washing-car-with-drinking-water-in-gurugram/videoshow/69693076.cms
Time of India,Women’s Championship: BCCI seeks government nod to host Pakistan women’s team,cricket,2019-06-08,21:36,https://timesofindia.indiatimes.com/videos/sports/cricket/womens-championship-bcci-seeks-government-nod-to-host-pakistan-womens-team/videoshow/69685208.cms
Time of India,Ask Dhoni to remove Army insignia from gloves: ICC to BCCI,cricket,2019-06-08,21:36,https://timesofindia.indiatimes.com/videos/sports/cricket/ask-dhoni-to-remove-army-insignia-from-gloves-icc-to-bcci/videoshow/69681579.cms
Time of India,ICC World Cup: Karunaratne insists Sri Lanka don't care about critics,cricket,2019-06-08,21:36,https://timesofindia.indiatimes.com/videos/sports/cricket/icc-world-cup-karunaratne-insists-sri-lanka-dont-care-about-critics/videoshow/69680449.cms
Time of India,World Cup 2019: Fans celebrate India’s opening victory against South Africa,cricket,2019-06-08,21:36,https://timesofindia.indiatimes.com/videos/sports/cricket/world-cup-2019-fans-celebrate-indias-opening-victory-against-south-africa/videoshow/69672945.cms
Time of India,"ICC World Cup 2019: Jasprit Bumrah operating at a different level, says Virat Kohli",cricket,2019-06-08,21:36,https://timesofindia.indiatimes.com/videos/sports/cricket/icc-world-cup-2019-jasprit-bumrah-operating-at-a-different-level-says-virat-kohli/videoshow/69671349.cms
Time of India,"Live Score, ICC World Cup 2019: Afghanistan vs NZ",cricket,2019-06-08,21:36,https://timesofindia.indiatimes.com/sports/cricket/icc-world-cup/live-blog/live-cricket-score-afghanistan-vs-new-zealand-icc-cricket-world-cup-2019-taunton/liveblog/69703258.cms
Time of India,"Live Score, England vs Bangladesh, ICC World Cup",cricket,2019-06-08,21:36,https://timesofindia.indiatimes.com/sports/cricket/icc-world-cup/live-blog/live-cricket-score-england-and-bangladesh-icc-world-cup-2019-cardiff/liveblog/69701500.cms
Time of India,WATCH: Can India have the last laugh against Aus?,cricket,2019-06-08,21:36,https://timesofindia.indiatimes.com/sports/cricket/icc-world-cup/watch-can-india-have-the-last-laugh-against-formidable-australia-in-their-world-cup-clash/articleshow/69699412.cms
Time of India,AB de Villiers chose money over country: Shoaib Akhtar,cricket,2019-06-08,21:36,https://timesofindia.indiatimes.com/sports/cricket/news/ab-de-villiers-chose-money-over-country-shoaib-akhtar/articleshow/69701701.cms
Time of India,"World Cup, India vs Australia: Three battles to watch out for",cricket,2019-06-08,21:36,https://timesofindia.indiatimes.com/sports/cricket/icc-world-cup/world-cup-2019-india-vs-australia-three-battles-to-watch-out-for/articleshow/69700740.cms
Time of India,Kohli & Co meet India’s High Commissioner to the UK ahead of Australia clash,cricket,2019-06-08,21:36,https://timesofindia.indiatimes.com/sports/cricket/icc-world-cup/world-cup-2019-team-india-meets-indias-high-commissioner-to-the-uk-ahead-of-australia-clash/articleshow/69700165.cms
Time of India,Dhoni can't wear 'Balidaan' logo on gloves: ICC,cricket,2019-06-08,21:36,https://timesofindia.indiatimes.com/sports/cricket/icc-world-cup/world-cup-ms-dhoni-cant-wear-balidaan-insignia-on-gloves-says-icc/articleshow/69698340.cms
Time of India,Nadal hands 'biggest rival' Federer worst Slam loss for 11 years in French Open semis,tennis,2019-06-08,21:36,https://timesofindia.indiatimes.com/sports/tennis/french-open/rafael-nadal-hands-biggest-rival-roger-federer-worst-slam-loss-for-11-years-in-french-open-semifinal/articleshow/69698539.cms
Time of India,French Open: Djokovic vs Thiem semi-final to resume on Saturday,tennis,2019-06-08,21:36,https://timesofindia.indiatimes.com/sports/tennis/french-open/french-open-djokovic-vs-thiem-semi-final-to-resume-on-saturday/articleshow/69695930.cms
Time of India,Nadal beats Federer to reach 12th French Open final,tennis,2019-06-08,21:36,https://timesofindia.indiatimes.com/sports/tennis/french-open/rafael-nadal-beats-roger-federer-to-reach-12th-french-open-final/articleshow/69693438.cms
Time of India,Teenager Vondrousova beats Konta to reach French Open final,tennis,2019-06-08,21:36,https://timesofindia.indiatimes.com/sports/tennis/french-open/teenager-vondrousova-beats-konta-to-reach-french-open-final/articleshow/69691227.cms
Time of India,Rafael Nadal beats Roger Federer to reach 12th French Open final,tennis,2019-06-08,21:36,https://timesofindia.indiatimes.com/videos/sports/tennis/rafael-nadal-beats-roger-federer-to-reach-12th-french-open-final/videoshow/69694857.cms
Time of India,Here are a few facts about Mahesh Shrinivas Bhupathi who turns 45 today,tennis,2019-06-08,21:36,https://timesofindia.indiatimes.com/videos/sports/tennis/here-are-a-few-facts-about-mahesh-shrinivas-bhupathi-who-turns-45-today/videoshow/69676694.cms
Time of India,Tennis legend Bjorn Borg turns 63 years old,tennis,2019-06-08,21:36,https://timesofindia.indiatimes.com/videos/sports/tennis/tennis-legend-bjorn-borg-turns-63-years-old/videoshow/69665120.cms
Time of India,Spanish tennis player Rafael Nadal turns 33,tennis,2019-06-08,21:36,https://timesofindia.indiatimes.com/videos/sports/tennis/spanish-tennis-player-rafael-nadal-turns-33/videoshow/69621090.cms
Time of India,Bengaluru: Former tennis star Arantax named World 10K brand ambassador,tennis,2019-06-08,21:36,https://timesofindia.indiatimes.com/videos/sports/tennis/bengaluru-former-tennis-star-arantax-named-world-10k-brand-ambassador/videoshow/69374972.cms
Time of India,Federer becomes second man in history to win 100 ATP singles titles,tennis,2019-06-08,21:36,https://timesofindia.indiatimes.com/videos/sports/tennis/federer-becomes-second-man-in-history-to-win-100-atp-singles-titles/videoshow/68239899.cms
Time of India, Former American Tennis player John McEnroe turns 60 today,tennis,2019-06-08,21:36,https://timesofindia.indiatimes.com/videos/sports/tennis/former-american-tennis-player-john-mcenroe-turns-60-today/videoshow/68008187.cms
Time of India,Novak Djokovic wins record seventh Australian Open title,tennis,2019-06-08,21:36,https://timesofindia.indiatimes.com/videos/sports/tennis/novak-djokovic-wins-record-seventh-australian-open-title/videoshow/67710640.cms
Time of India,Naomi Osaka beats Petra Kvitova to win Australian Open title,tennis,2019-06-08,21:36,https://timesofindia.indiatimes.com/videos/sports/tennis/naomi-osaka-beats-petra-kvitova-to-win-australian-open-title/videoshow/67703479.cms
Time of India,"Roger Federer knocked out by Stefanos Tsitsipas, out of Australian Open",tennis,2019-06-08,21:36,https://timesofindia.indiatimes.com/videos/sports/tennis/roger-federer-knocked-out-by-stefanos-tsitsipas-out-of-australian-open/videoshow/67612828.cms
Time of India,Roger Federer delights fans with hint of Paris return,tennis,2019-06-08,21:36,https://timesofindia.indiatimes.com/sports/tennis/french-open/roger-federer-delights-fans-with-hint-of-paris-return/articleshow/69695638.cms
Time of India,Barty ends Anisimova's run to reach French Open final,tennis,2019-06-08,21:36,https://timesofindia.indiatimes.com/sports/tennis/french-open/barty-ends-anisimovas-run-to-reach-french-open-final/articleshow/69691479.cms
Time of India,'We always have to justify ourselves': Konta blasts Roland Garros,tennis,2019-06-08,21:36,https://timesofindia.indiatimes.com/sports/tennis/french-open/we-always-have-to-justify-ourselves-konta-blasts-roland-garros/articleshow/69693497.cms
Time of India,'Shameful': Roland Garros sexism row over 'unfair' women's semi-finals shift,tennis,2019-06-08,21:36,https://timesofindia.indiatimes.com/sports/tennis/french-open/shameful-roland-garros-sexism-row-over-unfair-womens-semi-finals-shift/articleshow/69684650.cms
Time of India,Halep blown out of French Open by teenager Anisimova,tennis,2019-06-08,21:36,https://timesofindia.indiatimes.com/sports/tennis/french-open/halep-blown-out-of-french-open-by-teenager-anisimova/articleshow/69676780.cms
Time of India,Djokovic to face Thiem for Roland Garros final spot,tennis,2019-06-08,21:36,https://timesofindia.indiatimes.com/sports/tennis/french-open/djokovic-to-face-thiem-for-roland-garros-final-spot/articleshow/69680023.cms
Time of India,Barty outplays Keys to reach French Open semis,tennis,2019-06-08,21:36,https://timesofindia.indiatimes.com/sports/tennis/french-open/barty-outplays-keys-to-reach-french-open-semis/articleshow/69677084.cms
Time of India,Thiem reaches fourth straight French Open semis,tennis,2019-06-08,21:36,https://timesofindia.indiatimes.com/sports/tennis/french-open/dominic-thiem-reaches-fourth-straight-french-open-semi-final/articleshow/69680052.cms
Time of India,Like a 'hurricane': Djokovic blasts 'worst' ever conditions after Paris exit,tennis,2019-06-08,21:36,https://timesofindia.indiatimes.com/sports/tennis/french-open/like-a-hurricane-djokovic-blasts-worst-ever-conditions-after-paris-exit/articleshow/69706216.cms
Time of India,Hosts France enjoy winning start as women's World Cup kicks off,football,2019-06-08,21:36,https://timesofindia.indiatimes.com/sports/football/top-stories/hosts-france-enjoy-winning-start-as-womens-world-cup-kicks-off/articleshow/69698945.cms
Time of India,Willian to replace Neymar in Brazil's Copa America squad,football,2019-06-08,21:36,https://timesofindia.indiatimes.com/sports/football/top-stories/willian-to-replace-neymar-in-brazils-copa-america-squad/articleshow/69695838.cms
Time of India,King's Cup: Stimac aims to build on positives ahead of Thailand clash,football,2019-06-08,21:36,https://timesofindia.indiatimes.com/sports/football/top-stories/kings-cup-india-coach-stimac-aims-to-build-on-positives-ahead-of-thailand-clash/articleshow/69692941.cms
Time of India,Arsenal confirm Danny Welbeck exit,football,2019-06-08,21:36,https://timesofindia.indiatimes.com/sports/football/epl/top-stories/arsenal-confirm-danny-welbeck-exit/articleshow/69696170.cms
Time of India,Brazil football star Neymar denies rape allegations,football,2019-06-08,21:36,https://timesofindia.indiatimes.com/videos/sports/football/brazil-football-star-neymar-denies-rape-allegations/videoshow/69619504.cms
Time of India,David Beckham turns 44 today,football,2019-06-08,21:36,https://timesofindia.indiatimes.com/videos/sports/football/david-beckham-turns-44-today/videoshow/69129650.cms
Time of India,"Football greats Cristiano Ronaldo, Tevez and Neymar celebrate their birthdays today",football,2019-06-08,21:36,https://timesofindia.indiatimes.com/videos/sports/football/football-greats-cristiano-ronaldo-tevez-and-neymar-celebrate-their-birthdays-today/videoshow/67848695.cms
Time of India,Tax fraud case: Cristiano Ronaldo fined 3.57 million euros ,football,2019-06-08,21:36,https://timesofindia.indiatimes.com/videos/sports/football/tax-fraud-case-cristiano-ronaldo-fined-3-57-million-euros/videoshow/67643918.cms
Time of India,Baichung Bhutia: 'Sikkimese Sniper' celebrating birthday ,football,2019-06-08,21:36,https://timesofindia.indiatimes.com/videos/sports/football/baichung-bhutia-sikkimese-sniper-celebrating-birthday/videoshow/67094203.cms
Time of India,Juventus too good for Man United on Ronaldo's return,football,2019-06-08,21:36,https://timesofindia.indiatimes.com/videos/sports/football/juventus-too-good-for-manchester-united-on-ronaldos-return/videoshow/66349616.cms
Time of India,Cristiano Ronaldo rape allegation moving on two legal tracks in Nevada,football,2019-06-08,21:36,https://timesofindia.indiatimes.com/videos/sports/football/cristiano-ronaldo-rape-allegation-moving-on-two-legal-tracks-in-nevada/videoshow/66260247.cms
Time of India,Portugal PM Antonio Costa defends Cristiano Ronaldo in rape case,football,2019-06-08,21:36,https://timesofindia.indiatimes.com/videos/sports/football/portugal-pm-antonio-costa-defends-cristiano-ronaldo-in-rape-case/videoshow/66104815.cms
Time of India,Croatia's Luka Modric wins FIFA best player of the year award,football,2019-06-08,21:36,https://timesofindia.indiatimes.com/videos/sports/football/croatias-luka-modric-wins-fifa-best-player-of-the-year-award/videoshow/65944369.cms
Time of India,Champions League: Messi scores hat-trick fires Barcelona to victory,football,2019-06-08,21:36,https://timesofindia.indiatimes.com/videos/sports/football/champions-league-messi-scores-hat-trick-fires-barcelona-to-victory/videoshow/65873503.cms
Time of India,PSG medics to reassess injured Brazil star Neymar 'within 72 hours',football,2019-06-08,21:36,https://timesofindia.indiatimes.com/sports/football/top-stories/psg-medics-to-reassess-injured-brazil-star-neymar-within-72-hours/articleshow/69689363.cms
Time of India,"Nations League: England must learn from painful Dutch defeat, says Gareth Southgate",football,2019-06-08,21:36,https://timesofindia.indiatimes.com/sports/football/top-stories/nations-league-england-must-learn-from-painful-dutch-defeat-says-gareth-southgate/articleshow/69686813.cms
Time of India,Netherlands outclass England to reach Nations League final,football,2019-06-08,21:36,https://timesofindia.indiatimes.com/sports/football/top-stories/the-netherlands-outclass-england-to-reach-nations-league-final/articleshow/69684479.cms
Time of India,N'Golo Kante out of France's Euro qualifiers with knee injury,football,2019-06-08,21:36,https://timesofindia.indiatimes.com/sports/football/top-stories/ngolo-kante-out-of-frances-euro-qualifiers-with-knee-injury/articleshow/69686687.cms
Time of India,Brazil's Neymar out of Copa America after tearing ankle ligament,football,2019-06-08,21:36,https://timesofindia.indiatimes.com/sports/football/top-stories/brazils-neymar-out-of-copa-america-after-tearing-ankle-ligament/articleshow/69676460.cms
Time of India,USA thrash Mexico 9-0 to secure second win in FIH Series Finals,hockey,2019-06-08,21:36,https://timesofindia.indiatimes.com/sports/hockey/top-stories/usa-thrash-mexico-9-0-to-secure-second-win-in-fih-series-finals/articleshow/69705035.cms
Time of India,FIH Hockey Series Finals: India quell Polish challenge,hockey,2019-06-08,21:36,https://timesofindia.indiatimes.com/sports/hockey/top-stories/fih-hockey-series-finals-india-quell-polish-challenge/articleshow/69700038.cms
Time of India,"Being 9th in world, no reason why we can't qualify for Tokyo Olympics: Marijne",hockey,2019-06-08,21:36,https://timesofindia.indiatimes.com/sports/hockey/top-stories/being-9th-in-world-no-reason-why-we-cant-qualify-for-tokyo-olympics-marijne/articleshow/69694285.cms
Time of India,Asiad champion Japan beat Mexico in FIH Series Finals,hockey,2019-06-08,21:36,https://timesofindia.indiatimes.com/sports/hockey/top-stories/asiad-champion-japan-beat-mexico-in-fih-series-finals/articleshow/69688468.cms
Time of India,FIH Series Finals: India maul hapless Russia 10-0 in opener,hockey,2019-06-08,21:36,https://timesofindia.indiatimes.com/sports/hockey/top-stories/fih-series-finals-india-maul-hapless-russia-10-0-in-opener/articleshow/69680839.cms
Time of India,FIH Series Finals: USA stun South Africa 2-0,hockey,2019-06-08,21:36,https://timesofindia.indiatimes.com/sports/hockey/top-stories/fih-hockey-series-finals-usa-stun-south-africa-2-0/articleshow/69680720.cms
Time of India,FIH Hockey Series Finals: 'India' at the heart of Team USA,hockey,2019-06-08,21:36,https://timesofindia.indiatimes.com/sports/hockey/top-stories/fih-hockey-series-finals-india-at-the-heart-of-team-usa/articleshow/69675575.cms
Time of India,FIH Series Finals: Narinder Batra invites new Sports Minister to watch the final,hockey,2019-06-08,21:36,https://timesofindia.indiatimes.com/sports/hockey/top-stories/bhubaneswar-fih-series-finals-fih-president-narinder-batra-invites-new-sports-minister-to-watch-the-final/articleshow/69672955.cms
Time of India,Minnows USA stun South Africa 2-0 in FIH Series Finals opener,hockey,2019-06-08,21:36,https://timesofindia.indiatimes.com/sports/hockey/top-stories/minnows-usa-stun-south-africa-2-0-in-fih-series-finals-opener/articleshow/69674005.cms
Time of India,FIH Hockey Series Finals: India's quest for Olympic berth starts,hockey,2019-06-08,21:36,https://timesofindia.indiatimes.com/sports/hockey/top-stories/fih-hockey-series-finals-indias-quest-for-olympic-berth-starts/articleshow/69672754.cms
Time of India,Complacency has no place in modern hockey: Graham Reid,hockey,2019-06-08,21:36,https://timesofindia.indiatimes.com/sports/hockey/top-stories/complacency-has-no-place-in-modern-hockey-graham-reid/articleshow/69665099.cms
Time of India,"FIH Series Finals, Bhubaneswar: India should focus more on the objective than the opposition",hockey,2019-06-08,21:36,https://timesofindia.indiatimes.com/sports/hockey/top-stories/fih-series-finals-bhubaneswar-india-should-focus-more-on-the-objective-than-the-opposition/articleshow/69661134.cms
Time of India,All teams will give us tough fight: Manpreet Singh,hockey,2019-06-08,21:36,https://timesofindia.indiatimes.com/sports/hockey/top-stories/all-teams-will-give-us-tough-fight-manpreet-singh/articleshow/69654953.cms
Time of India,Hunger to wear India colours again kept me strong: Ramandeep,hockey,2019-06-08,21:36,https://timesofindia.indiatimes.com/sports/hockey/top-stories/hunger-to-wear-india-colours-again-kept-me-strong-says-fit-again-ramandeep-singh/articleshow/69635962.cms
Time of India,"Hockey's Road to the Olympics: FIH Series Final, Bhubaneswar - Meet the teams",hockey,2019-06-08,21:36,https://timesofindia.indiatimes.com/sports/hockey/top-stories/hockeys-road-to-the-olympics-fih-series-final-bhubaneswar-meet-the-teams/articleshow/69629839.cms
Time of India,"Hockey's Road to Olympics: FIH Series Final, Bhubaneswar - Know the format",hockey,2019-06-08,21:36,https://timesofindia.indiatimes.com/sports/hockey/top-stories/hockeys-road-to-olympics-fih-series-final-bhubaneswar-know-the-format/articleshow/69645373.cms
Time of India,"India beat Scotland 2-1, enter final of U21 four-nation tourney",hockey,2019-06-08,21:36,https://timesofindia.indiatimes.com/sports/hockey/top-stories/india-beat-scotland-2-1-enter-final-of-u21-four-nation-tourney/articleshow/69638705.cms
Time of India,I play with the cards in front of me: India's hockey coach Graham Reid,hockey,2019-06-08,21:36,https://timesofindia.indiatimes.com/sports/hockey/top-stories/i-play-with-the-cards-in-front-of-me-indias-hockey-coach-graham-reid/articleshow/69561957.cms
Time of India,India's men and women teams to don new kit at FIH Series Finals,hockey,2019-06-08,21:36,https://timesofindia.indiatimes.com/sports/hockey/top-stories/hockey-indias-men-and-women-teams-to-don-new-kit-at-fih-series-finals/articleshow/69611814.cms
Time of India,Indian women's hockey team beats Ireland 2-1 in U-21 four-nation tournament,hockey,2019-06-08,21:36,https://timesofindia.indiatimes.com/sports/hockey/top-stories/indian-womens-hockey-team-beat-ireland-2-1-in-u21-4-nation-tournament/articleshow/69617941.cms
Time of India,Indian junior women's hockey team beat Canada 2-0,hockey,2019-06-08,21:36,https://timesofindia.indiatimes.com/sports/hockey/top-stories/indian-junior-womens-hockey-team-beat-canada-2-0/articleshow/69609639.cms
Time of India,Converting opportunities will be key in FIH Series Finals: Manpreet Singh,hockey,2019-06-08,21:36,https://timesofindia.indiatimes.com/sports/hockey/top-stories/converting-opportunities-will-be-key-in-fih-series-finals-manpreet-singh/articleshow/69546914.cms
Time of India,"Our goal-scoring needs improvement, says Indian coach Reid",hockey,2019-06-08,21:36,https://timesofindia.indiatimes.com/sports/hockey/top-stories/our-goal-scoring-needs-improvement-says-indian-hockey-coach-graham-reid/articleshow/69548786.cms
Time of India,India recall Ramandeep Singh for men's Hockey Series Finals,hockey,2019-06-08,21:36,https://timesofindia.indiatimes.com/sports/hockey/top-stories/india-recall-ramandeep-singh-for-mens-hockey-series-finals/articleshow/69535799.cms
Time of India,Indian women lose 0-4 to Korea in inconsequential 3rd match of hockey series,hockey,2019-06-08,21:36,https://timesofindia.indiatimes.com/sports/hockey/top-stories/indian-women-lose-0-4-to-korea-in-inconsequential-3rd-match-of-hockey-series/articleshow/69482454.cms
Time of India,"I want to retire after Tokyo Olympics, says Mary Kom",boxing,2019-06-08,21:36,https://timesofindia.indiatimes.com/sports/boxing/i-want-to-retire-after-tokyo-olympics-says-mary-kom/articleshow/69677668.cms
Time of India,Ruiz rematch will be make-or-break for beaten Briton Joshua,boxing,2019-06-08,21:36,https://timesofindia.indiatimes.com/sports/boxing/ruiz-rematch-will-be-make-or-break-for-beaten-briton-joshua/articleshow/69638568.cms
Time of India,Andy Ruiz stuns Anthony Joshua for world heavyweight title,boxing,2019-06-08,21:36,https://timesofindia.indiatimes.com/sports/boxing/andy-ruiz-stuns-anthony-joshua-for-world-heavyweight-title/articleshow/69616953.cms
Time of India,"Vijender Singh is scared of me, says British boxer Amir Khan",boxing,2019-06-08,21:36,https://timesofindia.indiatimes.com/sports/boxing/vijender-singh-is-scared-of-me-says-british-boxer-amir-khan/articleshow/69600762.cms
Time of India,"India Open: Mary, Sarita, Shiva and Amit bag gold",boxing,2019-06-08,21:36,https://timesofindia.indiatimes.com/sports/boxing/india-open-mary-sarita-shiva-and-amit-bag-gold/articleshow/69492586.cms
Time of India,Indian Open: Mary Kom blasts Nikhat Zareen after beating her,boxing,2019-06-08,21:36,https://timesofindia.indiatimes.com/sports/boxing/indian-open-mary-kom-blasts-nikhat-zareen-after-beating-her/articleshow/69475009.cms
Time of India,Indian Open: Air of uncertainty in camp,boxing,2019-06-08,21:36,https://timesofindia.indiatimes.com/sports/boxing/indian-open-air-of-uncertainty-in-camp/articleshow/69476354.cms
Time of India,'Unprepared' Tokyo 2020 boxing boss vows to put athletes first,boxing,2019-06-08,21:36,https://timesofindia.indiatimes.com/sports/boxing/unprepared-tokyo-2020-boxing-boss-vows-to-put-athletes-first/articleshow/69464141.cms
Time of India,Tokyo 2020 organisers welcome IOC boxing decision,boxing,2019-06-08,21:36,https://timesofindia.indiatimes.com/sports/boxing/tokyo-2020-organisers-welcome-ioc-boxing-decision/articleshow/69467174.cms
Time of India,IOC decision to strip AIBA right to conduct boxing in Olympics shocks Thapa,boxing,2019-06-08,21:36,https://timesofindia.indiatimes.com/sports/boxing/ioc-decision-to-strip-aiba-right-to-conduct-boxing-in-olympics-shocks-shiva-thapa-amit-panghal-sees-advantage/articleshow/69466318.cms
Time of India,"India Open: Amit Panghal, Shiva Thapa reach semis in style",boxing,2019-06-08,21:36,https://timesofindia.indiatimes.com/sports/boxing/india-open-amit-panghal-shiva-thapa-reach-semis-in-style/articleshow/69457622.cms
Time of India,IOC recommends boxing keeps its place in Tokyo Olympics but not under AIBA,boxing,2019-06-08,21:36,https://timesofindia.indiatimes.com/sports/boxing/ioc-recommends-boxing-keeps-its-place-in-tokyo-olympics-but-not-under-aiba/articleshow/69449421.cms
Time of India,India Open: Uzbeks no-show makes lop-sided field for Indian boxers,boxing,2019-06-08,21:36,https://timesofindia.indiatimes.com/sports/boxing/india-open-uzbeks-no-show-makes-lop-sided-field-for-indian-boxers/articleshow/69448330.cms
Time of India,"India Open: Mary Kom wins first bout, assured of medal",boxing,2019-06-08,21:36,https://timesofindia.indiatimes.com/sports/boxing/india-open-mary-kom-wins-first-bout-assured-of-medal/articleshow/69434567.cms
