Newspaper,Heading,Category,Date,Time,URL
India Today," Himanta Biswa Sarma elected as vice president of Badminton Asia CouncilAssam's health and education minister Himanta Biswa Sarma was last year
unanimously elected the Badminton Association of India president.",badminton,2019-06-08,21:37:00,https://www.indiatoday.in/sports/badminton/story/himanta-biswa-sarma-badminton-asia-council-vice-president-election-1534960-2019-05-26
India Today," China thrash Thailand 3-0, reach Sudirman Cup finalTen-time winners China beat Thailand 3-0 to qualify for their 13th straight
Sudirman Cup final. China will play the final against the winner between
Japan and Indonesia.",badminton,2019-06-08,21:37:00,https://www.indiatoday.in/sports/badminton/story/sudirman-cup-li-junhui-liu-yuchen-1534566-2019-05-25
India Today," Pullela Gopichand blames hectic calendar for shuttlers' poor run in 2019The slump in form for the major badminton stars of India comes at a rather
awkward time with the 2020 Tokyo Olympics around the corner.",badminton,2019-06-08,21:37:00,https://www.indiatoday.in/sports/badminton/story/pullela-gopichand-gopichand-blames-calendar-shuttlers-poor-form-tokyo-olympics-1533753-2019-05-24
India Today," Sudirman Cup: Japan beat Malaysia to advance to last 4Japan put an all-round performance to defeat defeated Malaysia 3-0 to qualify
for the first semi-finals of the ongoing Sudirman Cup in China",badminton,2019-06-08,21:37:00,https://www.indiatoday.in/sports/badminton/story/ong-yew-sin-teo-ee-yi-sudirman-cup-1533648-2019-05-24
India Today," Sudirman Cup: Denmark beat Indonesia, both advance to last 8 Sudirman Cup: Denmark defeated Indonesia 3-2 in the pre-quarters, however,
the latter remained the group topper despite the loss as both the teams
advanced to the last 8 of the tournament.",badminton,2019-06-08,21:37:00,https://www.indiatoday.in/sports/badminton/story/sudirman-cup-denmark-beat-indonesia-enter-quarters-1532469-2019-05-23
India Today," India knocked out of Sudirman Cup after 0-5 loss to ChinaAfter going down 2-3 to Malaysia in their opening Group 1D match, India
needed an extraordinary effort to get across the mighty Chinese but the
shuttlers yet again produced a below-par performance to go down in a
lop-sided contest",badminton,2019-06-08,21:37:00,https://www.indiatoday.in/sports/badminton/story/sudirman-cup-badminton-india-lose-china-kidambi-srikanth-pv-sindhu-1531729-2019-05-22
India Today," Sudirman Cup: PV Sindhu's heroics in vain as Malaysia beat India 3-2 India's decision to field world no. 13 Sameer Verma instead of Kidambi
Srikanth in men's singles backfired as a young Malaysian contingent consigned
them to a 3-2 defeat despite PV Sindhu winning her own match",badminton,2019-06-08,21:37:00,https://www.indiatoday.in/sports/badminton/story/sudhirman-cup-malaysia-beat-india-pv-sidhu-sameer-verma-1530994-2019-05-21
India Today," Sudirman Cup: India shuttlers take on Malaysia, eye knockout stageSudirman Cup: India have reached the quarterfinals twice in the 2011 and 2017
editions but haven't crossed the last eight stage.",badminton,2019-06-08,21:37:00,https://www.indiatoday.in/sports/badminton/story/sudirman-cup-india-vs-malaysia-lee-chong-wei-pv-sindhu-saina-nehwal-1530247-2019-05-20
India Today," Sudirman Cup: Japan comeback from behind to defeat Russia 3-2 After going down 2-1 to Russia, Japan's women players came to rescue to win
both their singles and doubles matches to guide their team to a 3-2 win.",badminton,2019-06-08,21:37:00,https://www.indiatoday.in/sports/badminton/story/sudirman-cup-japan-beat-russia-nozomi-okuhara-1529662-2019-05-20
India Today," Dutee Chand warns followers against fake Twitter accounts using her nameDutee Chand's troubles don't seem to end as while battling her family and the
society at large due to her sexual orientation, she is now having to fight
out fake Twitter accounts in her own name",athletics,2019-06-08,21:37:00,https://www.indiatoday.in/sports/athletics/story/dutee-chand-twitter-account-india-atheltics-1535763-2019-05-27
India Today," Another athlete slams testosterone rules, refuses medicationOlympic medalist Margaret Wambui criticized the IAAF's testosterone
regulations and said she won't take ""any type of medication"" to lower her
natural testosterone.",athletics,2019-06-08,21:37:00,https://www.indiatoday.in/sports/athletics/story/caster-semenya-iaaf-margaret-wambui-iaaf-testosterone-regulations-1531912-2019-05-22
India Today," I'm so proud of Dutee Chand: Ellen DeGeneres on Indian sprinter's coming outPopular host Ellen DeGeneres rejoiced and was proud of the fact that Dutee
Chand became the 1st sportperson in India to openly admit that she's gay. The
100m record holder and winner of two Asian Games silver medals had recently
opened up to the media about her homosexuality.",athletics,2019-06-08,21:37:00,https://www.indiatoday.in/sports/athletics/story/tv-host-ellen-degeneres-proud-dutee-chand-opened-up-homosexuality-1531568-2019-05-22
India Today," Asian Championships winner Gomathi fails dope test, faces provisional suspensionAsian Championships 800 metres gold medallist Gomathi Marimuthu was tested
positive for a banned substance. Gomathi will face a 4-year suspension if her
B sample also tests positive.",athletics,2019-06-08,21:37:00,https://www.indiatoday.in/sports/athletics/story/asian-championships-winner-gomathi-marimuthu-fails-dope-test-1531329-2019-05-21
India Today," Sister's blackmail, torture forced me to reveal my same-sex relationship: Dutee ChandIndia's fastest woman Dutee Chand has said that she revealed about her
same-sex relationship after being tortured by her eldest sister.",athletics,2019-06-08,21:37:00,https://www.indiatoday.in/sports/athletics/story/dutee-chand-same-sex-relationship-blackmail-1531211-2019-05-21
India Today," Dutee Chand faces family's wrath after revealing same-sex relationshipDutee Chand said that her eldest sister threatened to not only expel her from
the family but also send her to jail.",athletics,2019-06-08,21:37:00,https://www.indiatoday.in/sports/athletics/story/dutee-chand-same-sex-relationship-expulsion-from-family-india-s-fastest-woman-1528795-2019-05-19
India Today," Ace sprinter Dutee Chand reveals she is in same-sex relationship with 'soulmate'Dutee Chand revealed in an interview that she is in a same-sex relationship
with a girl from her hometown.",athletics,2019-06-08,21:37:00,https://www.indiatoday.in/sports/athletics/story/dutee-chand-same-sex-relationship-soulmate-1528532-2019-05-19
India Today," Neeraj Chopra recovering without complications: AFI presidentNeeraj Chopra may miss the Doha World Championships as his recovery is likely
to take at least three months after he had arthroscopic surgery on his
throwing right hand to remove bone fragments from his elbow joint.",athletics,2019-06-08,21:37:00,https://www.indiatoday.in/sports/athletics/story/neeraj-chopra-afi-surgery-recovery-doha-world-championships-1526833-2019-05-16
India Today," South African government to appeal against Caster Semenya rulingMiddle-distance runner Caster Semenya had lost a crucial case after the Court
of Arbitration for Sport ruled that female track athletes with naturally high
levels of testosterone have to regulate their hormone levels to participate
in major events, including the Olympics.",athletics,2019-06-08,21:37:00,https://www.indiatoday.in/sports/athletics/story/caster-semenya-case-south-africa-to-appeal-1523911-2019-05-13
India Today," Russian athlete Savina gets 12-year banA ban as long as 12 years is uncommon but Russian athelete Kseniya Savina
attempted to shift blame and avoid sanctions by providing false medical
documents added another anti-doping rule violation in her case.",athletics,2019-06-08,21:37:00,https://www.indiatoday.in/sports/athletics/story/russian-athlete-kseniya-savina-doping-ban-1520369-2019-05-08
India Today," I can qualify for 2020 Tokyo Olympics: Jinson JohnsonJinson Johnson feels he can qualify for the 1500 metres event at the 2020
Tokyo Olympics, despite his recent injury concerns.",athletics,2019-06-08,21:37:00,https://www.indiatoday.in/sports/athletics/story/jinson-johnson-qualify-2020-tokyo-olympics-1519648-2019-05-07
India Today," Hell no: Defiant Caster Semenya wins, says she won't take drugsCaster Semenya won the 800 meters at the opening Diamond League meeting of
the season in Doha and it was her first win since losing her case against the
IAAF.",athletics,2019-06-08,21:37:00,https://www.indiatoday.in/sports/athletics/story/caster-semenya-800m-diamond-league-iaff-drug-testosterone-cas-1517010-2019-05-04
India Today," FIH Series 2019: Poland & Russia arrive in Bhubaneshwar India will open their campaign against Russia on June 6 and meet Poland on
June 7 and Uzbekistan on June 10 in their remaining pool matches. The final
of the tournament will be played on June 15.",hockey,2019-06-08,21:37:00,https://www.indiatoday.in/sports/hockey/story/fih-series-2019-poland-russia-arrive-in-bhubaneshwar-1539457-2019-05-31
India Today," Indian women's hockey team end series with 0-4 loss to South Korea After two back-to-back wins, Indian women's hockey team lost 0-4 to South
Korea in the third and final game of the series.",hockey,2019-06-08,21:37:00,https://www.indiatoday.in/sports/hockey/story/hockey-series-india-lose-south-africa-0-4-1533752-2019-05-24
India Today," India take unassailable 2-0 lead over Korea, clinch women's hockey seriesHigh on confidence after their impressive outings in Spain and Malaysia
earlier this year, India had won the opening game with identical margin.",hockey,2019-06-08,21:37:00,https://www.indiatoday.in/sports/hockey/story/india-take-unassailable-2-0-lead-over-korea-clinch-women-s-hockey-series-1531970-2019-05-22
India Today," Indian women's hockey team beat South Korea 2-1 in tour openerHigh on confidence after their impressive outings in Spain and Malaysia
earlier this year, India made a strong start against hosts South Korea",hockey,2019-06-08,21:37:00,https://www.indiatoday.in/sports/hockey/story/india-women-hockey-team-south-korea-tour-1529577-2019-05-20
India Today," Hockey: Need to score consistently under tight marking, says Graham ReidIndia lost both the matches against Australia on their tour Down Under after
performing well against Australia A and WA Thundersticks. ",hockey,2019-06-08,21:37:00,https://www.indiatoday.in/sports/hockey/story/india-hockey-team-australia-tour-coach-graham-reid-comments-1528817-2019-05-19
India Today," Rani Rampal sees Korea series as platform to prepare for FIH Women's series FinalsIndia women's hockey team captain Rani Rampal is looking forward to doing
well in the three-match series against Korea in the run-up to the FIH Women's
series Finals.",hockey,2019-06-08,21:37:00,https://www.indiatoday.in/sports/hockey/story/rani-rampal-india-women-s-hockey-team-vs-korea-fih-women-s-series-finals-1528185-2019-05-18
India Today," India end Australia tour with loss in the final matchIndia lost the fifth and final match by 5-2 against Australia to end their
tour on a sour note. Nilakanta Sharma and Rupinderpal Singh scored the two
goals for India.",hockey,2019-06-08,21:37:00,https://www.indiatoday.in/sports/hockey/story/india-loss-5-2-tour-of-australia-fifth-match-1527824-2019-05-17
India Today," India succumb to 0-4 loss against Australia in first hockey testAustralia rode on two goals each from Jeremy Hayward and Blake Govers to
outclass India in the first match of the two-test series at the Perth Hockey
Stadium on Wednesday.",hockey,2019-06-08,21:37:00,https://www.indiatoday.in/sports/hockey/story/australia-vs-india-1st-hockey-test-report-jeremy-hayward-blake-glovers-1525797-2019-05-15
India Today," Indian men's hockey team draws 1-1 with Australia AHarmanpreet Singh helped the Indian men's hockey team salvage a 1-1 draw
against Australia 'A' on Monday.",hockey,2019-06-08,21:37:00,https://www.indiatoday.in/sports/hockey/story/indian-men-hockey-team-draw-australia-a-1523786-2019-05-13
India Today," Indian men's hockey team wins 3-0 against Australia AThe Indian men's Hockey team registered a comfortable 3-0 victory against
Australia A on Friday. India will play their next match on May 13.",hockey,2019-06-08,21:37:00,https://www.indiatoday.in/sports/hockey/story/indian-men-hockey-team-wins-against-australia-a-1521718-2019-05-10
India Today," Playing Australia will boost our confidence, says India hockey captain Manpreet SinghThe India team travel Down Under for five matches starting Wednesday. The
tour, marked as a preparation for next month's Hockey Series Final will be
newly-appointed chief coach Graham Reid's maiden assignment with the team.",hockey,2019-06-08,21:37:00,https://www.indiatoday.in/sports/hockey/story/playing-australia-will-boost-confidence-manpreet-singh-1518366-2019-05-06
India Today," Manpreet Singh to lead India in tour of AustraliaManpreet Singh will lead a balanced 18-man squad in the four-match tour
against Australia which starts May 10. India men's hockey team head coach
Graham Reid also spoke of the importance of the tour ahead of the FIH Men's
Hockey Series Final.",hockey,2019-06-08,21:37:00,https://www.indiatoday.in/sports/hockey/story/manpreet-singh-india-men-s-hokey-team-tour-australia-graham-reid-1514449-2019-05-01
India Today," Want to retire after Tokyo Olympics, says Mary KomSix-time World Champion, Mary Kom said she wants to retire from the game
after winning a gold medal for the country at the 2020 Tokyo Olympics.",other sports,2019-06-08,21:37:00,https://www.indiatoday.in/sports/other-sports/story/mary-kom-6-time-world-champion-retirement-2020-olympics-1543995-2019-06-06
India Today," Vijender Singh is scared of me: British boxer Amir KhanAmir Khan, a celebrated boxer, bragged saying Vijender Singh is ""scared"" of
me. Khan, the British boxer, has expressed a desire to wrangle with Olympic
bronze medalist Vijender a number of times but the same has not been
materialized yet.",other sports,2019-06-08,21:37:00,https://www.indiatoday.in/sports/other-sports/story/super-boxing-league-vijender-singh-amir-khan-1539431-2019-05-31
India Today," India sweep mixed team titles to conclude best ever ISSF WC performanceIndia produced their best performance with a total of 5 gold and a silver
medal, to top the medals tally at the ISSF World Cup in Munich.",other sports,2019-06-08,21:37:00,https://www.indiatoday.in/sports/other-sports/story/issf-shooting-world-cup-munich-india-win-5-gold-best-performance-1538830-2019-05-30
India Today," Munich World Cup: Manu Bhaker secures Olympic quota in shootingIndian shooters are competing for 12 of the 17 Tokyo Olympic quotas available
in Munich, having already secured seven quota places in rifle and pistol
competitions.",other sports,2019-06-08,21:37:00,https://www.indiatoday.in/sports/other-sports/story/munich-world-cup-manu-bhaker-secures-olympic-quota-in-shooting-1537774-2019-05-29
India Today," ISSF Shooting World Cup: Saurabh Chaudhary smashes world record to put India on topA world-record shattering performance from young shooter Saurabh Chaudhary
combined with Rahi Sarnobat's gold medal put India on top of the medals tally
of the ISSF World Cup in Munich",other sports,2019-06-08,21:37:00,https://www.indiatoday.in/sports/other-sports/story/issf-shooting-world-cup-munich-2019-rahi-sarnobat-saurabh-chaudhary-gold-1536094-2019-05-27
India Today," ISSF Shooting World Cup: Apurvi Chandela bags 10m air rifle gold in MunichApurvi Chandela had also won silver in the 10m air rifle during the 2015
Munich competition. Chandela had won quotas for the 2020 Olympics after
finishing fourth at the world championships.",other sports,2019-06-08,21:37:00,https://www.indiatoday.in/sports/other-sports/story/shooting-world-cup-apurvi-chandela-wins-gold-2020-olympics-10-m-air-rifle-1535208-2019-05-26
India Today," Nike to waive performance targets for pregnant athletesSportswear giant Nike will be waiving performance-pay reductions for 12
months for athletes who are pregnant or already have a baby after 2 athletes
confirmed that Nike had frozen their sponsorship payments while they were
pregnant.",other sports,2019-06-08,21:37:00,https://www.indiatoday.in/sports/other-sports/story/nike-waive-performance-based-targets-12-months-1534617-2019-05-25
India Today," Boxing league likely to happen in August or September: BFI president Ajay SinghBoxing league is likely to happen this year in August or September as 'decent
amount of work is happening', Ajay Singh, President of Boxing Federation of
India, said. It is trying to find a slot to see that the league does not
clash with any other major leagues.",other sports,2019-06-08,21:37:00,https://www.indiatoday.in/sports/other-sports/story/ajay-singh-boxing-federation-of-india-1534315-2019-05-25
India Today," India Open Boxing: Mary, Sarita lead hosts' gold rush on final dayOlympic bronze medallist Mary Kom saw off a valiant fight by former national
champion Vanlal Duati of Mizoram to emerge winner by unanimous decision",other sports,2019-06-08,21:37:00,https://www.indiatoday.in/sports/other-sports/story/india-open-boxing-2019-results-mary-kom-sarita-devi-amit-panghal-gold-medals-1534099-2019-05-24
India Today," Indian Open Boxing: Mary Kom feels disrespected with opponent Nikhat Zareen's challenge Boxing legend Mary Kom was furious with Nikhat Zareen's comments on
challenging her and asked her to prove herself in the ring first rather than
making such 'irritating' comments.",other sports,2019-06-08,21:37:00,https://www.indiatoday.in/sports/other-sports/story/mary-kom-furious-nikhat-zareen-irritating-comments-1533424-2019-05-24
India Today," Dipa Karmakar will return to gymnastics only when fully fit: CoachWith Dipa Karmakar's participation uncertain at the 2020 Tokyo Olympics,
coach Bisweswar Nandi said the gymnast was doing everything possible to
return as soon as possible after a knee injury.",other sports,2019-06-08,21:37:00,https://www.indiatoday.in/sports/other-sports/story/dipa-karmakar-knee-injury-2020-tokyo-olympics-participation-1532858-2019-05-23
India Today," IOC recommends boxing to remain Olympic sport at TokyoInternational Olympic Committee’s (IOC) recommended boxing keeps its place
at next year’s Olympic Games but AIBA, the governing body of the sport’s
amateur version, should be suspended.",other sports,2019-06-08,21:37:00,https://www.indiatoday.in/sports/other-sports/story/ioc-boxing-remains-olympic-sport-tokyo-aiba-1532561-2019-05-23
Time of India,"World Cup 2019, India vs Australia: Three battles to watch out for",icc wc 2019,2019-06-08,21:36,https://timesofindia.indiatimes.com/sports/cricket/icc-world-cup/teams/india/news/world-cup-2019-india-vs-australia-three-battles-to-watch-out-for/articleshow/69701026.cms
Time of India,"World Cup 2019: We need middle-order contributions, that's the key, says Dimuth Karunaratne",icc wc 2019,2019-06-08,21:36,https://timesofindia.indiatimes.com/sports/cricket/icc-world-cup/teams/sri-lanka/news/world-cup-2019-we-need-middle-order-contributions-thats-the-key-says-dimuth-karunaratne/articleshow/69700829.cms
Time of India,World Cup 2019: Sarfaraz Ahmed backs Pakistan to maintain momentum after washout in Bristol,icc wc 2019,2019-06-08,21:36,https://timesofindia.indiatimes.com/sports/cricket/icc-world-cup/teams/pakistan/news/world-cup-2019-sarfaraz-ahmed-backs-pakistan-to-maintain-momentum-after-washout-in-bristol/articleshow/69700750.cms
Time of India,World Cup 2019: Virat Kohli & Co meet India’s High Commissioner to the UK ahead of Australia clash,icc wc 2019,2019-06-08,21:36,https://timesofindia.indiatimes.com/sports/cricket/icc-world-cup/teams/india/news/world-cup-2019-team-india-meets-indias-high-commissioner-to-the-uk-ahead-of-australia-clash/articleshow/69700278.cms
Time of India,Can India have the last laugh against formidable Aussies?,icc wc 2019,2019-06-08,21:36,https://timesofindia.indiatimes.com/sports/cricket/icc-world-cup/icc-world-cup-videos/can-india-have-the-last-laugh-against-formidable-aussies/videoshow/69699032.cms
Time of India,"We don't underestimate Bangladesh, says Eoin Morgan",icc wc 2019,2019-06-08,21:36,https://timesofindia.indiatimes.com/sports/cricket/icc-world-cup/icc-world-cup-videos/we-dont-underestimate-bangladesh-says-eoin-morgan/videoshow/69695580.cms
Time of India,"We have to play at our best, says Mashrafe Mortaza",icc wc 2019,2019-06-08,21:36,https://timesofindia.indiatimes.com/sports/cricket/icc-world-cup/icc-world-cup-videos/world-cup-we-have-to-play-at-our-best-says-mashrafe-mortaza/videoshow/69695856.cms
Time of India,"Coulter-Nile, Starc set up Australia win over Windies",icc wc 2019,2019-06-08,21:36,https://timesofindia.indiatimes.com/sports/cricket/icc-world-cup/icc-world-cup-videos/world-cup-coulter-nile-starc-set-up-australias-15-run-win-over-west-indies/videoshow/69687009.cms
Time of India,Starc revels in 'bowling at the death',icc wc 2019,2019-06-08,21:36,https://timesofindia.indiatimes.com/sports/cricket/icc-world-cup/icc-world-cup-videos/mitchell-starc-revels-in-bowling-at-the-death-to-get-five-wicket-haul/videoshow/69685882.cms
Time of India,Skipper Karunaratne insists Sri Lanka don't care about critics,icc wc 2019,2019-06-08,21:36,https://timesofindia.indiatimes.com/sports/cricket/icc-world-cup/icc-world-cup-videos/icc-world-cup-karunaratne-insists-sri-lanka-dont-care-about-critics/videoshow/69680434.cms
Time of India,New Zealand hold nerve to beat Bangladesh in a thriller,icc wc 2019,2019-06-08,21:36,https://timesofindia.indiatimes.com/sports/cricket/icc-world-cup/icc-world-cup-videos/icc-world-cup-new-zealand-hold-nerve-to-beat-bangladesh-in-a-thriller/videoshow/69672332.cms
Time of India,Rohit Sharma's century gives India winning start,icc wc 2019,2019-06-08,21:36,https://timesofindia.indiatimes.com/sports/cricket/icc-world-cup/icc-world-cup-videos/icc-world-cup-rohit-sharmas-century-gives-india-winning-start/videoshow/69672204.cms
Time of India,"Best Rohit innings I've ever seen, says Virat Kohli",icc wc 2019,2019-06-08,21:36,https://timesofindia.indiatimes.com/sports/cricket/icc-world-cup/icc-world-cup-videos/world-cup-best-rohit-sharma-innings-ive-ever-seen-says-virat-kohli/videoshow/69669082.cms
Time of India,Pakistan bounce back to beat England by 14 runs,icc wc 2019,2019-06-08,21:36,https://timesofindia.indiatimes.com/sports/cricket/icc-world-cup/icc-world-cup-videos/world-cup-2019-pakistan-bounce-back-to-beat-england-by-14-runs/videoshow/69644529.cms
Time of India,World Cup 2019: Ricky Ponting seeks answers from batsmen after Australia's top-order failure against West Indies,icc wc 2019,2019-06-08,21:36,https://timesofindia.indiatimes.com/sports/cricket/icc-world-cup/teams/australia/news/world-cup-2019-ricky-ponting-seeks-answers-from-batsmen-after-australias-top-order-failure-against-west-indies/articleshow/69699813.cms
Time of India,"World Cup 2019 AFG vs NZ, Preview: On-song Kiwis favourites against Afghanistan",icc wc 2019,2019-06-08,21:36,https://timesofindia.indiatimes.com/sports/cricket/icc-world-cup/teams/new-zealand/news/world-cup-2019-afg-vs-nz-preview-on-song-kiwis-favourites-against-afghanistan/articleshow/69699547.cms
Time of India,"World Cup 2019: New Zealand ready for Afghanistan's spin onslaught, says coach Gary Stead",icc wc 2019,2019-06-08,21:36,https://timesofindia.indiatimes.com/sports/cricket/icc-world-cup/teams/afghanistan/news/world-cup-2019-new-zealand-ready-for-afghanistans-spin-onslaught-says-coach-gary-stead/articleshow/69698662.cms
Time of India,India may opt for three pacers after Australia's struggle against WI: Ponting,icc wc 2019,2019-06-08,21:36,https://timesofindia.indiatimes.com/sports/cricket/icc-world-cup/teams/india/news/india-may-opt-for-three-pacers-after-australias-struggle-against-wi-ponting/articleshow/69695448.cms
Time of India,"World Cup: MS Dhoni can't wear 'Balidaan' insignia on gloves, says ICC",icc wc 2019,2019-06-08,21:36,https://timesofindia.indiatimes.com/sports/cricket/icc-world-cup/teams/india/news/world-cup-ms-dhoni-cant-wear-balidaan-insignia-on-gloves-says-icc/articleshow/69698788.cms
Time of India,Afghanistan's Naib rues Shahzad World Cup injury blow,icc wc 2019,2019-06-08,21:36,https://timesofindia.indiatimes.com/sports/cricket/icc-world-cup/teams/afghanistan/news/afghanistans-naib-rues-shahzad-world-cup-injury-blow/articleshow/69695428.cms
Time of India,"Can't allow Army insignia on Dhoni's gloves, ICC tells BCCI",icc wc 2019,2019-06-08,21:36,https://timesofindia.indiatimes.com/sports/cricket/icc-world-cup/teams/india/news/cant-allow-army-insignia-on-dhonis-gloves-icc-tells-bcci/articleshow/69695242.cms
Time of India,"Pakistan vs Sri Lanka, Cricket World Cup: Pakistan, Sri Lanka split points after wash out",icc wc 2019,2019-06-08,21:36,https://timesofindia.indiatimes.com/sports/cricket/icc-world-cup/teams/pakistan/news/pakistan-vs-sri-lanka-cricket-world-cup-pakistan-sri-lanka-split-points-after-wash-out/articleshow/69694322.cms
Time of India,"England won't panic at World Cup, says captain Morgan",icc wc 2019,2019-06-08,21:36,https://timesofindia.indiatimes.com/sports/cricket/icc-world-cup/teams/england/news/england-wont-panic-at-world-cup-says-captain-morgan/articleshow/69693385.cms
Time of India,ICC World Cup 2019: Starc says Australia found 'new way to win' against West Indies,icc wc 2019,2019-06-08,21:36,https://timesofindia.indiatimes.com/sports/cricket/icc-world-cup/teams/australia/news/icc-world-cup-2019-starc-says-australia-found-new-way-to-win-against-west-indies/articleshow/69693103.cms
