Source,Heading,Category,Date,Time,URL
India Today," Sudirman Cup: India shuttlers take on Malaysia, eye knockout stageSudirman Cup: India have reached the quarterfinals twice in the 2011 and 2017
editions but haven't crossed the last eight stage.",badminton,2019-06-17,14:59:00,https://www.indiatoday.in/sports/badminton/story/sudirman-cup-india-vs-malaysia-lee-chong-wei-pv-sindhu-saina-nehwal-1530247-2019-05-20
India Today," Dutee Chand warns followers against fake Twitter accounts using her nameDutee Chand's troubles don't seem to end as while battling her family and the
society at large due to her sexual orientation, she is now having to fight
out fake Twitter accounts in her own name",athletics,2019-06-17,14:59:00,https://www.indiatoday.in/sports/athletics/story/dutee-chand-twitter-account-india-atheltics-1535763-2019-05-27
India Today," Another athlete slams testosterone rules, refuses medicationOlympic medalist Margaret Wambui criticized the IAAF's testosterone
regulations and said she won't take ""any type of medication"" to lower her
natural testosterone.",athletics,2019-06-17,14:59:00,https://www.indiatoday.in/sports/athletics/story/caster-semenya-iaaf-margaret-wambui-iaaf-testosterone-regulations-1531912-2019-05-22
India Today," I'm so proud of Dutee Chand: Ellen DeGeneres on Indian sprinter's coming outPopular host Ellen DeGeneres rejoiced and was proud of the fact that Dutee
Chand became the 1st sportperson in India to openly admit that she's gay. The
100m record holder and winner of two Asian Games silver medals had recently
opened up to the media about her homosexuality.",athletics,2019-06-17,14:59:00,https://www.indiatoday.in/sports/athletics/story/tv-host-ellen-degeneres-proud-dutee-chand-opened-up-homosexuality-1531568-2019-05-22
India Today," Asian Championships winner Gomathi fails dope test, faces provisional suspensionAsian Championships 800 metres gold medallist Gomathi Marimuthu was tested
positive for a banned substance. Gomathi will face a 4-year suspension if her
B sample also tests positive.",athletics,2019-06-17,14:59:00,https://www.indiatoday.in/sports/athletics/story/asian-championships-winner-gomathi-marimuthu-fails-dope-test-1531329-2019-05-21
India Today," Sister's blackmail, torture forced me to reveal my same-sex relationship: Dutee ChandIndia's fastest woman Dutee Chand has said that she revealed about her
same-sex relationship after being tortured by her eldest sister.",athletics,2019-06-17,14:59:00,https://www.indiatoday.in/sports/athletics/story/dutee-chand-same-sex-relationship-blackmail-1531211-2019-05-21
India Today," Dutee Chand faces family's wrath after revealing same-sex relationshipDutee Chand said that her eldest sister threatened to not only expel her from
the family but also send her to jail.",athletics,2019-06-17,14:59:00,https://www.indiatoday.in/sports/athletics/story/dutee-chand-same-sex-relationship-expulsion-from-family-india-s-fastest-woman-1528795-2019-05-19
India Today," Ace sprinter Dutee Chand reveals she is in same-sex relationship with 'soulmate'Dutee Chand revealed in an interview that she is in a same-sex relationship
with a girl from her hometown.",athletics,2019-06-17,14:59:00,https://www.indiatoday.in/sports/athletics/story/dutee-chand-same-sex-relationship-soulmate-1528532-2019-05-19
India Today," Neeraj Chopra recovering without complications: AFI presidentNeeraj Chopra may miss the Doha World Championships as his recovery is likely
to take at least three months after he had arthroscopic surgery on his
throwing right hand to remove bone fragments from his elbow joint.",athletics,2019-06-17,14:59:00,https://www.indiatoday.in/sports/athletics/story/neeraj-chopra-afi-surgery-recovery-doha-world-championships-1526833-2019-05-16
India Today," South African government to appeal against Caster Semenya rulingMiddle-distance runner Caster Semenya had lost a crucial case after the Court
of Arbitration for Sport ruled that female track athletes with naturally high
levels of testosterone have to regulate their hormone levels to participate
in major events, including the Olympics.",athletics,2019-06-17,14:59:00,https://www.indiatoday.in/sports/athletics/story/caster-semenya-case-south-africa-to-appeal-1523911-2019-05-13
India Today," Russian athlete Savina gets 12-year banA ban as long as 12 years is uncommon but Russian athelete Kseniya Savina
attempted to shift blame and avoid sanctions by providing false medical
documents added another anti-doping rule violation in her case.",athletics,2019-06-17,14:59:00,https://www.indiatoday.in/sports/athletics/story/russian-athlete-kseniya-savina-doping-ban-1520369-2019-05-08
India Today," I can qualify for 2020 Tokyo Olympics: Jinson JohnsonJinson Johnson feels he can qualify for the 1500 metres event at the 2020
Tokyo Olympics, despite his recent injury concerns.",athletics,2019-06-17,14:59:00,https://www.indiatoday.in/sports/athletics/story/jinson-johnson-qualify-2020-tokyo-olympics-1519648-2019-05-07
India Today," Hell no: Defiant Caster Semenya wins, says she won't take drugsCaster Semenya won the 800 meters at the opening Diamond League meeting of
the season in Doha and it was her first win since losing her case against the
IAAF.",athletics,2019-06-17,14:59:00,https://www.indiatoday.in/sports/athletics/story/caster-semenya-800m-diamond-league-iaff-drug-testosterone-cas-1517010-2019-05-04
India Today," India beat South Africa 5-1 to win FIH Series FinalsWorld No. 5, India, came into the tournament as overwhelming favorites played
like champions and remained unbeaten throughout the tournament.",hockey,2019-06-17,14:59:00,https://www.indiatoday.in/sports/hockey/story/fih-series-finals-hockey-india-vs-south-africa-1549798-2019-06-16
India Today," FIH Series 2019: Poland & Russia arrive in Bhubaneshwar India will open their campaign against Russia on June 6 and meet Poland on
June 7 and Uzbekistan on June 10 in their remaining pool matches. The final
of the tournament will be played on June 15.",hockey,2019-06-17,14:59:00,https://www.indiatoday.in/sports/hockey/story/fih-series-2019-poland-russia-arrive-in-bhubaneshwar-1539457-2019-05-31
India Today," Indian women's hockey team end series with 0-4 loss to South Korea After two back-to-back wins, Indian women's hockey team lost 0-4 to South
Korea in the third and final game of the series.",hockey,2019-06-17,14:59:00,https://www.indiatoday.in/sports/hockey/story/hockey-series-india-lose-south-africa-0-4-1533752-2019-05-24
India Today," India take unassailable 2-0 lead over Korea, clinch women's hockey seriesHigh on confidence after their impressive outings in Spain and Malaysia
earlier this year, India had won the opening game with identical margin.",hockey,2019-06-17,14:59:00,https://www.indiatoday.in/sports/hockey/story/india-take-unassailable-2-0-lead-over-korea-clinch-women-s-hockey-series-1531970-2019-05-22
India Today," Indian women's hockey team beat South Korea 2-1 in tour openerHigh on confidence after their impressive outings in Spain and Malaysia
earlier this year, India made a strong start against hosts South Korea",hockey,2019-06-17,14:59:00,https://www.indiatoday.in/sports/hockey/story/india-women-hockey-team-south-korea-tour-1529577-2019-05-20
India Today," Hockey: Need to score consistently under tight marking, says Graham ReidIndia lost both the matches against Australia on their tour Down Under after
performing well against Australia A and WA Thundersticks. ",hockey,2019-06-17,14:59:00,https://www.indiatoday.in/sports/hockey/story/india-hockey-team-australia-tour-coach-graham-reid-comments-1528817-2019-05-19
India Today," Rani Rampal sees Korea series as platform to prepare for FIH Women's series FinalsIndia women's hockey team captain Rani Rampal is looking forward to doing
well in the three-match series against Korea in the run-up to the FIH Women's
series Finals.",hockey,2019-06-17,14:59:00,https://www.indiatoday.in/sports/hockey/story/rani-rampal-india-women-s-hockey-team-vs-korea-fih-women-s-series-finals-1528185-2019-05-18
India Today," India end Australia tour with loss in the final matchIndia lost the fifth and final match by 5-2 against Australia to end their
tour on a sour note. Nilakanta Sharma and Rupinderpal Singh scored the two
goals for India.",hockey,2019-06-17,14:59:00,https://www.indiatoday.in/sports/hockey/story/india-loss-5-2-tour-of-australia-fifth-match-1527824-2019-05-17
India Today," India succumb to 0-4 loss against Australia in first hockey testAustralia rode on two goals each from Jeremy Hayward and Blake Govers to
outclass India in the first match of the two-test series at the Perth Hockey
Stadium on Wednesday.",hockey,2019-06-17,14:59:00,https://www.indiatoday.in/sports/hockey/story/australia-vs-india-1st-hockey-test-report-jeremy-hayward-blake-glovers-1525797-2019-05-15
India Today," Indian men's hockey team draws 1-1 with Australia AHarmanpreet Singh helped the Indian men's hockey team salvage a 1-1 draw
against Australia 'A' on Monday.",hockey,2019-06-17,14:59:00,https://www.indiatoday.in/sports/hockey/story/indian-men-hockey-team-draw-australia-a-1523786-2019-05-13
India Today," Indian men's hockey team wins 3-0 against Australia AThe Indian men's Hockey team registered a comfortable 3-0 victory against
Australia A on Friday. India will play their next match on May 13.",hockey,2019-06-17,14:59:00,https://www.indiatoday.in/sports/hockey/story/indian-men-hockey-team-wins-against-australia-a-1521718-2019-05-10
India Today," Playing Australia will boost our confidence, says India hockey captain Manpreet SinghThe India team travel Down Under for five matches starting Wednesday. The
tour, marked as a preparation for next month's Hockey Series Final will be
newly-appointed chief coach Graham Reid's maiden assignment with the team.",hockey,2019-06-17,14:59:00,https://www.indiatoday.in/sports/hockey/story/playing-australia-will-boost-confidence-manpreet-singh-1518366-2019-05-06
India Today," Dad sold his house to buy me rifle: Shooter Gagan Narang shares emotional post on Father's DayElaborating further on the 20-year-old episode, Gagan Narang said that his
father sold his house not because he knew his son would win medals for the
country but because he came home crying.",other sports,2019-06-17,14:59:00,https://www.indiatoday.in/sports/story/dad-sold-his-house-to-buy-me-rifle-gagan-narang-fathers-day-1549906-2019-06-16
India Today," Want to retire after Tokyo Olympics, says Mary KomSix-time World Champion, Mary Kom said she wants to retire from the game
after winning a gold medal for the country at the 2020 Tokyo Olympics.",other sports,2019-06-17,14:59:00,https://www.indiatoday.in/sports/other-sports/story/mary-kom-6-time-world-champion-retirement-2020-olympics-1543995-2019-06-06
India Today," Vijender Singh is scared of me: British boxer Amir KhanAmir Khan, a celebrated boxer, bragged saying Vijender Singh is ""scared"" of
me. Khan, the British boxer, has expressed a desire to wrangle with Olympic
bronze medalist Vijender a number of times but the same has not been
materialized yet.",other sports,2019-06-17,14:59:00,https://www.indiatoday.in/sports/other-sports/story/super-boxing-league-vijender-singh-amir-khan-1539431-2019-05-31
India Today," India sweep mixed team titles to conclude best ever ISSF WC performanceIndia produced their best performance with a total of 5 gold and a silver
medal, to top the medals tally at the ISSF World Cup in Munich.",other sports,2019-06-17,14:59:00,https://www.indiatoday.in/sports/other-sports/story/issf-shooting-world-cup-munich-india-win-5-gold-best-performance-1538830-2019-05-30
India Today," Munich World Cup: Manu Bhaker secures Olympic quota in shootingIndian shooters are competing for 12 of the 17 Tokyo Olympic quotas available
in Munich, having already secured seven quota places in rifle and pistol
competitions.",other sports,2019-06-17,14:59:00,https://www.indiatoday.in/sports/other-sports/story/munich-world-cup-manu-bhaker-secures-olympic-quota-in-shooting-1537774-2019-05-29
India Today," ISSF Shooting World Cup: Saurabh Chaudhary smashes world record to put India on topA world-record shattering performance from young shooter Saurabh Chaudhary
combined with Rahi Sarnobat's gold medal put India on top of the medals tally
of the ISSF World Cup in Munich",other sports,2019-06-17,14:59:00,https://www.indiatoday.in/sports/other-sports/story/issf-shooting-world-cup-munich-2019-rahi-sarnobat-saurabh-chaudhary-gold-1536094-2019-05-27
India Today," ISSF Shooting World Cup: Apurvi Chandela bags 10m air rifle gold in MunichApurvi Chandela had also won silver in the 10m air rifle during the 2015
Munich competition. Chandela had won quotas for the 2020 Olympics after
finishing fourth at the world championships.",other sports,2019-06-17,14:59:00,https://www.indiatoday.in/sports/other-sports/story/shooting-world-cup-apurvi-chandela-wins-gold-2020-olympics-10-m-air-rifle-1535208-2019-05-26
India Today," Nike to waive performance targets for pregnant athletesSportswear giant Nike will be waiving performance-pay reductions for 12
months for athletes who are pregnant or already have a baby after 2 athletes
confirmed that Nike had frozen their sponsorship payments while they were
pregnant.",other sports,2019-06-17,14:59:00,https://www.indiatoday.in/sports/other-sports/story/nike-waive-performance-based-targets-12-months-1534617-2019-05-25
India Today," Boxing league likely to happen in August or September: BFI president Ajay SinghBoxing league is likely to happen this year in August or September as 'decent
amount of work is happening', Ajay Singh, President of Boxing Federation of
India, said. It is trying to find a slot to see that the league does not
clash with any other major leagues.",other sports,2019-06-17,14:59:00,https://www.indiatoday.in/sports/other-sports/story/ajay-singh-boxing-federation-of-india-1534315-2019-05-25
India Today," India Open Boxing: Mary, Sarita lead hosts' gold rush on final dayOlympic bronze medallist Mary Kom saw off a valiant fight by former national
champion Vanlal Duati of Mizoram to emerge winner by unanimous decision",other sports,2019-06-17,14:59:00,https://www.indiatoday.in/sports/other-sports/story/india-open-boxing-2019-results-mary-kom-sarita-devi-amit-panghal-gold-medals-1534099-2019-05-24
India Today," Indian Open Boxing: Mary Kom feels disrespected with opponent Nikhat Zareen's challenge Boxing legend Mary Kom was furious with Nikhat Zareen's comments on
challenging her and asked her to prove herself in the ring first rather than
making such 'irritating' comments.",other sports,2019-06-17,14:59:00,https://www.indiatoday.in/sports/other-sports/story/mary-kom-furious-nikhat-zareen-irritating-comments-1533424-2019-05-24
India Today," Dipa Karmakar will return to gymnastics only when fully fit: CoachWith Dipa Karmakar's participation uncertain at the 2020 Tokyo Olympics,
coach Bisweswar Nandi said the gymnast was doing everything possible to
return as soon as possible after a knee injury.",other sports,2019-06-17,14:59:00,https://www.indiatoday.in/sports/other-sports/story/dipa-karmakar-knee-injury-2020-tokyo-olympics-participation-1532858-2019-05-23
