Source,Heading,Category,Date,Time,URL
India Today," West Indies vs Bangladesh Live Score, ICC World Cup 2019: WI, BAN clash in chase of 2nd win",news,2019-06-17,14:59:00,https://www.indiatoday.in/sports/story/west-indies-vs-bangladesh-live-score-icc-world-cup-2019-wi-vs-ban-1550416-2019-06-17
India Today," World Cup 2019: Shami has potential to provide breakthroughs, says TendulkarWorld Cup 2019: India great Sachin Tendulkar said fast bowler Mohammed Shami
has the ability to give India crucial breakthroughs should he play in their
next game against Afghanistan.",news,2019-06-17,14:59:00,https://www.indiatoday.in/sports/cricket-world-cup-2019/story/icc-cricket-world-cup-mohammed-shami-bhuvneshwar-kumar-injured-india-vs-pakistan-sachin-tendulkar-1550358-2019-06-17
India Today," India vs Pakistan: Shoaib Akhtar slams 'brainless captain' Sarfaraz AhmedWorld Cup 2019: After Pakistan's drubbing at the hands of India in
Manchester, former fast bowler Shoaib Akhtar slammed captain Sarfaraz Ahmed
and bowler Hasan Ali for the defeat",news,2019-06-17,14:59:00,https://www.indiatoday.in/sports/cricket-world-cup-2019/story/india-vs-pakistan-icc-cricket-world-cup-2019-shoaib-akhtar-brainless-sarfaraz-ahmed-clueless-1550334-2019-06-17
India Today," West Indies vs Bangladesh, Live Streaming: When and where to watch World Cup 2019 match live West Indies vs Bangladesh (WI vs BAN) Live Streaming: Both West Indies and
Bangladesh started their World Cup campaign with a win but failed to register
another victory there on. The two teams will look to register their 2nd win
of the tournament when they take on each other in Taunton on June 17.",news,2019-06-17,14:59:00,https://www.indiatoday.in/sports/cricket-world-cup-2019/story/icc-cricket-world-cup-2019-west-indies-vs-bangladesh-taunton-when-where-how-to-watch-live-streaming-online-coverage-1550300-2019-06-17
India Today," World Cup 2019: Bhuvneshwar Kumar ruled out of next 3 games with hamstring injuryIndian pcer Bhuvneshwar Kumar pulled up his hamstring during India's victory
against Pakistan at Old Trafford on Sunday, possibly ruling him out for the
next 2-3 matches of World Cup 2019",news,2019-06-17,14:59:00,https://www.indiatoday.in/sports/cricket-world-cup-2019/story/icc-cricket-world-cup-2019-india-bhuvneshwar-kumar-hamstring-injury-virat-kohli-1550276-2019-06-17
India Today," Kuch fitness nai, kuch nai: Pakistan fans blame burger for defeat to IndiaIndia vs Pakistan: After Pakistan succumbed to an 89-run loss against their
arch-rivals India in their World Cup 2019 encounter on Sunday, pictures of
players having burgers on the eve of the match, infuriated Pak fans",news,2019-06-17,14:59:00,https://www.indiatoday.in/sports/cricket-world-cup-2019/story/icc-cricket-world-cup-2019-pakistan-fan-players-burger-defeat-india-1550254-2019-06-17
India Today," India vs Pakistan: Rohit Sharma's cheeky reply to Pak journalist will make you smileIndia vs Pakistan: Man of the match Rohit Sharma had a witty answer when
asked for his advice to Pakistan batsmen after the opener laid the foundation
of India's 89-run victory in their World Cup 2019 clash on Sunday",news,2019-06-17,14:59:00,https://www.indiatoday.in/sports/cricket-world-cup-2019/story/icc-cricket-world-cup-2019-india-vs-pakistan-rohit-sharma-reply-pak-journalist-1550241-2019-06-17
India Today," Watch: Ziva Dhoni and Rishabh Pant have a blast at India vs Pakistan matchWorld Cup 2019: Rishabh Pant and Ziva Dhoni were seen cheering for the Indian
team together during the high-octane clash against Pakistan at Old Trafford
on Sunday.",news,2019-06-17,14:59:00,https://www.indiatoday.in/sports/cricket-world-cup-2019/story/icc-cricket-world-cup-2019-india-vs-pakistan-rishabh-pant-ziva-dhoni-old-trafford-1550223-2019-06-17
India Today," India best team in World Cup 2019, way better than Pakistan: Sachin TendulkarSpeaking to India Today, legendary Sachin Tendulkar expressed confidence that
Virat Kohli's men will not let complacency creep in even after their dominant
win over arch-rivals Pakistan on Sunday. India extended their unbeaten run in
World Cup 2019 and now have 7 points from 4 matches",news,2019-06-17,14:59:00,https://www.indiatoday.in/sports/cricket-world-cup-2019/story/icc-cricket-world-cup-2019-india-best-better-than-pakistan-sachin-tendulkar-1550221-2019-06-17
India Today," India vs Pakistan: Rohit Sharma batting at a different level, says Sachin TendulkarIndia vs Pakistan: Sachin Tendulkar said Rohit Sharma's consistency has been
terrific. Rohit has so far scored 319 runs from 3 innings in the 2019 World
Cup. On Sunday, his 140 helped India defeat Pakistan at Old Trafford.",news,2019-06-17,14:59:00,https://www.indiatoday.in/sports/cricket-world-cup-2019/story/india-vs-pakistan-world-cup-2019-rohit-sharma-sachin-tendulkar-1550220-2019-06-17
India Today," India vs Pakistan: I had told Kuldeep 'don't worry, ho jaayega,' says Sachin TendulkarIndia vs Pakistan: Sachin Tendulkar heaped praise on Kuldeep Yadav who has
made a sensational comeback for India in World Cup 2019 after a poor campaign
for KKR in the Indian Premier League this year.",news,2019-06-17,14:59:00,https://www.indiatoday.in/sports/cricket-world-cup-2019/story/india-vs-pakistan-world-cup-2019-kuldeep-yadav-sachin-tendulkar-1550218-2019-06-17
India Today," 45:26India vs Pakistan: Losing toss was blessing in disguise for India, says Sachin Tendulkar",news,2019-06-17,14:59:00,https://www.indiatoday.in/sports/video/india-vs-pakistan-losing-toss-was-blessing-in-disguise-for-india-says-sachin-tendulkar-1550209-2019-06-17
India Today," Ashes 2019: Booing Warner, Smith can backfire for England, says AndersonDavid Warner and Steve Smith have returned to International Cricket after
serving one year post the Spot-fixing scandal in South Africa. They were
booed by English fans during Australia's warm-up match against England.",cricket,2019-06-17,14:59:00,https://www.indiatoday.in/sports/cricket/story/ashes-2019-booing-warner-smith-can-backfire-for-england-says-anderson-1550048-2019-06-16
India Today, 03:16World Cup 2019: MS Dhoni and Harbhajan Singh's banter will leave you in splits,cricket,2019-06-17,14:59:00,https://www.indiatoday.in/sports/video/india-vs-pakistan-world-cup-2019-ms-dhoni-harbhajan-singh-old-trafford-1549580-2019-06-15
India Today," Sachin Tendulkar sues Australian cricket bat maker for using his nameIndia legendary batsman Sachin Tendulkar has sued an Australia bat
manufacturer for using his name and image to promote their products.",cricket,2019-06-17,14:59:00,https://www.indiatoday.in/sports/cricket/story/sachin-tendulkar-former-india-opener-sues-australian-cricket-bat-maker-usd-2-million-1548709-2019-06-14
India Today," India to begin World Test Championship vs West Indies in Antigua on August 22 India will begin their World Test Championship campaign against the West
Indies in August in Antigua. The Asian giants will play the first 2 matches
of a 3-match T20I series in Florida. The tour will also include a 3-match ODI
series.",cricket,2019-06-17,14:59:00,https://www.indiatoday.in/sports/cricket/story/india-tour-of-usa-and-the-west-indies-full-schedule-3-t20is-odis-2-tests-championship-1547711-2019-06-12
India Today," Amir opened up on spot-fixing after Afridi slapped him: RazzaqICC had banned all three players—Salman Butt for ten years, of which five
were suspended, Muhammad Asif for seven years, of which two were suspended,
and Muhammad Amir for five years, after spot-fixing charges were proved
during investigation.",cricket,2019-06-17,14:59:00,https://www.indiatoday.in/sports/cricket/story/pakistan-spot-fixing-muhammed-amir-confession-shahid-afridi-slap-abdul-razzaq-1547351-2019-06-12
India Today," Yuvraj Singh deserves a proper farewell: Kapil DevKapil Dev said that a player of Yuvraj's stature deserves farewell from the
ground. Yuvraj announced his retirement from international cricket on Monday.",cricket,2019-06-17,14:59:00,https://www.indiatoday.in/sports/cricket/story/yuvraj-singh-deserves-a-proper-farewell-kapil-dev-1547265-2019-06-12
India Today," Jemimah Rodrigues to play England's Kia Super LeagueIndia's young women's cricket star Jemimah Rodrigues will become the third
player from the country after Smriti Mandhana and Harmanpreet Kaur to feature
in the T20 competition in England. ",cricket,2019-06-17,14:59:00,https://www.indiatoday.in/sports/cricket/story/jemimah-rodrigues-women-s-t20-kia-super-league-england-yorkshire-diamonds-1546985-2019-06-11
India Today," Virat Kohli only Indian in Forbes 2019 list of world's highest-paid athletesVirat Kohli, who was ranked 83rd in Forbes 2018 list of highest-paid
athletes, has been placed at the 100th spot in the recently-updated list
which is headed by Barcelona superstar Lionel Messi.",cricket,2019-06-17,14:59:00,https://www.indiatoday.in/sports/cricket/story/virat-kohli-100-forbes-2019-list-worlds-highest-paid-athletes-lionel-messi-cristiano-ronaldo-neymar-federer-1546924-2019-06-11
India Today," 21:04Shikhar Dhawan injury big blow to India: Harbhajan SinghHarbhajan Singh spoke to India Today after Shikhar Dhawan was ruled out of
World Cup 2019 for 3 weeks with a fractured thumb. Harbhajan told that
Shikhar Dhawan's injury is a big blow to India in World Cup 2019.
""Well, it could be 3 weeks depending on how bad the injury is. They are
actually assuming. In the end, it will come down to how Shikhar Dhawan will
feel batting with the injured finger. Even if the injury heals, it will
depend on him to get fully fit."" added Harbhajan.",cricket,2019-06-17,14:59:00,https://www.indiatoday.in/sports/video/shikhar-dhawan-injury-big-blow-to-india-harbhajan-singh-1546715-2019-06-11
India Today," Yuvraj Singh to Shoaib Akhtar: It was terrifying to face youA day after announcing his retirement from international cricket, Yuvraj
Singh thanked long-time rival Shoaib Akhtar for his tribute on social media",cricket,2019-06-17,14:59:00,https://www.indiatoday.in/sports/cricket/story/yuvraj-singh-retirement-shoaib-akhtar-terrified-1546712-2019-06-11
India Today," Does Yuvraj Singh deserve a farewell match? Here is Sourav Ganguly's takeSourav Ganguly on Tuesday said he doesn't believe in farewell matches when
responding to a fan's question on whether Yuvraj Singh deserved a retirement
match. Yuvraj announced his retirement from international cricket on Monday.",cricket,2019-06-17,14:59:00,https://www.indiatoday.in/sports/cricket/story/yuvraj-singh-farewell-match-sourav-ganguly-international-retirement-icc-world-cup-facebook-1546705-2019-06-11
India Today," #YuviDeservesProperFarewell trending on Twitter after Yuvraj Singh retirementYuvraj Singh said he had turned down an offer to play a retirement match but
his fans want him to get a proper farewell a day after the legend announced
his retirement from international cricket and the Indian Premier League.",cricket,2019-06-17,14:59:00,https://www.indiatoday.in/sports/cricket/story/yuvraj-singh-retirement-twitter-trend-yuvi-farewell-rohit-sharma-1546653-2019-06-11
India Today," Juventus appoint Maurizio Sarri as new managerMaurizio Sarri, who has left Chelsea after just one year with the Europa
League champions, has joined Juventus on a three-year contract. ",football,2019-06-17,14:59:00,https://www.indiatoday.in/sports/football/story/juventus-new-manager-maurizio-sarri-chelsea-italy-serie-a-1550144-2019-06-16
India Today," It will take a while to accept it, says Lionel Messi on Argentina's loss to BoliviaArgentina lost to Columbia by a 2-0 margin in Copa America 2019 and Lionel
Messi feels that the team needs to buckle up and play better for the next
match so that they can qualify into the quarter-finals.",football,2019-06-17,14:59:00,https://www.indiatoday.in/sports/football/story/lionel-messi-regrets-defeat-of-argentina-gainst-columbia-copa-america-1549926-2019-06-16
India Today," Philippe Coutinho scores a double as Brazil beat Bolivia in Copa America openerBrazil won over Bolivia 3-0 in which Philippe Coutinho netted the ball twice
in the 2nd half after which Everton, a substitute for David Neres netted the
ball 5 minutes before the game ended.",football,2019-06-17,14:59:00,https://www.indiatoday.in/sports/football/story/coutinho-scores-double-goals-brazil-wins-bolivia-copa-america-2019-1549350-2019-06-15
India Today," Eden Hazard fuels 'Galacticos' expectations at Real MadridEden Hazard's arrival at Real Madrid has made the fans dream once again of a
'Galacticos' team. The original Galacticos team included football's greatest
players like Zinedine Zidane, Ronaldo, Luis Figo, David Beckham and others
who played until the summer of 2005.",football,2019-06-17,14:59:00,https://www.indiatoday.in/sports/football/story/eden-hazard-real-madrid-galacticos-santiago-bernabeu-1548588-2019-06-14
India Today," Let me announce my retirement when the moment comes: Iker CasillasIker Casillas had suffered a heart attack during a training session with his
current team, FC Porto, casting major doubt about his ability to continue in
the sport.",football,2019-06-17,14:59:00,https://www.indiatoday.in/sports/football/story/iker-casillas-retirement-football-sara-carbonero-cancer-1548412-2019-06-13
India Today," UEFA launches online streaming portal, aims for young fansUEFA’s new streaming portal will show highlights of weekend matches in the
Bundesliga in TV markets including Britain, Italy, Russia, Spain, the Middle
East and Africa.",football,2019-06-17,14:59:00,https://www.indiatoday.in/sports/football/story/uefa-launches-online-streaming-portal-aims-for-young-fans-1548257-2019-06-13
India Today," EPL 2019/20 fixtures out: Manchester United v Chelsea tops opening gamesNew Premier League season will begin on Friday, August 9th one week after the
Community Shield final between Manchester City and Liverpool at Wembley.",football,2019-06-17,14:59:00,https://www.indiatoday.in/sports/football/story/epl-2019-20-fixtures-out-manchester-united-v-chelsea-tops-opening-games-1548034-2019-06-13
India Today," Manchester United complete Welsh winger James signingJames had joined Hull City in 2014 before moving to Swansea. The Welsh winger
had scored 5 goals in 38 matches for Swansea last season. ",football,2019-06-17,14:59:00,https://www.indiatoday.in/sports/football/story/manchester-united-daniel-james-transfer-news-wales-winger-swansea-city-1547518-2019-06-12
India Today," Euro 2020 qualifiers: France bounce back, Belgium and Germany win bigTheir third victory in as many matches lifted Germany to nine points while
world champions France cruised to a 4-0 against Andorra and reclaimed first
place in Group H.",football,2019-06-17,14:59:00,https://www.indiatoday.in/sports/football/story/euro-2020-qualifiers-france-belgium-germany-match-results-1547106-2019-06-12
India Today," Filipe Luis to decide future after Copa AmericaFilipe Luis will decide his future between teams in Europe and Brazil, after
the Copa America. Luis' contract with Atletico Madrid expires on June 30 and
has been in touch with Barcelona and Flamengo, but he has not ruled out
remaining at Atletico Madrid.",football,2019-06-17,14:59:00,https://www.indiatoday.in/sports/football/story/atletico-madrid-defender-filipe-luis-future-copa-america-1547055-2019-06-12
India Today," Copa America: Neymar's absence could be blessing in disguise for hosts BrazilNeymar suffered the ankle injury during Brazil's 2-0 friendly win over Qatar
and he won't be able to recover in time for their Copa America campaign.",football,2019-06-17,14:59:00,https://www.indiatoday.in/sports/football/story/copa-america-neymar-s-absence-could-be-blessing-in-disguise-for-hosts-brazil-1546507-2019-06-11
India Today," Neymar wants controversial Santos-Barca transfer trial to be held in BarcelonaTrial for alleged fraud and corruption over, 2013 Santos-Barcelona transfer
deal be moved to the Spanish city, Neymar and his parents requested,
prosecutor opposed.",football,2019-06-17,14:59:00,https://www.indiatoday.in/sports/football/story/neymar-jr-santos-barcelona-fc-transfer-trial-1546358-2019-06-11
India Today," Dominic Thiem extends olive branch to Serena Williams with mixed doubles offerDominic Thiem was left fuming after being asked to make way for Serena
Williams at a post-match news conference following her third-round defeat in
the first week of the French Open last month.",tennis,2019-06-17,14:59:00,https://www.indiatoday.in/sports/tennis/story/dominic-thiem-serena-williams-french-open-controversy-1547120-2019-06-12
India Today," Maria Sharapova to return to action at Mallorca OpenFormer world No.1 Maria Sharapova, who has not played since her withdrawal
from a second-round match at the WTA St Petersburg Ladies Trophy, will make a
return at Mallorca Open.",tennis,2019-06-17,14:59:00,https://www.indiatoday.in/sports/tennis/story/maria-sharapova-return-tennis-mallorca-open-wildcard-entry-1546085-2019-06-10
India Today,"  French Open 2019: Rafael Nadal beats Dominic Thiem to clinch 12th title at Roland GarrosRafael Nadal won 6-3, 5-7, 6-1, 6-1 against the fourth-seeded Austrian and is
now only two grand slam titles behind Roger Federer's record of 20.",tennis,2019-06-17,14:59:00,https://www.indiatoday.in/sports/tennis/story/-french-open-2019-rafael-nadal-beats-dominic-thiem-to-clinch-12th-title-at-roland-garros-1545610-2019-06-09
India Today, French Open 2019 Men's Singles Final Highlights: Rafael Nadal wins record-extending 12th title,tennis,2019-06-17,14:59:00,https://www.indiatoday.in/sports/story/french-open-final-2019-rafael-nadal-vs-dominic-thiem-live-updates-1545479-2019-06-09
India Today," Rafael Nadal vs Dominic Thiem Live Streaming: French Open 2019 Final BroadcastIt is a contest between Dominic Thiem, who is aiming to win his maiden major
crown and Rafael Nadal, who is a 17-time Grand Slam champion and is bidding
for a record-extending French Open title. It is a repeat of the 2018 final on
June 9 in Paris.",tennis,2019-06-17,14:59:00,https://www.indiatoday.in/sports/tennis/story/french-open-2019-rafael-nadal-vs-dominic-thiem-when-and-where-live-streaming-1545425-2019-06-09
India Today," Marketa Vondrousova will be new face of Czech tennis, says Hana MandlikovaAccording to Hana Mandlikova, a 1981 Roland Garros champion, Marketa
Vondrousova's pursuit to become the first Czech woman to win the French Open
fell short but the 19-year-old is destined to win a Grand Slam title.
Mandlikova was also 19 when she claimed the French Open.",tennis,2019-06-17,14:59:00,https://www.indiatoday.in/sports/tennis/story/marketa-vondrousova-hana-mandlikova-french-open-2019-1545253-2019-06-09
India Today," Ashleigh Barty: The cricket star who went on to become French Open 2019 championAshleigh Barty, who came in the French Open seeded eighth, became the first
Australian in 46 years to lift the women's trophy at Roland Garros.",tennis,2019-06-17,14:59:00,https://www.indiatoday.in/sports/tennis/story/ashleigh-barty-french-open-2019-champion-brisbane-heat-cricket-women-s-big-bash-league-1545235-2019-06-09
India Today," I played the perfect match: Ashleigh Barty after French Open 2019 triumphAfter ditching tennis for cricket for a year, Ashleigh Barty made a great
come back by smashing Marketa Vondrousova for six to lift the French Open
crown. This is Barty's first Grand Slam title and Australia's first French
women’s singles crown in more than four decades.",tennis,2019-06-17,14:59:00,https://www.indiatoday.in/sports/tennis/story/ashleigh-barty-marketa-vondrousova-french-open-2019-1545233-2019-06-09
India Today," French Open 2019: Ashleigh Barty clinches historic Roland Garros title in one-sided finalAshleigh Barty, who had played Women's Big Bash League before returning to
tennis in 2016, became the first Australian player in 46 years to win the
women's singles title at French Open. ",tennis,2019-06-17,14:59:00,https://www.indiatoday.in/sports/tennis/story/french-open-2019-women-s-singles-final-ashleigh-barty-1st-australian-1973-marketa-vondrousova-1545121-2019-06-08
India Today," French Open 2019: Dominic Thiem ends Novak Djokovic streak to reach finalFrench Open 2019: In a rain interrupted men's singles semi-final, Dominic
Thiem defeated Novak Djokovic in 5 sets to face Rafael Nadal in the final on
Sunday.",tennis,2019-06-17,14:59:00,https://www.indiatoday.in/sports/tennis/story/french-open-2019-dominic-thiem-beats-novak-djokovic-face-rafael-nadal-final-1545066-2019-06-08
India Today, French Open women's singles final Highlights: Ashleigh Barty wins maiden Grand Slam singles title,tennis,2019-06-17,14:59:00,https://www.indiatoday.in/sports/story/ashleigh-barty-vs-marketa-vondrousova-french-open-2019-women-s-singles-tennis-live-score-roland-garros-1545000-2019-06-08
India Today," French Open 2019: Djokovic, Thiem resume semifinal, women's final followsNovak Djokovic and Dominic Thiem have split the first two sets, then Thiem
went up by a break in the third, before play was halted Friday due to rain.
They're scheduled to resume in Court Philippe Chatrier on Saturday.",tennis,2019-06-17,14:59:00,https://www.indiatoday.in/sports/tennis/story/french-open-2019-novak-djokovic-dominic-thiem-match-suspended-women-s-final-1544915-2019-06-08
India Today," Malaysian badminton icon Lee Chong Wei announces retirement after cancer battleThree-time Olympic medallist Lee Chong Wei has announced retirement after 19
years of stellar badminton career following his battle with nose cancer.",badminton,2019-06-17,14:59:00,https://www.indiatoday.in/sports/badminton/story/lee-chong-wei-malaysian-badminton-icon-olympic-medallist-retires-after-cancer-1547930-2019-06-13
India Today," PV Sindhu, Sameer Verma lose in dismal day for India at Australian OpenPV Sindhu's struggles on the tour this season continues as she was knocked
out in the second round of Australian Open 2019 after a straight-game loss to
lower-ranked Nitchaon Jindapol on Thursday.",badminton,2019-06-17,14:59:00,https://www.indiatoday.in/sports/badminton/story/australian-open-pv-sindhu-2nd-round-defeat-sameer-verma-india-badminton-1543884-2019-06-06
India Today," Sindhu, Sameer make impressive starts at Australian OpenP V Sindhu and Sameer Verma progressing to the second round of the Australian
Open World Tour Super 300 tournament. The Indian will meet experienced Thai
Nitchaon Jindapol next.",badminton,2019-06-17,14:59:00,https://www.indiatoday.in/sports/badminton/story/p-v-sindhu-sameer-verma-australian-open-1543149-2019-06-05
India Today," Sudirman Cup: Kento Momota stunned as China cruise to 11th titleWorld No. 1 men's singles shuttler Kento Momota suffered his first defeat in
a team event at the senior level as Shi Yuqi led China to their
record-extending 11th Sudirman Cup title on Sunday.",badminton,2019-06-17,14:59:00,https://www.indiatoday.in/sports/badminton/story/sudirman-cup-2019-china-vs-japan-shi-yuqi-chen-yufei-kento-momota-badminton-report-1535063-2019-05-26
India Today," Himanta Biswa Sarma elected as vice president of Badminton Asia CouncilAssam's health and education minister Himanta Biswa Sarma was last year
unanimously elected the Badminton Association of India president.",badminton,2019-06-17,14:59:00,https://www.indiatoday.in/sports/badminton/story/himanta-biswa-sarma-badminton-asia-council-vice-president-election-1534960-2019-05-26
India Today," China thrash Thailand 3-0, reach Sudirman Cup finalTen-time winners China beat Thailand 3-0 to qualify for their 13th straight
Sudirman Cup final. China will play the final against the winner between
Japan and Indonesia.",badminton,2019-06-17,14:59:00,https://www.indiatoday.in/sports/badminton/story/sudirman-cup-li-junhui-liu-yuchen-1534566-2019-05-25
India Today," Pullela Gopichand blames hectic calendar for shuttlers' poor run in 2019The slump in form for the major badminton stars of India comes at a rather
awkward time with the 2020 Tokyo Olympics around the corner.",badminton,2019-06-17,14:59:00,https://www.indiatoday.in/sports/badminton/story/pullela-gopichand-gopichand-blames-calendar-shuttlers-poor-form-tokyo-olympics-1533753-2019-05-24
India Today," Sudirman Cup: Japan beat Malaysia to advance to last 4Japan put an all-round performance to defeat defeated Malaysia 3-0 to qualify
for the first semi-finals of the ongoing Sudirman Cup in China",badminton,2019-06-17,14:59:00,https://www.indiatoday.in/sports/badminton/story/ong-yew-sin-teo-ee-yi-sudirman-cup-1533648-2019-05-24
India Today," Sudirman Cup: Denmark beat Indonesia, both advance to last 8 Sudirman Cup: Denmark defeated Indonesia 3-2 in the pre-quarters, however,
the latter remained the group topper despite the loss as both the teams
advanced to the last 8 of the tournament.",badminton,2019-06-17,14:59:00,https://www.indiatoday.in/sports/badminton/story/sudirman-cup-denmark-beat-indonesia-enter-quarters-1532469-2019-05-23
India Today," India knocked out of Sudirman Cup after 0-5 loss to ChinaAfter going down 2-3 to Malaysia in their opening Group 1D match, India
needed an extraordinary effort to get across the mighty Chinese but the
shuttlers yet again produced a below-par performance to go down in a
lop-sided contest",badminton,2019-06-17,14:59:00,https://www.indiatoday.in/sports/badminton/story/sudirman-cup-badminton-india-lose-china-kidambi-srikanth-pv-sindhu-1531729-2019-05-22
India Today," Sudirman Cup: PV Sindhu's heroics in vain as Malaysia beat India 3-2 India's decision to field world no. 13 Sameer Verma instead of Kidambi
Srikanth in men's singles backfired as a young Malaysian contingent consigned
them to a 3-2 defeat despite PV Sindhu winning her own match",badminton,2019-06-17,14:59:00,https://www.indiatoday.in/sports/badminton/story/sudhirman-cup-malaysia-beat-india-pv-sidhu-sameer-verma-1530994-2019-05-21
