Newspaper,Heading,Date,Time,URL
India Today, HRD Ministry drafts new National Educational Policy: 19 changes recommended,2019-06-01,22:54,https://timesofindia.indiatimes.com/education-today/news/story/hrd-ministry-drafts-new-national-educational-policy-19-changes-recommended-1540190-2019-06-01
India Today," SSC GD Constable Result 2019 to be released on this date, download result at ssc.nic.in",2019-06-01,22:54,https://timesofindia.indiatimes.com/education-today/notification/story/ssc-gd-constable-result-2019-to-be-released-on-this-date-download-result-at-ssc-nic-in-1540082-2019-06-01
India Today," RSOS Class 12th Result 2019 declared: 34.82% students clear Class 12 exam, girls outshine boys",2019-06-01,22:54,https://timesofindia.indiatimes.com/education-today/notification/story/rsos-class-12th-result-2019-declared-34-82-students-clear-class-12-exam-girls-outshine-boys-1540096-2019-06-01
India Today, DU admissions: Problems faced by students on day 1,2019-06-01,22:54,https://timesofindia.indiatimes.com/education-today/news/story/du-admissions-problems-faced-by-students-on-day-1-1540073-2019-06-01
India Today," UPCATET result 2019 declared, check result at upcatet.org",2019-06-01,22:54,https://timesofindia.indiatimes.com/education-today/notification/story/upcatet-result-2019-declared-check-result-at-upcatet-org-1540066-2019-06-01
India Today, Delhi University Admissions 2019: Maths made compulsary in 'Best Of Four' subjects for BA (H) in Economics,2019-06-01,22:54,https://timesofindia.indiatimes.com/education-today/news/story/delhi-university-admissions-2019-maths-made-compulsary-in-best-of-four-subjects-for-ba-h-in-economics-1540034-2019-06-01
India Today, CISF admit card for Head Constable Recruitment 2019 released: Here's how to download,2019-06-01,22:54,https://timesofindia.indiatimes.com/education-today/notification/story/cisf-admit-card-for-head-constable-recruitment-2019-released-here-s-how-to-download-1540016-2019-06-01
India Today, Delhi University admissions: Students faced technical glitches and other issues,2019-06-01,22:54,https://timesofindia.indiatimes.com/education-today/news/story/delhi-university-admissions-students-faced-technical-glitches-and-other-issues-1540021-2019-06-01
India Today, CHSE Odisha 12th Result 2019 to be out soon: Here's how to check,2019-06-01,22:54,https://timesofindia.indiatimes.com/education-today/notification/story/chse-odisha-12th-result-2019-to-be-out-soon-here-s-how-to-check-1539994-2019-06-01
India Today, Odisha 12th Result 2019: CHSE Odisha to declare Class 12 result soon at orissaresults.nic.in,2019-06-01,22:54,https://timesofindia.indiatimes.com/education-today/notification/story/odisha-12th-result-2019-chse-odisha-to-declare-class-12-result-soon-at-orissaresults-nic-in-1539989-2019-06-01
India Today, Rajasthan Board class 10 result 2019 to be declared on June 3: Here is all you need to know,2019-06-01,22:54,https://timesofindia.indiatimes.com/education-today/notification/story/rajasthan-board-class-10-result-2019-to-be-declared-on-june-3-here-is-all-you-need-to-know-1539969-2019-06-01
India Today, MCI extends last date for PG medical admissions to May 31,2019-06-01,22:54,https://timesofindia.indiatimes.com/education-today/news/story/mci-extends-last-date-for-pg-medical-admissions-to-may-31-1539585-2019-05-31
India Today, JIPMER MBBS 2019 entrance exam on June 2: All you need to know,2019-06-01,22:54,https://timesofindia.indiatimes.com/education-today/news/story/jipmer-mbbs-2019-entrance-exam-on-june-2-all-you-need-to-know-1539529-2019-05-31
India Today, Shekhawati University Result 2019 released: Check result at shekhauni.com,2019-06-01,22:54,https://timesofindia.indiatimes.com/education-today/notification/story/shekhawati-university-result-2019-released-check-result-at-shekhauni-com-1539467-2019-05-31
India Today, How this Bihar boy became the world's youngest international pageant director at just 19,2019-06-01,22:54,https://timesofindia.indiatimes.com/education-today/how-i-made-it/story/how-this-bihar-boy-became-the-world-s-youngest-international-pageant-director-at-just-19-1539477-2019-05-31
India Today, Last minute tips to ace UPSC prelims 2019,2019-06-01,22:54,https://timesofindia.indiatimes.com/education-today/tips-and-tricks/story/last-minute-tips-to-ace-upsc-prelims-2019-1539428-2019-05-31
India Today, BSER RBSE 8th Result 2019: Date and time confirmed,2019-06-01,22:54,https://timesofindia.indiatimes.com/education-today/notification/story/bser-rbse-8th-result-2019-date-rajasthan-board-divd-1539502-2019-05-31
India Today, This 24-year-old on a mission to change one million lives in 10 years educated over 500 girls about menstrual hygiene,2019-06-01,22:54,https://timesofindia.indiatimes.com/education-today/how-i-made-it/story/menstrual-hygiene-day-awareness-educating-girls-menstruation-1536571-2019-05-28
India Today, This 24-year-old college graduate is making pencils with newspaper waste,2019-06-01,22:54,https://timesofindia.indiatimes.com/education-today/how-i-made-it/story/college-graduate-making-pencils-with-waste-newspapers-1529467-2019-05-20
India Today," NEET answer key 2019: Last 1 hour to raise objection, result to be released on June 5 at www.ntaneet.nic.in",2019-06-01,22:54,https://timesofindia.indiatimes.com/education-today/news/story/neet-answer-key-2019-last-1-hour-to-raise-objection-result-to-be-released-on-june-5-at-www-ntaneet-nic-in-1540191-2019-06-01
India Today, HRD Ministry drafts new National Educational Policy: 19 changes recommended,2019-06-01,22:54,https://timesofindia.indiatimes.com/education-today/news/story/hrd-ministry-drafts-new-national-educational-policy-19-changes-recommended-1540190-2019-06-01
India Today, DU admissions: Problems faced by students on day 1,2019-06-01,22:54,https://timesofindia.indiatimes.com/education-today/news/story/du-admissions-problems-faced-by-students-on-day-1-1540073-2019-06-01
India Today, TS ICET answer key 2019 released: Here's how to download,2019-06-01,22:54,https://timesofindia.indiatimes.com/education-today/notification/story/ts-icet-answer-key-2019-released-here-s-how-to-download-1540186-2019-06-01
India Today," SSC GD Constable Result 2019 to be released on this date, download result at ssc.nic.in",2019-06-01,22:54,https://timesofindia.indiatimes.com/education-today/notification/story/ssc-gd-constable-result-2019-to-be-released-on-this-date-download-result-at-ssc-nic-in-1540082-2019-06-01
India Today," RSOS Class 12th Result 2019 declared: 34.82% students clear Class 12 exam, girls outshine boys",2019-06-01,22:54,https://timesofindia.indiatimes.com/education-today/notification/story/rsos-class-12th-result-2019-declared-34-82-students-clear-class-12-exam-girls-outshine-boys-1540096-2019-06-01
India Today," UPCATET result 2019 declared, check result at upcatet.org",2019-06-01,22:54,https://timesofindia.indiatimes.com/education-today/notification/story/upcatet-result-2019-declared-check-result-at-upcatet-org-1540066-2019-06-01
India Today," LIC ADO Recruitment 2019: Official notice released, check important dates for recruitment",2019-06-01,22:54,https://timesofindia.indiatimes.com/education-today/jobs-and-careers/story/lic-ado-recruitment-2019-official-notice-released-check-important-dates-for-recruitment-1529509-2019-05-20
India Today, 5 off-beat career options to break the monotony of 9 to 5 jobs,2019-06-01,22:54,https://timesofindia.indiatimes.com/education-today/jobs-and-careers/story/5-off-beat-career-options-to-break-the-monotony-of-9-to-5-jobs-1527398-2019-05-17
India Today, Last minute tips to ace UPSC prelims 2019,2019-06-01,22:54,https://timesofindia.indiatimes.com/education-today/tips-and-tricks/story/last-minute-tips-to-ace-upsc-prelims-2019-1539428-2019-05-31
India Today, UPSC Civil Services 2019 prelims: Dos and don'ts for UPSC IAS exam,2019-06-01,22:54,https://timesofindia.indiatimes.com/education-today/tips-and-tricks/story/upsc-civil-services-2019-prelims-dos-and-don-ts-for-upsc-ias-exam-1535626-2019-05-27
India Today, Last minute tips for AIIMS MBBS entrance exam 2019,2019-06-01,22:54,https://timesofindia.indiatimes.com/education-today/tips-and-tricks/story/last-minute-tips-for-aiims-mbbs-entrance-exam-2019-1535513-2019-05-27
India Today, Last minute Tips for JEE Advanced,2019-06-01,22:54,https://timesofindia.indiatimes.com/education-today/tips-and-tricks/story/last-minute-tips-for-jee-advanced-1535490-2019-05-27
India Today, CBSE Class 12 Chemistry sample paper 2019 with solutions: Practice now,2019-06-01,22:54,https://timesofindia.indiatimes.com/education-today/sample-papers/story/cbse-class-12-chemistry-sample-paper-2019-divd-1454190-2019-02-12
India Today, CBSE Class 12 Biology sample paper 2019 with solutions: Check now,2019-06-01,22:54,https://timesofindia.indiatimes.com/education-today/sample-papers/story/cbse-class-12-biology-sample-paper-2019-divd-1454151-2019-02-12
India Today, CBSE Class 10 English Sample Paper with solutions: Check now,2019-06-01,22:54,https://timesofindia.indiatimes.com/education-today/sample-papers/story/cbse-class-10-english-sample-paper-cbse-board-exams-2019-divd-1450385-2019-02-07
India Today, CBSE Board Exam 2019: Find Class 10 Maths sample paper with answers here,2019-06-01,22:54,https://timesofindia.indiatimes.com/education-today/sample-papers/story/cbse-board-exam-2019-find-class-10-maths-sample-paper-with-answers-here-1417498-2018-12-26
India Today, Earn upto 2 lakh per month by applying for UPSC CDS 2 2019 recruitment: Check important dates and vacancy details here,2019-06-01,22:54,https://timesofindia.indiatimes.com/education-today/government-jobs/story/2-lakh-per-month-upsc-cds-2-2019-recruitment-darkari-naukri-sarkari-result-divd-1539215-2019-05-31
India Today, BRO Recruitment 2019: Apply for 778 Electrician and other vacancies @bro.gov.in,2019-06-01,22:54,https://timesofindia.indiatimes.com/education-today/government-jobs/story/bro-recruitment-2019-electrician-bro-gov-in-divd-1538362-2019-05-30
India Today," NVS Recruitment 2019: Apply for 370 PGT, TGT, FCSA posts before this date",2019-06-01,22:54,https://timesofindia.indiatimes.com/education-today/government-jobs/story/nvs-recruitment-2019-jobs-2019-divd-1536540-2019-05-28
India Today, DRDO is hiring! Apply for 351 technician vacancies till this date,2019-06-01,22:54,https://timesofindia.indiatimes.com/education-today/government-jobs/story/drdo-recruitment-2019-sarkari-naukri-govt-job-divd-1536482-2019-05-28
India Today," Earn upto Rs 2, 08,700 for 439 vacancies in Banaras Hindu University (BHU), apply online @bhu.ac.in",2019-06-01,22:54,https://timesofindia.indiatimes.com/education-today/government-jobs/story/earn-upto-rs-2-08-700-banaras-hindu-university-bhu-bhu-ac-in-divd-1535637-2019-05-27
India Today, 10 ways to politely say 'NO',2019-06-01,22:54,https://timesofindia.indiatimes.com/education-today/grammar-vocabulary/story/10-ways-to-politely-say-no-1505465-2019-04-19
India Today, 20 words to use instead of 'sad',2019-06-01,22:54,https://timesofindia.indiatimes.com/education-today/grammar-vocabulary/story/20-words-to-use-instead-of-sad-1503076-2019-04-16
India Today, Areas with productive climate tend to have more languages: Study,2019-06-01,22:54,https://timesofindia.indiatimes.com/education-today/gk-current-affairs/story/productive-climate-language-diversity-study-1529426-2019-05-20
India Today, List of 6 manned moon missions: These people set foot on lunar surface after Neil Armstrong,2019-06-01,22:54,https://timesofindia.indiatimes.com/education-today/gk-current-affairs/story/manned-moon-mission-lunar-surface-moon-landing-nasa-1408563-2018-12-13
India Today, This small-town school in Bengal teaches students with apps and storybooks ,2019-06-01,22:54,https://timesofindia.indiatimes.com/education-today/video/levelfield-school-teaches-students-with-apps-and-storybooks-html-1393974-2018-11-22
India Today," [WATCH] Nipah virus can be transmitted through contaminated water and fruits, warns govt advisory",2019-06-01,22:54,https://timesofindia.indiatimes.com/education-today/video/-watch-nipah-virus-can-be-transmitted-through-contaminated-water-and-fruits-warns-govt-advisory-1238575-2018-05-22
India Today," On Menstrual Hygiene Day, here's how workplaces need to deal with periods ",2019-06-01,22:54,https://timesofindia.indiatimes.com/education-today/featurephilia/story/menstruation-how-workplaces-need-to-deal-with-periods-1536483-2019-05-28
India Today, Why your mental health is an important factor in your government exam preparation,2019-06-01,22:54,https://timesofindia.indiatimes.com/education-today/featurephilia/story/why-your-mental-health-is-an-important-factor-in-your-govt-exam-preparation-1536297-2019-05-28
